keyword,author_id,sub_id,submission,comments,subreddit,created,timestamp,risk
live,45ys4cs4,d57rp7,Hong Kong police group warns live ammo may be used against protesters who throw petrol bombs at officers,2,Anarchism,1568672842.0,2019-09-17 06:27:22,-1
breath,45ys4cs4,d4zohx,Having trouble breathing outside? For a large amount of dollars you can buy one of our stylish and form-fitting face masks so you can breathe outside like its 2005!,25,ABoringDystopia,1568635332.0,2019-09-16 20:02:12,0
end,45ys4cs4,d4ygx0,"British judge jails Assange indefinitely, despite end of prison sentence",119,unitedkingdom,1568627687.0,2019-09-16 17:54:47,1
night,45ys4cs4,d4qhip,Fascists are planning a modern Night of the Long Knives,4,DescentIntoTyranny,1568581310.0,2019-09-16 05:01:50,-1
plan,45ys4cs4,d4qhip,Fascists are planning a modern Night of the Long Knives,4,DescentIntoTyranny,1568581310.0,2019-09-16 05:01:50,-1
kill,45ys4cs4,d44bso,Nooo don't kill yourself you're too valuable to The Economy aha,331,ABoringDystopia,1568462742.0,2019-09-14 20:05:42,1
panic,45ys4cs4,d36a43,"An article from 2005 about panic buying at petrol stations after a rise to £1 a litre, news of planned protests and rumours of a closed station, quite an interesting public reaction",0,unitedkingdom,1568286438.0,2019-09-12 19:07:18,-1
plan,45ys4cs4,d36a43,"An article from 2005 about panic buying at petrol stations after a rise to £1 a litre, news of planned protests and rumours of a closed station, quite an interesting public reaction",0,unitedkingdom,1568286438.0,2019-09-12 19:07:18,-1
plan,45ys4cs4,d11zgo,"Climate Science Deniers Planning European Misinformation Campaign, Leaked Documents Reveal",3,Fuckthealtright,1567891909.0,2019-09-08 05:31:49,-1
suicid,20huv6cv,cb655d,This quote about suicide is feeling far too accurate,49,SuicideWatch,1562703072.0,2019-07-10 04:11:12,-1
night,3j82c5fo,bs4wb7,My sister committed suicide last night.,61,SuicideWatch,1558628155.0,2019-05-24 00:15:55,-1
commit,3j82c5fo,bs4wb7,My sister committed suicide last night.,61,SuicideWatch,1558628155.0,2019-05-24 00:15:55,-1
suicid,3j82c5fo,bs4wb7,My sister committed suicide last night.,61,SuicideWatch,1558628155.0,2019-05-24 00:15:55,-1
kill,3j82c5fo,bq0vzb,Tried to kill myself and it didn’t work again F14.,2,SuicideWatch,1558160479.0,2019-05-18 14:21:19,-1
care,3j82c5fo,bnl9wu,I don’t care about anything anymore,5,depression,1557635914.0,2019-05-12 12:38:34,1
kill,3j82c5fo,bhhlkj,I nearly killed myself today F14,16,SuicideWatch,1556248658.0,2019-04-26 11:17:38,-1
alon,3j82c5fo,be6iky,I’m all alone.,7,SuicideWatch,1555499554.0,2019-04-17 19:12:34,-1
bulli,3j82c5fo,be5wml,Bullies are getting to me F14,5,SuicideWatch,1555494691.0,2019-04-17 17:51:31,0
breath,3j82c5fo,bdmw2e,I’m shaking and can’t breathe,34,SuicideWatch,1555371127.0,2019-04-16 07:32:07,0
pain,3j82c5fo,bcg7r1,The pain won’t go away,2,SuicideWatch,1555089789.0,2019-04-13 01:23:09,-1
cut,3j82c5fo,bbmw72,I started cutting my other arm F14,5,SuicideWatch,1554907734.0,2019-04-10 22:48:54,0
aliv,3j82c5fo,baur4q,I am alive. sadly,3,SuicideWatch,1554735220.0,2019-04-08 22:53:40,0
hang,3j82c5fo,b9cvzl,"I tried to hang myself yesterday + the story of my life. If I ever kill myself, here’s why.",14,SuicideWatch,1554385493.0,2019-04-04 21:44:53,-1
kill,3j82c5fo,b9cvzl,"I tried to hang myself yesterday + the story of my life. If I ever kill myself, here’s why.",14,SuicideWatch,1554385493.0,2019-04-04 21:44:53,-1
pain,3j82c5fo,b97onf,"My beautiful baby. I miss you so much. I wish you would have told me how you felt, I wish I could saved you. You’ve left me in pain, but i’m glad you aren’t in pain anymore. See you soon baby girl 💛",9,GriefSupport,1554348438.0,2019-04-04 11:27:18,1
care,3j82c5fo,b93gjv,"This is my beautiful bestfriend I lost to suicide on the 15th of August😭 I wish I could tell you how much I miss you, I wish I could hug you and never let you go. I wish I could tell you how much I care about you. I love you, i’m sorry",3,GriefSupport,1554324284.0,2019-04-04 04:44:44,1
lost,3j82c5fo,b93gjv,"This is my beautiful bestfriend I lost to suicide on the 15th of August😭 I wish I could tell you how much I miss you, I wish I could hug you and never let you go. I wish I could tell you how much I care about you. I love you, i’m sorry",3,GriefSupport,1554324284.0,2019-04-04 04:44:44,1
suicid,3j82c5fo,b93gjv,"This is my beautiful bestfriend I lost to suicide on the 15th of August😭 I wish I could tell you how much I miss you, I wish I could hug you and never let you go. I wish I could tell you how much I care about you. I love you, i’m sorry",3,GriefSupport,1554324284.0,2019-04-04 04:44:44,1
suicid,3j82c5fo,b90gq8,Attempting suicide today because I can’t take it anymore. Happy birthday me,12,SuicideWatch,1554310270.0,2019-04-04 00:51:10,-1
die,3j82c5fo,b8yoze,I want to die,6,SuicideWatch,1554301876.0,2019-04-03 22:31:16,-1
die,15le6i,b6hni0,Do you ever have a really good dream but then wake up back to reality and tasting that fleeting moment of happiness makes you just want to fucking die so much?,69,SuicideWatch,1553772716.0,2019-03-28 19:31:56,1
kill,15le6i,ab26c1,Hey tb to when I was like 8 and wasnt an empty husk that didnt want to kill myself on the daily,4,SuicideWatch,1546219495.0,2018-12-31 09:24:55,1
suicid,15le6i,8l4bhh,What's the point of a therapist if you can't tell them you're suicidal...,24,SuicideWatch,1526937061.0,2018-05-22 05:11:01,0
end,15le6i,66lg0k,Ending a track ride.,7,PlanetCoaster,1492730030.0,2017-04-21 07:13:50,0
abus,3ce70mgz,c057mq,My ex girlfriennd was abused by her mom,2,raisedbynarcissists,1560428959.0,2019-06-13 20:29:19,-1
kill,3ce70mgz,bffan5,My friend has killed himself,48,SuicideWatch,1555784319.0,2019-04-21 02:18:39,-1
hate,rdor3gd,ci3llu,I love you but I hate you at the same time.,2,UnsentLetters,1564151592.0,2019-07-26 22:33:12,-1
fight,rdor3gd,chwj43,DAE feel an extremely overwhelming sense of brokenness and emptiness after a fight with your FP?,1,BPD,1564104827.0,2019-07-26 09:33:47,-1
cut,rdor3gd,c5zms0,"Does anyone else just feel like disappearing socially? Nuking social media, cutting ties to your family & friends, etc?",85,SuicideWatch,1561601534.0,2019-06-27 10:12:14,1
suicid,rdor3gd,awdktn,Passively Suicidal,1,SuicideWatch,1551499007.0,2019-03-02 11:56:47,-1
despair,rdor3gd,8ritoa,"Gloom, Despair & Agony",0,depression,1529149083.0,2018-06-16 19:38:03,-1
hurt,rdor3gd,7pa108,It hurts more than you know.,2,UnsentLetters,1515530145.0,2018-01-10 04:35:45,-1
pain,4nh7za5y,dj4nrp,"Suicidal people don’t want to die, they just want the pain to stop.",90,SuicideWatch,1571309434.0,2019-10-17 18:50:34,-1
die,4nh7za5y,dj4nrp,"Suicidal people don’t want to die, they just want the pain to stop.",90,SuicideWatch,1571309434.0,2019-10-17 18:50:34,-1
suicid,4nh7za5y,dj4nrp,"Suicidal people don’t want to die, they just want the pain to stop.",90,SuicideWatch,1571309434.0,2019-10-17 18:50:34,-1
suicid,4na7xt8e,d7zskx,My Mom showed off my suicide letter like it was a fashion statement,103,SuicideWatch,1569202730.0,2019-09-23 09:38:50,-1
end,49sheo3j,cxpfh5,"I’m just so tired of being ugly, I tried makeup and I ended up looking worse and I don’t have any money to do surgery or anything...",1,ugly,1567212037.0,2019-08-31 08:40:37,-1
suicid,49sheo3j,cuiinz,"I’m absolutely annoyed whenever I comment something suicidal and random people just tell me “call the national suicide prevention hotline” , I actually want people that I can relate my problems with, I don’t want a fucking hotline that doesn’t do shit.",90,SuicideWatch,1566587939.0,2019-08-24 03:18:59,-1
insecur,49sheo3j,ck53nt,has insecurities been a problem for you guys?,2,self,1564557965.0,2019-07-31 15:26:05,-1
die,474sq6bx,cg2rwu,What took you the fear of dying?,2,SuicideWatch,1563736343.0,2019-07-22 03:12:23,-1
suicid,474sq6bx,cfpj9u,Ive attempted suicide and my goodbye letter was shown to everyone,50,SuicideWatch,1563649616.0,2019-07-21 03:06:56,-1
anxieti,1ritlfux,ce0xmf,I completely shut off everyone I know for 2 years because of ANXIETY,3,Anxietyhelp,1563301552.0,2019-07-17 02:25:52,-1
hate,1ritlfux,c684pq,"Everytime im watching tv with my mum, suicide scenes/topics would always Come up. I get extremely uncomfortable because she knows I’m suicidal. I hate watching tv NOW.",5,SuicideWatch,1561655363.0,2019-06-28 01:09:23,-1
suicid,1ritlfux,c684pq,"Everytime im watching tv with my mum, suicide scenes/topics would always Come up. I get extremely uncomfortable because she knows I’m suicidal. I hate watching tv NOW.",5,SuicideWatch,1561655363.0,2019-06-28 01:09:23,-1
suicid,1ritlfux,bjfu2r,The idea of an existing god yet the extreme suffering that people experience in hospitals and mental clinics and suicide rates terrifies me.,44,atheism,1556708920.0,2019-05-01 19:08:40,-1
exist,1ritlfux,bjfu2r,The idea of an existing god yet the extreme suffering that people experience in hospitals and mental clinics and suicide rates terrifies me.,44,atheism,1556708920.0,2019-05-01 19:08:40,-1
die,1ritlfux,bfoyug,I get so angry when I hear about people who die in their sleep because it’s not fair and it should be me.,44,SuicideWatch,1555854459.0,2019-04-21 21:47:39,-1
die,1ritlfux,bevo2j,I received an acceptance letter from a good university and I started crying because I still wanted to Die,15,SuicideWatch,1555652417.0,2019-04-19 13:40:17,-1
useless,1ritlfux,bbln9q,"“There are two kinds of pain. The sort of pain that makes you strong, or useless pain. The sort of pain that's only suffering.” Frank Underwood",3,SuicideWatch,1554900723.0,2019-04-10 20:52:03,-1
pain,1ritlfux,bbln9q,"“There are two kinds of pain. The sort of pain that makes you strong, or useless pain. The sort of pain that's only suffering.” Frank Underwood",3,SuicideWatch,1554900723.0,2019-04-10 20:52:03,-1
anxieti,1ritlfux,b91u17,OTC anxiety meds?,2,Anxiety,1554316714.0,2019-04-04 02:38:34,0
dead,1ritlfux,b7ezsz,"Today I couldn’t breathe at all, I’m already dead",1,SuicideWatch,1553974120.0,2019-03-31 03:28:40,-1
breath,1ritlfux,b7ezsz,"Today I couldn’t breathe at all, I’m already dead",1,SuicideWatch,1553974120.0,2019-03-31 03:28:40,-1
hate,1ritlfux,b7d5rl,"I hate myself for thinking this way, but I wish I had an incurable disease that would give me only 6 more months to live",3,SuicideWatch,1553963757.0,2019-03-31 00:35:57,1
live,1ritlfux,b7d5rl,"I hate myself for thinking this way, but I wish I had an incurable disease that would give me only 6 more months to live",3,SuicideWatch,1553963757.0,2019-03-31 00:35:57,1
live,1ritlfux,b7cbso,I don’t think I’ll live long,12,SuicideWatch,1553958738.0,2019-03-30 23:12:18,0
night,1ritlfux,b5v2b9,I force myself to stay up all night so that I end up sleeping the whole day because I can’t stand living anymore,6,SuicideWatch,1553633306.0,2019-03-27 04:48:26,0
end,1ritlfux,b5v2b9,I force myself to stay up all night so that I end up sleeping the whole day because I can’t stand living anymore,6,SuicideWatch,1553633306.0,2019-03-27 04:48:26,0
live,1ritlfux,b5v2b9,I force myself to stay up all night so that I end up sleeping the whole day because I can’t stand living anymore,6,SuicideWatch,1553633306.0,2019-03-27 04:48:26,0
hate,1ritlfux,b4wax6,Why is so damn hard to kill yourself when it seems so EASY in stupid movies and shows. I hate everything.,28,SuicideWatch,1553433898.0,2019-03-24 21:24:58,-1
stupid,1ritlfux,b4wax6,Why is so damn hard to kill yourself when it seems so EASY in stupid movies and shows. I hate everything.,28,SuicideWatch,1553433898.0,2019-03-24 21:24:58,-1
kill,1ritlfux,b4wax6,Why is so damn hard to kill yourself when it seems so EASY in stupid movies and shows. I hate everything.,28,SuicideWatch,1553433898.0,2019-03-24 21:24:58,-1
kill,1ritlfux,b3wdze,"I was about to kill myself when someone randomly sent “ don’t kill yourself, death will come to you at the right time”",10,SuicideWatch,1553204265.0,2019-03-22 05:37:45,-1
depress,1ritlfux,b3kqxk,Anyone extra depressed because it’s spring and then summer,4,depression,1553133522.0,2019-03-21 09:58:42,-1
exist,1ritlfux,b3d7bc,What do you do when your own existence is your trauma,0,depression,1553094836.0,2019-03-20 23:13:56,-1
end,1ritlfux,b2louy,I realized I lay down in bed all day waiting for the universe to end,7,BodyDysmorphia,1552931125.0,2019-03-19 01:45:25,0
end,1ritlfux,azn46k,I’m desperate and want to end it,2,SuicideWatch,1552267257.0,2019-03-11 09:20:57,-1
dead,1ritlfux,az4uvy,My soul is dead,9,depression,1552147085.0,2019-03-09 23:58:05,-1
hate,1ritlfux,axn1r7,I currently hate my family,2,depression,1551803436.0,2019-03-06 00:30:36,-1
cut,1ritlfux,as9aq4,Overdosing or cutting,5,SuicideWatch,1550574788.0,2019-02-19 19:13:08,0
hurt,1ritlfux,anqe3v,Ever love someone so much that it hurts,3,PanicAttack,1549457460.0,2019-02-06 20:51:00,1
afraid,1ritlfux,ajhn1r,Afraid,1,SuicideWatch,1548366217.0,2019-01-25 05:43:37,0
die,1ritlfux,ah915x,Can I please die already,2,depression,1547806118.0,2019-01-18 18:08:38,-1
lost,1ritlfux,a65jau,Lost interest,2,depression,1544799714.0,2018-12-14 23:01:54,0
live,1ritlfux,94kvhd,I live one day everyday,8,depression,1533404094.0,2018-08-05 01:34:54,0
alon,3hdghkqn,b5jhfp,Just please read it would mean a lot to me. I’m so alone.,102,SuicideWatch,1553563675.0,2019-03-26 09:27:55,0
useless,41u78p67,cvldox,Iam a useless NPC in life,6,SkyrimMemes,1566809221.0,2019-08-26 16:47:01,-1
useless,41u78p67,cvlaht,Do you feel like a useless NPC ?,92,SuicideWatch,1566808555.0,2019-08-26 16:35:55,0
alon,41u78p67,cvfduy,You are not alone ...,0,depression,1566772669.0,2019-08-26 06:37:49,0
fight,41u78p67,cuiy1r,"""We fight together or we die alone. "" Kuai Liang",16,MortalKombat,1566589882.0,2019-08-24 03:51:22,-1
die,41u78p67,cuiy1r,"""We fight together or we die alone. "" Kuai Liang",16,MortalKombat,1566589882.0,2019-08-24 03:51:22,-1
hate,41u78p67,cszomi,Scp 610 - Flesh That Hates,0,SCP,1566311029.0,2019-08-20 22:23:49,-1
hurt,41u78p67,c7i1qh,It hurts so much ...,3,depression,1561920737.0,2019-07-01 02:52:17,-1
hurt,41u78p67,c7hxko,I cannot take it anymore it hurts so much ...,4,SuicideWatch,1561920123.0,2019-07-01 02:42:03,-1
depress,1f5lfbn9,drde9f,How many people on here actually have clinical depression?,14,depression,1572846674.0,2019-11-04 13:51:14,-1
suicid,1f5lfbn9,dpklnl,I wish I could talk about how suicidal I am without getting sent away.,21,depression,1572510763.0,2019-10-31 16:32:43,-1
suicid,1f5lfbn9,dcyuge,If I tell my therapist about a previous suicide attempt will I be hospitalized?,2,mentalhealth,1570143987.0,2019-10-04 07:06:27,-1
depress,1f5lfbn9,d5ammv,What will help me [21F] stop being depressed?,7,Advice,1568686796.0,2019-09-17 10:19:56,-1
plan,1f5lfbn9,cvyqhz,DAE ever just wish someone would make all your decisions for you and plan out your life so you wouldn't have to?,40,BPD,1566876221.0,2019-08-27 11:23:41,1
pain,1f5lfbn9,csb03w,Can we talk about how painful it is to watch someone get over you while you're still super attached to them?,12,BPD,1566182440.0,2019-08-19 10:40:40,1
die,1f5lfbn9,cqjtdx,What age did you think you would die by?,12,depression,1565835873.0,2019-08-15 10:24:33,-1
pain,1f5lfbn9,cfbp9i,ABANDONMENT IS SO PAINFUL.,6,BPD,1563563134.0,2019-07-20 03:05:34,-1
pain,1f5lfbn9,c02n9j,How painful was/is invisalign for you?,24,Invisalign,1560409766.0,2019-06-13 15:09:26,-1
live,1f5lfbn9,akhbbi,What are some songs that you can think of that were obviously written with live performances or streaming in mind?,39,popheads,1548632252.0,2019-01-28 07:37:32,0
die,1f5lfbn9,aftccd,Gaga's horse Arabella is reportedly dying ❤️😢,8,LadyGaga,1547450185.0,2019-01-14 15:16:25,0
hate,1f5lfbn9,9m1q5q,I don't mean to hate on shane so maybe he isn't a vlogger...but I don't think he's a documentarian either.,0,ShaneDawson,1538878516.0,2018-10-07 10:15:16,1
commit,1f5lfbn9,8ykwtq,It’s beyond me that there are people who don’t think about committing suicide.,82,SuicideWatch,1531495758.0,2018-07-13 23:29:18,-1
suicid,1f5lfbn9,8ykwtq,It’s beyond me that there are people who don’t think about committing suicide.,82,SuicideWatch,1531495758.0,2018-07-13 23:29:18,-1
depress,1f5lfbn9,8t91i8,You know you have BPD & depression when...,26,BPD,1529748964.0,2018-06-23 18:16:04,-1
plan,eb3fncz,bjzs6w,"Just graduated from college today, planning on taking my life tonight.",145,SuicideWatch,1556829288.0,2019-05-03 04:34:48,0
kill,2ivawh17,d501qi,Anybody else wishing that they could run away instead of killing themselves?,88,SuicideWatch,1568637339.0,2019-09-16 20:35:39,-1
end,2ivawh17,bomnkw,"In the end, at least he boosted some dude’s self esteem.",0,rimjob_steve,1557858694.0,2019-05-15 02:31:34,1
hate,wvrqr,dkrmv8,I hate how your brain teases you with random moments of motivation/hope/joy/etc. then plunges you back into feeling like subhuman trash for days or weeks on end,28,SuicideWatch,1571613587.0,2019-10-21 07:19:47,-1
end,wvrqr,dkrmv8,I hate how your brain teases you with random moments of motivation/hope/joy/etc. then plunges you back into feeling like subhuman trash for days or weeks on end,28,SuicideWatch,1571613587.0,2019-10-21 07:19:47,-1
bad,wvrqr,ccxqhq,"Fortnite good, Minecraft bad",9,teenagers,1563070824.0,2019-07-14 10:20:24,0
kill,wvrqr,ccxj8z,"Humans: *sends long list of our history, accomplishments, and reasons for aliens not to kill us or take our resources*",5,teenagers,1563069599.0,2019-07-14 09:59:59,1
depress,wvrqr,bnku85,When people tell you to not give a fuck about anything to be happier and you already have but you are depressed is pretty fucking terrible,0,depression,1557632618.0,2019-05-12 11:43:38,-1
die,wvrqr,bi571e,I hope you die,7,teenagers,1556408916.0,2019-04-28 07:48:36,-1
hate,wvrqr,b8rf8c,"I hate whenever I am around players of the opposite sex I get the ""nervous"" debuff.",0,outside,1554252696.0,2019-04-03 08:51:36,-1
depress,wvrqr,awyaci,Underrated song by Radiohead that kind of sums up depression (at least for a lot of people with depression).,5,depression,1551645573.0,2019-03-04 04:39:33,-1
nobodi,wvrqr,7oemxs,What are places you'd like to go but nobody else would want to go?,9,AskReddit,1515189195.0,2018-01-06 05:53:15,1
end,wvrqr,7o9kj9,What is one time you thought you couldn't make it through a really tough part in your life but end up actually getting over it?,10,AskReddit,1515136101.0,2018-01-05 15:08:21,0
bad,wvrqr,6uynrr,I never felt like shit so bad in a while...,1,NoFap,1503266747.0,2017-08-21 06:05:47,-1
drug,wvrqr,6o30m2,Porn is more like junk food than drugs.,0,NoFap,1500405313.0,2017-07-19 03:15:13,1
hate,3jrcxi9w,dfr5ku,"My emotions are: sad, depressed, horny, embarrassment, fear, hate, disgust, humiliation, anger, jealousy, envy, bored, empty, uncomfortable, regret, and feeling lonely.",7,depression,1570672523.0,2019-10-10 09:55:23,-1
sad,3jrcxi9w,dfr5ku,"My emotions are: sad, depressed, horny, embarrassment, fear, hate, disgust, humiliation, anger, jealousy, envy, bored, empty, uncomfortable, regret, and feeling lonely.",7,depression,1570672523.0,2019-10-10 09:55:23,-1
depress,3jrcxi9w,dfr5ku,"My emotions are: sad, depressed, horny, embarrassment, fear, hate, disgust, humiliation, anger, jealousy, envy, bored, empty, uncomfortable, regret, and feeling lonely.",7,depression,1570672523.0,2019-10-10 09:55:23,-1
sad,3jrcxi9w,d2jndv,"This is so sad. Alexa, play “Godbless the USA - Lee Greenwood”",57,lossofalovedone,1568171315.0,2019-09-11 11:08:35,-1
kill,3jrcxi9w,clpk56,Do y’all’s ever want to kill yourself over a minor inconvenience and that makes you want to kill yourself even more cause other people have it way worse?,36,SuicideWatch,1564875776.0,2019-08-04 07:42:56,-1
meaningless,jdh0u,dcwjkc,"So empty, So meaningless.",2,SuicideWatch,1570134018.0,2019-10-04 04:20:18,-1
fight,jdh0u,d0ldpr,"Too tired to win, too weak to fight.",3,SuicideWatch,1567798336.0,2019-09-07 03:32:16,-1
hate,jdh0u,bayxv8,"Sleeping is so peaceful, I hate waking up.",65,SuicideWatch,1554756485.0,2019-04-09 04:48:05,0
drug,jdh0u,b2w9q1,"TIL Bayer sold HIV and Hepatitis C contaminated blood products that caused up to 10,000 people in the US alone infected to HIV. After they found out the drug was contaminated, they pulled it off the US market and sold it to countries in Asia and Latin America so that they could still make money.",8,LateStageCapitalism,1552995026.0,2019-03-19 19:30:26,-1
alon,jdh0u,b2w9q1,"TIL Bayer sold HIV and Hepatitis C contaminated blood products that caused up to 10,000 people in the US alone infected to HIV. After they found out the drug was contaminated, they pulled it off the US market and sold it to countries in Asia and Latin America so that they could still make money.",8,LateStageCapitalism,1552995026.0,2019-03-19 19:30:26,-1
bad,jdh0u,8ekkmn,She Needs It So Bad. 💗,0,AnimeMILFS,1524578111.0,2018-04-24 21:55:11,-1
plan,121aza,ccs5ch,I asked SEVEN different people to be my plus one at a wedding. All of them bailed/made other plans.,1,lonely,1563040100.0,2019-07-14 01:48:20,0
anxieti,121aza,b228m1,I feel like my anxiety is keeping me from who I really am,2,Anxiety,1552802905.0,2019-03-17 14:08:25,1
aliv,121aza,a3vrfu,The concept that suicide will always be an option keeps me alive.,13,SuicideWatch,1544152594.0,2018-12-07 11:16:34,-1
suicid,121aza,a3vrfu,The concept that suicide will always be an option keeps me alive.,13,SuicideWatch,1544152594.0,2018-12-07 11:16:34,-1
abus,121aza,a13smn,"My abusive, schizophrenic ex-boyfriend just tried to contact me out of the blue. The no-contact order has expired. How do I proceed? Washington State",5,TwoXChromosomes,1543387843.0,2018-11-28 14:50:43,-1
abus,121aza,a13gpx,"My abusive, schizophrenic ex-boyfriend just tried to contact me out of the blue. The no-contact order has expired. How do I proceed? Washington State",2,domesticviolence,1543384838.0,2018-11-28 14:00:38,-1
abus,121aza,a13cx6,"My abusive, schizophrenic ex-boyfriend just tried to contact me out of the blue. The no-contact order has expired. How do I proceed? Washington State",1,legal,1543383893.0,2018-11-28 13:44:53,-1
abus,121aza,8gezu5,How do I (21F) tell my parents (60'sM/F) they abusing me by parentification without disrespecting them...?,2,relationships,1525238505.0,2018-05-02 13:21:45,-1
commit,121aza,6e5wfi,Will I EVER commit suicide? Probably not. Do I think about doing it? Every. Single. Day.,36,SuicideWatch,1496129658.0,2017-05-30 15:34:18,-1
suicid,121aza,6e5wfi,Will I EVER commit suicide? Probably not. Do I think about doing it? Every. Single. Day.,36,SuicideWatch,1496129658.0,2017-05-30 15:34:18,-1
suicid,q5whm,dkfkaq,Do you ever feel like suicide is your destiny?,125,SuicideWatch,1571549703.0,2019-10-20 13:35:03,-1
live,3wi9k8ow,c9o27b,"UPDATE THANK YOU, EVERYONE,​ WHO PUSHED ME TO LIVE!!!!!!!",94,SuicideWatch,1562377604.0,2019-07-06 09:46:44,1
suicid,3wi9k8ow,bxpfp1,on the verge of suicide!!!!! please help!!,48,SuicideWatch,1559875303.0,2019-06-07 10:41:43,1
suicid,4eji107y,cwio6u,"My name is Tyler, that’s my real name this is my only account, I’m highly suicidal, have been since I was about 6-7 years old, I’m 26 now and it’s different now. I’m going to tell you my story in a new attempt to gain enough relief to fall asleep tonight. Thanks for reading if you do <3",46,SuicideWatch,1566986546.0,2019-08-28 18:02:26,1
die,3omvhqgz,dkvqx4,two recent suicide attempts and hospitalizations later and i still want to die,6,SuicideWatch,1571635317.0,2019-10-21 13:21:57,-1
suicid,3omvhqgz,dkvqx4,two recent suicide attempts and hospitalizations later and i still want to die,6,SuicideWatch,1571635317.0,2019-10-21 13:21:57,-1
night,3omvhqgz,ddacqo,my scrumptious dinner from last night 👌🏼👏🏻😍 #mealspo,6,EDanonymemes,1570209399.0,2019-10-05 01:16:39,1
pill,3omvhqgz,d8jmpf,i just took all the remaining pills of my 5 prescriptions. goodbye.,171,SuicideWatch,1569308949.0,2019-09-24 15:09:09,0
suicid,3omvhqgz,d0twjt,Does anyone else experience intense short lived bouts of suicidal feelings/ideation when not otherwise suicidal?,8,bipolar,1567848200.0,2019-09-07 17:23:20,-1
live,3omvhqgz,d0twjt,Does anyone else experience intense short lived bouts of suicidal feelings/ideation when not otherwise suicidal?,8,bipolar,1567848200.0,2019-09-07 17:23:20,-1
hopeless,3omvhqgz,bxtxil,I feel hopeless and directionless after my first LTR break up?,3,Advice,1559909855.0,2019-06-07 20:17:35,-1
live,3omvhqgz,bjsicb,Has anybody lived on campus at CSUB before?,11,Bakersfield,1556785662.0,2019-05-02 16:27:42,0
bad,tzk5p63,dimccf,I overdosed. Ended up calling 911 before it was late. I ended up pretty bad. I couldn’t move and wasn’t coherent for a day and half. Spent 6 days in the hospital. Getting outpatient help I guess we go from here. I have better hope now I think,36,SuicideWatch,1571214690.0,2019-10-16 16:31:30,1
end,tzk5p63,dimccf,I overdosed. Ended up calling 911 before it was late. I ended up pretty bad. I couldn’t move and wasn’t coherent for a day and half. Spent 6 days in the hospital. Getting outpatient help I guess we go from here. I have better hope now I think,36,SuicideWatch,1571214690.0,2019-10-16 16:31:30,1
die,tzk5p63,dfsjvo,Should I just drink instead or dying just drink all time? Which can be better I choose the latter,1,SuicideWatch,1570680085.0,2019-10-10 12:01:25,1
kill,kwtj9,drh9mf,Buddhist take on killing as an act of compassion?,16,Buddhism,1572872335.0,2019-11-04 20:58:55,-1
kill,kwtj9,bzi3ly,I tried killing myself today.,45,SuicideWatch,1560286794.0,2019-06-12 04:59:54,-1
pill,kwtj9,b1wps4,Does anyone know what the colored crystals in these pills might be?,14,MDMA,1552766991.0,2019-03-17 04:09:51,0
