keyword,author_id,sub_id,submission,comments,subreddit,created,timestamp,risk
drug,kwtj9,abehiy,"Happy new year to all, whatever your drug of choice (long read).",2,Drugs,1546313160.0,2019-01-01 11:26:00,1
depress,ajeutqm,drmz1j,A rant from the depths of my seemingly endless depressive episode,0,mentalhealth,1572896861.0,2019-11-05 03:47:41,-1
exist,ajeutqm,d0z0hy,Good people do exist,7,LifeAfterNarcissism,1567877869.0,2019-09-08 01:37:49,1
anxieti,ajeutqm,cxrjbm,"Going on a date soon, anxiety over the possibility of another narc",4,NarcissisticAbuse,1567224699.0,2019-08-31 12:11:39,0
cut,ajeutqm,cw167n,Anyone else cut off their narc before they could discard?,28,NarcissisticAbuse,1566891997.0,2019-08-27 15:46:37,-1
pain,ajeutqm,cmln92,Vision problems accompanied by neck pain,3,AskDocs,1565063909.0,2019-08-06 11:58:29,-1
sad,ajeutqm,chzd9f,"I get a strange, deep feeling of sadness when I see old people",1,offmychest,1564122975.0,2019-07-26 14:36:15,-1
unsur,ajeutqm,cf0l32,"Expecting every new person to be a narc now, unsure about how to proceed with new ""relationship""",6,NarcissisticAbuse,1563496035.0,2019-07-19 08:27:15,-1
die,ajeutqm,ca583y,"Half the time I want to die, the other half I'm terrified to die",17,mentalhealth,1562493380.0,2019-07-07 17:56:20,-1
aliv,ajeutqm,c7pd98,Being alive is terrifying,0,mentalhealth,1561964350.0,2019-07-01 14:59:10,-1
anxieti,ajeutqm,c6ah0j,Anxiety,1,mentalhealth,1561666815.0,2019-06-28 04:20:15,0
lost,ajeutqm,c63ish,I lost a year of my life,5,NarcissisticAbuse,1561628556.0,2019-06-27 17:42:36,-1
depress,ajeutqm,c03c84,I think another depressive episode is coming on,1,mentalhealth,1560415541.0,2019-06-13 16:45:41,-1
care,ajeutqm,bx0rk0,Angry at my parents for not acting like they care,0,mentalhealth,1559728221.0,2019-06-05 17:50:21,-1
anxieti,ajeutqm,bq2hpa,It's 3am and my loneliness is giving me so much anxiety,5,mentalhealth,1558174477.0,2019-05-18 18:14:37,-1
stupid,ajeutqm,bl7f5l,Honestly don't know if I'm stupid or just have zero attention span,2,mentalhealth,1557116300.0,2019-05-06 12:18:20,0
die,ajeutqm,bkj7k8,DAE feel like they've died before?,1,DAE,1556959930.0,2019-05-04 16:52:10,-1
sad,ajeutqm,bjsc7w,i swear my cat knows when i'm sad,0,offmychest,1556784051.0,2019-05-02 16:00:51,-1
alon,ajeutqm,bfhdvp,I always sleep with a pillow next to me so I can pretend I'm not sleeping alone,2,confession,1555796079.0,2019-04-21 05:34:39,0
pretend,ajeutqm,bfhdvp,I always sleep with a pillow next to me so I can pretend I'm not sleeping alone,2,confession,1555796079.0,2019-04-21 05:34:39,0
panic,ajeutqm,b2fakm,I think I had a panic attack,2,mentalhealth,1552890703.0,2019-03-18 14:31:43,-1
hate,ajeutqm,ay7opy,I absolutely hate the healthcare system,2,offmychest,1551927385.0,2019-03-07 10:56:25,-1
harm,ajeutqm,awfmm3,My (20f) little brother (14m) got high at school and I'm debating whether telling my parents will do more harm than good,1,relationships,1551514759.0,2019-03-02 16:19:19,0
aliv,ajeutqm,as2xve,It feels like I'm alive again,1,NarcissisticAbuse,1550528772.0,2019-02-19 06:26:12,1
suicid,ajeutqm,9ik8d8,i become severely suicidal every month as a part of my pms,4,mentalhealth,1537812025.0,2018-09-25 02:00:25,-1
die,ajeutqm,9igy4o,my grandma is dying.,0,offmychest,1537786753.0,2018-09-24 18:59:13,0
alon,ajeutqm,9869uz,Shutting down. I feel like I'm truly alone,3,offmychest,1534541936.0,2018-08-18 05:38:56,1
commit,ajeutqm,95icab,nobody cares if youre suicidal until you actually commit suicide,52,SuicideWatch,1533697432.0,2018-08-08 11:03:52,-1
nobodi,ajeutqm,95icab,nobody cares if youre suicidal until you actually commit suicide,52,SuicideWatch,1533697432.0,2018-08-08 11:03:52,-1
care,ajeutqm,95icab,nobody cares if youre suicidal until you actually commit suicide,52,SuicideWatch,1533697432.0,2018-08-08 11:03:52,-1
suicid,ajeutqm,95icab,nobody cares if youre suicidal until you actually commit suicide,52,SuicideWatch,1533697432.0,2018-08-08 11:03:52,-1
abus,ajeutqm,944yvx,"i (19f) am finally done with my abusive, homeless boyfriend (20m) of almost a year.. having a happy broken heart seemed like an oxymoron until now",5,JustNoSO,1533257045.0,2018-08-03 08:44:05,-1
lost,lq18c,cfjgkg,[TOMT][SCIFI BOOK][probably a classic] Sci-fi book where people engineered a religion to be about science so that after a post-apocalyptic event science isn't lost,15,tipofmytongue,1563610395.0,2019-07-20 16:13:15,1
die,lq18c,ae3ki8,What's that fetish called where you want something really big to enter your anus and die by rupturing your internal organs?,8,NoStupidQuestions,1547010927.0,2019-01-09 13:15:27,-1
suicid,lq18c,7he3h4,"the only existence sadder than being suicidal is being suicidal but with the option of suicide taken away from you because if you were to kill yourself, you would kill someone else too",63,SuicideWatch,1512351909.0,2017-12-04 09:45:09,-1
kill,lq18c,7he3h4,"the only existence sadder than being suicidal is being suicidal but with the option of suicide taken away from you because if you were to kill yourself, you would kill someone else too",63,SuicideWatch,1512351909.0,2017-12-04 09:45:09,-1
exist,lq18c,7he3h4,"the only existence sadder than being suicidal is being suicidal but with the option of suicide taken away from you because if you were to kill yourself, you would kill someone else too",63,SuicideWatch,1512351909.0,2017-12-04 09:45:09,-1
end,lq18c,7fgaam,What's your guys' favorite Asimov book or story? Mine is The End of Eternity for sure.,35,printSF,1511628076.0,2017-11-26 00:41:16,1
lost,lq18c,7dl3kd,"On this day, one year ago, we lost What.CD.",169,trackers,1510927169.0,2017-11-17 21:59:29,-1
live,lq18c,6ygkx2,Irma Live Thread is up,30,weather,1504714272.0,2017-09-07 00:11:12,0
fight,lq18c,6gr8uz,"6 months on - Seems like Redacted has won the ""What.CD Replacement"" fight",302,trackers,1497261123.0,2017-06-12 17:52:03,1
suicid,3fhlni5d,cei14y,Failed suicide attempt,97,SuicideWatch,1563393931.0,2019-07-18 04:05:31,-1
harm,3sbcbcul,cddlro,I scratch myself as self harm,3,SuicideWatch,1563169703.0,2019-07-15 13:48:23,-1
worthless,3sbcbcul,c6cqu9,I’m worthless,1,SuicideWatch,1561678533.0,2019-06-28 07:35:33,-1
harm,3sbcbcul,c64whf,In my bathroom self harming again,5,SuicideWatch,1561638405.0,2019-06-27 20:26:45,-1
disord,3sbcbcul,c5w11l,Does anyone else have persistent depressive disorder?,2,SuicideWatch,1561583611.0,2019-06-27 05:13:31,-1
depress,3sbcbcul,c5w11l,Does anyone else have persistent depressive disorder?,2,SuicideWatch,1561583611.0,2019-06-27 05:13:31,-1
kill,3sbcbcul,bt61pi,The loneliness is killing me,9,SuicideWatch,1558863282.0,2019-05-26 17:34:42,-1
depress,3sbcbcul,bqim6u,Can we not gatekeep suicidal depression?,55,SuicideWatch,1558282015.0,2019-05-20 00:06:55,1
suicid,3sbcbcul,bqim6u,Can we not gatekeep suicidal depression?,55,SuicideWatch,1558282015.0,2019-05-20 00:06:55,1
lost,3sbcbcul,bqb7s6,I lost the only person to show interest in me and now I don’t want to live anymore,7,SuicideWatch,1558227969.0,2019-05-19 09:06:09,1
live,3sbcbcul,bqb7s6,I lost the only person to show interest in me and now I don’t want to live anymore,7,SuicideWatch,1558227969.0,2019-05-19 09:06:09,1
bad,3sbcbcul,bq2ay6,I’m a bad person,8,SuicideWatch,1558173631.0,2019-05-18 18:00:31,-1
bad,3sbcbcul,bq26ah,I’m a bad person,0,u_wanna-be-unbirthed,1558172978.0,2019-05-18 17:49:38,-1
commit,i0hgj,c9689w,I feel like an NPC in a world filled with players. i’m just created to commit suicide and i can’t change the settings to stop that.,49,SuicideWatch,1562266359.0,2019-07-05 02:52:39,-1
suicid,i0hgj,c9689w,I feel like an NPC in a world filled with players. i’m just created to commit suicide and i can’t change the settings to stop that.,49,SuicideWatch,1562266359.0,2019-07-05 02:52:39,-1
live,i0hgj,4wf2es,When you live in a rural area,0,pokemongo,1470471609.0,2016-08-06 16:20:09,0
jump,1aqmex3u,bgq09m,I jumped off a (small) bridge,53,SuicideWatch,1556077984.0,2019-04-24 11:53:04,0
cut,1aqmex3u,aynima,"So, I cut myself a bit",4,SuicideWatch,1552029920.0,2019-03-08 15:25:20,-1
dead,1aqmex3u,8gzxg2,Wedding Photography is Dead,0,photography,1525446355.0,2018-05-04 23:05:55,-1
aliv,3mw5lzow,cv9yc5,"well guys, i’m alive",91,SuicideWatch,1566747328.0,2019-08-25 23:35:28,1
breath,21q2o21j,dp9z6l,"Everyone has about 2 minutes to live, breathing just resets the clock.",5,DeepThoughts,1572457176.0,2019-10-31 01:39:36,0
live,21q2o21j,dp9z6l,"Everyone has about 2 minutes to live, breathing just resets the clock.",5,DeepThoughts,1572457176.0,2019-10-31 01:39:36,0
suicid,21q2o21j,dhy1pv,I'm thinking about suicide.,16,mentalillness,1571091161.0,2019-10-15 06:12:41,-1
suicid,21q2o21j,dhw9cz,I have attempted suicide AMA,11,AMA,1571083764.0,2019-10-15 04:09:24,-1
pill,21q2o21j,dgyp7y,Just took about 600 differnet pills.,17,SuicideWatch,1570903903.0,2019-10-13 02:11:43,0
depress,21q2o21j,cs4klj,I think my depression is passing,41,SuicideWatch,1566151027.0,2019-08-19 01:57:07,-1
schizophrenia,21q2o21j,clzctu,I suffer from schizophrenia. AMA,5,AMA,1564941587.0,2019-08-05 01:59:47,-1
panic,21q2o21j,cd98jl,What does a panic attack feel like?,16,AskReddit,1563143416.0,2019-07-15 06:30:16,-1
suicid,21q2o21j,c9zt18,Anyone else have absolutely no reason to be suicidal?,6,SuicideWatch,1562453506.0,2019-07-07 06:51:46,-1
depress,21q2o21j,c97zhd,What does your depression feel like?,11,AskReddit,1562275986.0,2019-07-05 05:33:06,-1
depress,21q2o21j,bu37ou,What was the shittiest advice you've ever gotten for depression?,18,AskReddit,1559066310.0,2019-05-29 01:58:30,-1
hurt,21q2o21j,bs5izm,What's the most hurtful thing someone has said to you?,5,AskReddit,1558631305.0,2019-05-24 01:08:25,-1
depress,21q2o21j,bnc4u2,I think my depression is finally passing.,22,SuicideWatch,1557581790.0,2019-05-11 21:36:30,-1
hurt,13vtw1,7yi7aq,Do you ever feel so lonely your chest physically hurts?,91,SuicideWatch,1518995549.0,2018-02-19 07:12:29,-1
die,3el60h0g,b0tmq3,I almost died yesterday,63,SuicideWatch,1552523063.0,2019-03-14 08:24:23,-1
alon,4hahd2qg,d16gmi,I just called the hotline and got hung up on. Talk about feeling alone,54,SuicideWatch,1567916678.0,2019-09-08 12:24:38,0
hung,4hahd2qg,d16gmi,I just called the hotline and got hung up on. Talk about feeling alone,54,SuicideWatch,1567916678.0,2019-09-08 12:24:38,0
exist,3kuscuvj,dh5ec1,I wish pizza stopped existing,3,themonkeysotherpaw,1570937660.0,2019-10-13 11:34:20,1
end,3kuscuvj,derocs,[offer] I will teach you what to do at the end of the world for 5$ per hour.,3,slavelabour,1570490898.0,2019-10-08 07:28:18,0
dead,3kuscuvj,dav1yo,Is the game dead?,1,FortNiteBR,1569763387.0,2019-09-29 21:23:07,-1
bad,3kuscuvj,daguv2,"Peertube good, Youtube bad.",6,dankmemes,1569681794.0,2019-09-28 22:43:14,0
hate,3kuscuvj,d7y7sg,I don't know why everyone hates history as a subject.,34,CasualConversation,1569194539.0,2019-09-23 07:22:19,-1
hate,3kuscuvj,d75d3l,The meme chain of hate,4,AskMemeologists,1569036039.0,2019-09-21 11:20:39,-1
sad,3kuscuvj,d4z9zu,sad :...(,0,Christianity,1568632983.0,2019-09-16 19:23:03,-1
care,3kuscuvj,d4z9z7,People only care about me when I tell them I want to die.,2,SuicideWatch,1568632980.0,2019-09-16 19:23:00,0
die,3kuscuvj,d4z9z7,People only care about me when I tell them I want to die.,2,SuicideWatch,1568632980.0,2019-09-16 19:23:00,0
dead,3kuscuvj,d4q9rv,I’m already dead.,2,SuicideWatch,1568580378.0,2019-09-16 04:46:18,-1
die,3kuscuvj,d4037y,I am the kid that tries to join your friend group but fails. I am the kid that can’t take a hint. I am the kid that no one likes. I am the weird kid. I want to die.,101,SuicideWatch,1568431970.0,2019-09-14 11:32:50,-1
live,3kuscuvj,d3zs39,"[US] 4634 7975 8087 gifts daily, live in New York and travel monthly",1,pokemongotrades,1568430111.0,2019-09-14 11:01:51,0
sad,3kuscuvj,d1xewp,That sad moment when you can’t find the ball that was thrown.,0,aww,1568064492.0,2019-09-10 05:28:12,-1
live,3kuscuvj,czbx31,"People who live outside North America, are there some memes in other languages, if so what are they?",0,AskReddit,1567549609.0,2019-09-04 06:26:49,0
die,40pzmob4,c9umba,I just want to die in my sleep.,146,SuicideWatch,1562425882.0,2019-07-06 23:11:22,-1
hang,40pzmob4,c8bwkx,"I'm going to hang myself tonight, goodbye everyone.",15,SuicideWatch,1562087696.0,2019-07-03 01:14:56,0
hate,q897m,b76viu,I hate that you can’t even mention suicidal thoughts because everyone will freak out,40,SuicideWatch,1553918691.0,2019-03-30 12:04:51,-1
suicid,q897m,b76viu,I hate that you can’t even mention suicidal thoughts because everyone will freak out,40,SuicideWatch,1553918691.0,2019-03-30 12:04:51,-1
plan,q897m,5q34gh,Is Citrico's worth it without a dining plan?,11,WaltDisneyWorld,1485350428.0,2017-01-25 21:20:28,1
sick,q897m,59u1w9,Should we even consider tube feeding our sick kitten (cancer)?,5,cats,1477656596.0,2016-10-28 20:09:56,-1
night,q897m,4to4xp,Kitten suckling face at night?,1,cats,1468970529.0,2016-07-20 07:22:09,0
bad,q897m,4799uy,"Looking for this French poster? Can't make out the words due to the bad quality, but something to do with fill in the picture with pretty colors (jolie couleur). Even if someone can make out the text, it would be appreciated.",0,HelpMeFind,1456267400.0,2016-02-24 06:43:20,1
night,q897m,3wag61,"I just watched ""Escape from L.A."" last night and can't stop thinking about it",19,BoJackHorseman,1449787305.0,2015-12-11 06:41:45,1
bad,q897m,3vuyr5,"What do real life jerk jocks, bullies, and mean cheerleaders think when they see their stereotype in a movie playing the bad guy?",8,Showerthoughts,1449532879.0,2015-12-08 08:01:19,-1
bulli,q897m,3vuyr5,"What do real life jerk jocks, bullies, and mean cheerleaders think when they see their stereotype in a movie playing the bad guy?",8,Showerthoughts,1449532879.0,2015-12-08 08:01:19,-1
kill,3svkyrdg,d7on6t,I tried to kill myself.,98,SuicideWatch,1569147791.0,2019-09-22 18:23:11,-1
hurt,2pidiiln,dadmlq,"i'm lucky enough to have a few people in my life who care so much for me that sometimes it actually hurts. i don't want them to wake up one day to find me dead. even if right now i can't live for myself, i will try for them.",65,SuicideWatch,1569661118.0,2019-09-28 16:58:38,-1
care,2pidiiln,dadmlq,"i'm lucky enough to have a few people in my life who care so much for me that sometimes it actually hurts. i don't want them to wake up one day to find me dead. even if right now i can't live for myself, i will try for them.",65,SuicideWatch,1569661118.0,2019-09-28 16:58:38,-1
dead,2pidiiln,dadmlq,"i'm lucky enough to have a few people in my life who care so much for me that sometimes it actually hurts. i don't want them to wake up one day to find me dead. even if right now i can't live for myself, i will try for them.",65,SuicideWatch,1569661118.0,2019-09-28 16:58:38,-1
live,2pidiiln,dadmlq,"i'm lucky enough to have a few people in my life who care so much for me that sometimes it actually hurts. i don't want them to wake up one day to find me dead. even if right now i can't live for myself, i will try for them.",65,SuicideWatch,1569661118.0,2019-09-28 16:58:38,-1
night,122dss,c5j2vf,My daughter (14f) tried to kill herself last night,113,SuicideWatch,1561512993.0,2019-06-26 09:36:33,-1
kill,122dss,c5j2vf,My daughter (14f) tried to kill herself last night,113,SuicideWatch,1561512993.0,2019-06-26 09:36:33,-1
breath,122dss,99jdsn,Everyone takes breathing through their nose for granted until they can’t.,2,Showerthoughts,1534989852.0,2018-08-23 10:04:12,1
care,122dss,999fqw,How many Redditors wish they took better care of their teeth when they were younger?,19,AskReddit,1534904301.0,2018-08-22 10:18:21,1
live,122dss,8usmqh,We live in a society,7,GamersRiseUp,1530274243.0,2018-06-29 20:10:43,0
live,122dss,8b6ihp,I keep Facebook around to be able to share pictures and information with my family that lives 12 hours away. Not to give all my information to some data mining company. I should have known better.,3,mildlyinfuriating,1523355053.0,2018-04-10 18:10:53,1
night,122dss,80qg8m,Let me introduce: The I’m 30 and taking online college at night while working 40+ hours a week and raising three girls battle top.,19,Battletops,1519768146.0,2018-02-28 05:49:06,-1
end,122dss,7s02zx,"During a NFL playoff game both teams kickers, quarterbacks, and star players are injured. The game goes a full four quarters and the score remains 0-0. Overtime starts but still neither team can score. The game has been going on for 10 hours. How long does the game continue? How does it end?",7,AskReddit,1516564881.0,2018-01-22 04:01:21,-1
end,120jovx9,cv7j78,Just venting my feelings. I want to end it soon.,1,SuicideWatch,1566733631.0,2019-08-25 19:47:11,0
fight,120jovx9,c32k0k,"Parents fighting, getting a divorce. Need advice",5,AbuseInterrupted,1561069716.0,2019-06-21 06:28:36,-1
alon,120jovx9,c2lgl1,I'm so alone.,21,SuicideWatch,1560972469.0,2019-06-20 03:27:49,-1
suicid,120jovx9,c1qw03,Does anyone else think about suicide every few seconds?,75,SuicideWatch,1560794793.0,2019-06-18 02:06:33,-1
suicid,120jovx9,bztfa9,Suicide as a way to help people around me?,11,SuicideWatch,1560357434.0,2019-06-13 00:37:14,-1
aliv,120jovx9,ahw1tu,The longer I stay alive the more of a burden I am to people around me.,1,SuicideWatch,1547976663.0,2019-01-20 17:31:03,0
hurt,120jovx9,a7q4j3,How to get better and improve without hurting other people in the process?,3,AbuseInterrupted,1545250713.0,2018-12-20 04:18:33,1
commit,120jovx9,a72a4i,I feel like I'm at the end of my rope. And thinking about commiting makes me feel happy in a way.,1,SuicideWatch,1545070467.0,2018-12-18 02:14:27,1
end,120jovx9,a72a4i,I feel like I'm at the end of my rope. And thinking about commiting makes me feel happy in a way.,1,SuicideWatch,1545070467.0,2018-12-18 02:14:27,1
suicid,120jovx9,9ugtmf,"Mentioned suicidal thoughts, instantly got hospitalized. I feel traumatized",22,SuicideWatch,1541446869.0,2018-11-06 03:41:09,-1
abus,120jovx9,9pdh89,Does/did your abuser ever threaten suicide?,9,AbuseInterrupted,1539898238.0,2018-10-19 05:30:38,-1
suicid,120jovx9,9pdh89,Does/did your abuser ever threaten suicide?,9,AbuseInterrupted,1539898238.0,2018-10-19 05:30:38,-1
abus,120jovx9,9jurst,I just want the abuse to stop. But I feel trapped.,5,AbuseInterrupted,1538206885.0,2018-09-29 15:41:25,-1
useless,120jovx9,92h2uv,I'm so useless,2,SuicideWatch,1532730868.0,2018-07-28 06:34:28,-1
kill,2hc6c9wy,9rq2jd,"I killed my girlfriend, and now I want to kill myself..",61,SuicideWatch,1540599541.0,2018-10-27 08:19:01,-1
kill,2hc6c9wy,9rj58a,I killed my Girlfriend,4,nosleep,1540545223.0,2018-10-26 17:13:43,-1
hate,efaiege,cicxob,"[Meta] Anyway we can get a mega thread of the list of the NFL top 100 with links to all the videos? Even if you hate the rankings, the highlight videos are cool to watch?",2,nfl,1564200341.0,2019-07-27 12:05:41,1
aliv,efaiege,c9y4g4,Which former fired head coach (that’s still alive) would you want to see get another shot at an HC gig?,43,nfl,1562444304.0,2019-07-07 04:18:24,-1
night,efaiege,bphbub,Anyone know any places that do Sports Trivia nights?,2,SeattleWA,1558036844.0,2019-05-17 04:00:44,0
care,efaiege,b96pdp,Zyn and oral care / gums,3,Snus,1554342322.0,2019-04-04 09:45:22,1
injuri,efaiege,b7xxr3,"TIL Matt Flynn wasn’t the original drummer of Maroon 5. After serving as the touring drummer for two years, Flynn replaced starting drummer Ryan Dusick after Dusick suffered multiple wrist & shoulder injuries",1,nfl,1554096785.0,2019-04-01 13:33:05,-1
kill,efaiege,avbcuc,"Insomnia is killing me, but part of the reason is because my mind can’t stop thinking about how excited I am to tackle another day",6,stopdrinking,1551257772.0,2019-02-27 16:56:12,-1
bad,efaiege,aqe4nb,"It sucks so bad when you have a bunch of great days in a row, and you feel like you’re making a ton of progression on your mental health and outlook and life in general. Then 1 bad thing happens and you’re back to feeling worthless",47,SuicideWatch,1550106969.0,2019-02-14 09:16:09,-1
worthless,efaiege,aqe4nb,"It sucks so bad when you have a bunch of great days in a row, and you feel like you’re making a ton of progression on your mental health and outlook and life in general. Then 1 bad thing happens and you’re back to feeling worthless",47,SuicideWatch,1550106969.0,2019-02-14 09:16:09,-1
plan,efaiege,aq7veq,Locked On NFL Draft Podcast [02/13/2019] - Offseason Plans for the NFC West (Seahawks analysis starts at 22:08),3,Seahawks,1550072699.0,2019-02-13 23:44:59,-1
