keyword,author_id,sub_id,submission,comments,subreddit,created,timestamp,risk
kill,3zahvor3,c34ko8,My girlfriend killed herself a week after we broke up,193,SuicideWatch,1561082051.0,2019-06-21 09:54:11,-1
bad,2zpif9u2,bczd1f,Why do I feel this bad all the time?,4,SuicideWatch,1555217325.0,2019-04-14 12:48:45,-1
end,2zpif9u2,b7hszh,Alright I finally set a time for when I’m going to end my life,2,SuicideWatch,1553991264.0,2019-03-31 08:14:24,1
commit,2zpif9u2,b4gsy8,I’m starting to feel like I’m meant to commit suicide the same way as someone else is meant to become a doctor or to get married. It’s just the path I was meant to take,179,SuicideWatch,1553329505.0,2019-03-23 16:25:05,-1
suicid,2zpif9u2,b4gsy8,I’m starting to feel like I’m meant to commit suicide the same way as someone else is meant to become a doctor or to get married. It’s just the path I was meant to take,179,SuicideWatch,1553329505.0,2019-03-23 16:25:05,-1
kill,2zpif9u2,b39e3k,I was supposed to kill myself tonight,6,SuicideWatch,1553069790.0,2019-03-20 16:16:30,-1
hate,2zpif9u2,b2frui,I hate being too afraid to kill myself,11,SuicideWatch,1552894862.0,2019-03-18 15:41:02,-1
afraid,2zpif9u2,b2frui,I hate being too afraid to kill myself,11,SuicideWatch,1552894862.0,2019-03-18 15:41:02,-1
kill,2zpif9u2,b2frui,I hate being too afraid to kill myself,11,SuicideWatch,1552894862.0,2019-03-18 15:41:02,-1
die,2zpif9u2,b1ccgv,I wish dying was easier,5,SuicideWatch,1552638688.0,2019-03-15 16:31:28,1
kill,2zpif9u2,b1audi,I think I’m finally going to kill myself by this time next week. Thank you for the people on here who have tried to talk to me before.,6,SuicideWatch,1552627035.0,2019-03-15 13:17:15,-1
die,2zpif9u2,al8sv7,I just want to die. I’m so mad at myself everyday I want it to stop,5,SuicideWatch,1548821144.0,2019-01-30 12:05:44,-1
depress,2zpif9u2,aier4v,My mom asked me if I’m depressed and I said nothing,17,SuicideWatch,1548104029.0,2019-01-22 04:53:49,-1
cut,2zpif9u2,ahha8i,I couldn’t get myself to cut,2,SuicideWatch,1547860361.0,2019-01-19 09:12:41,-1
depress,15fss0,drlw29,Why does depression have to keep coming back,2,SuicideWatch,1572892467.0,2019-11-05 02:34:27,-1
sad,15fss0,dmij6t,Anyone else feel sad that they can’t relate to break up songs?,6,ForeverAlone,1571933117.0,2019-10-25 00:05:17,-1
afraid,15fss0,dku5rd,"First time I see my A. Chalcodes groom herself. And to think not even six months ago I was very afraid of spiders, including tarantulas",0,tarantulas,1571626347.0,2019-10-21 10:52:27,0
depress,15fss0,d4rvsq,DAE find sunny days depressing?,18,DAE,1568587456.0,2019-09-16 06:44:16,0
alon,15fss0,d1u229,I feel so alone and vulnerable,4,ForeverAlone,1568050269.0,2019-09-10 01:31:09,-1
stress,15fss0,ccvnek,DAE feel stressed out about enjoying your day off to the fullest,4,DAE,1563058281.0,2019-07-14 06:51:21,1
depress,15fss0,cbk8i7,I feel embarrassed but....does anyone else get extremely depressed and suicidal when you see a cute person and remember that you’ll always be single and never have a family of your own,256,SuicideWatch,1562782392.0,2019-07-11 02:13:12,-1
suicid,15fss0,cbk8i7,I feel embarrassed but....does anyone else get extremely depressed and suicidal when you see a cute person and remember that you’ll always be single and never have a family of your own,256,SuicideWatch,1562782392.0,2019-07-11 02:13:12,-1
live,15fss0,bntdel,I want to live a solitary life,4,offmychest,1557691002.0,2019-05-13 03:56:42,0
depress,15fss0,bmfixh,Anyone else get extremely depressed with just the thought of working your life away?,20,SuicideWatch,1557376398.0,2019-05-09 12:33:18,-1
suicid,15fss0,blf5h0,"I’m confident that suicide is bound to happen, no matter how good I’m doing",5,SuicideWatch,1557164253.0,2019-05-07 01:37:33,0
depress,15fss0,blf2ng,Does depression ever go away or is it with you for life and you just have to learn to live with it and keep under control?,14,NoStupidQuestions,1557163875.0,2019-05-07 01:31:15,-1
live,15fss0,blf2ng,Does depression ever go away or is it with you for life and you just have to learn to live with it and keep under control?,14,NoStupidQuestions,1557163875.0,2019-05-07 01:31:15,-1
end,15fss0,b94xed,Is anyone else waiting for an accident or illness to kill you because you’re too scared to end it yourself?,24,SuicideWatch,1554332008.0,2019-04-04 06:53:28,-1
kill,15fss0,b94xed,Is anyone else waiting for an accident or illness to kill you because you’re too scared to end it yourself?,24,SuicideWatch,1554332008.0,2019-04-04 06:53:28,-1
hate,15fss0,b7vc47,"When you never asked to be born and hate your existence, but others are quick to point out how selfish it would be to kill yourself and how it would affect them...",8,SuicideWatch,1554080763.0,2019-04-01 09:06:03,-1
kill,15fss0,b7vc47,"When you never asked to be born and hate your existence, but others are quick to point out how selfish it would be to kill yourself and how it would affect them...",8,SuicideWatch,1554080763.0,2019-04-01 09:06:03,-1
exist,15fss0,b7vc47,"When you never asked to be born and hate your existence, but others are quick to point out how selfish it would be to kill yourself and how it would affect them...",8,SuicideWatch,1554080763.0,2019-04-01 09:06:03,-1
stupid,15fss0,b4f0if,"This may sound stupid, but does anyone else become more depressed and suicidal when they have a crush?",5,SuicideWatch,1553315945.0,2019-03-23 12:39:05,-1
depress,15fss0,b4f0if,"This may sound stupid, but does anyone else become more depressed and suicidal when they have a crush?",5,SuicideWatch,1553315945.0,2019-03-23 12:39:05,-1
suicid,15fss0,b4f0if,"This may sound stupid, but does anyone else become more depressed and suicidal when they have a crush?",5,SuicideWatch,1553315945.0,2019-03-23 12:39:05,-1
hang,15fss0,arsxh1,I think my best friends have to force themselves to hang out with me,2,ForeverAlone,1550462094.0,2019-02-18 11:54:54,1
die,15fss0,ag7pd9,"Feeling guilty about wanting die, but then I remembered I didn’t ask to be born",11,SuicideWatch,1547552992.0,2019-01-15 19:49:52,-1
aliv,15fss0,a1b6be,It really sucks staying alive for others,8,SuicideWatch,1543444372.0,2018-11-29 06:32:52,0
depress,15fss0,9e8nli,Is it just me or does it feel like depression will always be in your life?,6,depression,1536450244.0,2018-09-09 07:44:04,-1
cut,15fss0,9dyz92,"I feel the need to cut contact with everyone, specially family, and I’m not sure why",79,Advice,1536357519.0,2018-09-08 05:58:39,-1
care,15fss0,7d1f35,Seems like people only care once you’re gone,6,SuicideWatch,1510717708.0,2017-11-15 11:48:28,1
pain,15fss0,6jp6fw,"""Suicide doesn't end the pain, it just passes it onto someone else""",41,SuicideWatch,1498523520.0,2017-06-27 08:32:00,-1
end,15fss0,6jp6fw,"""Suicide doesn't end the pain, it just passes it onto someone else""",41,SuicideWatch,1498523520.0,2017-06-27 08:32:00,-1
suicid,15fss0,6jp6fw,"""Suicide doesn't end the pain, it just passes it onto someone else""",41,SuicideWatch,1498523520.0,2017-06-27 08:32:00,-1
depress,3nra8exd,dpfc8x,Scribbled a shitty poem about depression and suicide I'm not even really sure when but,13,depression,1572480195.0,2019-10-31 08:03:15,-1
suicid,3nra8exd,dpfc8x,Scribbled a shitty poem about depression and suicide I'm not even really sure when but,13,depression,1572480195.0,2019-10-31 08:03:15,-1
depress,3nra8exd,dmacrp,I was only about 13 the last time I was happy and I'm a few days from 21 now. It feels like I've only known life through the lens of depression.,0,depression,1571885939.0,2019-10-24 10:58:59,1
hate,3nra8exd,dkp7t3,"I hate hate hate the tough love ""stop making excuses get up and kick depressions ass and just do it"" attitude to help",46,depression,1571602855.0,2019-10-21 04:20:55,-1
depress,3nra8exd,dkp7t3,"I hate hate hate the tough love ""stop making excuses get up and kick depressions ass and just do it"" attitude to help",46,depression,1571602855.0,2019-10-21 04:20:55,-1
panic,3nra8exd,dkg127,I'm extremely stressed out because of money right now. I haven't had a panic attack in years but this feels like the start of one,4,Anxiety,1571553155.0,2019-10-20 14:32:35,1
stress,3nra8exd,dkg127,I'm extremely stressed out because of money right now. I haven't had a panic attack in years but this feels like the start of one,4,Anxiety,1571553155.0,2019-10-20 14:32:35,1
night,3nra8exd,dhzb50,Having a really bad night,13,depression,1571096761.0,2019-10-15 07:46:01,-1
bad,3nra8exd,dhzb50,Having a really bad night,13,depression,1571096761.0,2019-10-15 07:46:01,-1
night,3nra8exd,dh7utu,I've felt really bad the last week or so at nights,0,depression,1570954876.0,2019-10-13 16:21:16,-1
bad,3nra8exd,dh7utu,I've felt really bad the last week or so at nights,0,depression,1570954876.0,2019-10-13 16:21:16,-1
stuck,3nra8exd,dh7ryz,I'm extremely angry because I'm stuck with this forever,7,depression,1570954293.0,2019-10-13 16:11:33,-1
stupid,3nra8exd,dclt9i,Sounds cliché and stupid but I really don't feel like I'll find anybody else,2,BreakUp,1570075977.0,2019-10-03 12:12:57,-1
live,3nra8exd,dac2gw,People always say just live moment to moment and distract yourself from reality but that's a terrible way to live,0,depression,1569649229.0,2019-09-28 13:40:29,-1
depress,3nra8exd,d9xaga,Alright yeah we're depressed but life and the world also just suck,16,depression,1569571964.0,2019-09-27 16:12:44,-1
hate,3nra8exd,d8wqv1,What are you supposed to do when you hate literally everything about your life?,2,depression,1569376339.0,2019-09-25 09:52:19,-1
ptsd,3nra8exd,d7n99h,I think I want to talk to my therapist about ptsd,9,mentalillness,1569137254.0,2019-09-22 15:27:34,0
die,3nra8exd,d7mve8,"People always say they don't wanna die, they just don't want so suffer anymore. But how do you stop suffering otherwise?",2,depression,1569134354.0,2019-09-22 14:39:14,-1
suicid,3nra8exd,d7lah8,Anyone else just want suicide prevention month to be over already,7,depression,1569123896.0,2019-09-22 11:44:56,-1
depress,3nra8exd,d5u6ew,"On the one hand I had fun doing something for once tonight, on the other hand I still got crushed with the depression and suicidal thoughts as soon as it ended",1,depression,1568791130.0,2019-09-18 15:18:50,-1
end,3nra8exd,d5u6ew,"On the one hand I had fun doing something for once tonight, on the other hand I still got crushed with the depression and suicidal thoughts as soon as it ended",1,depression,1568791130.0,2019-09-18 15:18:50,-1
suicid,3nra8exd,d5u6ew,"On the one hand I had fun doing something for once tonight, on the other hand I still got crushed with the depression and suicidal thoughts as soon as it ended",1,depression,1568791130.0,2019-09-18 15:18:50,-1
end,3nra8exd,d4wg20,Anybody ever feel like they're gonna end up killing themselves eventually anyway so what's the point in waiting,0,depression,1568612705.0,2019-09-16 13:45:05,-1
kill,3nra8exd,d4wg20,Anybody ever feel like they're gonna end up killing themselves eventually anyway so what's the point in waiting,0,depression,1568612705.0,2019-09-16 13:45:05,-1
die,3nra8exd,d4w46h,"Hello everyone welcome to another day, I still just wanna die",0,SuicideWatch,1568610562.0,2019-09-16 13:09:22,-1
nobodi,3nra8exd,d4w3pm,Literally not one person knows all of my problems so nobody knows why suicide so often seems like the best option.,7,depression,1568610485.0,2019-09-16 13:08:05,0
suicid,3nra8exd,d4w3pm,Literally not one person knows all of my problems so nobody knows why suicide so often seems like the best option.,7,depression,1568610485.0,2019-09-16 13:08:05,0
hate,3nra8exd,d3xvuo,"I hate hearing that it'll get better, even from people who have experienced depression because for so many people it really doesn't",5,SuicideWatch,1568419546.0,2019-09-14 08:05:46,-1
depress,3nra8exd,d3xvuo,"I hate hearing that it'll get better, even from people who have experienced depression because for so many people it really doesn't",5,SuicideWatch,1568419546.0,2019-09-14 08:05:46,-1
stupid,3nra8exd,d340h3,It sounds really stupid but I saw a bunch of animals tonight and had a good time,7,depression,1568270725.0,2019-09-12 14:45:25,1
die,3nra8exd,d2k5lc,"The only point of life really is to just work, pay bills, die",73,depression,1568173803.0,2019-09-11 11:50:03,-1
sick,3nra8exd,d1lox9,How can I use sick time or how does that work?,1,starbucks,1568001210.0,2019-09-09 11:53:30,-1
bad,3nra8exd,d1jn4f,Took a walk but feel just as bad as I did,0,depression,1567990185.0,2019-09-09 08:49:45,-1
die,3nra8exd,d17tao,I've at least loosely known SIX people who have died by suicide and there's one thing I've noticed,14,SuicideWatch,1567926515.0,2019-09-08 15:08:35,-1
suicid,3nra8exd,d17tao,I've at least loosely known SIX people who have died by suicide and there's one thing I've noticed,14,SuicideWatch,1567926515.0,2019-09-08 15:08:35,-1
nobodi,3nra8exd,d17oen,Nobody understands how reasonable suicide seems in situations like this and it makes me feel even more isolated and crazy,4,depression,1567925481.0,2019-09-08 14:51:21,-1
suicid,3nra8exd,d17oen,Nobody understands how reasonable suicide seems in situations like this and it makes me feel even more isolated and crazy,4,depression,1567925481.0,2019-09-08 14:51:21,-1
pain,3nra8exd,d16wa3,"I hope someone reads this. I'm completely broken and I don't understand. Is there ANY way even possible to stop or reduce the pain besides sleeping, drugs/alcohol, or suicide?",66,depression,1567919635.0,2019-09-08 13:13:55,-1
suicid,3nra8exd,d16wa3,"I hope someone reads this. I'm completely broken and I don't understand. Is there ANY way even possible to stop or reduce the pain besides sleeping, drugs/alcohol, or suicide?",66,depression,1567919635.0,2019-09-08 13:13:55,-1
depress,3nra8exd,czxtw5,I ruined myself for life financially bc of depression and it makes my suicidal thoughts so much stronger. I can't take it.,8,depression,1567670626.0,2019-09-05 16:03:46,-1
suicid,3nra8exd,czxtw5,I ruined myself for life financially bc of depression and it makes my suicidal thoughts so much stronger. I can't take it.,8,depression,1567670626.0,2019-09-05 16:03:46,-1
live,3nra8exd,cz1pg9,I don't have anything that I think is worth living for,3,depression,1567496577.0,2019-09-03 15:42:57,1
anxieti,3nra8exd,cz1mqx,"I neeeeeed to leave my parents' house. This place makes my depression, anxiety and suicidal thoughts so much worse.",0,depression,1567495984.0,2019-09-03 15:33:04,-1
depress,3nra8exd,cz1mqx,"I neeeeeed to leave my parents' house. This place makes my depression, anxiety and suicidal thoughts so much worse.",0,depression,1567495984.0,2019-09-03 15:33:04,-1
suicid,3nra8exd,cz1mqx,"I neeeeeed to leave my parents' house. This place makes my depression, anxiety and suicidal thoughts so much worse.",0,depression,1567495984.0,2019-09-03 15:33:04,-1
hate,3nra8exd,cyml3f,I'm starting to hate my family and I feel like I don't want to talk to them anymore,1,depression,1567415033.0,2019-09-02 17:03:53,-1
hate,3nra8exd,cymh1x,I hate my family I hate my house I hate my room I hate everything about my environment.,4,depression,1567414118.0,2019-09-02 16:48:38,-1
depress,3nra8exd,cyhl1z,All of these things everyone says to do like they're the magic bullet cure to depression *don't work*,4,depression,1567382671.0,2019-09-02 08:04:31,-1
care,3nra8exd,cy7ok1,"I really really really just want to die. I don't care about anyone or anything and I'm giving up on treatment. Depression ruined me and ruined my life, permanently.",1,SuicideWatch,1567327976.0,2019-09-01 16:52:56,-1
depress,3nra8exd,cy7ok1,"I really really really just want to die. I don't care about anyone or anything and I'm giving up on treatment. Depression ruined me and ruined my life, permanently.",1,SuicideWatch,1567327976.0,2019-09-01 16:52:56,-1
die,3nra8exd,cy7ok1,"I really really really just want to die. I don't care about anyone or anything and I'm giving up on treatment. Depression ruined me and ruined my life, permanently.",1,SuicideWatch,1567327976.0,2019-09-01 16:52:56,-1
stuck,3nra8exd,cy7hfz,I NEED to leave my parents' house but can't get anywhere else to live right now so I'm stuck.,3,depression,1567326219.0,2019-09-01 16:23:39,-1
live,3nra8exd,cy7hfz,I NEED to leave my parents' house but can't get anywhere else to live right now so I'm stuck.,3,depression,1567326219.0,2019-09-01 16:23:39,-1
plan,3nra8exd,cy5m95,"I've meticulously planned everything to the last detail, but whenever they ask me if I have a plan I say no",82,SuicideWatch,1567311843.0,2019-09-01 12:24:03,-1
pain,3nra8exd,cxh3ip,"Honest question, if you stay living how are you supposed to decrease the pain, or do people expect you to be a superhero and just bear it forever?",8,depression,1567172482.0,2019-08-30 21:41:22,0
live,3nra8exd,cxh3ip,"Honest question, if you stay living how are you supposed to decrease the pain, or do people expect you to be a superhero and just bear it forever?",8,depression,1567172482.0,2019-08-30 21:41:22,0
pill,3nra8exd,cxd6t8,"I'm taking now 10 pills a day, which will be 11 in a week",4,depression,1567147036.0,2019-08-30 14:37:16,0
care,3nra8exd,cx7cgn,"I have a concert coming up on the 17th of September, but that's the last thing I really care to do. I feel like I'll do it right after that",9,SuicideWatch,1567114666.0,2019-08-30 05:37:46,1
hate,3nra8exd,cwll7a,"I HATE the fucking ""do you have a plan"" question",46,SuicideWatch,1567002613.0,2019-08-28 22:30:13,-1
plan,3nra8exd,cwll7a,"I HATE the fucking ""do you have a plan"" question",46,SuicideWatch,1567002613.0,2019-08-28 22:30:13,-1
hurt,3nra8exd,cwlkdc,I'm not supposed to kill myself but that means bearing all this pain every second I'm awake. Nothing makes it hurt any less.,1,depression,1567002485.0,2019-08-28 22:28:05,0
pain,3nra8exd,cwlkdc,I'm not supposed to kill myself but that means bearing all this pain every second I'm awake. Nothing makes it hurt any less.,1,depression,1567002485.0,2019-08-28 22:28:05,0
kill,3nra8exd,cwlkdc,I'm not supposed to kill myself but that means bearing all this pain every second I'm awake. Nothing makes it hurt any less.,1,depression,1567002485.0,2019-08-28 22:28:05,0
live,3nra8exd,cwg3av,Pretty much all the advice I get says find a hobby/interest that makes life worth living but that isn't possible.,2,SuicideWatch,1566967937.0,2019-08-28 12:52:17,1
suicid,3nra8exd,cwfxo6,Suicidal thoughts are strong tonight.,0,depression,1566966942.0,2019-08-28 12:35:42,-1
hopeless,3nra8exd,cvl7au,Everyone who talks about depression treatment makes it seem hopeless,6,depression,1566807811.0,2019-08-26 16:23:31,-1
depress,3nra8exd,cvl7au,Everyone who talks about depression treatment makes it seem hopeless,6,depression,1566807811.0,2019-08-26 16:23:31,-1
hate,3nra8exd,cuphm5,I hate being told that I'm not trying hard enough,15,depression,1566624596.0,2019-08-24 13:29:56,-1
aliv,3nra8exd,cua6fs,I'm at my worst. I can't find a single fucking reason to stay alive,6,SuicideWatch,1566543017.0,2019-08-23 14:50:17,-1
lost,3k2c2zrm,dn9zvr,I feel so lost and don’t know what to do.,1,offmychest,1572070095.0,2019-10-26 14:08:15,-1
panic,3k2c2zrm,dmv73v,Every time I panic he threats to call the police.,0,offmychest,1571997394.0,2019-10-25 17:56:34,-1
plan,3k2c2zrm,dlg5e7,And here I am back to old habits and planning a way to end my life.,5,offmychest,1571741232.0,2019-10-22 18:47:12,0
end,3k2c2zrm,dlg5e7,And here I am back to old habits and planning a way to end my life.,5,offmychest,1571741232.0,2019-10-22 18:47:12,0
hate,3k2c2zrm,dl5f1t,"I hate myself and everything I do to people, I see no other way then suicide to stop how destructive I am.",1,SuicideWatch,1571685530.0,2019-10-22 03:18:50,-1
suicid,3k2c2zrm,dl5f1t,"I hate myself and everything I do to people, I see no other way then suicide to stop how destructive I am.",1,SuicideWatch,1571685530.0,2019-10-22 03:18:50,-1
depress,3k2c2zrm,d04kb5,and then they leave you and make u even more depressed,21,depression_memes,1567707461.0,2019-09-06 02:17:41,-1
disord,3k2c2zrm,czyrp1,How to tell someone that rehab isn’t the solution for your disorder?,7,Advice,1567677835.0,2019-09-05 18:03:55,0
hate,3k2c2zrm,cyfpuu,I hate how people dismiss us when we openly say that we are suicidal but when someone keep quiet and kill them selves people be shocked like “They never said anything I didn’t know” WAKE TF UP AND LOVE ME STOP DISMISSING HOW I FEEL,129,SuicideWatch,1567372707.0,2019-09-02 05:18:27,-1
suicid,3k2c2zrm,cyfpuu,I hate how people dismiss us when we openly say that we are suicidal but when someone keep quiet and kill them selves people be shocked like “They never said anything I didn’t know” WAKE TF UP AND LOVE ME STOP DISMISSING HOW I FEEL,129,SuicideWatch,1567372707.0,2019-09-02 05:18:27,-1
kill,3k2c2zrm,cyfpuu,I hate how people dismiss us when we openly say that we are suicidal but when someone keep quiet and kill them selves people be shocked like “They never said anything I didn’t know” WAKE TF UP AND LOVE ME STOP DISMISSING HOW I FEEL,129,SuicideWatch,1567372707.0,2019-09-02 05:18:27,-1
suicid,3k2c2zrm,cxxg9b,Being suicidal taught me that money means nothing.,10,SuicideWatch,1567269021.0,2019-09-01 00:30:21,-1
live,3k2c2zrm,cq9l1z,Rescued from the rain yesterday and now living the best life,31,cats,1565788892.0,2019-08-14 21:21:32,1
hurt,3k2c2zrm,ce1ngs,"I’m a waste of time and space, worthless and a failure. Not brave enough to live, not brave enough to end it, so I just hurt day by day, I can’t take any more",9,SuicideWatch,1563304782.0,2019-07-17 03:19:42,-1
worthless,3k2c2zrm,ce1ngs,"I’m a waste of time and space, worthless and a failure. Not brave enough to live, not brave enough to end it, so I just hurt day by day, I can’t take any more",9,SuicideWatch,1563304782.0,2019-07-17 03:19:42,-1
end,3k2c2zrm,ce1ngs,"I’m a waste of time and space, worthless and a failure. Not brave enough to live, not brave enough to end it, so I just hurt day by day, I can’t take any more",9,SuicideWatch,1563304782.0,2019-07-17 03:19:42,-1
live,3k2c2zrm,ce1ngs,"I’m a waste of time and space, worthless and a failure. Not brave enough to live, not brave enough to end it, so I just hurt day by day, I can’t take any more",9,SuicideWatch,1563304782.0,2019-07-17 03:19:42,-1
harm,3k2c2zrm,cd803w,Staying alive is self harm and people can’t see it,18,SuicideWatch,1563137067.0,2019-07-15 04:44:27,-1
aliv,3k2c2zrm,cd803w,Staying alive is self harm and people can’t see it,18,SuicideWatch,1563137067.0,2019-07-15 04:44:27,-1
suicid,3k2c2zrm,bt9os3,People should be educated about how to help suicidal people,9,SuicideWatch,1558887049.0,2019-05-27 00:10:49,-1
alon,16kbgk,ct0z23,feeling deeply sad & alone tonight,6,depression,1566315893.0,2019-08-20 23:44:53,-1
sad,16kbgk,ct0z23,feeling deeply sad & alone tonight,6,depression,1566315893.0,2019-08-20 23:44:53,-1
aliv,16kbgk,bo2ho7,anyone else just staying alive for other people at this point?,128,SuicideWatch,1557748339.0,2019-05-13 19:52:19,1
die,16kbgk,au5jzi,keep wanting to die. i wish i could do it,6,SuicideWatch,1550992100.0,2019-02-24 15:08:20,-1
kill,2ilsggu8,baiby5,I’ve decided that I won’t kill my self,98,SuicideWatch,1554656177.0,2019-04-08 00:56:17,-1
plan,2ilsggu8,ba72nn,I’m planning on killing myself today,6,SuicideWatch,1554573733.0,2019-04-07 02:02:13,-1
kill,2ilsggu8,ba72nn,I’m planning on killing myself today,6,SuicideWatch,1554573733.0,2019-04-07 02:02:13,-1
alon,tib5k,drsq3i,I’m so deeply depressed and alone.,0,SuicideWatch,1572921025.0,2019-11-05 10:30:25,-1
depress,tib5k,drsq3i,I’m so deeply depressed and alone.,0,SuicideWatch,1572921025.0,2019-11-05 10:30:25,-1
kill,tib5k,di94pe,i can’t kill my self.,1,SuicideWatch,1571151717.0,2019-10-15 23:01:57,-1
hate,tib5k,di1tsc,i hate myself so much i can’t stand it anymore,1,SuicideWatch,1571109406.0,2019-10-15 11:16:46,-1
suicid,tib5k,d9i9x7,Feeling suicidal,9,adultsurvivors,1569497058.0,2019-09-26 19:24:18,-1
harm,tib5k,d7s7fp,Can’t shake flashback. (Tw self harm),5,CPTSD,1569167345.0,2019-09-22 23:49:05,0
harm,tib5k,d7r1b6,Genital self harm (tw),2,adultsurvivors,1569162043.0,2019-09-22 22:20:43,-1
abus,tib5k,d6togr,"I know bedwetting is common in children who are abused, but does anyone still deal with it as an adult?",9,adultsurvivors,1568979776.0,2019-09-20 19:42:56,-1
sick,tib5k,cqmgqw,i’m sick of people telling me it will get better,6,SuicideWatch,1565852690.0,2019-08-15 15:04:50,0
dead,tib5k,cpklw5,I would rather be dead than live like this.,35,SuicideWatch,1565653047.0,2019-08-13 07:37:27,-1
live,tib5k,cpklw5,I would rather be dead than live like this.,35,SuicideWatch,1565653047.0,2019-08-13 07:37:27,-1
pain,tib5k,cp6yzm,Do you feel pain when you have flashbacks?,7,adultsurvivors,1565581399.0,2019-08-12 11:43:19,-1
suicid,tib5k,coxe4f,"Does anyone else have this really destructive pattern of feeling suicidal and ruining everything in your life because you think you won’t be around to deal with it, only to fail or not even attempt suicide and have to try to pick up the pieces?",72,SuicideWatch,1565533864.0,2019-08-11 22:31:04,-1
sad,tib5k,ccx1bw,I’m sad today.,6,adultsurvivors,1563066428.0,2019-07-14 09:07:08,-1
hate,tib5k,ca4p9v,I hate myself so much. I can’t stop crying I just don’t want to live anymore,3,SuicideWatch,1562488515.0,2019-07-07 16:35:15,-1
live,tib5k,ca4p9v,I hate myself so much. I can’t stop crying I just don’t want to live anymore,3,SuicideWatch,1562488515.0,2019-07-07 16:35:15,-1
harm,tib5k,bwhf61,NSFW (tw for self harm) Something I’m deeply ashamed of.,4,adultsurvivors,1559603329.0,2019-06-04 07:08:49,-1
anxieti,tib5k,brm0c8,My life is just a constant cycle of anxiety and depression.,56,SuicideWatch,1558512579.0,2019-05-22 16:09:39,-1
