keyword,author_id,sub_id,submission,comments,subreddit,created,timestamp,risk
depress,tib5k,brm0c8,My life is just a constant cycle of anxiety and depression.,56,SuicideWatch,1558512579.0,2019-05-22 16:09:39,-1
suicid,tib5k,a7tq3o,I think I’m beyond help. Suicide feels inevitable.,1,SuicideWatch,1545275323.0,2018-12-20 11:08:43,-1
anxieti,tib5k,5r1vr9,Social anxiety is stopping me from getting help for social anxiety...or anything else.,11,socialanxiety,1485794835.0,2017-01-31 00:47:15,0
die,ls75qsa,d92gf2,I wish I could swap places with a person who died that wanted to live.,86,SuicideWatch,1569413857.0,2019-09-25 20:17:37,-1
live,ls75qsa,d92gf2,I wish I could swap places with a person who died that wanted to live.,86,SuicideWatch,1569413857.0,2019-09-25 20:17:37,-1
hate,ls75qsa,cvp6ea,"Thanks, I hate vegan eyelashes.",0,thanksihateit,1566831490.0,2019-08-26 22:58:10,-1
die,jn0ae,dkh67u,Anyone else just want to die because of ARFID?,10,ARFID,1571561842.0,2019-10-20 16:57:22,-1
live,jn0ae,dbr4xs,This streamer hosted an interactive live carnival.,0,videos,1569924145.0,2019-10-01 18:02:25,0
disord,jn0ae,dbr3ok,this little known eating disorder i have to deal with is making me want to die,2,SuicideWatch,1569923919.0,2019-10-01 17:58:39,-1
die,jn0ae,dbr3ok,this little known eating disorder i have to deal with is making me want to die,2,SuicideWatch,1569923919.0,2019-10-01 17:58:39,-1
live,jn0ae,c92z7d,Just wanted to wish all the people with ARFID living in the US good luck today.,9,ARFID,1562249142.0,2019-07-04 22:05:42,1
hate,jn0ae,c68ql2,People don't give a fuck about you until you're dead. I fucking hate humanity,97,SuicideWatch,1561658366.0,2019-06-28 01:59:26,-1
dead,jn0ae,c68ql2,People don't give a fuck about you until you're dead. I fucking hate humanity,97,SuicideWatch,1561658366.0,2019-06-28 01:59:26,-1
aliv,jn0ae,bfoyin,"I was Blue Ray. My mom was daughterless but she worked hard. When she died I was the last one alive, so I built a house in her memory.",4,onehouronelife,1555854400.0,2019-04-21 21:46:40,-1
die,jn0ae,bfoyin,"I was Blue Ray. My mom was daughterless but she worked hard. When she died I was the last one alive, so I built a house in her memory.",4,onehouronelife,1555854400.0,2019-04-21 21:46:40,-1
bad,jn0ae,ahzz4j,"Mein Kampf is like a really, really bad strategy guide for life.",0,Showerthoughts,1548005000.0,2019-01-21 01:23:20,-1
disord,jn0ae,9xnusa,"The more I think about this disorder, the more I realize how screwed my life is.",0,ARFID,1542386942.0,2018-11-17 00:49:02,-1
plan,jn0ae,90gfh7,Murdoc's plan,11,gorillaz,1532096810.0,2018-07-20 22:26:50,0
lost,jn0ae,8rbcfy,"We lost right as we put the key into the slot, but we still technically won...",6,dontstarve,1529072801.0,2018-06-15 22:26:41,0
live,jn0ae,8pioer,They should have really went for the live visual for the Sorcererz visualiser.,1,gorillaz,1528452263.0,2018-06-08 18:04:23,0
live,jn0ae,8o1asp,Phase 5 Murdoc art in the Souk Eye live visual,27,gorillaz,1527953490.0,2018-06-02 23:31:30,0
live,jn0ae,8lrs0a,Karl Bossche (drummer in the live band) rehearsing a song that sounds like Rock The House...,12,gorillaz,1527160059.0,2018-05-24 19:07:39,1
live,jn0ae,8ba834,Gorillaz - Feel Good Inc live but there's no live band.,3,gorillaz,1523386239.0,2018-04-11 02:50:39,-1
night,jn0ae,80naeu,Bat protection contraption I built. The fences are so that the pigs won't go back into their house at night.,9,dontstarve,1519745521.0,2018-02-27 23:32:01,0
fake,jn0ae,7xa3wl,LOOKING FOR ARCHIVED VERSION OF THE DELETED FAKE LEAK REVIEW OF BLUR'S THE MAGIC WHIP,0,fantanoforever,1518535538.0,2018-02-13 23:25:38,-1
cut,jn0ae,7ujlek,"Some of the late snapchat snippets, including some unreleased or scrapped humanz cuts",4,gorillaz,1517499961.0,2018-02-01 23:46:01,-1
dead,jn0ae,7spzms,Felt like this belongs on here. Mark E. Smith dead at age 60,2,gorillaz,1516824872.0,2018-01-25 04:14:32,-1
jump,3wavathx,bz8f05,"I wanted to jump off a bridge, but I got a burrito instead.",55,SuicideWatch,1560230334.0,2019-06-11 13:18:54,0
die,3wavathx,bxbwzr,"I want to die, but I'm too much of a coward to do it myself.",2,SuicideWatch,1559791821.0,2019-06-06 11:30:21,-1
suicid,nghshq2,7opdab,"Just called suicide hotline. Thanks, Tom.",32,SuicideWatch,1515310841.0,2018-01-07 15:40:41,-1
bad,2xxntvzu,d8f5jm,"I get really bad stomach aches everyday even when I stay home from being anxious, is this common?",2,Anxiety,1569283039.0,2019-09-24 07:57:19,-1
ach,2xxntvzu,d8f5jm,"I get really bad stomach aches everyday even when I stay home from being anxious, is this common?",2,Anxiety,1569283039.0,2019-09-24 07:57:19,-1
useless,2xxntvzu,d7aen0,Just talked to a suicidal hotline and they’ve gotta he the most useless mf I’ve ever talked to,0,depression,1569072061.0,2019-09-21 21:21:01,-1
suicid,2xxntvzu,d7aen0,Just talked to a suicidal hotline and they’ve gotta he the most useless mf I’ve ever talked to,0,depression,1569072061.0,2019-09-21 21:21:01,-1
die,2xxntvzu,d79wg2,Why do I want to die,0,depression,1569069108.0,2019-09-21 20:31:48,-1
sick,2xxntvzu,d79vpc,I’m so sick of talking I just want to stop feeling like this,0,depression,1569068972.0,2019-09-21 20:29:32,-1
die,2xxntvzu,d7807g,I don’t want to die I just don’t want to feel like this anymore,1,SuicideWatch,1569055083.0,2019-09-21 16:38:03,-1
night,2xxntvzu,d77ozy,I think tonight’s the night,2,SuicideWatch,1569052396.0,2019-09-21 15:53:16,0
pain,2xxntvzu,d6v9un,How do I ease the pain and emptiness,0,depression,1568987771.0,2019-09-20 21:56:11,-1
hate,2xxntvzu,d6uydl,I want to be alone but I also hate coming home to the silence of my own thoughts,0,depression,1568986271.0,2019-09-20 21:31:11,-1
alon,2xxntvzu,d6uydl,I want to be alone but I also hate coming home to the silence of my own thoughts,0,depression,1568986271.0,2019-09-20 21:31:11,-1
bad,2xxntvzu,d6u10t,I can feel people getting bored talking to me and I feel so bad,0,depression,1568981662.0,2019-09-20 20:14:22,-1
depress,2xxntvzu,d4rl5g,I get depressed and push people away because I feel like “we’re not right for each other” and they deserve better,0,depression,1568586057.0,2019-09-16 06:20:57,1
sad,2xxntvzu,d4j7m5,"I’m so selfish, how can I feel so sad when there are so many people who have it so much worse",2,depression,1568546517.0,2019-09-15 19:21:57,-1
night,2xxntvzu,d4bdmt,It’s now 5am. Spent the entire night thinking about how much I hate myself and forgot to sleep ahaha great.,5,Anxiety,1568496819.0,2019-09-15 05:33:39,0
hate,2xxntvzu,d4bdmt,It’s now 5am. Spent the entire night thinking about how much I hate myself and forgot to sleep ahaha great.,5,Anxiety,1568496819.0,2019-09-15 05:33:39,0
fight,2xxntvzu,d4awnu,Everyday is such an unnecessarily huge battle that I don’t want to fight,0,depression,1568494565.0,2019-09-15 04:56:05,-1
hate,2xxntvzu,d4a1wy,"I hate myself so much, I feel physically nauseous",0,BodyDysmorphia,1568490562.0,2019-09-15 03:49:22,-1
care,2xxntvzu,d465lt,"Not being included is the worst feeling in the world but on the other half being included is also the worst feeling because I feel like I was only invited because they felt obligated to, and they don’t really care if I was there or not",0,depression,1568472721.0,2019-09-14 22:52:01,0
aliv,2xxntvzu,d404r1,Am I tired of being alive or have I just not eaten or drunk anything in a while,1,bulimia,1568432231.0,2019-09-14 11:37:11,0
hate,2xxntvzu,d3pa9u,When I say I hate myself I mean I HATE myself,0,depression,1568381397.0,2019-09-13 21:29:57,-1
depress,2xxntvzu,d38cpt,Yh I know that I’ll still be depressed if I reached my goal weight but atleast I’d be depressed and socially accepted by society,0,BodyDysmorphia,1568296973.0,2019-09-12 22:02:53,-1
suicid,2xxntvzu,d1qdah,Is everyone suicidal at least once in their life?,3,depression,1568032854.0,2019-09-09 20:40:54,-1
hate,2xxntvzu,d0gbrm,The constant fear that all my friends hate me and think I’m annoying and want me to stop talking but are too nice to say anything is crushing,68,Anxiety,1567774726.0,2019-09-06 20:58:46,-1
exist,2xxntvzu,d0gagz,"Imagine me, but with a will to exist.... ahaha jk",0,depression,1567774522.0,2019-09-06 20:55:22,1
hate,2xxntvzu,d0g8c6,It’s so hard accepting compliments when I hate myself and I got constantly bullied for being “ugly” when I was younger,1,BodyDysmorphia,1567774219.0,2019-09-06 20:50:19,-1
bulli,2xxntvzu,d0g8c6,It’s so hard accepting compliments when I hate myself and I got constantly bullied for being “ugly” when I was younger,1,BodyDysmorphia,1567774219.0,2019-09-06 20:50:19,-1
stress,2xxntvzu,cx2pb3,People always say they “get it” and they “get stressed sometimes too”,1,depression,1567093736.0,2019-08-29 23:48:56,-1
care,2xxntvzu,cx0cgv,"I’m so fucking annoying, every word that comes out of my mouth is so irritating just like SHUT UP NO ONE CARES WHAT YOU HAVE TO SAY !",0,depression,1567082329.0,2019-08-29 20:38:49,-1
aliv,2xxntvzu,cwfvus,My sister used to say that living is survival of the fittest and I guess she was right because I’m too weak to find the power to keep myself alive,1,SuicideWatch,1566966637.0,2019-08-28 12:30:37,0
live,2xxntvzu,cwfvus,My sister used to say that living is survival of the fittest and I guess she was right because I’m too weak to find the power to keep myself alive,1,SuicideWatch,1566966637.0,2019-08-28 12:30:37,0
care,2xxntvzu,cubxv2,No one cares about your life until you say you want to end it,112,SuicideWatch,1566555661.0,2019-08-23 18:21:01,1
end,2xxntvzu,cubxv2,No one cares about your life until you say you want to end it,112,SuicideWatch,1566555661.0,2019-08-23 18:21:01,1
live,2xxntvzu,cubxhe,Why me? I just want to live a normal life without being burdened by this constant dark cloud above my head,0,depression,1566555598.0,2019-08-23 18:19:58,1
live,2xxntvzu,cub8gg,Struggle to find reasons to live,2,SuicideWatch,1566550778.0,2019-08-23 16:59:38,-1
sad,2xxntvzu,ctozx2,My life is forcing me into a hole of sadness because I feel like I don’t deserve to leave,0,depression,1566430271.0,2019-08-22 07:31:11,0
anxieti,2xxntvzu,cry61w,One of my friends has anxiety but throws around the word like it’s nothing,2,Anxiety,1566112263.0,2019-08-18 15:11:03,1
bad,2xxntvzu,cqk7fq,"Is it normal to get really bad stomach aches everytime I go to school, does this have anything to do with anxiety?",3,Anxiety,1565837948.0,2019-08-15 10:59:08,-1
ach,2xxntvzu,cqk7fq,"Is it normal to get really bad stomach aches everytime I go to school, does this have anything to do with anxiety?",3,Anxiety,1565837948.0,2019-08-15 10:59:08,-1
anxieti,2xxntvzu,cqk7fq,"Is it normal to get really bad stomach aches everytime I go to school, does this have anything to do with anxiety?",3,Anxiety,1565837948.0,2019-08-15 10:59:08,-1
exist,2xxntvzu,cq9w8p,My google searches be like: how to stop existing,0,depression,1565790412.0,2019-08-14 21:46:52,0
sad,2xxntvzu,cptsmw,My friend said that she would always be here to listen if I needed to talk but I always feel so constantly sad,1,depression,1565706030.0,2019-08-13 22:20:30,-1
exist,2xxntvzu,cptpqz,My existence feels like such a joke,0,depression,1565705652.0,2019-08-13 22:14:12,1
exist,2xxntvzu,cpti4t,I just want to never go outside and stay inside forever so I don’t have to burden anyone with my existence,3,Anxiety,1565704662.0,2019-08-13 21:57:42,-1
alon,2xxntvzu,cpssc9,Feeling alone,1,depression,1565701065.0,2019-08-13 20:57:45,0
aliv,2xxntvzu,cpsfqi,It’s so stressful knowing I’m alive and breathing,0,depression,1565699238.0,2019-08-13 20:27:18,-1
stress,2xxntvzu,cpsfqi,It’s so stressful knowing I’m alive and breathing,0,depression,1565699238.0,2019-08-13 20:27:18,-1
breath,2xxntvzu,cpsfqi,It’s so stressful knowing I’m alive and breathing,0,depression,1565699238.0,2019-08-13 20:27:18,-1
exist,2xxntvzu,cpsfkb,My existence bothers me,0,depression,1565699210.0,2019-08-13 20:26:50,-1
exist,2xxntvzu,cpsa5d,I feel so annoying I want to delete myself from existence,0,depression,1565698411.0,2019-08-13 20:13:31,-1
sad,2xxntvzu,cps1d3,"Aaannnddd I’ve done it again, I’ve forced myself into a hole of sadness that I feel like I don’t deserve to leave",1,sad,1565697084.0,2019-08-13 19:51:24,-1
hate,2xxntvzu,cp3mv9,I feel like I need attention and even then I still feel like everyone hates me,0,depression,1565563571.0,2019-08-12 06:46:11,1
hate,2xxntvzu,cp3mkh,How do I stop feeling like everyone hates me and I’m a burden,7,depression,1565563523.0,2019-08-12 06:45:23,-1
stupid,3bt40uew,dmg28p,College is stupid and it makes me want to die even more,44,SuicideWatch,1571922033.0,2019-10-24 21:00:33,-1
die,3bt40uew,dmg28p,College is stupid and it makes me want to die even more,44,SuicideWatch,1571922033.0,2019-10-24 21:00:33,-1
stupid,3bt40uew,dje8ls,Why do I feel so stupid and guilty,0,depression,1571353018.0,2019-10-18 06:56:58,-1
live,3bt40uew,dfuby6,I can’t do the one thing I want to do for a living cause I can’t fucking talk to people,2,SuicideWatch,1570691340.0,2019-10-10 15:09:00,0
kill,3bt40uew,degb5a,I have a midterm assignment due at 11:59. My grade right now is an 8% out of 100. What’s the quickest way to fucking kill myself?,7,depression,1570434562.0,2019-10-07 15:49:22,-1
suicid,3bt40uew,d56r46,Fuck people who report suicidal people to the police. They have better shit to do.,39,SuicideWatch,1568668340.0,2019-09-17 05:12:20,-1
hurt,3bt40uew,d56pr5,I feel like I’m too thick skinned to the point where I’m hurting everybody else,1,SuicideWatch,1568668176.0,2019-09-17 05:09:36,0
die,3bt40uew,d56mls,Idk if I want to die but I don’t want to do this life shit anymore,4,SuicideWatch,1568667807.0,2019-09-17 05:03:27,-1
suicid,3bt40uew,d244v2,Fuck suicide prevention day,1,SuicideWatch,1568099856.0,2019-09-10 15:17:36,-1
suicid,3bt40uew,d18hjk,"“Hey if it all goes wrong, there’s always suicide”",1,SuicideWatch,1567931995.0,2019-09-08 16:39:55,-1
kill,3bt40uew,d17r3e,I should kill myself because my parents only put me here to make themselves look good,2,SuicideWatch,1567926055.0,2019-09-08 15:00:55,-1
hate,3bt40uew,czwgjj,If you try to make me feel better or show me that you care my mind will literally hate you,9,SuicideWatch,1567660673.0,2019-09-05 13:17:53,1
care,3bt40uew,czwgjj,If you try to make me feel better or show me that you care my mind will literally hate you,9,SuicideWatch,1567660673.0,2019-09-05 13:17:53,1
kill,3bt40uew,cztaq5,You ever just leave an awkward conversation and think “Wow. I should really just kill myself.”?,53,SuicideWatch,1567642964.0,2019-09-05 08:22:44,-1
plan,3bt40uew,csdrrq,I can’t wait for classes to start so I can really plan on ending it,3,SuicideWatch,1566199943.0,2019-08-19 15:32:23,0
end,3bt40uew,csdrrq,I can’t wait for classes to start so I can really plan on ending it,3,SuicideWatch,1566199943.0,2019-08-19 15:32:23,0
useless,3bt40uew,cpqsbr,I’m so fucking useless,1,SuicideWatch,1565688960.0,2019-08-13 17:36:00,-1
nobodi,3bt40uew,cn9350,Nobody fucking wants me here,5,SuicideWatch,1565200254.0,2019-08-08 01:50:54,0
nobodi,3bt40uew,cn9282,How am I supposed to build a network and get a job when nobody wants me around?,0,depression,1565200147.0,2019-08-08 01:49:07,0
hate,3bt40uew,cizsaq,Can you imagine there are people who hate it when they get asked to take selfies,0,depression,1564340303.0,2019-07-29 02:58:23,-1
kill,3bt40uew,cap76v,I should kill myself,7,depression,1562611985.0,2019-07-09 02:53:05,-1
care,3bt40uew,bse2xe,What’s it like having a support group or a single person who cares if you exist?,0,depression,1558684116.0,2019-05-24 15:48:36,1
exist,3bt40uew,bse2xe,What’s it like having a support group or a single person who cares if you exist?,0,depression,1558684116.0,2019-05-24 15:48:36,1
die,3bt40uew,br727c,From how high does a 6’0 tall man need to fall in order to die?,8,SuicideWatch,1558420957.0,2019-05-21 14:42:37,-1
live,3bt40uew,br6xhy,"“You have your life ahead of you”, “you have so much to live for”, “people want you here”",9,SuicideWatch,1558419926.0,2019-05-21 14:25:26,0
nobodi,3bt40uew,bqnm6r,Nobody cares if I’m here or not. I don’t have a friend circle or anything like that,0,depression,1558308203.0,2019-05-20 07:23:23,1
care,3bt40uew,bqnm6r,Nobody cares if I’m here or not. I don’t have a friend circle or anything like that,0,depression,1558308203.0,2019-05-20 07:23:23,1
kill,3bt40uew,bqe4ec,I really should kill myself,3,depression,1558251069.0,2019-05-19 15:31:09,-1
die,3bt40uew,bp61gd,Sometimes I wish I could die and be reborn less ugly,0,depression,1557967463.0,2019-05-16 08:44:23,-1
suicid,3bt40uew,bkd4lh,Why are people so against suicide?,1,depression,1556915521.0,2019-05-04 04:32:01,-1
care,3bt40uew,bikjl6,People who say “somebody cares about you” don’t know what it’s like when literally everyone in your life couldn’t give two shits if you’re breathing right now,0,depression,1556511211.0,2019-04-29 12:13:31,1
breath,3bt40uew,bikjl6,People who say “somebody cares about you” don’t know what it’s like when literally everyone in your life couldn’t give two shits if you’re breathing right now,0,depression,1556511211.0,2019-04-29 12:13:31,1
suicid,3bt40uew,bikhpg,My pastor thinks I’m suicidal and now I feel too embarrassed to show my face at church,0,depression,1556511016.0,2019-04-29 12:10:16,-1
hate,3bt40uew,bikfxi,I’m 19 studying computer science but I hate it and I want to drop out of college but my family’s relying on me to make money and support them,0,depression,1556510842.0,2019-04-29 12:07:22,-1
hang,3bt40uew,bikerm,Need to hang out with friends to become an interesting person. Need to become an interesting person to make friends,0,depression,1556510736.0,2019-04-29 12:05:36,1
end,3bt40uew,bika15,Everyone I know is out with their friends enjoying the end of finals and here I am at the end of my second semester of college just as lonely as when I started,0,depression,1556510259.0,2019-04-29 11:57:39,1
stress,3bt40uew,bic7dd,"My younger brother gets to have fun and enjoy high school and get offers from different colleges while I spent those four years stressing out, isolating myself, and considering suicide just to get into college with a scholarship.",3,depression,1556464281.0,2019-04-28 23:11:21,0
suicid,3bt40uew,bic7dd,"My younger brother gets to have fun and enjoy high school and get offers from different colleges while I spent those four years stressing out, isolating myself, and considering suicide just to get into college with a scholarship.",3,depression,1556464281.0,2019-04-28 23:11:21,0
hate,3bt40uew,bi2ox1,Sometimes I hate my parents for putting me here,0,depression,1556393660.0,2019-04-28 03:34:20,-1
nobodi,3bt40uew,bi2e7z,Nobody’s ever going to give a fuck about me. I’m never going to be likeable or surrounded by friends like everyone else. I should just fucking end this embarrassing life now.,0,depression,1556391899.0,2019-04-28 03:04:59,0
end,3bt40uew,bi2e7z,Nobody’s ever going to give a fuck about me. I’m never going to be likeable or surrounded by friends like everyone else. I should just fucking end this embarrassing life now.,0,depression,1556391899.0,2019-04-28 03:04:59,0
nobodi,3bt40uew,bhsagw,Every time I want to go out and do something nobody ever wants to join me,4,depression,1556317531.0,2019-04-27 06:25:31,1
nobodi,3bt40uew,bhi3fg,How does dating work when nobody’s interested in you?,0,depression,1556252068.0,2019-04-26 12:14:28,1
suicid,3bt40uew,bh5tyz,Suicide hotlines are bullshit,78,SuicideWatch,1556177608.0,2019-04-25 15:33:28,-1
kill,3bt40uew,bh5npz,Anybody over 30 regret not killing themselves when they were younger?,0,depression,1556176154.0,2019-04-25 15:09:14,0
die,3bt40uew,bgr4sx,I’m 19 and my mom’s a cancer survivor but I wouldn’t mind if I died from cancer,0,depression,1556085963.0,2019-04-24 14:06:03,-1
nobodi,3bt40uew,bdplpn,Nobody cares that I’m fucking here,0,depression,1555388139.0,2019-04-16 12:15:39,1
care,3bt40uew,bdplpn,Nobody cares that I’m fucking here,0,depression,1555388139.0,2019-04-16 12:15:39,1
nobodi,3bt40uew,bdpbub,Nobody fucking likes me and I wish they’d stop acting as if they do,0,depression,1555386204.0,2019-04-16 11:43:24,1
alon,3bt40uew,bdnplw,I just walked out of a comedy show that I went to alone,11,depression,1555376019.0,2019-04-16 08:53:39,0
note,3bt40uew,bclt1b,Should I write a suicide note or not? Not like I have close friends or anything who would read it,2,depression,1555121423.0,2019-04-13 10:10:23,0
suicid,3bt40uew,bclt1b,Should I write a suicide note or not? Not like I have close friends or anything who would read it,2,depression,1555121423.0,2019-04-13 10:10:23,0
jump,3bt40uew,bcls79,Should I do these three huge assignments due in 2 hours or just take the F and jump off a parking garage,6,depression,1555121261.0,2019-04-13 10:07:41,1
die,3bt40uew,bcljbh,[L][M][19] I’m a shitty friend and I should fucking die,7,KindVoice,1555119574.0,2019-04-13 09:39:34,-1
die,3bt40uew,bclinv,It’s my fault. I’m the shit friend no matter who I try to make friends with. Wow. I should just die.,1,depression,1555119449.0,2019-04-13 09:37:29,1
die,3bt40uew,b7d1vx,In a few months it’s going to be a year since I pissed off my best friend and they stopped talking to me. I deserve to die.,5,SuicideWatch,1553963127.0,2019-03-31 00:25:27,-1
care,3bt40uew,b7cnjg,Stop pretending like you all fucking care,104,SuicideWatch,1553960753.0,2019-03-30 23:45:53,1
pretend,3bt40uew,b7cnjg,Stop pretending like you all fucking care,104,SuicideWatch,1553960753.0,2019-03-30 23:45:53,1
sad,3v1oosyy,d7jb0v,Has anyone else felt extremely sad after seeing someone particularly attractive?,49,ForeverAlone,1569112864.0,2019-09-22 08:41:04,0
live,3v1oosyy,d1fx4w,I wish I could donate my time on Earth to people who really deserve to live. I'm not enjoying my stay.,70,SuicideWatch,1567972266.0,2019-09-09 03:51:06,0
live,3v1oosyy,catolf,How do you find the will to live?,46,FA30plus,1562633759.0,2019-07-09 08:55:59,0
hurt,14uh33,8fpbd4,Sleep is great because it's like being dead without hurting your family.,44,SuicideWatch,1524977832.0,2018-04-29 12:57:12,1
dead,14uh33,8fpbd4,Sleep is great because it's like being dead without hurting your family.,44,SuicideWatch,1524977832.0,2018-04-29 12:57:12,1
kill,4o4r25ca,dritda,"Tonight, my grandma stopped me from killing myself without her realizing it.",57,SuicideWatch,1572879872.0,2019-11-04 23:04:32,-1
die,sg4qt00,82gf20,Today I want too die.,3,SuicideWatch,1520354278.0,2018-03-07 00:37:58,-1
stupid,sg4qt00,81aeou,Today I told the love of my life no because my stupid ass mind wasn’t ok with the thought off happiness.,1,Anxiety,1519951859.0,2018-03-02 08:50:59,1
hate,sg4qt00,7yaf24,I hate how when you’re depressed you just forget everything. You forget to do stuff and you forget the stuff you did. Time passes without you realising and instead of doing nothing for ten minutes you did nothing for three hours but you didn’t even realise you were actually living.,50,SuicideWatch,1518910665.0,2018-02-18 07:37:45,-1
depress,sg4qt00,7yaf24,I hate how when you’re depressed you just forget everything. You forget to do stuff and you forget the stuff you did. Time passes without you realising and instead of doing nothing for ten minutes you did nothing for three hours but you didn’t even realise you were actually living.,50,SuicideWatch,1518910665.0,2018-02-18 07:37:45,-1
live,sg4qt00,7yaf24,I hate how when you’re depressed you just forget everything. You forget to do stuff and you forget the stuff you did. Time passes without you realising and instead of doing nothing for ten minutes you did nothing for three hours but you didn’t even realise you were actually living.,50,SuicideWatch,1518910665.0,2018-02-18 07:37:45,-1
pain,sg4qt00,7r43zo,How do my parents look me in the eyes everyday and not see the mental pain I suffer because when I look in the mirror I see nothing but numbness.,15,SuicideWatch,1516221755.0,2018-01-18 04:42:35,-1
lost,ui6rl,dkv341,Let’s get lost together,6,gonewildcolor,1571631339.0,2019-10-21 12:15:39,-1
lost,ui6rl,dkovuu,Get lost (with me),10,DreamFuck,1571601473.0,2019-10-21 03:57:53,-1
night,ui6rl,dc61gk,going to bed alone every night is getting old... 🥺,20,DreamFuck,1569994959.0,2019-10-02 13:42:39,-1
alon,ui6rl,dc61gk,going to bed alone every night is getting old... 🥺,20,DreamFuck,1569994959.0,2019-10-02 13:42:39,-1
live,ui6rl,dbsfg7,"Guys, I'm live on Chaturbate now!",2,DreamFuck,1569931749.0,2019-10-01 20:09:09,0
bad,ui6rl,d8xl6x,He said I have bad hair and I look very haggardly,21,DreamFuck,1569381317.0,2019-09-25 11:15:17,-1
abus,ui6rl,d2247f,The abuser is following me on ManyVids,11,DreamFuck,1568086583.0,2019-09-10 11:36:23,-1
night,ui6rl,cuqjxy,"""hot Summer nights"" LIVE on ChaturH8!",4,DreamFuck,1566632693.0,2019-08-24 15:44:53,0
live,ui6rl,cuqjxy,"""hot Summer nights"" LIVE on ChaturH8!",4,DreamFuck,1566632693.0,2019-08-24 15:44:53,0
care,ui6rl,crksdw,"Does anyone even care if I’m on cam or not? Because if not, I’ll log off now. I’m just wasting everyone’s time. Including my own.",46,DreamFuck,1566039635.0,2019-08-17 19:00:35,0
care,ui6rl,crjzwa,"POLL: If I hop on cam right now, would you watch? YES; NO; or I don't care",4,DreamFuck,1566033815.0,2019-08-17 17:23:35,-1
plan,45ys4cs4,dekwto,[Serious] How many of you plan to not have children because of your worries about the future?,15,AskReddit,1570461714.0,2019-10-07 23:21:54,-1
fight,45ys4cs4,d876i4,Fighting capitalism. With memes.,3,COMPLETEANARCHY,1569248459.0,2019-09-23 22:20:59,-1
exist,45ys4cs4,d7ihif,"""Medical debt"" is a phrase that shouldn't exist in a rational society",6,LateStageCapitalism,1569109274.0,2019-09-22 07:41:14,-1
