author_id,sub_id,submission,subreddit,created,timestamp,risk
11cgygmb,a1d71a,"A message to parents with schoolchildren, from a student.",singapore,1543458995.0,2018-11-29 10:36:35,0
z73cn,d16wny,My dad died and I have no one to talk to about it.,offmychest,1567919700.0,2019-09-08 13:15:00,-1
z73cn,cd0hjp,Shout out to the particular hell that is functional depression.,depression,1563090820.0,2019-07-14 15:53:40,-1
z73cn,9rv9cx,How I deal with working full time.,socialanxiety,1540655427.0,2018-10-27 23:50:27,0
z73cn,8q3hs9,Is anyone else just completely hyper sensitive in their adult life?,raisedbynarcissists,1528661532.0,2018-06-11 04:12:12,0
z73cn,54s3mf,Anxiety rash????,Anxiety,1475001793.0,2016-09-28 02:43:13,-1
y5ast,b7fxrm,"Does anyone ever feel okay for a while, then a wave of depression just hits you like a truck?",depression,1553979544.0,2019-03-31 04:59:04,0
y5ast,75pshg,How has the BTBAM tour been?,Metalcore,1507735625.0,2017-10-11 23:27:05,0
y5ast,58hg5g,What are some of the most beautiful/emotional riffs you know?,Metalcore,1476977244.0,2016-10-20 23:27:24,0
y5ast,54h8nr,I was planning on going to see Avenged Sevenfold tonight at Houston Open Air and they cancelled it due to the weather :(,Metalcore,1474838949.0,2016-09-26 05:29:09,-1
