author_id,sub_id,submission,comments,subreddit,created,timestamp,risk
dneha,cdezvu,"So there's this song I really like by Fool's Garden called ""Lemon Tree""",2,depression,1563180397.0,2019-07-15 16:46:37,1
dneha,cdeucv,"Sometimes I just take a few steps back and loudly proclaim ""Holy shit, my life is depressing.""",0,depression,1563179113.0,2019-07-15 16:25:13,-1
dneha,cd45wk,I want a 'living world' to sandbox in. Are there any maps/mods that do such a thing?,4,gmod,1563117609.0,2019-07-14 23:20:09,0
dneha,cb04q3,What are hedgehogs up to?,65,NoStupidQuestions,1562674795.0,2019-07-09 20:19:55,0
dneha,car0mk,"[PS4] I've been playing a lot of Gmod lately, and I kinda wish to get a AAA experience like what I've been doing. (AKA: I want a space game)",3,gamingsuggestions,1562620320.0,2019-07-09 05:12:00,1
dneha,caqovi,This is the only place open right now. The rest is all closed. Guess who's not getting food tonight.,5,mildlyinfuriating,1562618792.0,2019-07-09 04:46:32,0
dneha,caqeuz,Do you think the facilities from Happy Home Designer might return?,4,AnimalCrossing,1562617493.0,2019-07-09 04:24:53,1
dneha,capogx,Welcome to /r/villageriscute! Where Villager is cute.,2,villageriscute,1562614128.0,2019-07-09 03:28:48,1
dneha,capo56,Villager is Cute has been created,0,villageriscute,1562614085.0,2019-07-09 03:28:05,1
dneha,ca7864,[Batman: Arkham Asylum] How would a regular person survive the events of the Asylum riots?,6,AskScienceFiction,1562508702.0,2019-07-07 22:11:42,-1
dneha,c9r3if,Two cutiepies being cute together!,12,linkiscute,1562399602.0,2019-07-06 15:53:22,1
dneha,c764vx,Sometimes you don't even realize how bad you feel. Occasionally it dawns on you just how long you've felt this bad and how awful it truly is.,1,depression,1561850805.0,2019-06-30 07:26:45,-1
dneha,bycijd,Fun fact: when I was younger many people told me I was a gifted child of above average intelligence.,288,depression,1560027627.0,2019-06-09 05:00:27,1
dneha,bvzz6v,"So, what would've happened in Arkham Knight if...",5,BatmanArkham,1559497232.0,2019-06-03 01:40:32,0
dneha,bu2f1q,Is Warband worth getting?,39,mountandblade,1559062486.0,2019-05-29 00:54:46,1
dneha,bt736y,"Arkham Knight, boss fights and metahumans.",7,BatmanArkham,1558871803.0,2019-05-26 19:56:43,-1
dneha,bsznm8,So what if Arkham Knight wins?,5,BatmanArkham,1558818583.0,2019-05-26 05:09:43,1
dneha,bqmybw,Spider-Man for PS4 and the type of Batman game I've always wanted,13,BatmanArkham,1558304520.0,2019-05-20 06:22:00,0
dneha,bpsv4h,You start closely resembling Homer Simpson when you eat grapes.,0,shittysuperpowers,1558107815.0,2019-05-17 23:43:35,0
dneha,bohv9u,"[Star Wars] Is the Death Star little more than a massive weapon, or is there something inherently sinister about it?",22,AskScienceFiction,1557834410.0,2019-05-14 19:46:50,-1
dneha,bnbhhr,"The importance of Shay, Edward and Connor.",59,assassinscreed,1557577307.0,2019-05-11 20:21:47,1
dneha,bmhwjf,I hate being reminded of my childhood.,0,depression,1557396445.0,2019-05-09 18:07:25,-1
dneha,blprtb,Recently got diagnosed with chronic insomnia,7,insomnia,1557230031.0,2019-05-07 19:53:51,0
dneha,bkm3zg,"Wow, my life sucks.",2,SuicideWatch,1556982746.0,2019-05-04 23:12:26,1
dneha,bjtqet,The entire struggle against the First Order feels pointless.,47,saltierthancrait,1556795836.0,2019-05-02 19:17:16,-1
dneha,bjn71z,"My current life, because I feel like throwing this out somewhere.",0,depression,1556748442.0,2019-05-02 06:07:22,1
dneha,biuw3e,The wanted system in this game kinda bugs me. Is it just me?,14,reddeadredemption,1556572664.0,2019-04-30 05:17:44,0
dneha,bhmlou,Do ghosts exist in the Assassin's Creed universe?,25,assassinscreed,1556287225.0,2019-04-26 22:00:25,0
252x02w8,dnpgx1,Nothing has helped,0,depression,1572155591.0,2019-10-27 13:53:11,0
252x02w8,dbnooc,I can’t stop sexualizing people and I can’t stand it.,5,offmychest,1569902043.0,2019-10-01 11:54:03,-1
252x02w8,d814xk,I am terrified,58,collapse,1569209975.0,2019-09-23 11:39:35,-1
252x02w8,d73u5a,The climate strikes were inspiring and all but...,0,Vent,1569027142.0,2019-09-21 08:52:22,0
252x02w8,d22s84,I have trouble with casual sex and I can’t tell if it’s related to guilt or emotional attachment.,2,sex,1568090537.0,2019-09-10 12:42:17,0
252x02w8,d0g033,Waking up and remembering what you did last night is awesome,16,Petioles,1567772932.0,2019-09-06 20:28:52,1
252x02w8,cz4f0a,Normal thought blockers not working as well,3,depression,1567514876.0,2019-09-03 20:47:56,-1
252x02w8,cyydwt,It’s like I can’t relax,2,Anxiety,1567475324.0,2019-09-03 09:48:44,1
252x02w8,cybmk0,I’m [20 M] am talking to a 21 F and it’s getting to intense to fast.,8,relationship_advice,1567353276.0,2019-09-01 23:54:36,0
252x02w8,cxs4ux,I just realized I am a waste.,14,Anxiety,1567228807.0,2019-08-31 13:20:07,-1
252x02w8,cx0m92,20/M just looking for a pal to talk to,0,Needafriend,1567083741.0,2019-08-29 21:02:21,0
252x02w8,cwoljs,I dunno if I’m an addict or just a heavy user.,2,Petioles,1567016212.0,2019-08-29 02:16:52,0
252x02w8,cwl19g,It’s not that I want to kill myself. But if I die I wouldn’t be upset.,209,depression,1566999966.0,2019-08-28 21:46:06,-1
252x02w8,cwe76w,I can’t make friends,7,lonely,1566957224.0,2019-08-28 09:53:44,1
252x02w8,cu5mg6,"Day four, withdrawals smacked me like a train.",12,leaves,1566516978.0,2019-08-23 07:36:18,1
252x02w8,cs1gaz,"I’m going to do this, first day sober.",11,leaves,1566136422.0,2019-08-18 21:53:42,0
252x02w8,cqlffs,I feel like I’m afraid of everything,1,Anxiety,1565845206.0,2019-08-15 13:00:06,1
252x02w8,clldwc,Already cut back use but still feel like a burnout.,6,Petioles,1564853509.0,2019-08-04 01:31:49,1
252x02w8,cleq1p,I am afraid to leave the house.,0,Anxiety,1564807020.0,2019-08-03 12:37:00,0
252x02w8,ck9hf1,I haven’t been happy since high school.,9,depression,1564584594.0,2019-07-31 22:49:54,1
252x02w8,a7boxx,Starting to feel people avoiding me.,2,lonely,1545144642.0,2018-12-18 22:50:42,-1
252x02w8,9tvesy,Struggling with my sense of criminality,31,probation,1541262220.0,2018-11-04 00:23:40,-1
206yt4lm,dcr0xu,I really dont get what intuition means,6,infp,1570109881.0,2019-10-03 21:38:01,0
206yt4lm,dbc6x7,Is the personality test true??,4,infp,1569852984.0,2019-09-30 22:16:24,1
206yt4lm,c8hd46,Do you ever just feel like people say really stupid things to you?,6,GriefSupport,1562113977.0,2019-07-03 08:32:57,-1
206yt4lm,c7gkp8,My sweet grandma died last week and it’s still very hard to process this I can’t stop thinking about her it’s my first time grieving,0,GriefSupport,1561912898.0,2019-07-01 00:41:38,-1
206yt4lm,bfgj3t,New here i dont even think i have body dysmorphia i truly am ugly but i feel as if my struggles can be understood here,2,BodyDysmorphia,1555791160.0,2019-04-21 04:12:40,-1
206yt4lm,b6ebjm,I want to look for a job but im really scared! Please reply i want advice!!,2,depression,1553746753.0,2019-03-28 12:19:13,-1
206yt4lm,b20dgx,I feel like the antagonist of my own life,0,depression,1552788952.0,2019-03-17 10:15:52,0
206yt4lm,ayzbis,I feel bad for hating my dying grandfather,0,offmychest,1552103533.0,2019-03-09 11:52:13,-1
206yt4lm,ax1tqi,Tomorrow i read a PowerPoint presentation word for word in front of the class (pls read i mean if you want),9,socialanxiety,1551666724.0,2019-03-04 10:32:04,0
206yt4lm,av60v4,The way everything hits back when you least expect it is so upsetting and heartbreaking,2,depression,1551222892.0,2019-02-27 07:14:52,-1
206yt4lm,aqkoqr,Its my 17th birthday today and the fact that i am still alive feels so weird and bizarre,1,depression,1550156887.0,2019-02-14 23:08:07,-1
206yt4lm,alp7yz,I don't want to be here anymore and i hate how deciding on this can lead to damaging your loved ones,2,SuicideWatch,1548939707.0,2019-01-31 21:01:47,-1
206yt4lm,alegh5,I am walking out of school early because i just cant take it anymore,1,depression,1548866133.0,2019-01-31 00:35:33,0
206yt4lm,ajj94m,Not even this sub helps anymore,5,depression,1548376095.0,2019-01-25 08:28:15,1
206yt4lm,aj4cd8,Starting to self harm because things are getting unbearable how do i prevent this from becoming a daily thing Help,2,selfharm,1548276668.0,2019-01-24 04:51:08,0
206yt4lm,aish4h,I hate the way i feel and think. I hate how i am supposed to move on with a life i dont even want to exist in and put on a facade,3,depression,1548196245.0,2019-01-23 06:30:45,-1
206yt4lm,agcr2q,Was having a good day today until i looked at my legs after school only to find out i have fresh scratch scars from last night (TW),0,depression,1547583315.0,2019-01-16 04:15:15,1
206yt4lm,agcovo,I really can't stand stand the idea of my corpse rotting my body being examined at the morgue or shit like that,2,SuicideWatch,1547582988.0,2019-01-16 04:09:48,-1
206yt4lm,agaxf0,We really just be existing bro,0,depression,1547573487.0,2019-01-16 01:31:27,0
206yt4lm,af20mg,I feel like my presence on this earth does no good,3,depression,1547253180.0,2019-01-12 08:33:00,1
206yt4lm,af1yqt,I want to kill myself,3,depression,1547252819.0,2019-01-12 08:26:59,-1
206yt4lm,aeqe1z,I dont have a reason to be this way but here i am dude,0,depression,1547172102.0,2019-01-11 10:01:42,0
206yt4lm,advp0d,It genuinely feels like the only thing i know how to do well is fall apart or purposely make my self fall apart (would appreciate if my post was read),6,SuicideWatch,1546963707.0,2019-01-09 00:08:27,1
206yt4lm,ad8age,I already lived a decade and i want to end it before i live two,2,depression,1546799885.0,2019-01-07 02:38:05,0
206yt4lm,ad0byh,I regret allowing myself to live after my 16th birthday Now i am 30 days away from being 17 and all i know is that i dont want to go anymore,1,SuicideWatch,1546735230.0,2019-01-06 08:40:30,-1
206yt4lm,ac1nlh,In bed thinking about how when i wake up tomorrow ill be worthless and useless for another day again :/,0,depression,1546487772.0,2019-01-03 11:56:12,-1
206yt4lm,abvvnk,My sister told me my mom had a dream that i overdosed but my mom knows nothing about my suicidal ideation. What could this mean?,3,depression,1546452543.0,2019-01-03 02:09:03,1
206yt4lm,abmu1g,Nobody cares that im suffering dude,19,SuicideWatch,1546382223.0,2019-01-02 06:37:03,0
206yt4lm,abb2c4,I wanted to kill myself today but i couldn't carry through it,2,SuicideWatch,1546289112.0,2019-01-01 04:45:12,-1
206yt4lm,aa64os,The possibility of me ending my life is extremely high and if so and so happens i want to say thank you from the bottom of my heart,6,depression,1545965207.0,2018-12-28 10:46:47,1
206yt4lm,a9bo68,I am suicidal because i want to stop feeling the way i do all the time i dont even know why i feel the way i do lol,1,depression,1545709436.0,2018-12-25 11:43:56,-1
206yt4lm,a90jn1,Trying really hard to restrain myself from ending my life in a couple of days,1,depression,1545615728.0,2018-12-24 09:42:08,0
206yt4lm,a8h97v,Whats the point of living if i am going to be afraid every single day of my fucking life,35,Anxiety,1545447872.0,2018-12-22 11:04:32,0
206yt4lm,a8h6zu,Do you ever just want to smash your head against a wall so hard that it fractures your skull and you instantaneously die bevause you are a fuck up that wont amount to anything and will only dissapoint for the rest of your life?,9,depression,1545447362.0,2018-12-22 10:56:02,-1
206yt4lm,a85lvq,It seems like almost everyone one of us wants to end it in the holiday week,1,SuicideWatch,1545360692.0,2018-12-21 10:51:32,1
206yt4lm,a8327m,I Fucked up in every aspect of my life i am at loss for words,0,depression,1545343352.0,2018-12-21 06:02:32,-1
206yt4lm,a81px0,I barely self harm except on some rare occasions but most of the time the urge to just jab a sharp object everywhere in my body consumes me,0,depression,1545335558.0,2018-12-21 03:52:38,-1
206yt4lm,a7xndj,I am messing up my junior year of highschool with very bad grades and so many absences,3,depression,1545310561.0,2018-12-20 20:56:01,-1
206yt4lm,a7ustk,I feel unbelievably lost like i truly have no one i can count on to talk about this and its hurting me and scaring me very badly,3,SuicideWatch,1545284042.0,2018-12-20 13:34:02,-1
206yt4lm,a7i5m9,I am going to end it finally i have eleven days,8,SuicideWatch,1545186835.0,2018-12-19 10:33:55,0
206yt4lm,a75x2z,My attempts to seem outgoing and happy are working but deep inside i am still broken and i want to lock myself in a dark room and never be around anyone,1,depression,1545094037.0,2018-12-18 08:47:17,0
206yt4lm,a73e51,Am i a terrible person for wanting to drop out of highschool? Advice needed,5,depression,1545077378.0,2018-12-18 04:09:38,-1
206yt4lm,a5v8rv,I want to go to the ER on my christmas break,3,depression,1544719988.0,2018-12-14 00:53:08,0
206yt4lm,a5tpcf,A nine year old killed herself it appeared on google news and it broke my fucking heart,6,SuicideWatch,1544709418.0,2018-12-13 21:56:58,-1
206yt4lm,a5to1s,What does an overdose on pills feel like,7,SuicideWatch,1544709127.0,2018-12-13 21:52:07,1
206yt4lm,a5ofut,I still remember the day my english teacher pulled out my transcript of 72 gpa and showed it to the whole entire class and every one was looking at me while i was sitting all teary eyed paralyzed with fear,4,depression,1544662908.0,2018-12-13 09:01:48,-1
206yt4lm,a5ktov,Bro i fear that my ip address will be tracked and cops will knock on my door based on my suicidal posts,15,SuicideWatch,1544639317.0,2018-12-13 02:28:37,-1
206yt4lm,a5kqeq,What countries do you guys live in and how does your culture handle mental health issues lol sorry for weird question im just curious,2,depression,1544638743.0,2018-12-13 02:19:03,1
206yt4lm,a5ekmi,Holy shit dude i remember thinking how bizarre the idea of suicide was back when i was a kid and now im here longing it more than ever :/,31,SuicideWatch,1544587338.0,2018-12-12 12:02:18,-1
206yt4lm,a5c7t0,I want to swallow many pills on december 31st,2,SuicideWatch,1544570102.0,2018-12-12 07:15:02,0
206yt4lm,a5c5i7,I am getting very tired of holding on to life for those who i love,0,depression,1544569674.0,2018-12-12 07:07:54,1
206yt4lm,a5ajhy,Literally 2 four year olds managed to make me cry lol,5,depression,1544559503.0,2018-12-12 04:18:23,0
206yt4lm,a4weh6,It really stings to think how i disappointed my mom out of everyone in my life,0,depression,1544454341.0,2018-12-10 23:05:41,-1
206yt4lm,a45zkn,Feeling like you are destined for suicide that dying early is your calling all while staying alive for the sake of your family is an awful feeling,2,depression,1544229678.0,2018-12-08 08:41:18,-1
206yt4lm,a32x96,I feel bad because there are people in the world who live through war poverty and violence and they wish they had privileges like mine yet i am crying and whining,35,depression,1543945388.0,2018-12-05 01:43:08,-1
206yt4lm,a2l0rz,I saw a video of a man shooting himself in the head and its truly disheartening,22,SuicideWatch,1543810408.0,2018-12-03 12:13:28,0
206yt4lm,a2hcup,Should i drop out and get my ged instead (please give thoughts),3,depression,1543785179.0,2018-12-03 05:12:59,-1
206yt4lm,a201vs,Watching telenovelas with my mom is the only thing allowing me to hold on at the moment lmao,1,depression,1543639736.0,2018-12-01 12:48:56,1
206yt4lm,a1oyg4,I Just did the mistake of searching my highschool on instagram,1,depression,1543550793.0,2018-11-30 12:06:33,-1
206yt4lm,a1ip3l,I feel so fucking desperate and suffocated at school,0,depression,1543508032.0,2018-11-30 00:13:52,-1
206yt4lm,a1i433,I have to go to the oral surgeon and im really scared,2,Anxiety,1543504099.0,2018-11-29 23:08:19,-1
206yt4lm,a1hkob,My depression has not been able to get to my relationships with my family like before but if it gets to that point again i will surely kill myself,0,depression,1543500124.0,2018-11-29 22:02:04,-1
206yt4lm,a1891a,Anyone like being in the shower not for the purpose to get clean but standing in the water while the hot water just runs through your body while you just stare,214,depression,1543425757.0,2018-11-29 01:22:37,1
206yt4lm,a0ejvh,A huge thank you to those here who take time out of their day to reply with helpful advice and try to make people feel better You have a heart of gold,16,depression,1543194977.0,2018-11-26 09:16:17,1
206yt4lm,a06oai,I want to end my life before New years i dont even have what it takes to be alive,19,depression,1543130958.0,2018-11-25 15:29:18,1
206yt4lm,a06ndg,I want to end my life before New years i dont even have what it takes to be alive,0,depression,1543130657.0,2018-11-25 15:24:17,1
206yt4lm,a063g0,Any one here depressed and terrified as hell because of immigration laws,1,depression,1543124833.0,2018-11-25 13:47:13,-1
206yt4lm,9zv1ug,My older sister went through my sketchbook containing very concerning writings and drawings and on top of that she took pictures through her phone,11,depression,1543030188.0,2018-11-24 11:29:48,1
206yt4lm,9zqof8,Huge wave of sadness when i read how people here say they will kill themselves in a few hours or days,3,SuicideWatch,1542997505.0,2018-11-24 02:25:05,-1
206yt4lm,9zi9ay,I want to dissipate into thin air being in this constant headspace is absolutely exhausting my mind cant handle feeling terribly sad and feeling alienated all the time,3,depression,1542922788.0,2018-11-23 05:39:48,-1
206yt4lm,9za6x8,Deciding whether or not if december 31st is the day i leave,0,SuicideWatch,1542855994.0,2018-11-22 11:06:34,0
206yt4lm,9yzgb4,Does anyone know whats happening with daca? I have so many questions regarding immigration stuff,4,DACA,1542770974.0,2018-11-21 11:29:34,0
206yt4lm,9ycaap,When your happy but its still there lingering on to you with its presence,0,depression,1542593124.0,2018-11-19 10:05:24,1
206yt4lm,9xs6uv,I care so much about people inside but i am so quiet and reserved which makes people think i am cold and distant :( 'give thoughts pls lol',10,infp,1542417239.0,2018-11-17 09:13:59,1
206yt4lm,9wzqas,I just want to feel normal and okay again and i dont want to feel overwhelming guilt for feeling okay,2,depression,1542199086.0,2018-11-14 20:38:06,1
206yt4lm,9pqf3u,I want to die this world is mean and horrifying,1,depression,1540002584.0,2018-10-20 10:29:44,-1
206yt4lm,9jipgc,I dont deserve to live,3,depression,1538098049.0,2018-09-28 09:27:29,0
206yt4lm,9iviuu,Being suicidal made me realize how big my love for my family is,2,depression,1537905560.0,2018-09-26 03:59:20,0
206yt4lm,9gr6nx,My mom said to me that if i decide to kill my self she will never forgive herself and tells me that she will live in remorse forever,5,depression,1537240611.0,2018-09-18 11:16:51,-1
206yt4lm,9dof83,"People view suicide as the ""easy way out"" when i reality its the hard way out and the only way out",20,depression,1536276573.0,2018-09-07 07:29:33,-1
206yt4lm,9dbhi6,I dont even want to have friends at this point,12,socialanxiety,1536184766.0,2018-09-06 05:59:26,1
206yt4lm,9crylj,Anyone here know how to make yourself sob and cry hard like baby? Im unable to do that and i miss it,4,depression,1536031124.0,2018-09-04 11:18:44,-1
206yt4lm,9b5m4s,Ive been setting up dates for my suicide and i never have the courage to go through with them because i visualize the emotional damage ill give to my family,1,depression,1535512231.0,2018-08-29 11:10:31,-1
206yt4lm,98khnl,Depression and anxiety made me its little bitch since the age of 8,8,depression,1534687891.0,2018-08-19 22:11:31,-1
kpd9vjd,cgu4yb,/u/vincitopusme C4CRep,2,C4CRep,1563896113.0,2019-07-23 23:35:13,0
kpd9vjd,bnpuhz,/u/vincitopusme GCX Rep Profile,10,GCXRep,1557673221.0,2019-05-12 23:00:21,0
kpd9vjd,dn01i8,Healthy ways to manage anger/irritability?,1,depression,1572021581.0,2019-10-26 00:39:41,1
kpd9vjd,dhb20g,Losing Moral Compass,7,socialskills,1570975884.0,2019-10-13 22:11:24,-1
kpd9vjd,ddzakb,Worth it to talk back to my parents?,11,antinatalism,1570341201.0,2019-10-06 13:53:21,1
kpd9vjd,dd7ram,"Stressed that I'm going to have an episode any second, having trouble managing my emotions and performing daily tasks",7,Psychosis,1570197659.0,2019-10-04 22:00:59,-1
kpd9vjd,d60ly1,ILPT Request: What's the step by step process of making fake IDs?,4,IllegalLifeProTips,1568825564.0,2019-09-19 00:52:44,-1
kpd9vjd,d444dd,I need some honesty,9,Psychosis,1568461387.0,2019-09-14 19:43:07,1
kpd9vjd,d3hghv,How long does it take for people to 'forget' you?,6,socialanxiety,1568336063.0,2019-09-13 08:54:23,0
kpd9vjd,cv9wde,Social Skills for the depressed,2,socialskills,1566747069.0,2019-08-25 23:31:09,-1
kpd9vjd,cv8866,How do I earn ($80k+) if I'm going to graduate from a no-name school outside of the country?,14,cscareerquestions,1566738142.0,2019-08-25 21:02:22,0
kpd9vjd,cuwayd,They shouldn't have...,7,13ReasonsWhy,1566667643.0,2019-08-25 01:27:23,0
kpd9vjd,cuuqgb,"[H] Cheap, HQ Accounts (Streaming: Sling TV, Fubo TV, Hulu, Netflix, ESPN, Hotstar, Viki...; Music: Spotify, Pandora, Tidal...; VPN: ExpressVPN, NordVPN, IPVanish, Tunnelbear...; Misc: Scribd, Chegg, Masterclass,...) [W] PayPal, BTC, Giftcards, LTC",25,redditbay,1566660381.0,2019-08-24 23:26:21,0
kpd9vjd,crxo84,[TOMT][YA Book][Early 2010s] Book about a girl that goes to India and stays in motels and stuff...,9,tipofmytongue,1566108423.0,2019-08-18 14:07:03,0
kpd9vjd,cro0hw,I don't get how the world works,16,antinatalism,1566057755.0,2019-08-18 00:02:35,0
kpd9vjd,co5ajg,Therapy?,6,Psychosis,1565370446.0,2019-08-10 01:07:26,0
kpd9vjd,ck9gar,How long does it take for accepted payments to show up?,16,CashApp,1564584445.0,2019-07-31 22:47:25,1
kpd9vjd,cjrk8h,"Recruiters, what skills make you automatically consider someone?",258,cscareerquestions,1564492267.0,2019-07-30 21:11:07,0
kpd9vjd,cjck03,Tbh reading this sub makes me depressed,31,Psychosis,1564413180.0,2019-07-29 23:13:00,-1
kpd9vjd,cig7w1,Anyone else hate themselves a lot?,13,Psychosis,1564225416.0,2019-07-27 19:03:36,-1
kpd9vjd,chn6nf,[H] Private UHD Netflix Accounts [W] $2 BTC,1,redditbay,1564058676.0,2019-07-25 20:44:36,0
kpd9vjd,ch55i8,[H] $31 PayPal [W] 85% BTC,4,Cash4Cash,1563954370.0,2019-07-24 15:46:10,0
kpd9vjd,cgszgv,[H] Private Netflix with 4 screens with 1 month warranty [W] $2 BTC,1,redditbay,1563890517.0,2019-07-23 22:01:57,0
kpd9vjd,cgsffy,[H] $50 Pacsun Gift Card [W] $35 BTC or $40 PayPal,6,giftcardexchange,1563887506.0,2019-07-23 21:11:46,1
kpd9vjd,cfkzc0,[H] $50 Barnes and Noble (x2 $25 Gift Cards) [W] $25 BTC or $30 PayPal,8,giftcardexchange,1563623428.0,2019-07-20 19:50:28,1
kpd9vjd,cf90rr,[H] x2 $25 Barnes & Noble GCs [W] $35 BTC or $40 PayPal,4,giftcardexchange,1563550523.0,2019-07-19 23:35:23,1
kpd9vjd,cd5eor,What are some popular posts on Reddit that you’re convinced are fake?,2,AskReddit,1563124049.0,2019-07-15 01:07:29,1
kpd9vjd,cbchua,Looking for a US - Based Virtual Debit/Credit Card,12,personalfinance,1562736002.0,2019-07-10 13:20:02,0
kpd9vjd,camawm,"ILPT Request: Delta, Amex, or Hilton Honors server?",5,IllegalLifeProTips,1562598882.0,2019-07-08 23:14:42,1
kpd9vjd,c7h9a6,Can't live with myself,23,Psychosis,1561916524.0,2019-07-01 01:42:04,0
kpd9vjd,c70ime,ILPT Request: Where can I hire a hitman to kill me?,37,IllegalLifeProTips,1561823466.0,2019-06-29 23:51:06,-1
kpd9vjd,c6ywio,Any service where I can access US Netflix by just changing my DNS?,13,NetflixViaVPN,1561814609.0,2019-06-29 21:23:29,0
kpd9vjd,c68z6y,ilpt req: how to find someone's phone number?,6,IllegalLifeProTips,1561659535.0,2019-06-28 02:18:55,0
kpd9vjd,c5k8nr,"[H] NordVPN, Spotify, Hulu (no commercials), WWE, NBA, Wowcher, Tidal, Skype, SkillShare, SendSpace, Nest, Depop, Crunchyroll, and PornHUB with 1 month warranty! [W] $3 PayPal",25,redditbay,1561518701.0,2019-06-26 11:11:41,0
kpd9vjd,bzc9jt,"Too depressed to be productive, and not depressed enough to kill myself",215,depression,1560258493.0,2019-06-11 21:08:13,-1
nbzp7,boi7tj,Today I woke up and didn’t want to die.,114,depression,1557836511.0,2019-05-14 20:21:51,-1
nbzp7,93e3p6,My friend's creepy uncle,0,u_highwayrider,1533040666.0,2018-07-31 20:37:46,0
nbzp7,8hnlye,Why aren’t any of the Sixers’ training staff making Ben Simmons shoot right-handed?,9,sixers,1525700875.0,2018-05-07 21:47:55,-1
nbzp7,88zh9m,Can I just crawl in a hole today?,4,depression,1522677455.0,2018-04-02 21:57:35,0
nbzp7,7afhjt,Owning a business while suffering from depression.,3,depression,1509665032.0,2017-11-03 07:23:52,-1
nbzp7,5i8vzc,Some thoughts and questions on Russell Westbrook.,54,nba,1481693887.0,2016-12-14 13:38:07,0
nbzp7,48kilo,Past hookup with roommate causing problems,2,dating,1456892844.0,2016-03-02 12:27:24,-1
nbzp7,48kgxn,Past hookup with roommate causing trouble,4,dating_advice,1456892109.0,2016-03-02 12:15:09,-1
nbzp7,388d4f,Looking for apartment in Cortland area?,3,ithaca,1433260886.0,2015-06-03 00:01:26,0
nbzp7,35l8t8,Seymour Hersh: The White House is lying about the killing of Osama bin Laden,3,Journalism,1431347739.0,2015-05-11 20:35:39,-1
gjx0j,dlth95,Anyone else having an issue with trash plants showing up everywhere outside where you can edit lots?,1,thesims,1571801276.0,2019-10-23 11:27:56,0
gjx0j,dk4sk3,"[Fluff] When I was crying from anxiety, my huge dog climbed on me like a lapdog and wouldn’t stop licking my face",22,dogs,1571496917.0,2019-10-19 22:55:17,-1
gjx0j,dj7jx7,Could this be a yeast infection? Already made a vet appointment to see what’s going on,1,AskVet,1571324265.0,2019-10-17 22:57:45,0
gjx0j,dhmd5z,MCCC world dresser clean freezing my game forever until I force quit - Is it possible to do such a huge thing without this happening?,2,thesims,1571032569.0,2019-10-14 13:56:09,1
gjx0j,dfmzrw,"[Discussion] [Help] My dog’s ears pick up so much dirt quickly, how can I combat this besides cleaning them?",3,dogs,1570653423.0,2019-10-10 04:37:03,-1
gjx0j,df7j6o,here’s a picture of my dog . be friends,1,submatch,1570573874.0,2019-10-09 06:31:14,1
gjx0j,deun8i,[Help] My dog hates eating,8,dogs,1570506145.0,2019-10-08 11:42:25,-1
