author_id,sub_id,submission,comments,subreddit,created,timestamp,risk
3lmqq3v3,cdlwm7,My brother sexually assaulted my boyfriend,18,relationship_advice,1563217766.0,2019-07-16 03:09:26,-1
3lmqq3v3,c6aei6,"Should I break up? Help, I'm going insane.",1,BreakUps,1561666458.0,2019-06-28 04:14:18,0
3lmqq3v3,c2fuf3,Depression is so much worse if you live with your parents.,588,depression,1560943508.0,2019-06-19 19:25:08,-1
3lmqq3v3,bz3gc8,What is the worst part of having acne for you?,20,acne,1560201446.0,2019-06-11 05:17:26,-1
3lmqq3v3,bst90u,Would you break up over this?,3,relationship_advice,1558781826.0,2019-05-25 18:57:06,0
3lmqq3v3,bqsox3,Neutrogena Body Clear body wash?,2,acne,1558339420.0,2019-05-20 16:03:40,1
z73cn,d16wny,My dad died and I have no one to talk to about it.,16,offmychest,1567919700.0,2019-09-08 13:15:00,-1
z73cn,clztya,"Gen Zers, do you actually dress like this?",11,euphoria,1564943894.0,2019-08-05 02:38:14,1
z73cn,clqc7o,DAE feel like every thin person has an ED?,15,EDAnonymous,1564880396.0,2019-08-04 08:59:56,1
z73cn,cd0hjp,Shout out to the particular hell that is functional depression.,356,depression,1563090820.0,2019-07-14 15:53:40,-1
z73cn,9rv9cx,How I deal with working full time.,9,socialanxiety,1540655427.0,2018-10-27 23:50:27,0
z73cn,9pu9es,I survived my first international trip.,4,Anxiety,1540043166.0,2018-10-20 21:46:06,1
z73cn,8q3hs9,Is anyone else just completely hyper sensitive in their adult life?,114,raisedbynarcissists,1528661532.0,2018-06-11 04:12:12,0
z73cn,89402x,I desperately want to get back into climbing,8,climbing,1522697659.0,2018-04-03 03:34:19,-1
z73cn,88xa1v,"Recovering, but dealing with anger",8,emotionalabuse,1522649400.0,2018-04-02 14:10:00,-1
z73cn,7zklee,An update from the other side,2,emotionalabuse,1519352512.0,2018-02-23 10:21:52,0
z73cn,7qzh5e,"Well, I left him.",5,emotionalabuse,1516175296.0,2018-01-17 15:48:16,1
z73cn,7oe4z2,A moment of silence for everyone who has to help people with website use over the phone.,22,talesfromcallcenters,1515184952.0,2018-01-06 04:42:32,1
z73cn,5im5hn,I'm turning 26 and moving at the same time.,1,obamacare,1481859855.0,2016-12-16 11:44:15,0
z73cn,5ikbed,I have to give my job my two weeks notice within the next couple days and I'm terrified.,1,Anxiety,1481838218.0,2016-12-16 05:43:38,-1
z73cn,5icop1,Sensitivity paste stuff hurt my gums?,1,Dentistry,1481744533.0,2016-12-15 03:42:13,-1
z73cn,5hzapj,What were you afraid of as a kid that still freaks you out?,44,AskReddit,1481577329.0,2016-12-13 05:15:29,0
z73cn,54s3mf,Anxiety rash????,2,Anxiety,1475001793.0,2016-09-28 02:43:13,-1
z73cn,52chcn,"Young adults, what do you deal with that your parents didn't at your age?",23,AskReddit,1473652040.0,2016-09-12 11:47:20,0
z73cn,5201ic,Started dating again this year,2,BoneandStone,1473459585.0,2016-09-10 06:19:45,0
z73cn,4uskks,"Why do so many men have bad handwriting compared to women? Really, it's not like our hands are built differently.",14,Showerthoughts,1469589132.0,2016-07-27 11:12:12,-1
z73cn,4tp1cf,"Do you have recurring dreams or nightmares? What are they, and do you think they mean anything?",15,AskReddit,1468982978.0,2016-07-20 10:49:38,1
z73cn,4spitk,What is the best change you've made that has positively impacted your health (physical or mental)?,8,AskReddit,1468444363.0,2016-07-14 05:12:43,1
z73cn,4raz6x,What is something your workplace uses regularly that is painfully outdated?,24,AskReddit,1467692973.0,2016-07-05 12:29:33,-1
y5ast,d2tf6q,"I have a feeling I know the answer, but what’s the general consensus of Thank You Scientist’s live performances?",22,thankyouscientist,1568221636.0,2019-09-12 01:07:16,1
y5ast,cnrwib,Planning on taking a 250 ug dose in two weeks for the first time,1,LSD,1565297805.0,2019-08-09 04:56:45,0
y5ast,be400n,Took this at a park one night after it snowed. It evokes a certain feeling,6,infp,1555477994.0,2019-04-17 13:13:14,1
y5ast,bc3wep,"Posted a sunset pic last night and it seemed to go well, so here’s another one I took at a park near my apartment!",0,infp,1555010147.0,2019-04-12 03:15:47,1
y5ast,ba0yof,"I got this dark green cubic fluorite sample for Christmas. Tonight, I decided it needed a photoshoot. Here you guys go!",2,geology,1554526839.0,2019-04-06 13:00:39,0
y5ast,b7fxrm,"Does anyone ever feel okay for a while, then a wave of depression just hits you like a truck?",378,depression,1553979544.0,2019-03-31 04:59:04,0
y5ast,a2er64,My strange dream with August Burns Red,4,Metalcore,1543769270.0,2018-12-03 00:47:50,0
y5ast,9hro8d,All I want to see before I die is Texas In July play Bloodwork in full,17,Metalcore,1537547754.0,2018-09-22 00:35:54,-1
y5ast,8xzr11,"Every time I listen to Erra’s ‘Drift’, I feel it just keeps getting better and better",46,Metalcore,1531317141.0,2018-07-11 21:52:21,1
y5ast,8xfq3x,"If everything is perfectly balanced, then shouldn’t there be an evil Thanos out there somewhere who wants to bring disorder and chaos to the universe instead of order and peace?",2,thanosdidnothingwrong,1531167422.0,2018-07-10 04:17:02,-1
y5ast,8kur74,I have a quick question concerning headsets,2,xboxone,1526843336.0,2018-05-21 03:08:56,0
y5ast,7v32dh,"Really last minute, but I have an extra free ticket to August Burns Red tonight in Houston.",4,Metalcore,1517701405.0,2018-02-04 07:43:25,1
y5ast,7lwm1u,"Have any of you ever tripped in Sam Houston National Forest? Thinking about doing it on Wednesday with a few friends, but haven't decided yet.",2,LSD,1514139790.0,2017-12-25 02:23:10,1
y5ast,7lbn19,Can't remember a song I heard while tripping (details in text),5,LSD,1513883348.0,2017-12-22 03:09:08,0
y5ast,77xp3t,First time doing shrooms,7,shrooms,1508639200.0,2017-10-22 10:26:40,0
y5ast,75pshg,How has the BTBAM tour been?,10,Metalcore,1507735625.0,2017-10-11 23:27:05,0
y5ast,6rm1vo,"Does anyone know what the start times are going to be for the bands tonight in Phoenix? It says 6:00 on the ticket, but is that when doors open?",4,Metallica,1501867841.0,2017-08-05 01:30:41,0
y5ast,6nk9d2,Why go to parties with stupid people when you could have dinners with intellectuals?,1,iamverysmart,1500177033.0,2017-07-16 11:50:33,1
y5ast,6ajxhb,Breakdown of Sanity - Cardiac Silhouette (Such a beautiful ending. Thanks for everything),3,Metalcore,1494507355.0,2017-05-11 20:55:55,1
y5ast,652pll,"If you could listen to one song before you die, what would it be?",17,AskReddit,1492049478.0,2017-04-13 10:11:18,-1
y5ast,61twm5,"Are there any bands similar to DGD, or are they pretty unique? One of my friends, who isn't really into heavy music, said that he really enjoys their sound and I was wondering if there was anything else like them. Thanks!",53,PostHardcore,1490638670.0,2017-03-28 02:17:50,1
y5ast,611q7e,"I have two tickets for the Architects show tonight and I can't make it :( if any one wants to go, I have two tickets. First come first serve, and i'm giving them away",2,Metalcore,1490274336.0,2017-03-23 21:05:36,1
y5ast,5txiq2,I'm adopted and I turned 18 recently. I was thinking about reaching out to my biological parents?,12,Adoption,1487040227.0,2017-02-14 10:43:47,1
y5ast,5rovha,"To people have gone to back to back concerts, how was your experience?",28,Metalcore,1486063760.0,2017-02-03 03:29:20,0
y5ast,5pm613,Dave Escamilla really kills it in this new video he posted on instagram!,17,Metalcore,1485144480.0,2017-01-23 12:08:00,-1
y5ast,5mptaf,Dawn Of Justice - Duty [OFFICIAL MUSIC VIDEO] (This song really has a great ending),0,Metalcore,1483861602.0,2017-01-08 15:46:42,1
y5ast,5a7txo,Do bands restock their merch?,3,Metalcore,1477856422.0,2016-10-31 03:40:22,0
y5ast,58hg5g,What are some of the most beautiful/emotional riffs you know?,25,Metalcore,1476977244.0,2016-10-20 23:27:24,0
y5ast,585s83,Parkway Drive Vinyl,7,Metalcore,1476818789.0,2016-10-19 03:26:29,0
y5ast,55m006,Just got back from the Legends of Fall tour,7,Metalcore,1475467384.0,2016-10-03 12:03:04,0
y5ast,54h8nr,I was planning on going to see Avenged Sevenfold tonight at Houston Open Air and they cancelled it due to the weather :(,7,Metalcore,1474838949.0,2016-09-26 05:29:09,-1
y5ast,52xvzm,Avenged Sevenfold live?,6,Metalcore,1473967556.0,2016-09-16 03:25:56,0
y5ast,50v37j,Fall Concerts,24,Metalcore,1472845367.0,2016-09-03 03:42:47,0
y5ast,4sx3u1,Breakdowns with spoken parts right before,15,Metalcore,1468551107.0,2016-07-15 10:51:47,0
y5ast,4pqqyj,Warped tour tips,27,Metalcore,1466824604.0,2016-06-25 11:16:44,0
1qu2ijfd,ch5k91,"Living with depression is like running a marathon with a broken leg and then having everyone run past you and say “Yeah, yeah, broken leg boo-hoo, we’re all tired.” And then run the same fucking race everyday. The cycle.",142,depression,1563957654.0,2019-07-24 16:40:54,-1
1qu2ijfd,bbqbig,These random spikes of happiness and hope really fuck you up after. Nothing matters now.,108,depression,1554924945.0,2019-04-11 03:35:45,1
1qu2ijfd,ayv4dk,"“There’s so much life ahead of you!” Yeah, that’s my fucking problem.",63,depression,1552078061.0,2019-03-09 04:47:41,-1
1qu2ijfd,aqjz2f,Anyone know how to get dress pants that fit well? How’d you get your perfect fit?,23,AskMen,1550152460.0,2019-02-14 21:54:20,1
1qu2ijfd,aqc21b,ILPT Request: A racist neighbor beat our dog to death. How can I get revenge for it?,124,IllegalLifeProTips,1550094925.0,2019-02-14 05:55:25,-1
1528oy,bdoikz,DAE have really long depressions? I’m talking months on end,37,bipolar2,1555380859.0,2019-04-16 10:14:19,-1
1528oy,b8du9p,Who else struggles going to work?,46,bipolar2,1554175637.0,2019-04-02 11:27:17,-1
1528oy,awx2t7,Anyone with a BPD sibling here? My parents are so enabling,8,BPDlovedones,1551639050.0,2019-03-04 02:50:50,0
1528oy,awqejx,Working full time through a depressive episode is the worst,23,bipolar2,1551586691.0,2019-03-03 12:18:11,-1
1528oy,aw059x,How do you work full time through your depressive phase?,4,bipolar,1551411950.0,2019-03-01 11:45:50,-1
1528oy,aty21e,[oh no] Bridesmaid in a wedding and need to drop 35 pounds...guess I won’t be eating for the next 6 months.,10,EDAnonymous,1550944546.0,2019-02-24 01:55:46,-1
1528oy,as55w2,It’s crazy to me that there are people out there who have never been depressed or thought about killing themselves,116,depression,1550542414.0,2019-02-19 10:13:34,-1
1528oy,arhgpn,I’m so tired of this. I’m so depressed I don’t know what to do. Just looking for some encouragement,3,bipolar,1550380583.0,2019-02-17 13:16:23,-1
1528oy,ae2wh4,Feel like I’m not allowed to just have a bad day.,4,bipolar,1547006124.0,2019-01-09 11:55:24,-1
1528oy,9kdnkj,Did any of you find out you were mixed later in life?,6,mixedrace,1538372083.0,2018-10-01 13:34:43,0
1528oy,9j6s67,"Wrote 50,000 words for a novel in a few days while hypo and now can only manage a few sentences at a time. Thanks bipolar",12,bipolar,1537997632.0,2018-09-27 05:33:52,1
1528oy,9ibsl4,Anyone else really conscious of their breathing?,4,Anxiety,1537735680.0,2018-09-24 04:48:00,0
1528oy,9b3095,Had a nocturnal panic attack and now I’m having trouble sleeping...any tips?,4,Anxiety,1535491750.0,2018-08-29 05:29:10,-1
1528oy,99rzm1,Have any of you had your anxiety start out of nowhere?,2,Anxiety,1535064032.0,2018-08-24 06:40:32,0
1528oy,97m1da,Great...now I’m having panic attacks,8,bipolar,1534367075.0,2018-08-16 05:04:35,-1
1528oy,974w18,I had my first panic attack last night...I have never felt so scared in my life,2,Anxiety,1534216322.0,2018-08-14 11:12:02,-1
1528oy,8mnuz3,Has anyone lost a passion and it’s never come back?,10,bipolar,1527486950.0,2018-05-28 13:55:50,0
1528oy,8gnrtz,Anyone else just feel like a complete moron after a manic/hypomanic episode?,15,bipolar,1525322168.0,2018-05-03 12:36:08,0
1528oy,8fv2zb,On my way to a job and medical school! It’s not hopeless guys!!,17,bipolar,1525043035.0,2018-04-30 07:03:55,1
1528oy,8dthzl,Realized I was hypomanic DURING an episode for the first time ever! :),4,bipolar,1524284026.0,2018-04-21 12:13:46,1
1528oy,8cxn29,Can events or circumstances make you hypomanic?,11,bipolar,1523980790.0,2018-04-17 23:59:50,0
1528oy,8ciafb,How did you find a good doctor? What should I look for?,4,bipolar,1523826770.0,2018-04-16 05:12:50,1
1528oy,8bnc69,How to control the obsessions during hypomania?,3,bipolar,1523505184.0,2018-04-12 11:53:04,-1
1528oy,89r3zb,Does anyone else’s family encourage their hypomania?,22,bipolar,1522859966.0,2018-04-05 00:39:26,1
1528oy,873sze,Anyone here diagnosed BP NOS or bipolar spectrum (‘soft bipolar) disorder?,19,bipolar,1522012612.0,2018-03-26 05:16:52,-1
1528oy,7wjibk,"My instense fear of failure is one of the main reasons I’m to the point I think of suicide. Ironically, it’s also one of the main things that keep me from actually going through with it.",8,depression,1518239384.0,2018-02-10 13:09:44,-1
1528oy,7utted,The black hole has sucked me back in,3,depression,1517599742.0,2018-02-03 03:29:02,-1
1528oy,7oe15v,Does anyone else just *feel* the weight of disappointment whenever they are in the same room with their parents?,34,depression,1515184048.0,2018-01-06 04:27:28,-1
1528oy,6n6xie,I picked up a book for the first time in a year and a half,12,depression,1500006740.0,2017-07-14 12:32:20,0
1528oy,6drm5r,"Losing weight triggers me, but I'm sick of being fat. Does this happen to anyone else?",9,bipolar,1495939668.0,2017-05-28 10:47:48,-1
1528oy,660rtl,"""I used to lie in my bed crying at night. Now, I just lie there with a blank expression on my face. I never thought I'd get used to feeling this way, but I did.""",53,depression,1492490431.0,2017-04-18 12:40:31,-1
1528oy,64bkp1,How do you guys get over the fear of taking medication?,9,bipolar,1491715021.0,2017-04-09 13:17:01,-1
1528oy,6436ul,"""Depression isn't always at 3am when you're alone with only the thoughts in your head. Sometimes it's at 3pm, when you're surrounded by friends in the middle of laughing."" This is high functioning depression. So many people don't get it.",254,depression,1491599610.0,2017-04-08 05:13:30,-1
1528oy,63jg66,How do you change pdocs while on meds?,11,bipolar,1491366969.0,2017-04-05 12:36:09,0
1528oy,62xtmk,Sorry if it seems like I obsessively comment on everyone's posts...I just hate thinking someone poured their heart out on this sub only to be ignored. As if we don't get enough of that in real life.,15,depression,1491107624.0,2017-04-02 12:33:44,-1
1528oy,62jo4e,How do you maintain friendships?,9,bipolar,1490942785.0,2017-03-31 14:46:25,1
1528oy,61kd9p,"""That's how depression hits. You wake up one morning afraid you're going to live""",20,depression,1490511091.0,2017-03-26 14:51:31,-1
1528oy,61eadj,Now I get why people turn to drugs and alcohol,26,depression,1490423315.0,2017-03-25 14:28:35,0
1528oy,608cb9,I am TRYING. People don't get that simple existing when you have depression is completely & utterly exhausting.,53,depression,1489896188.0,2017-03-19 12:03:08,-1
1528oy,5vyxlw,Made an A on an exam AND asked someone for their phone number...today was the first good day I've had in so long,22,depression,1487958757.0,2017-02-25 01:52:37,1
1528oy,5vp3tf,Can I hear your experiences with Wellbutrin?,17,bipolar,1487834774.0,2017-02-23 15:26:14,0
1528oy,5vp2dq,Wellbutrin? Tell me your experiences,6,depression,1487834123.0,2017-02-23 15:15:23,0
1528oy,5tqtha,I don't understand how society can be so unsympathetic towards suicidal people,62,depression,1486959081.0,2017-02-13 12:11:21,-1
1528oy,5t358d,Actual question: How do you guys manage to exercise?,9,depression,1486677441.0,2017-02-10 05:57:21,0
1528oy,5rz7t6,I'm just tired.,7,depression,1486189735.0,2017-02-04 14:28:55,-1
kpvyxd8,d3gskz,What’re some good story games to play for PS4?,16,gaming,1568332849.0,2019-09-13 08:00:49,1
kpvyxd8,c872mi,What’s the best way to end it?,10,SuicideWatch,1562059162.0,2019-07-02 17:19:22,1
kpvyxd8,bnlkt8,"Sometimes when I close my eyes at night, I hope that I don’t wake up in the morning.",6,confessions,1557638294.0,2019-05-12 13:18:14,1
kpvyxd8,bkfk14,How do I get motivated in life?,10,NoStupidQuestions,1556930019.0,2019-05-04 08:33:39,1
kpvyxd8,b5jtw6,She said she no longer loved me anymore,3,BreakUps,1553565617.0,2019-03-26 10:00:17,1
kpvyxd8,b1ww0s,I want friends but I hate socializing. Do you see my problem ? ):,5,socialanxiety,1552767900.0,2019-03-17 04:25:00,-1
kpvyxd8,b1wvsq,I want friends but I hate socializing. Do you see my problem ? ):,1,CasualConversation,1552767866.0,2019-03-17 04:24:26,-1
kpvyxd8,b1cp1j,Reality is suffocating me. I’d rather live my life in my dreams. Sleep is the only time I’m numb to the pain.,3,SuicideWatch,1552641501.0,2019-03-15 17:18:21,-1
kpvyxd8,b1cown,Reality is suffocating me. I’d rather live my life in my dreams. Sleep is the only time I’m numb to the pain.,0,depression,1552641468.0,2019-03-15 17:17:48,-1
kpvyxd8,b0fona,Who needs to take notes (;,0,teenagers,1552438365.0,2019-03-13 08:52:45,1
kpvyxd8,ao7csx,Handsome pills for a handsome boy!,1,aww,1549567073.0,2019-02-08 03:17:53,1
kpvyxd8,ao13mu,Handsome pills for a handsome boy!,5,wholesomememes,1549522695.0,2019-02-07 14:58:15,1
kpvyxd8,adbla8,"It’s amazing how technology can bring people far apart closer together, and also completely separate two people on the same couch.",1,Showerthoughts,1546819113.0,2019-01-07 07:58:33,1
kpvyxd8,aao8ip,Being on your period is not an excuse to be an asshole.,30,unpopularopinion,1546112454.0,2018-12-30 03:40:54,0
kpvyxd8,a0dpk6,I hate being socially awkward.,18,socialanxiety,1543188832.0,2018-11-26 07:33:52,-1
kpvyxd8,9kvwh2,"Losing your phone now is much scarier than it was 10 years ago because it’s equivalent to losing your phone, contacts, camera, credit cards, social security, and iPod all at once.",3,Showerthoughts,1538523700.0,2018-10-03 07:41:40,0
kpvyxd8,9i2vv4,"If insects suddenly disappeared from the planet, all life would soon end. If humans suddenly disappeared, all remaining life would flourish.",5,Showerthoughts,1537648795.0,2018-09-23 04:39:55,-1
kpvyxd8,9h82c4,Everyday someone becomes the drunkest person on the planet but they’ll never know.,8,Showerthoughts,1537384211.0,2018-09-20 03:10:11,0
kpvyxd8,9gmfpt,If this isn’t the cutest thing ever,2,wholesomememes,1537205840.0,2018-09-18 01:37:20,1
kpvyxd8,95u6ez,Addiction is a choice not an illness or disease.,61,unpopularopinion,1533798054.0,2018-08-09 15:00:54,1
kpvyxd8,95rwad,"In the future, instead of colorizing black and white photos, they will de-filtering our social media photos",1,Showerthoughts,1533776251.0,2018-08-09 08:57:31,0
109znqut,didq4h,[Thank You] WOOOOO!!! MY FIRST UNI MAIL!!!!,6,RandomActsofCards,1571170634.0,2019-10-16 04:17:14,0
109znqut,cws6nr,[Thank You] Slightly belated but extremely grateful thank yous!!,13,RandomActsofCards,1567032433.0,2019-08-29 06:47:13,1
109znqut,ct97jv,She's so lovely,0,actuallesbians,1566348392.0,2019-08-21 08:46:32,1
109znqut,cqdbp2,[Thank You] So many cool cards!!,11,RandomActsofCards,1565805613.0,2019-08-15 02:00:13,1
109znqut,cncau4,[Thank You] Four amazing postcards,5,RandomActsofCards,1565215021.0,2019-08-08 05:57:01,1
109znqut,clcxp6,Why must stamps be so expensive: A Rant,32,RAoC_meta,1564796018.0,2019-08-03 09:33:38,-1
109znqut,cktwoi,[Thank You] Lovely mail from lovely humans + my bizarre RAoC dream,11,RandomActsofCards,1564691622.0,2019-08-02 04:33:42,1
109znqut,cjxcf0,[Thank You] So many beautiful postcards,6,RandomActsofCards,1564517499.0,2019-07-31 04:11:39,1
109znqut,cj3qu6,What are some unexpected perks of sending cards that you've experienced?,31,RAoC_meta,1564359829.0,2019-07-29 08:23:49,0
109znqut,cicb8q,[Thank You] So much wonderful mail over the past few days,5,RandomActsofCards,1564196218.0,2019-07-27 10:56:58,1
109znqut,ci5ros,[Exchange] 4 Delaware postcards up for exchange! [US to US],4,RandomActsofCards,1564161932.0,2019-07-27 01:25:32,0
109znqut,cggkey,[Thank You] My mailbox was literally bursting today!! So much joy!!,13,RandomActsofCards,1563818223.0,2019-07-23 01:57:03,1
109znqut,cg2o5h,[Exchange] I still have a collection of Delaware postcards looking for good homes! [US to US],3,RandomActsofCards,1563735809.0,2019-07-22 03:03:29,1
109znqut,cfgeo4,[Exchange] Loads of postcards up for exchange!! [US to US],5,RandomActsofCards,1563588061.0,2019-07-20 10:01:01,0
109znqut,cf24a9,I feel broken.,10,actuallesbians,1563504936.0,2019-07-19 10:55:36,-1
109znqut,cevakg,[Thank You] Postcards from all over the world in my mailbox today :) Also featuring a glitch in the matrix,8,RandomActsofCards,1563469983.0,2019-07-19 01:13:03,1
109znqut,ce24al,[Thank You] Christmas in July! How wonderful!,2,RandomActsofCards,1563306916.0,2019-07-17 03:55:16,1
109znqut,ce1jbb,[Thank you] I finally was able to check my PO Box!! So many thank yous!!,10,RandomActsofCards,1563304265.0,2019-07-17 03:11:05,-1
109znqut,cdprsr,"[Exchange] 20 Delaware postcards and 3 from Ocean City, NJ! [US to US]",8,RandomActsofCards,1563236593.0,2019-07-16 08:23:13,0
109znqut,cdkgn3,[Thank You] u/missnettiemoore for the lovely ferris wheel card!,3,RandomActsofCards,1563211709.0,2019-07-16 01:28:29,1
109znqut,cd9trg,[Thank You] An update on my mission to fill my dorm room wall!,8,RandomActsofCards,1563146676.0,2019-07-15 07:24:36,0
109znqut,cc2mwx,"[Exchange] Back from a vacation, picked up postcards on the way! [US to WW]",13,RandomActsofCards,1562885634.0,2019-07-12 06:53:54,0
109znqut,cbr5rp,[Thank You] Just got home from a two-week vacation to find lots of mail waiting :),5,RandomActsofCards,1562818688.0,2019-07-11 12:18:08,1
109znqut,c31j12,[Thank You] Came back from a trip today to find loads waiting for me :),10,RandomActsofCards,1561064380.0,2019-06-21 04:59:40,1
109znqut,bz4el0,[Thank You] I got five postcards in the mail today!!!,3,RandomActsofCards,1560206318.0,2019-06-11 06:38:38,0
109znqut,bxzcps,Will I miss out if I don’t go clubbing during freshers week?,28,UniUK,1559938920.0,2019-06-08 04:22:00,0
109znqut,bw4kve,[Exchange] Decorating my dorm room wall with postcards from around the world! [USA to anywhere],12,PostCardExchange,1559523007.0,2019-06-03 08:50:07,0
109znqut,bw1ntx,[Exchange] I keep coming back here because I love this community so much! Help me fill my dorm room wall with postcards :) [USA to anywhere],16,RandomActsofCards,1559506222.0,2019-06-03 04:10:22,1
109znqut,bu4upp,[Thank You] for so many postcards!,10,RandomActsofCards,1559074188.0,2019-05-29 04:09:48,0
109znqut,bt13we,[Exchange] I'm going to decorate my wall at uni with postcards from all over the world! [USA to anywhere],9,RandomActsofCards,1558826929.0,2019-05-26 07:28:49,0
109znqut,bswhym,What's the best mobile plan for students?,33,CasualUK,1558802133.0,2019-05-26 00:35:33,1
109znqut,bnur7z,"Does anyone want to exchange postcards? I can send you a cool one from the east coast, USA :)",3,AskEurope,1557698326.0,2019-05-13 05:58:46,1
109znqut,bnun9m,"Does anyone want to exchange postcards? I can send you a cool one from the east coast, USA :)",3,AskCentralAsia,1557697709.0,2019-05-13 05:48:29,1
109znqut,bnkedk,"Does anyone want to exchange postcards? I can send you a cool one from the east coast, USA :)",6,AskAnAfrican,1557629508.0,2019-05-12 10:51:48,1
109znqut,bnk1gi,[Exchange] Going to uni next year I'd like to fill my dorm room wall with postcards from all over the world! [USA to anywhere],12,RandomActsofCards,1557627164.0,2019-05-12 10:12:44,1
109znqut,bnewd7,[Exchange] Looking to fill my dorm room wall!,12,PostCardExchange,1557597281.0,2019-05-12 01:54:41,0
109znqut,bnes2y,Anyone want to exchange postcards?,2,greenland,1557596649.0,2019-05-12 01:44:09,0
109znqut,blve0g,Two exams tomorrow and I just got diagnosed with strep throat,9,APStudents,1557259175.0,2019-05-08 03:59:35,0
109znqut,b5lw5z,Does anyone else stay up super late to avoid the next day?,217,depression,1553578819.0,2019-03-26 13:40:19,1
109znqut,b1p3rl,Poorly executed too,1,uselessredcircle,1552714843.0,2019-03-16 13:40:43,0
109znqut,azxbr1,Holy shit my senioritis is bad,26,ApplyingToCollege,1552331210.0,2019-03-12 03:06:50,-1
109znqut,ay8kua,I told myself I’d start my homework at 11:30pm but it’s apparently my cake day so for some reason I’ve now allowed myself another hour of time wasting,11,teenagers,1551933247.0,2019-03-07 12:34:07,-1
109znqut,awpi9e,What should I do to plan??,17,ApplyingToCollege,1551580225.0,2019-03-03 10:30:25,0
109znqut,aw0b9u,"I am soul-crushingly sad and I don't know why, what should I watch",6,teenagers,1551413009.0,2019-03-01 12:03:29,-1
109znqut,auvlwr,"Maybe a stupid question, but...",3,AdventuresOfSabrina,1551159013.0,2019-02-26 13:30:13,-1
109znqut,akhhph,“Don’t lie around like a depressed person”,28,depression,1548633373.0,2019-01-28 07:56:13,-1
109znqut,ahg9np,An experience I had today,7,misophonia,1547853412.0,2019-01-19 07:16:52,0
109znqut,a7e8iv,I asked a girl out,20,Anxiety,1545160887.0,2018-12-19 03:21:27,0
109znqut,a69qra,When the test grades are online but you’ve failed so hard yours is just a note saying to come see the teacher,2,teenagers,1544827535.0,2018-12-15 06:45:35,-1
109znqut,9si3zi,"Stayed home from school to get caught up, ended up just laying on the couch with crippling anxiety all day!",6,Anxiety,1540853093.0,2018-10-30 06:44:53,-1
109znqut,9seo8y,I forgot to go to school,4,teenagers,1540830911.0,2018-10-30 00:35:11,0
109znqut,9ryxxb,Fuck,12,ApplyingToCollege,1540684302.0,2018-10-28 07:51:42,-1
109znqut,9ry0c9,A couple stupid questions,2,ApplyingToCollege,1540676518.0,2018-10-28 05:41:58,-1
109znqut,9rs3sb,Is there Snapchat in Antarctica?,26,antarctica,1540620196.0,2018-10-27 14:03:16,0
109znqut,9r7jdy,I stayed home from school to catch up on work and ended up sleeping for most of the day. Now it's nearly 2am and I'm wide awake,7,teenagers,1540446331.0,2018-10-25 13:45:31,0
109znqut,9pr5k2,One of the best nights of my life,4,chvrches,1540009523.0,2018-10-20 12:25:23,1
bvwuh,dgtcba,Has anyone else ever been wondering about this?,2,depression,1570875660.0,2019-10-12 18:21:00,0
