author_id,sub_id,submission,comments,subreddit,created,timestamp,risk
2r4vr6e7,dk1yn9,I (23M) am a philosophy graduate who has been stuck in retail for 2 1/2 years since graduation. Feeling a little hopeless but know that I'm not destined to work there for the rest of my life.,40,findapath,1571480847.0,2019-10-19 18:27:27,-1
2r4vr6e7,dk1qy5,"I'm alone because I don't put in enough effort to meet women, and I don't ask them out. There, I fucking admit it.",85,ForeverAlone,1571479384.0,2019-10-19 18:03:04,0
2r4vr6e7,dini90,The idea that you have to be highly self-improved to find a partner is laughable when reality suggests otherwise.,41,ForeverAlone,1571222656.0,2019-10-16 18:44:16,0
2r4vr6e7,dhpd8h,My long-term dating problems wouldn’t be nearly as frustrating if there was something wrong with me. Being a normal guy makes the situation more baffling and mysterious.,14,ForeverAlone,1571053303.0,2019-10-14 19:41:43,-1
2r4vr6e7,dge0hg,I can’t fucking believe this is my life.,81,ForeverAlone,1570794590.0,2019-10-11 19:49:50,0
2r4vr6e7,dfe5il,It feels like my life has been one big sausage fest and that the universe is keeping me away from women. Anyone else had this feeling?,11,ForeverAlone,1570609842.0,2019-10-09 16:30:42,1
2r4vr6e7,dccb4b,Seeing all of these success stories makes me wonder when it'll be my turn to post one.,14,ForeverAlone,1570032426.0,2019-10-03 00:07:06,1
2r4vr6e7,dbf9y9,"It's incredibly frustrating that my social circles have been overwhelmingly male for my entire life, all of whom are in the same boat as I am and know no single women. I have tried to expand my social circle but have continuously only been able to meet people like myself. Networking is so important.",11,ForeverAlone,1569865611.0,2019-10-01 01:46:51,1
2r4vr6e7,daez5o,It’s only logical that a woman wouldn’t want to date me.,33,ForeverAlone,1569671306.0,2019-09-28 19:48:26,0
2r4vr6e7,d9hwnw,"Why can’t I give up? Why do I have to keep being strung along by my stupid brain, and keep suffering over and over again?",4,ForeverAlone,1569494786.0,2019-09-26 18:46:26,-1
2r4vr6e7,d84p0z,"I've stopped pushing towards a better life. The universe doesn't want me to succeed, I will just accept a life of mediocrity and rot for the next 50 years.",7,ForeverAlone,1569234854.0,2019-09-23 18:34:14,1
2r4vr6e7,d4qmcz,Any graduates here who still haven't found a job in their field?,15,ForeverAlone,1568581874.0,2019-09-16 05:11:14,0
2r4vr6e7,d1exwp,I want to give up on love and sex but I can’t due to biology. All it does it bring me pain.,5,Advice,1567968049.0,2019-09-09 02:40:49,-1
2r4vr6e7,czj4yw,Is it wrong to settle for less if trying to achieve more just brings more pain and misery than mediocrity itself does?,4,Advice,1567593787.0,2019-09-04 18:43:07,-1
2r4vr6e7,cz7eln,"Life just isn't moving forward, I'm totally stuck in the mud.",13,NEET,1567529186.0,2019-09-04 00:46:26,-1
2r4vr6e7,cz4brq,"My problem is that I’m not bad per se, just thoroughly unremarkable and average.",1,ForeverAlone,1567514382.0,2019-09-03 20:39:42,0
2r4vr6e7,cwmaut,I've decided to solely focus on myself and live as if I'll never find anyone.,22,ForeverAlone,1567005883.0,2019-08-28 23:24:43,0
2r4vr6e7,cw87pv,Some degrees are just worthless. People who can't a job in their field should suck it up and take an entry level job that doesn't require their degree.,8,offmychest,1566929484.0,2019-08-28 02:11:24,-1
2r4vr6e7,cva1sb,It’s not worth focusing on anymore.,1,ForeverAlone,1566747797.0,2019-08-25 23:43:17,0
2r4vr6e7,cuxji6,"Is it wrong to disqualify myself [23M] from dating if I feel like my life isn't in order? I feel that given my current position, no one would want to date me anyway. How rational am I in thinking this?",10,dating_advice,1566673209.0,2019-08-25 03:00:09,-1
2r4vr6e7,cnsjv4,"PSA: Please make sure that weights are securely locked into your belt when doing weighted chin-ups/dips. I didn't check earlier and the weight came loose from the chain when I stood up, and it landed on my big toe.",35,bodyweightfitness,1565300638.0,2019-08-09 05:43:58,1
2r4vr6e7,chl26f,Do you ever feel like the universe is actively working against you?,68,ForeverAlone,1564044033.0,2019-07-25 16:40:33,1
2r4vr6e7,cegqck,"I took a break from subs like this for a month, here's what I learned.",8,ForeverAlone,1563388043.0,2019-07-18 02:27:23,1
2r4vr6e7,bvwtgp,"Why do most clothes companies insist on making their sleeves absolutely huge, so much that you’d need bodybuilder level arms to fill them out?",6,NoStupidQuestions,1559478221.0,2019-06-02 20:23:41,1
2r4vr6e7,brsy1y,"Does anyone have a period where they feel really motivated and see things clearly, only to crash even harder the more you try to better yourself, feeling even more depressed than you were originally?",202,depression,1558552904.0,2019-05-23 03:21:44,1
2r4vr6e7,b9vfdf,Gonna go out solo to the bar again tonight.,12,ForeverAlone,1554491985.0,2019-04-06 03:19:45,0
2r4vr6e7,ajnjqj,Pulsatile tinnitus,8,HealthAnxiety,1548410037.0,2019-01-25 17:53:57,0
2r4vr6e7,afcpvh,"Does the barbell absolutely need to touch the chest after every rep of a standing press, or is going below the chin fine?",39,Fitness,1547333304.0,2019-01-13 06:48:24,1
2r4vr6e7,ae6vos,6'1. Will I look good after a cut?,23,BulkOrCut,1547040949.0,2019-01-09 21:35:49,1
2r4vr6e7,aaoddu,"Finding it increasingly difficult to feign laughter after hearing the ""see you next year"" comment from friends/colleagues after hearing it for the 23rd time.",3,britishproblems,1546113354.0,2018-12-30 03:55:54,0
2r4vr6e7,aalw2n,"A subreddit where people learn to be comfortable with being single, with a focus on self-improvement.",96,findareddit,1546096147.0,2018-12-29 23:09:07,1
2r4vr6e7,a6rhbd,"You don't have to be perfect or a high-achiever to date, and you need to stop being so hard on yourselves.",160,dating_advice,1544985122.0,2018-12-17 02:32:02,1
2ldrj98,dibyo7,How do I catch up on so much missed work?,2,college,1571163495.0,2019-10-16 02:18:15,-1
2ldrj98,dibsl3,"having migraines makes it harder to prevent migraines by keeping a healthy, consistent lifestyle",28,migraine,1571162802.0,2019-10-16 02:06:42,1
2ldrj98,dh7rtn,What are good preventative measures to take against migraines?,11,migraine,1570954264.0,2019-10-13 16:11:04,1
2ldrj98,dfr4xy,Does medical marijuana actually help migraines?,9,migraine,1570672433.0,2019-10-10 09:53:53,1
2ldrj98,df9k0g,I think my roommates gonna move out soon,3,college,1570582764.0,2019-10-09 08:59:24,0
2ldrj98,dc4lji,My math class literally gives me migraines,10,migraine,1569986169.0,2019-10-02 11:16:09,0
2ldrj98,cws5pr,A perspective on suicide you never hear,7,SuicideWatch,1567032288.0,2019-08-29 06:44:48,-1
2ldrj98,cvjzfi,Off to a women’s college ready to hoe it out!,6,actuallesbians,1566798753.0,2019-08-26 13:52:33,1
2ldrj98,cvjujz,It takes so much work to not be depressed,2,depression,1566797774.0,2019-08-26 13:36:14,1
2ldrj98,cvjsdv,How do I let myself believe that people like me?,0,depression,1566797346.0,2019-08-26 13:29:06,1
2ldrj98,bvv4vq,Animal crossing is calling me out and I. D.o.n.t like it,7,actuallesbians,1559462262.0,2019-06-02 15:57:42,1
2ldrj98,bvunql,Yo I just made a sub you should all join,4,teenagers,1559457471.0,2019-06-02 14:37:51,1
2ldrj98,bvqdcu,How we can change things so we don’t die because of climate change,19,teenagers,1559427645.0,2019-06-02 06:20:45,-1
2ldrj98,br3qbx,Will I get rescinded if i got a detention for cutting class?,7,ApplyingToCollege,1558399226.0,2019-05-21 08:40:26,-1
2ldrj98,bmybu1,Important life-changing college advice about the SAT,5,ApplyingToCollege,1557495070.0,2019-05-10 21:31:10,1
2ldrj98,bmecc5,How to talk to girls (made by a girl),8,teenagers,1557368914.0,2019-05-09 10:28:34,0
2ldrj98,bly5rd,For the two girls on this sub,7,teenagers,1557273170.0,2019-05-08 07:52:50,0
2ldrj98,bid1kk,Don’t forget about liberal arts colleges,22,ApplyingToCollege,1556469091.0,2019-04-29 00:31:31,-1
2ldrj98,bicr2c,What college admissions ppl look for,13,ApplyingToCollege,1556467442.0,2019-04-29 00:04:02,0
2ldrj98,be4090,You GOTTA try taking your meds super late at night and gooooooo (don’t actually),0,ADHD,1555478042.0,2019-04-17 13:14:02,1
2ldrj98,bcwg17,I think I found a local baby gay and idk how to reach out to her,1,actuallesbians,1555196685.0,2019-04-14 07:04:45,0
2ldrj98,b7q1kc,Becoming a regular at a local coffee shop changed my life,168,depression,1554052412.0,2019-04-01 01:13:32,0
2ldrj98,b66vcn,My old friend is back!!!!!!,2,depression,1553706851.0,2019-03-28 01:14:11,1
2ldrj98,b4qlxq,how to gaydar,20,actuallesbians,1553389650.0,2019-03-24 09:07:30,0
7qowrd,dbd5gr,My therapist died,81,depression,1569857007.0,2019-09-30 23:23:27,-1
7qowrd,bnei4y,"If you had a 10-gallon nano tank to stock however you you want, what would you do?",11,Aquariums,1557595150.0,2019-05-12 01:19:10,0
7qowrd,8gafyt,Thought you guys would like my notebook!,19,bettafish,1525197385.0,2018-05-02 01:56:25,1
7qowrd,7v1a5p,Female bettas are cute too. Meet Ophelia!!!,4,bettafish,1517684452.0,2018-02-04 03:00:52,1
7qowrd,7p8cb9,Ferdinand hard at work... on water change day.,5,bettafish,1515516553.0,2018-01-10 00:49:13,0
3r50vh0p,cp1ajy,does anyone else have a constant feeling of not fitting in or belonging anywhere?,281,depression,1565552467.0,2019-08-12 03:41:07,0
3r50vh0p,chl7ur,is it okay to have opposite sex friends when you’re in a relationship?,27,relationship_advice,1564045331.0,2019-07-25 17:02:11,1
3r50vh0p,cdogzd,how to quit a job for mental health reasons?,1,depression,1563229661.0,2019-07-16 06:27:41,0
3r50vh0p,c81eio,is anyone else an extreme pushover due to fear of confrontation?,43,Anxiety,1562021660.0,2019-07-02 06:54:20,-1
3r50vh0p,byyg0q,lightbulbs blow out when i’m angry?,8,Unexplained_Mysteries,1560176553.0,2019-06-10 22:22:33,-1
3r50vh0p,bynsyc,Why do I always attract needy/clingy people?,8,relationship_advice,1560107368.0,2019-06-10 03:09:28,1
3r50vh0p,bxn1hc,"guy i’m newly dating annoys the hell out of me, should i move on?",10,relationship_advice,1559860698.0,2019-06-07 06:38:18,-1
23mvbbgf,crc51e,My first time actually experiencing full blown Stimulant Psychosis. Report + Aftermath,7,Drugs,1565987949.0,2019-08-17 04:39:09,0
23mvbbgf,cq4zik,Help overcoming a stimulant addiction. What can I do to break this fucked up circle.,14,researchchemicals,1565758655.0,2019-08-14 12:57:35,-1
23mvbbgf,codh7o,I want to learn more about the interactions of chemicals and how minor substitutions of a ring can drastically change the effect. Basically how the chemistry works and how it targets particular neurotransmitters. Does anyone have good resources to share so I can learn more?,16,researchchemicals,1565411258.0,2019-08-10 12:27:38,1
23mvbbgf,cn5vlj,"The worst part of depression is waking up and the first thought that pops in your head is how shitty you feel, alone and already struggling to get through the day before it’s even started.",190,depression,1565184942.0,2019-08-07 21:35:42,-1
23mvbbgf,cm5ygx,PSA: Please remember to research with caution. Near death very powerful eye opening experience.,30,researchchemicals,1564976988.0,2019-08-05 11:49:48,0
23mvbbgf,cl08e7,"Extremely depressed, I decided to try my first full dose locked in my room to gain different perspective. Forgot I logged my thoughts at the peak. Died laughing when i first read this jibberish but realized there is some truth. I read this often to remember to keep fighting the darkness. Ty LSD.",18,LSD,1564726091.0,2019-08-02 14:08:11,0
23mvbbgf,c3sc8b,"Hydrophilic RC’s, This is the second time i’ve came across an extremely moisture sensitive chem.",17,researchchemicals,1561224185.0,2019-06-23 01:23:05,0
23mvbbgf,c3erno,My MANY RC experiences and the effects of each one! (Updated),26,researchchemicals,1561143340.0,2019-06-22 02:55:40,0
23mvbbgf,ampv3z,"So my friend works at a printing lab that costs a few cents, it gets used everyday and they let me go through the change. Nearly shit myself when i saw this but when comparing certified ones i’m thinking it may be a fake... Although i am still ecstatic! Wtf was this doing in some random jar..",25,coins,1549203118.0,2019-02-03 22:11:58,-1
23mvbbgf,9m4p6n,I can’t be the only one who feels literally “lost”,11,depression,1538915557.0,2018-10-07 20:32:37,0
23mvbbgf,9kjo2x,Stumbled upon the most beautiful wheat i’ve ever laid my eyes upon!,0,coincollecting,1538423284.0,2018-10-02 03:48:04,1
1oax8o8z,djrz5a,Anybody else feel like your just spinning your wheels in place?,2,depression,1571424697.0,2019-10-19 02:51:37,1
1oax8o8z,diy4zy,Trump’s letter to Erdogan,15,cringepics,1571270291.0,2019-10-17 07:58:11,0
1oax8o8z,dis39e,I think the main thing keeping myself alive is that my little sisters birthday is coming up and I don’t wanna do that to her,4,depression,1571244735.0,2019-10-17 00:52:15,1
1oax8o8z,dis0f3,How many milligrams of bupropion would kill me?,1,SuicideWatch,1571244408.0,2019-10-17 00:46:48,-1
1oax8o8z,didlut,Why am I always on the outside?,1,depression,1571170157.0,2019-10-16 04:09:17,0
1oax8o8z,dds0ff,I freak people out with my accidental bedroom eyes.,1,offmychest,1570303801.0,2019-10-06 03:30:01,-1
1oax8o8z,ddnx5k,What’s a strange and specific anxiety or insecurity you think only you have?,11,AskReddit,1570285734.0,2019-10-05 22:28:54,-1
1oax8o8z,d8uza5,When I called the suicide hotline I was too nervous to say anything,3,SuicideWatch,1569366268.0,2019-09-25 07:04:28,-1
1oax8o8z,d8h3kd,I’ve decided I’m not reaching out anymore.,3,lonely,1569292906.0,2019-09-24 10:41:46,0
1oax8o8z,d7kbni,[L][Male][20],2,KindVoice,1569118304.0,2019-09-22 10:11:44,0
1oax8o8z,d7k7cs,Really bad day. Really few months.,1,KindVoice,1569117616.0,2019-09-22 10:00:16,-1
1oax8o8z,d7fagu,My loneliness has turned into bitterness and it’s destroying me.,4,lonely,1569095325.0,2019-09-22 03:48:45,-1
1oax8o8z,d7caq5,All I want is one of two things. The courage to finally kill myself or to know what the fuck is wrong with me so I can finally be accepted by someone.,6,TrueOffMyChest,1569081553.0,2019-09-21 23:59:13,-1
1oax8o8z,d73rk9,I feel like I’m going fucking insane.,2,depression,1569026740.0,2019-09-21 08:45:40,0
1oax8o8z,d71rz1,Everyone will always reject me in every way,4,lonely,1569016610.0,2019-09-21 05:56:50,-1
1oax8o8z,d12lfw,Last night I had hxh dreams.,3,HunterXHunter,1567894935.0,2019-09-08 06:22:15,1
1oax8o8z,d091ar,Freind just said this and I am dying,4,rareinsults,1567728691.0,2019-09-06 08:11:31,0
1oax8o8z,d02qtf,How do I deal with abandonment and rejection.,10,relationship_advice,1567699387.0,2019-09-06 00:03:07,-1
1oax8o8z,cz6w7p,Anybody find it hard to maintain self respect with crippling loneliness and depression?,2,lonely,1567526867.0,2019-09-04 00:07:47,-1
1oax8o8z,cywf5c,If I decided to shoot my self right now nobody outside of my immediate family would notice my absence.,2,SuicideWatch,1567464866.0,2019-09-03 06:54:26,-1
1oax8o8z,cyvo8v,My 20th is coming up and I have absolutely no one.,4,depression,1567461288.0,2019-09-03 05:54:48,-1
1oax8o8z,cvvh72,Just got out of the hospital and not a single person reached out to me.,8,lonely,1566859735.0,2019-08-27 06:48:55,0
1oax8o8z,cttbek,Apt for projection?,3,AstralProjection,1566454192.0,2019-08-22 14:09:52,0
1oax8o8z,csb1ra,Every single day there’s a new “last straw” and now I’m just numb.,0,depression,1566182684.0,2019-08-19 10:44:44,-1
1oax8o8z,cq4t05,Always on the outside?,3,socialskills,1565757534.0,2019-08-14 12:38:54,0
1oax8o8z,cpvwhh,Is anyone else strangely sick of being high functioning?,334,depression,1565715312.0,2019-08-14 00:55:12,-1
1oax8o8z,cpnb9m,Anyone else feel like there’s something wrong with them that separates them from everyone else.,5,depression,1565666360.0,2019-08-13 11:19:20,0
1oax8o8z,cpjzzs,I fucking hate myself so much. Nobody will ever want to be around me or be my friend.,1,depression,1565650168.0,2019-08-13 06:49:28,0
1oax8o8z,cp838z,I just want someone to show that I’m not invisible.,3,depression,1565588246.0,2019-08-12 13:37:26,0
1oax8o8z,cp7cr6,And a bunch of my “friends” are hanging out without me. Time to down my Wellbutrin.,1,SuicideWatch,1565583606.0,2019-08-12 12:20:06,0
1oax8o8z,coxgcw,Beginning to think I might just be another family kook,0,mentalhealth,1565534178.0,2019-08-11 22:36:18,0
1oax8o8z,conb6s,I’m such a pathetic loser.,8,depression,1565469491.0,2019-08-11 04:38:11,-1
1oax8o8z,cojui1,Is my plant I’m propagating ready to be potted or should I hold out for more roots?,1,plants,1565452985.0,2019-08-11 00:03:05,1
1oax8o8z,codbg2,Does anybody else feel like depression is truth,5,depression,1565410294.0,2019-08-10 12:11:34,0
1oax8o8z,cnx6jq,If I disappeared nobody outside my immediate family would even notice or think twice.,1,depression,1565324157.0,2019-08-09 12:15:57,-1
1oax8o8z,cn8mi7,You guys ever miss yourself,2,depression,1565198158.0,2019-08-08 01:15:58,0
1oax8o8z,cn1vlk,Fucking love dissociatives.,18,Drugs,1565157018.0,2019-08-07 13:50:18,1
1oax8o8z,cn19k2,I have to go to work in 2 days and am literally shitting myself.,0,depression,1565152854.0,2019-08-07 12:40:54,-1
1oax8o8z,cmwvz5,Just bought melatonin,0,depression,1565129081.0,2019-08-07 06:04:41,0
1oax8o8z,cmjy65,I hate the weight that my extreme depression is putting on my family.,1,depression,1565054161.0,2019-08-06 09:16:01,-1
1oax8o8z,cmci53,Waiting for my Xans plug so I can become a drunken bartard then die,0,depression,1565019388.0,2019-08-05 23:36:28,-1
1oax8o8z,cm1joc,Always an outsider,0,depression,1564952423.0,2019-08-05 05:00:23,0
1oax8o8z,clz67h,Just downed my lithium orotate:),2,depression,1564940673.0,2019-08-05 01:44:33,0
1oax8o8z,clewoq,How much Xanax would make someone OD?,17,Drugs,1564808306.0,2019-08-03 12:58:26,0
1oax8o8z,clewo6,Anyone else have there will mentally planned out?,1,depression,1564808303.0,2019-08-03 12:58:23,0
1oax8o8z,cleh9f,I just fucking can’t go to work tomorrow. I think I’d rather od.,4,SuicideWatch,1564805444.0,2019-08-03 12:10:44,0
1oax8o8z,cl6c2y,I hate waking up.,3,depression,1564763138.0,2019-08-03 00:25:38,-1
1oax8o8z,cfb5vl,Do you guys ever just hate yourself so much that you have to punch yourself?,46,depression,1563560597.0,2019-07-20 02:23:17,-1
1oax8o8z,ceknvh,I’m incapable of making friends or any real connection.,3,depression,1563406464.0,2019-07-18 07:34:24,0
1oax8o8z,cdm2i1,Nobody ever invites me anywhere,2,depression,1563218467.0,2019-07-16 03:21:07,0
1oax8o8z,bm3lc2,hxh score thing i noticed,5,HunterXHunter,1557311455.0,2019-05-08 18:30:55,0
1oax8o8z,bc4bde,nen power idea,6,HunterXHunter,1555012334.0,2019-04-12 03:52:14,0
1oax8o8z,b5g8bh,How to handle when introducing your friends to each other.,1,relationship_advice,1553547143.0,2019-03-26 04:52:23,1
1oax8o8z,als46i,"Gay people of Reddit who were in a straight marriage and came out later life, ending that marriage, what is your story and why did you wait so long?",13,AskReddit,1548957093.0,2019-02-01 01:51:33,1
1oax8o8z,9j87uk,"Two thirds of the way there, spider, just gotta kill my heroes.",56,TargetedShirts,1538008897.0,2018-09-27 08:41:37,-1
1oax8o8z,8wd0fl,This dead cat drone,5,badtaxidermy,1530816667.0,2018-07-06 02:51:07,-1
wxauitr,bhfpo3,I've upgraded from considering suicide to being terrified of dying and the inevitability of my eventual death,4,depression,1556236612.0,2019-04-26 07:56:52,-1
wxauitr,b8tms8,The worst part of depression is that it's stolen my personality,167,depression,1554266715.0,2019-04-03 12:45:15,-1
32np3jka,cqqe91,"2 years since I dropped out of college due to anxiety and depression, I finally signed back up for classes yesterday.",175,depression,1565878516.0,2019-08-15 22:15:16,-1
32np3jka,combgj,Has anyone experienced an increase of anxiety and anger while on zoloft?,1,depression,1565464693.0,2019-08-11 03:18:13,-1
32np3jka,cgtp07,I keep pretending to be sick to get out of work,8,offmychest,1563894042.0,2019-07-23 23:00:42,-1
32np3jka,b8astg,Made a post on another subreddit about almost being sexually assaulted and it’s made me realize how real victim blaming is.,191,TwoXChromosomes,1554159627.0,2019-04-02 07:00:27,-1
xq71k,dl3z13,Being a sex worker doesn’t make you a bad person,362,unpopularopinion,1571679387.0,2019-10-22 01:36:27,-1
xq71k,df3993,"18M If your up at late at night and lookin for someone to talk to, I’m your guy.",4,Needafriend,1570555853.0,2019-10-09 01:30:53,0
xq71k,devv7o,"18M If your up at late at night and lookin for someone to talk to, I’m your guy.",5,MakeNewFriendsHere,1570513936.0,2019-10-08 13:52:16,0
xq71k,demuxq,Longing for love,2,depression,1570470088.0,2019-10-08 01:41:28,1
xq71k,dakj7u,The Juul Shouldn’t Be Banned.,23,unpopularopinion,1569698598.0,2019-09-29 03:23:18,-1
xq71k,d95ga6,My Dreams Are Better Than My Real Life,2,Needafriend,1569427830.0,2019-09-26 00:10:30,1
xq71k,d7di4o,Despair.,1,depression,1569087162.0,2019-09-22 01:32:42,-1
xq71k,btcc3j,"After 1 suicide attempt, and one overdose, I GRADUATED!!!!",196,depression,1558900313.0,2019-05-27 03:51:53,-1
xq71k,ar4ugx,"I'm 17, and I Had My First Overdose.",62,Drugs,1550288145.0,2019-02-16 11:35:45,0
ybml6,dig37q,Tell us why you would make a terrible assassin!,30,HiTMAN,1571180477.0,2019-10-16 07:01:17,-1
ybml6,d4r5a0,What new features or actions would you like to see added in Hitman 3?,31,HiTMAN,1568584132.0,2019-09-16 05:48:52,1
ybml6,czwwz4,What kind of mission stories might a female player character have?,14,HiTMAN,1567663822.0,2019-09-05 14:10:22,0
ybml6,cyzg5i,Any good tall trees/plants to grow for shade in our climate?,10,singapore,1567481336.0,2019-09-03 11:28:56,1
ybml6,csslyd,What's the most nonsensical logic you've ever seen from a Hitman NPC?,10,HiTMAN,1566274538.0,2019-08-20 12:15:38,0
ybml6,cr38of,My Friend,0,depression,1565942246.0,2019-08-16 15:57:26,1
ybml6,cb36mj,When the government picks a hotline number that's way too close to your own.,36,IDontWorkHereLady,1562689950.0,2019-07-10 00:32:30,0
ybml6,c04tbd,LeT's Be PoSiTiVe!,15,ShitpostXIV,1560426451.0,2019-06-13 19:47:31,1
ybml6,buq56r,"We only wish depression was being ""sad"".",127,depression,1559200266.0,2019-05-30 15:11:06,-1
ybml6,btgmau,Your body is a cult in which individual cells are born solely to serve and die for the good of the collective.,3,Showerthoughts,1558924513.0,2019-05-27 10:35:13,-1
ybml6,bqukqq,What other things could 47 use to improvise a fibre wire?,10,HiTMAN,1558353221.0,2019-05-20 19:53:41,0
ybml6,blzliw,"Semi-serious: Which character is the worst-written, in your opinion?",65,ShitpostXIV,1557281431.0,2019-05-08 10:10:31,0
ybml6,blqv8g,[EU] You run a support group for ordinary people whose lives and livelihoods were destroyed in the fights of careless superheroes.,3,WritingPrompts,1557236624.0,2019-05-07 21:43:44,-1
ybml6,bj53gg,hello i am bad sprout please carry me,18,ShitpostXIV,1556640528.0,2019-05-01 00:08:48,-1
ybml6,biyz2z,#notallBLMs #BLMlivesmatter,13,ShitpostXIV,1556597208.0,2019-04-30 12:06:48,0
ybml6,bhpwow,Would a pickpocketing mechanic work in H3?,14,HiTMAN,1556304364.0,2019-04-27 02:46:04,0
ybml6,bep7ox,PSA: Concerning Certain Gameplay Mechanics in Hitman 2,27,HiTMAN,1555613355.0,2019-04-19 02:49:15,1
ybml6,be77b3,SCH help please,13,ShitpostXIV,1555504169.0,2019-04-17 20:29:29,1
ybml6,bdaoye,What's the dumbest way your run has spiralled out of control?,33,HiTMAN,1555294296.0,2019-04-15 10:11:36,-1
ybml6,bcfnyi,UwU this game is soooo gud,9,ShitpostXIV,1555087012.0,2019-04-13 00:36:52,0
ybml6,bbleyc,You know you've been playing too much Hitman when...,35,HiTMAN,1554899257.0,2019-04-10 20:27:37,1
ybml6,a3v98e,"Help, first-time tank here",2,ShitpostXIV,1544149075.0,2018-12-07 10:17:55,1
ybml6,9tujxa,Why do some people obsess over having children so much?,0,AskReddit,1541255655.0,2018-11-03 22:34:15,-1
ybml6,9s4fon,What should a BRD be doing in Suzaku EX?,31,ffxiv,1540744035.0,2018-10-29 00:27:15,0
ybml6,9qiv3z,"What are some ""loans"" you've never gotten back?",39,ffxiv,1540248053.0,2018-10-23 06:40:53,0
2698llcj,dng8ik,Yung isang psych kanina sabi wala daw akong depression,19,MentalHealthPH,1572107851.0,2019-10-27 00:37:31,-1
2698llcj,dmfprl,I was hanging out with an old smoking buddy and I didn't light up one cigarette.,17,stopsmoking,1571920233.0,2019-10-24 20:30:33,0
2698llcj,dgdnax,What pisses me off is that some people think that I am not depressed just because I can do tasks everyday.,4,depression,1570792421.0,2019-10-11 19:13:41,0
2698llcj,df8jum,I cried at the beach,1,depression,1570578285.0,2019-10-09 07:44:45,-1
2698llcj,dceh2h,I drown my sadness with food and sleeping.,0,depression,1570041883.0,2019-10-03 02:44:43,-1
2698llcj,daepr8,what should i do if someone is standing outside my house every night and that person is someone I don't know,3,NoStupidQuestions,1569669426.0,2019-09-28 19:17:06,0
2698llcj,d7ese9,I wanna commit suicide but imagining my son being miserable after I die really breaks my heart.,0,depression,1569093074.0,2019-09-22 03:11:14,-1
2698llcj,cxgy2u,"Even with antidepressants, I'm still sad as fuck",1,depression,1567171767.0,2019-08-30 21:29:27,-1
2698llcj,cvmbzg,Don't you just want to sleep and sleep and sleep?,254,depression,1566816093.0,2019-08-26 18:41:33,0
2698llcj,cv51bm,Can you guys please motivate me not to light up a cigarette?,3,stopsmoking,1566713757.0,2019-08-25 14:15:57,1
2698llcj,cr7zj6,Trailer parks in the Philippines?,5,CasualPH,1565969527.0,2019-08-16 23:32:07,0
2698llcj,c60jih,Wala akong trabaho,2,AlasFeels,1561606858.0,2019-06-27 11:40:58,0
2698llcj,c3cr18,Sunog in the middle of the night.,8,Philippines,1561134303.0,2019-06-22 00:25:03,0
2698llcj,bxcgmd,How to get from SM Bicutan to National Center for Mental Health,1,HowToGetTherePH,1559795492.0,2019-06-06 12:31:32,0
2698llcj,bpz0p8,From SM Bicutan going to EURM?,1,HowToGetTherePH,1558140019.0,2019-05-18 08:40:19,0
2698llcj,b5xwog,"Hey guys, I'm not feeling well",2,MentalHealthPH,1553648109.0,2019-03-27 08:55:09,-1
