author_id,sub_id,submission,comments,subreddit,created,timestamp,risk
gjx0j,dbp0dr,Have you ever felt uncomfortable talking with people you’re normally friends with because of your intrusive thoughts surrounding you being a danger to them?,0,OCD,1569909819.0,2019-10-01 14:03:39,-1
gjx0j,db6qd6,"Finally, some accurate sims social media content",6,thesims,1569819711.0,2019-09-30 13:01:51,0
gjx0j,dazd0u,Anyone else deal with anhedonia (deficits in hedonic function)?,6,depression,1569783018.0,2019-09-30 02:50:18,0
gjx0j,daiwrn,"Are you ever self aware of how ridiculous your logic is, but your feelings don’t change? Had a mental breakdown last night (Mix vent/DAE)",6,BPD,1569691265.0,2019-09-29 01:21:05,0
gjx0j,d74la8,I’m feeling discouraged from seeking help for BPD because of stigma negatively impacting how doctors see me,2,BPD,1569031459.0,2019-09-21 10:04:19,0
gjx0j,d68u9t,This end cap from GTW makes a great fake doorknob when you size it down. I love discovering stuff like this!,4,thesims,1568866517.0,2019-09-19 12:15:17,1
gjx0j,d3jjiw,[Help] My dog is scared of stairs,1,dogs,1568346671.0,2019-09-13 11:51:11,-1
gjx0j,d0rba1,I know the “look at my cute sim” posts get annoying but oh my god I have to share my cute sim because she’s incredible,4,thesims,1567828723.0,2019-09-07 11:58:43,1
gjx0j,cvqhke,[Fluff] My dog is the reason I get up in the morning,109,dogs,1566837413.0,2019-08-27 00:36:53,0
gjx0j,cpznt8,"Leaked Draft of Trump Executive Order to 'Censor the Internet' Denounced as Dangerous, Unconstitutional Edict",9,technology,1565731379.0,2019-08-14 05:22:59,-1
gjx0j,co4ktx,"My stepdad, a right-wing libertarian, liked Yang the most in debates even with UBI",5,YangForPresidentHQ,1565367376.0,2019-08-10 00:16:16,1
gjx0j,cef9gf,Glitch I noticed that gives you infinite fame,0,thesims,1563381363.0,2019-07-18 00:36:03,1
gjx0j,ce78y0,My dog managed to acquire the human fitness skill...pretty sure he won't find the workout equipment useful,5,thesims,1563333077.0,2019-07-17 11:11:17,1
gjx0j,c9wp01,Remember the pic of Jeff Bezos and Joseph Stalin fighting I posted? This is them now. Feel old yet?,10,thesims,1562436800.0,2019-07-07 02:13:20,-1
gjx0j,c9mmsr,"No harm, just my political views!",16,dogelore,1562368627.0,2019-07-06 07:17:07,-1
gjx0j,c2q334,[Discussion] I’m getting puppy mill ads under YouTube videos relating to HELPING harmed dogs. Anyone else come across these ads?,3,dogs,1560996519.0,2019-06-20 10:08:39,0
gjx0j,c0exmz,"In 2020, Bernie Sanders will stop supporting democratic socialism, and support an ideology every American would love, democratic _______.",21,AskOuija,1560480730.0,2019-06-14 10:52:10,1
gjx0j,c0bgtb,I’m having fun making political figures and businessmen fight in alternative history scenarios,32,thesims,1560460289.0,2019-06-14 05:11:29,0
gjx0j,bzequr,People don’t realize it’s so easy for US to be the ones to be manipulated and abused in relationships,98,BPD,1560271091.0,2019-06-12 00:38:11,-1
gjx0j,bxtte1,"It’s your host, killer ______!",10,AskOuija,1559909147.0,2019-06-07 20:05:47,-1
gjx0j,bs442u,[Help] My puppy is afraid of metal,3,dogs,1558624196.0,2019-05-23 23:09:56,0
gjx0j,brgdoy,Has anyone else dealt with an abuser that wanted you to act much younger than you are?,6,CPTSD,1558475169.0,2019-05-22 05:46:09,-1
gjx0j,bq9l5j,I don’t know how to feel about the fact that I died laughing at this stupid tweet,0,comedyheaven,1558217829.0,2019-05-19 06:17:09,-1
gjx0j,bp1h6a,FP is now a relationship with someone,1,BPD,1557944488.0,2019-05-16 02:21:28,0
gjx0j,bnunnk,"Thought I was getting better and didn’t need treatment because I had a good day, now I’m probably going back to the hospital",0,BPD,1557697771.0,2019-05-13 05:49:31,1
gjx0j,bmpcu7,Feel like doctors are lying to me,7,schizoaffective,1557436269.0,2019-05-10 05:11:09,-1
gjx0j,blls7x,Getting a very stubborn and mischievous puppy to come when called?,2,puppy101,1557199671.0,2019-05-07 11:27:51,-1
gjx0j,blglm8,I get an urge to self harm when people don’t take my emotions seriously,4,BPD,1557171459.0,2019-05-07 03:37:39,-1
gjx0j,bktcxk,Do you ever get so empty you’re excited when you finally start crying because at least you’re feeling an emotion?,114,depression,1557027176.0,2019-05-05 11:32:56,-1
gjx0j,bk9w1v,Anyone else find themselves trying to get into risky relationships after the abuse just to validate yourself and prove you can be loved ?,3,CPTSD,1556898030.0,2019-05-03 23:40:30,0
gjx0j,bk9omy,What’s the most dramatic or ridiculous thing you’ve done out of jealousy and avoiding abandonment?,26,BPD,1556896926.0,2019-05-03 23:22:06,-1
gjx0j,bj9xh3,DAE feel the need to change your appearance when the person you like shows interest in people with a certain style?,1,BPD,1556664884.0,2019-05-01 06:54:44,1
gjx0j,bisiar,"just found out british people totally ripped off fortnite to make their own word, “fortnight”...and they say gamers aren’t oppressed 🤨",1,GamersRiseUp,1556560506.0,2019-04-30 01:55:06,-1
gjx0j,bir6in,Keeping my leonberger pup cool in the summer?,5,puppy101,1556553739.0,2019-04-30 00:02:19,1
gjx0j,bifd8e,"I can’t imagine living with anyone other than my FP in the future, and it stresses me out because there’s no guarantee it will happen.",0,BPD,1556481820.0,2019-04-29 04:03:40,-1
gjx0j,bhvnr1,"My fear of abandonment has gotten so bad I stopped contacting all my friends, because then I’d be the one leaving them. Now I’m so lonely and want them back. Anyone else ever go through this?",8,BPD,1556340374.0,2019-04-27 12:46:14,-1
gjx0j,bh4nyx,"I experience a low amount of empathy due to mental illness. Does it effect me in some way to watch excessively violent or disturbing videos, even though I have no emotional reaction?",4,morbidquestions,1556168025.0,2019-04-25 12:53:45,-1
zo73woe,dl0db9,Has downtime started?,5,mkxmobile,1571663622.0,2019-10-21 21:13:42,0
zo73woe,d70es9,I believe I’m doing this right?,2,Assistance,1569010192.0,2019-09-21 04:09:52,0
zo73woe,cyrxu2,Questions about Faction Wars characters.,8,mkxmobile,1567444757.0,2019-09-03 01:19:17,-1
zo73woe,cx1p8j,Power generation cards?,2,mkxmobile,1567089069.0,2019-08-29 22:31:09,0
zo73woe,cd5ocg,Birthday,5,dxm,1563125409.0,2019-07-15 01:30:09,0
zo73woe,cd4q5r,It’s my birthday and all I want is my mom back.,3,ChildrenofDeadParents,1563120602.0,2019-07-15 00:10:02,0
zo73woe,c7ctrl,This shits almost unbearable.,4,ChildrenofDeadParents,1561897699.0,2019-06-30 20:28:19,-1
zo73woe,bvwzko,Moms funeral today.,9,ChildrenofDeadParents,1559479566.0,2019-06-02 20:46:06,-1
zo73woe,bue9q3,Mom died last night going to be needing all your love and support.,235,depression,1559134201.0,2019-05-29 20:50:01,1
zo73woe,blr89t,Do speed elixers eliminate reptile eyes from rewards?,4,mkxmobile,1557238619.0,2019-05-07 22:16:59,1
zo73woe,avf80f,Guesses on when update goes live?,5,mkxmobile,1551284415.0,2019-02-28 00:20:15,0
zo73woe,apa138,Variety or power?,8,mkxmobile,1549842279.0,2019-02-11 07:44:39,0
zo73woe,anim1g,Most powerful diamond card?,5,mkxmobile,1549400262.0,2019-02-06 04:57:42,1
4f6qpmz4,dldjyt,So tired of being alone all the time....,0,depression,1571723753.0,2019-10-22 13:55:53,-1
4f6qpmz4,dfuslt,"Im very depressed these days,my parents.. instead of asking me whats wrong and trying to make me feel better,they threaten me with taking my phone and grounding me if i dont stop being depressed,like why??",1,depression,1570694698.0,2019-10-10 16:04:58,-1
4f6qpmz4,dfhddf,I have reached a very bad level in depression that i think about suicide around 8 times a day,4,depression,1570629274.0,2019-10-09 21:54:34,-1
4f6qpmz4,dfaxpt,"I had a dream that something came out of me and i no longer had depression and i was no longer sad,and i was breathing heavily and that it came out,unfortunetly it was just a dream",3,depression,1570589632.0,2019-10-09 10:53:52,-1
4f6qpmz4,dea3ej,"Anybody else sick of the ""i feel the same"" you get everytime you try to discuss your depression and suicidal thoughts with someone?",13,SuicideWatch,1570399057.0,2019-10-07 05:57:37,-1
4f6qpmz4,de9tqy,"Anybody else sick of the ""i feel the same"" you get everytime you try to discuss your depression with someone?",115,depression,1570397867.0,2019-10-07 05:37:47,-1
4f6qpmz4,db0bhz,"I hope being dead is like sleeping,because im tired,i really am,i just want to sleep forever and never wake up again",189,depression,1569787138.0,2019-09-30 03:58:58,0
4f6qpmz4,db09hp,"As much as i hate depression,but i really like the feeling that you arent afraid of anything because everything is already f***ed up and you dont care anyway",0,depression,1569786891.0,2019-09-30 03:54:51,-1
4f6qpmz4,d939vv,I need someone who supports me in real life... I cant manage life on my own anymore,14,depression,1569418024.0,2019-09-25 21:27:04,1
37pps7un,bp83bc,Attempted suicide 2 weeks ago. Now I’m glad it didn’t work.,9,depression,1557979824.0,2019-05-16 12:10:24,-1
37pps7un,bj8r6y,17F. My friends won’t tell me the truth so I need reddit for that :),2,amiugly,1556658907.0,2019-05-01 05:15:07,1
37pps7un,bh71ld,"Do you ever doubt the validity of your depression? And just think that the reason you can’t do normal things, is just because you’re a bad person?",178,depression,1556188480.0,2019-04-25 18:34:40,-1
zxkm9,d39ghz,"Anybody feel like you died long ago, and you're just a zombified shell?",233,depression,1568301737.0,2019-09-12 23:22:17,-1
zxkm9,crulau,unpopular onion: DAE orange man bad? AITA?,0,circlejerk,1566089563.0,2019-08-18 08:52:43,-1
zxkm9,a0a3kr,every suicide raises the rate by 0.0000000133,2,teenagersnew,1543165259.0,2018-11-26 01:00:59,-1
zxkm9,9wn49x,this percentage is the chance of there existing alien lizards in our local galaxy cluster,0,teenagersnew,1542095853.0,2018-11-13 15:57:33,1
zxkm9,9wgkve,ITT make up a god and backstory for some unexplained thing,2,teenagersnew,1542047356.0,2018-11-13 02:29:16,1
zxkm9,9mltqf,I just made coffee so bad that I spit it out of my nose while drinking it,5,cafe,1539056459.0,2018-10-09 11:40:59,-1
zxkm9,9khnz8,Genius Idea:,0,Wallops_irl,1538410071.0,2018-10-02 00:07:51,0
zxkm9,8z8s6o,holy shit,1,teenagersnew,1531724480.0,2018-07-16 15:01:20,-1
zxkm9,8z8qnd,to all the people who post spooky pictures late at night,1,teenagersnew,1531723964.0,2018-07-16 14:52:44,0
zxkm9,8yrb9r,goodnight,1,teenagersnew,1531549501.0,2018-07-14 14:25:01,0
a3xsj,c4n0bm,Anyone ever create a fake persona/life when meeting people while solo travelling?,19,solotravel,1561379794.0,2019-06-24 20:36:34,-1
a3xsj,bxrb9q,Took this photo of Nyhavn last night. Copenhagen is a beautiful city,50,travel,1559889500.0,2019-06-07 14:38:20,1
a3xsj,baz8j2,Getting a Spanish student visa,6,travel,1554757956.0,2019-04-09 05:12:36,0
a3xsj,b3r3kq,"Reddit, what would you think of a new legislation that allows people under a certain age (early 20s) to not have to pay taxes, allowing them to save as much as possible in the very beginning of their work lives?",17,AskReddit,1553178082.0,2019-03-21 22:21:22,1
a3xsj,b3pipn,"Fuck this shit dude, how in the hell is anyone supposed to keep up with scjool, work, social life, healthy eating + exercise, and hobbies?",190,depression,1553168565.0,2019-03-21 19:42:45,-1
a3xsj,ajt1ms,The cozy chair in the sunlight my dog sleeps in every day,0,CozyPlaces,1548446972.0,2019-01-26 04:09:32,0
a3xsj,aj13zb,What are some little things in life worth living for?,31,AskReddit,1548259169.0,2019-01-23 23:59:29,1
a3xsj,ahzgb3,I am going to be in Sweden for 2 months next summer. What weekend trips should I make?,8,travel,1548003146.0,2019-01-21 00:52:26,0
a3xsj,ablyem,Who would be on your kill-list if the purge was real?,16,AskReddit,1546376530.0,2019-01-02 05:02:10,0
a3xsj,8yo6g3,"With Ronaldo gone, and Bale/Benzema/Kovacic unsure of their future, lets remember some things",13,realmadrid,1531519008.0,2018-07-14 05:56:48,-1
a3xsj,8sc7r9,Real Madrid sign Andriy Lunin - who is this kid?,14,realmadrid,1529440319.0,2018-06-20 04:31:59,0
a3xsj,8md4pn,R/soccer is an absolute SHITSHOW right now,11,realmadrid,1527369200.0,2018-05-27 05:13:20,0
a3xsj,8jfjde,How come animals like lions and other carnivores can eat raw meat but we can't?,13,NoStupidQuestions,1526329375.0,2018-05-15 04:22:55,0
a3xsj,86y7m4,"Probably my 10th read through, but Rowling planning ahead always blows my mind. Just noticed this detail from sorcerers stone.",19,harrypotter,1521947495.0,2018-03-25 11:11:35,0
a3xsj,7t3m1e,"During times like this, let's remember one of the best nights of our lives, and one I will never forget :)",17,realmadrid,1516961077.0,2018-01-26 18:04:37,1
a3xsj,7t3jg7,What's your longest snipe??!!,25,FortNiteBR,1516959963.0,2018-01-26 17:46:03,0
a3xsj,7rs84l,"Gay parents of Reddit, how did you tell your kids that you were gay?",13,AskReddit,1516474130.0,2018-01-21 02:48:50,0
a3xsj,7mpjo0,[SPOILERS] What was your least favorite line in TLJ?,15,StarWars,1514496271.0,2017-12-29 05:24:31,-1
a3xsj,7h482l,Cringe in my math class,7,cringe,1512238687.0,2017-12-03 02:18:07,0
a3xsj,7b8w2d,Advice for longshot medals?,3,WWII,1510008834.0,2017-11-07 06:53:54,0
a3xsj,70saql,"What movie changed your mind about an actor/actress? Either ruined their image for you, or made you flip on one you previously disliked",0,movies,1505703867.0,2017-09-18 11:04:27,-1
a3xsj,70b7md,"A genie grants you 3 wishes, and you can't abuse them in any way to get more wishes. What do you wish for?",25,AskReddit,1505495261.0,2017-09-16 01:07:41,1
a3xsj,6rzvbj,My old doggo was crazy last night for no reason! He was running around and playing with toys like a puppy when he usually just lays around. Anyone else's pets have days like that?,7,aww,1502042756.0,2017-08-07 02:05:56,1
a3xsj,6m9jpe,"Not only does this cute broke girl talk to herself out loud, this stranger agrees with her!",2,thatHappened,1499630005.0,2017-07-10 03:53:25,1
a3xsj,6lo972,What's the most fucked up liveleak video?,47,AskReddit,1499370149.0,2017-07-07 03:42:29,-1
214meu31,dnfjx5,"An upcoming visit, and I'm already feeling sick about it. Hoping to find some support here.",6,EstrangedAdultChild,1572104865.0,2019-10-26 23:47:45,1
214meu31,dn9ia9,That constant feeling of uselessness and self-disgust,0,depression,1572066676.0,2019-10-26 13:11:16,-1
214meu31,dai9bw,"Which is worse, killing myself and leaving behind others to feel pain, or not killing myself and others feeling endlessly obligated to support me, convince me I'm not a bad person, listen to my bullshit, etc. etc. etc.?",7,SuicideWatch,1569688340.0,2019-09-29 00:32:20,-1
214meu31,d93kw4,Anyone here middle-aged?,11,depression,1569419511.0,2019-09-25 21:51:51,0
214meu31,coxt84,"I'm starting to see AvPD as a symptom rather than ""the problem"". For me, it's a consequence related to being incredibly sensitive and hypervigilant, which are probably symptoms of underlying depression + anxiety.",5,AvPD,1565536030.0,2019-08-11 23:07:10,-1
214meu31,ck913s,"The reality of depression: Yesterday I was googling ""most effective suicide methods"". Today I feel fine.",232,depression,1564582344.0,2019-07-31 22:12:24,-1
214meu31,cgu4ev,No longer driven by money or sex. Now what.,118,RedditForGrownups,1563896042.0,2019-07-23 23:34:02,-1
214meu31,cfzvmp,"Shame on stupid parents for letting their kids walk and sit on restaurant tables. Seriously, screw you.",23,childfree,1563721163.0,2019-07-21 22:59:23,-1
214meu31,cefv7c,"I absolutely hate when I find out that a musician, actor, comedian, author, etc. I once respected has kids.",22,antinatalism,1563384088.0,2019-07-18 01:21:28,0
214meu31,cc93uz,Is there ANYTHING we can do to combat the all the destruction?,13,antinatalism,1562927164.0,2019-07-12 18:26:04,-1
214meu31,cbnlt2,Every time I see a new housing development or skyscraper my heart breaks all over again.,23,antinatalism,1562798450.0,2019-07-11 06:40:50,0
214meu31,c8a5yb,Learned something infuriating about my oldest friend,18,antinatalism,1562079158.0,2019-07-02 22:52:38,0
214meu31,c4wnie,"There's something inherently unlikable about me. I don't know exactly what it is, but I can tell it's there by the way others respond to me.",17,AvPD,1561413608.0,2019-06-25 06:00:08,0
214meu31,c3f1vh,My experience at the park today,12,antinatalism,1561144629.0,2019-06-22 03:17:09,0
214meu31,brs34c,What's the point of surviving if I'm still just as depressed and unmotivated as ever?,13,depression,1558548636.0,2019-05-23 02:10:36,-1
214meu31,brs0sk,"I've never cultivated any relationships because I didn't enjoy spending time with other people, but now...",20,AvPD,1558548305.0,2019-05-23 02:05:05,-1
214meu31,bn48bo,Couldn't do it anymore - back in contact,18,EstrangedAdultChild,1557524561.0,2019-05-11 05:42:41,0
214meu31,bhiflu,The letter I will never send to them.,1,EstrangedAdultChild,1556254533.0,2019-04-26 12:55:33,0
214meu31,bhi85g,I guess I still love them. I'm very conflicted.,4,EstrangedAdultChild,1556252976.0,2019-04-26 12:29:36,1
214meu31,bfk5ir,"Anyone else have that ""My soul is a toxic wasteland"" feeling?",9,depression,1555813626.0,2019-04-21 10:27:06,0
214meu31,bf8a05,I'm so tired of beating myself up for being who I am.,8,EstrangedAdultChild,1555733157.0,2019-04-20 12:05:57,-1
214meu31,be4q6y,I just don't understand people. At all.,5,AvPD,1555483933.0,2019-04-17 14:52:13,0
214meu31,bbxf20,IBS and depression anyone?,9,ibs,1554971438.0,2019-04-11 16:30:38,-1
214meu31,bac6za,"Begrudgingly entering the next phase of my life: ""Post-family""",6,EstrangedAdultChild,1554606594.0,2019-04-07 11:09:54,0
214meu31,b6utay,"I hate the word ""avoidant"" and I REALLY hate the concept of ""personality disorder"" but . . .",10,AvPD,1553849270.0,2019-03-29 16:47:50,-1
214meu31,b6u0mx,Anyone else become completely self-absorbed and self-centered when depressed?,14,depression,1553842298.0,2019-03-29 14:51:38,-1
214meu31,b6rx5u,A typical day when I'm depressed,3,depression,1553826906.0,2019-03-29 10:35:06,-1
214meu31,b6f9i2,"The pain comes and goes in waves, but it's always sort of just there.",3,EstrangedAdultChild,1553753762.0,2019-03-28 14:16:02,-1
214meu31,b5li2u,One of the few people in the world I could relate to and who could relate to me died. I'll miss him so much.,3,AvPD,1553576115.0,2019-03-26 12:55:15,-1
214meu31,b408j5,Anatomy of an estrangement,2,EstrangedAdultChild,1553226249.0,2019-03-22 11:44:09,0
214meu31,b3n18d,So depressed it takes effort to breathe today. I hate days like this.,12,depression_help,1553148369.0,2019-03-21 14:06:09,-1
214meu31,b22s1r,"[Serious] Children (young and old) who don't feel comfortable with their parents, and/or parents who don't feel comfortable with their children, why is that?",9,AskReddit,1552807661.0,2019-03-17 15:27:41,-1
214meu31,b1p9pl,I acknowledge that I can be difficult to deal with. So now the question is: how do I get past feeling guilty for my part of the estrangements?,14,EstrangedAdultChild,1552716190.0,2019-03-16 14:03:10,-1
214meu31,b0dwzl,Starting to get glimpses of forgiveness... a term I used to hate,9,EstrangedAdultChild,1552428943.0,2019-03-13 06:15:43,-1
214meu31,az131n,I realized something important today: my only focus needs to be feeling comfortable in my own skin.,7,EstrangedAdultChild,1552117328.0,2019-03-09 15:42:08,1
214meu31,ayncn3,The hell of rumination,4,OCD,1552028563.0,2019-03-08 15:02:43,-1
214meu31,ay7sr5,"""Acknowledge the pain, and move forward"". Except that I can't. (rant)",6,EstrangedAdultChild,1551928078.0,2019-03-07 11:07:58,-1
214meu31,axfcfz,I wish we could all start a big new family with each other to fill in the missing pieces of each of our lives.,5,EstrangedAdultChild,1551749901.0,2019-03-05 09:38:21,0
214meu31,au5dxl,I hate that in order to better care for myself I had to hurt other people by creating distance.,5,EstrangedAdultChild,1550990628.0,2019-02-24 14:43:48,0
214meu31,atdnsd,I don't really enjoy spending time with most people - but I do feel lonely and empty. I've never understood this about myself.,20,AvPD,1550813668.0,2019-02-22 13:34:28,-1
214meu31,aslmhn,Why is it as painful to have them out of my life as it was when they were in it? Sometimes even worse actually...,6,EstrangedAdultChild,1550648925.0,2019-02-20 15:48:45,-1
214meu31,arjh0o,"Chills, a feeling of dread, and intense depression after",4,ibs,1550399907.0,2019-02-17 18:38:27,-1
214meu31,appjgb,Sometimes I'm so angry. Sometimes relieved. But the worst is feeling sad.,14,EstrangedAdultChild,1549946972.0,2019-02-12 12:49:32,-1
214meu31,ammrcc,There's so few new posts here that I feel even more alone about my estrangement.,14,EstrangedAdultChild,1549171942.0,2019-02-03 13:32:22,-1
214meu31,ag292c,I didn't want it to be this way,2,EstrangedAdultChild,1547510716.0,2019-01-15 08:05:16,0
214meu31,afuxyw,Reminders of why I don't keep in touch with you anymore,0,offmychest,1547465353.0,2019-01-14 19:29:13,0
214meu31,afsy56,One of those days where I'm so tired of ruminating and all the pain that I'm tempted to contact them - I need some support,9,EstrangedAdultChild,1547446793.0,2019-01-14 14:19:53,-1
214meu31,aegu9h,"I'm thinking of looking for a ""replacement wife"" for my husband. I'm ready to check out, but I don't want to leave him without a future.",8,offmychest,1547105901.0,2019-01-10 15:38:21,0
214meu31,abqp3w,I could use some feedback please...,5,EstrangedAdultChild,1546410015.0,2019-01-02 14:20:15,0
214meu31,ab0sp8,"Another round of ""OMG, what if they're right and it's ME who's the problem?!?!""",20,EstrangedAdultChild,1546210278.0,2018-12-31 06:51:18,0
214meu31,aavvwn,"After years of turmoil, and stretching out of my comfort zone to ""make things work"", and realizing it can NEVER work, I'm now shooting for acceptance...",7,EstrangedAdultChild,1546176673.0,2018-12-30 21:31:13,0
214meu31,9zbxym,My brain is broken.,1,SuicideWatch,1542871302.0,2018-11-22 15:21:42,-1
214meu31,9ucakr,"Lately life just feels like a series of physical and emotional pain. If I don't adapt and adjust, I'm in big trouble.",0,offmychest,1541412075.0,2018-11-05 18:01:15,-1
214meu31,9rk2hb,"Of the thousands of people I've met, worked with, lived near, been related to, etc. during my lifetime I can count actual friends on one hand.",2,AvPD,1540554978.0,2018-10-26 19:56:18,1
214meu31,9rk269,I'm simultaneously afraid of so many things and thinking about killing myself. It doesn't make sense.,4,Anxiety,1540554899.0,2018-10-26 19:54:59,-1
214meu31,9qos8s,I've been almost completely estranged from my siblings for a few years now because I thought my life would be better without them. Now I'm doubting myself again.,7,offmychest,1540300010.0,2018-10-23 21:06:50,0
214meu31,9qoqo6,"Am virtually estranged from toxic siblings for a few years now, but my heart still hurts.",2,AvPD,1540299696.0,2018-10-23 21:01:36,-1
214meu31,9qoi30,"[Serious] Redditors with depression and anxiety, what helps you the most?",154,AskReddit,1540297850.0,2018-10-23 20:30:50,-1
214meu31,9qckkn,When I'm sick I get depressed. When I'm tired I get depressed. When there's a problem at work or with a relationship I get depressed.,4,depression,1540204390.0,2018-10-22 18:33:10,-1
214meu31,9q5gvs,Got that punched-in-the-gut feeling again. Not looking forward to tomorrow.,11,ibs,1540143751.0,2018-10-22 01:42:31,0
214meu31,9obkji,"It always starts off OK. Getting to know each other, interested in who the other person is . . .",16,AvPD,1539600332.0,2018-10-15 18:45:32,1
214meu31,9nj5bm,"My pain tells me it's CPTSD, but my brain is telling me I'm just overreacting.",11,CPTSD,1539340600.0,2018-10-12 18:36:40,-1
214meu31,9n9amf,"I hate that a flare up can change me from a strong, healthy person into a paranoid, quivering mess.",14,ibs,1539258991.0,2018-10-11 19:56:31,-1
214meu31,9n98yl,Where in your body do you feel your anxiety the most?,11,Anxiety,1539258563.0,2018-10-11 19:49:23,0
214meu31,9n98jt,At this point I no longer believe I can change. Avoiding pain/people is now who I am.,23,AvPD,1539258452.0,2018-10-11 19:47:32,-1
214meu31,9mofbe,Most of the time avoiding suits me well. Until the loneliness sets in again.,10,AvPD,1539085511.0,2018-10-09 19:45:11,-1
214meu31,9m5l65,"I usually get very depressed at the same time my system is messed up. I don't know which comes first, the diarrhea or the depression/anxiety.",17,ibs,1538923899.0,2018-10-07 22:51:39,-1
214meu31,9gjix0,"Do you ever find yourself talking out loud to yourself while you're flinching, thinking about something shameful from your past?",7,Anxiety,1537184076.0,2018-09-17 19:34:36,-1
214meu31,9f50mo,Anyone else here do just fine with small talk or even making a room full of people laugh... but unable to maintain a relationship?,29,AvPD,1536730455.0,2018-09-12 13:34:15,0
214meu31,9cdtbp,I have no intention of getting old.,2,offmychest,1535909180.0,2018-09-03 01:26:20,-1
214meu31,9bscgw,Every time I have diarrhea it's followed by a major bout of depression.,4,ibs,1535710064.0,2018-08-31 18:07:44,-1
214meu31,9bj19r,Do you ever feel like depressed-you is a completely different person than okay-you?,14,depression,1535630778.0,2018-08-30 20:06:18,1
214meu31,9bgp9w,A woman was passed out on the sidewalk yesterday after OD'ing on something. I checked her pulse and stayed with her until police arrived. Then I cried like a baby.,10,offmychest,1535605019.0,2018-08-30 12:56:59,0
214meu31,99ljfg,"I think I might have AvPD. Reading the ""symptoms"" list I've checked off each one. Holy shit. Now what do I do?",9,AvPD,1535011951.0,2018-08-23 16:12:31,-1
214meu31,99dao7,I no longer have a family,8,offmychest,1534944198.0,2018-08-22 21:23:18,-1
214meu31,99bzqm,What techniques do you use to stop the endless droning of negative thoughts?,18,Anxiety,1534931510.0,2018-08-22 17:51:50,-1
sxayj,dbyrgc,I want to completely change who I am into a better and more confident person. I need help from the people who have done this.,0,GetMotivated,1569959555.0,2019-10-02 03:52:35,1
sxayj,d9bhb5,Letting my laundry build up until it begins to reek.,1,depression,1569454941.0,2019-09-26 07:42:21,-1
