author_id,sub_id,submission,comments,subreddit,created,timestamp,risk
2iu718zl,dnnbof,I feel like my depression and anxiety has prevented me from reaching my true potential,24,depression,1572142152.0,2019-10-27 10:09:12,1
2iu718zl,dmu4zq,"I often create ""fake memories"" in my head to help cope with the fact that I lead a very boring life",1,depression,1571989913.0,2019-10-25 15:51:53,-1
2iu718zl,dmsbk4,Don't wanna die but I don't wanna live either,1,depression,1571978070.0,2019-10-25 12:34:30,1
2iu718zl,dldr00,I wish I could go back in time and redo my life,2,depression,1571724951.0,2019-10-22 14:15:51,1
2iu718zl,dflwkj,A lot of my time is spent thinking about what I should have done,2,depression,1570648746.0,2019-10-10 03:19:06,0
2iu718zl,dfa45f,I can't think of anything positive to say about myself,1,depression,1570585483.0,2019-10-09 09:44:43,1
2iu718zl,d0q6tb,What can I do with a bachelors in economics?,5,jobs,1567822002.0,2019-09-07 10:06:42,0
2iu718zl,cs55oi,I get super petty of trivial stuff and I wish harm upon people,0,depression,1566153605.0,2019-08-19 02:40:05,1
2iu718zl,crtzt7,My life is just a series of one failure after another,3,depression,1566086327.0,2019-08-18 07:58:47,-1
2iu718zl,crs2fr,Wallowing in self-hatred and self-loathing,0,depression,1566076519.0,2019-08-18 05:15:19,0
2iu718zl,cdtm3f,A guy in my one of my classes keeps calling me his best friend,4,Advice,1563260463.0,2019-07-16 15:01:03,1
2iu718zl,b9lf2b,I get super petty of stuff and wish harm upon them,1,selfimprovement,1554429466.0,2019-04-05 09:57:46,1
3vv071vd,dno34a,[O Levels] anyone needs elective geography concised notes?,113,SGExams,1572146584.0,2019-10-27 11:23:04,0
