author_id,sub_id,submission,comments,subreddit,created,timestamp,risk
15le6i,9xotks,I'm okay with the atomic shop but there's nothing good in it.,10,fo76,1542393166.0,2018-11-17 02:32:46,-1
15le6i,9wk5hx,Desktop sometimes doesn't wake from sleep,0,techsupport,1542070518.0,2018-11-13 08:55:18,0
15le6i,9m03go,[PC] lf2 nightfall,0,Fireteams,1538864127.0,2018-10-07 06:15:27,0
15le6i,9e85lh,Heroic PEs and ascendant challenges not counting towards bounty,0,DestinyTheGame,1536445938.0,2018-09-09 06:32:18,1
15le6i,8l4bhh,What's the point of a therapist if you can't tell them you're suicidal...,24,SuicideWatch,1526937061.0,2018-05-22 05:11:01,0
15le6i,8bvuvu,How the heck do I radius the fretboard?,6,Luthier,1523586569.0,2018-04-13 10:29:29,0
15le6i,7lyqa9,Transitioning from FO4 to FONV?,16,Fallout,1514164682.0,2017-12-25 09:18:02,0
15le6i,6olrxf,Professional badge help,1,comiccon,1500612562.0,2017-07-21 12:49:22,1
15le6i,66lg0k,Ending a track ride.,7,PlanetCoaster,1492730030.0,2017-04-21 07:13:50,0
15le6i,5v8hql,Keep falling through world (PC),2,ARK,1487638381.0,2017-02-21 08:53:01,0
3ce70mgz,c057mq,My ex girlfriennd was abused by her mom,2,raisedbynarcissists,1560428959.0,2019-06-13 20:29:19,-1
3ce70mgz,bffan5,My friend has killed himself,48,SuicideWatch,1555784319.0,2019-04-21 02:18:39,-1
1u7qicsh,dljy1o,Need advice on behalf of a friend,2,highschool,1571759979.0,2019-10-22 23:59:39,1
1u7qicsh,dite5b,In desperate need of degree-related A level option advice.,6,University,1571250087.0,2019-10-17 02:21:27,-1
1u7qicsh,dif0wk,Holdin in those feels,2,feemagers,1571175895.0,2019-10-16 05:44:55,0
1u7qicsh,ddrrbt,I'ma leave,4,teenagers,1570302622.0,2019-10-06 03:10:22,0
1u7qicsh,ddr3dp,Starting to hate myself,5,teenagers,1570299840.0,2019-10-06 02:24:00,-1
1u7qicsh,dc6fe8,Did y'all ever feel lonely as shit when seeing those 'I got a gf' posts?,6,teenagers,1569997789.0,2019-10-02 14:29:49,-1
1u7qicsh,d7on12,"Y'all are cute, and that's a fact.",9,feemagers,1569147752.0,2019-09-22 18:22:32,1
1u7qicsh,cy0rwb,A short story to make you cringe,0,teenagers,1567284960.0,2019-09-01 04:56:00,0
1u7qicsh,cwq4c9,"If anyone is feeling lonely or depressed, my DMs are open.",4,feemagers,1567023011.0,2019-08-29 04:10:11,-1
1u7qicsh,cskw0e,Am very confused rn,8,teenagers,1566238146.0,2019-08-20 02:09:06,-1
1u7qicsh,cs7g86,Tf am I even supposed to do now to get a girlfriend,8,teenagers,1566164029.0,2019-08-19 05:33:49,0
1u7qicsh,cs72pu,Huge anticlimax,5,teenagers,1566162263.0,2019-08-19 05:04:23,1
1u7qicsh,crb968,Closing in on a girlfriend is somehow making me feel awful,9,teenagers,1565983873.0,2019-08-17 03:31:13,-1
1u7qicsh,cqgtcw,Tonight is the most stressed and lonely I've felt in years,9,feemagers,1565820845.0,2019-08-15 06:14:05,-1
1u7qicsh,con0fe,This is how bad the mods fucked up,1,teenagers,1565468031.0,2019-08-11 04:13:51,-1
1u7qicsh,ccpmb9,I think I damaged my tailbone but idk how,6,teenagers,1563026281.0,2019-07-13 21:58:01,-1
1u7qicsh,c4bhse,We need some support over at r/Teenagers.,101,SuicideWatch,1561322605.0,2019-06-24 04:43:25,1
1u7qicsh,c45iox,"[IMPORTANT, PLEASE CLICK] Everyone on this subreddit today needs to band together to prevent suicide.",165,teenagers,1561300166.0,2019-06-23 22:29:26,-1
1u7qicsh,c2ezhk,Tips on paper,0,origami,1560937099.0,2019-06-19 17:38:19,0
1u7qicsh,be6bhj,Genuinely interested in this movement and would greatly appreciate a discussion.,28,Flat_Earth,1555498080.0,2019-04-17 18:48:00,1
1u7qicsh,ay17b7,Advice on hardware,1,musicproduction,1551892315.0,2019-03-07 01:11:55,0
1u7qicsh,ay10xy,Educake is having a bad day,1,softwaregore,1551891413.0,2019-03-07 00:56:53,-1
1u7qicsh,9mcgud,"Animals are affected by genetics in the same way we are, they suffer physical genetic mutations sometimes; so why is it that they never experience a change in sexual orientation?",1,Showerthoughts,1538979859.0,2018-10-08 14:24:19,-1
rdor3gd,ci3llu,I love you but I hate you at the same time.,2,UnsentLetters,1564151592.0,2019-07-26 22:33:12,-1
rdor3gd,chwj43,DAE feel an extremely overwhelming sense of brokenness and emptiness after a fight with your FP?,1,BPD,1564104827.0,2019-07-26 09:33:47,-1
rdor3gd,chrwot,I miss my best friend.,1,UnsentLetters,1564080984.0,2019-07-26 02:56:24,1
rdor3gd,cbklo0,You lied to me.,2,UnsentLetters,1562784078.0,2019-07-11 02:41:18,-1
rdor3gd,c5zms0,"Does anyone else just feel like disappearing socially? Nuking social media, cutting ties to your family & friends, etc?",85,SuicideWatch,1561601534.0,2019-06-27 10:12:14,1
rdor3gd,awdktn,Passively Suicidal,1,SuicideWatch,1551499007.0,2019-03-02 11:56:47,-1
rdor3gd,8ritoa,"Gloom, Despair & Agony",0,depression,1529149083.0,2018-06-16 19:38:03,-1
rdor3gd,8izszj,[PC-Windows][1995-2000s?]Monster Hunting/Catching Game,7,tipofmyjoystick,1526167467.0,2018-05-13 07:24:27,0
rdor3gd,7pa108,It hurts more than you know.,2,UnsentLetters,1515530145.0,2018-01-10 04:35:45,-1
4na7xt8e,d7zskx,My Mom showed off my suicide letter like it was a fashion statement,103,SuicideWatch,1569202730.0,2019-09-23 09:38:50,-1
2uf54mjq,dobe23,Fun Fact #4529: Did you know selfish kids don't have siblings?,4,raisedbynarcissists,1572280890.0,2019-10-29 00:41:30,0
2uf54mjq,d4whtq,Yay me!,5,selfharm,1568613059.0,2019-09-16 13:50:59,1
2uf54mjq,ciijgu,"""Depression is just stupid people's excuse to not do anything!""",3,selfharm,1564239874.0,2019-07-27 23:04:34,-1
2uf54mjq,c9ct10,A letter to a friend who'll never read it.,96,SuicideWatch,1562309359.0,2019-07-05 14:49:19,1
2uf54mjq,c1yl7m,Does my accounts notes qualify?,3,PenmanshipPorn,1560838101.0,2019-06-18 14:08:21,0
2uf54mjq,c0nev7,"Adopt Me for the Father's Day weekend, Please.",38,family,1560536341.0,2019-06-15 02:19:01,1
2uf54mjq,c0icza,Screenshotted at 9:17 (pm?). Would the phone survive the night?,0,ChargeYourPhone,1560506879.0,2019-06-14 18:07:59,0
2uf54mjq,bxv3h1,Why did you choose when I asked you to choose?,1,raisedbynarcissists,1559916824.0,2019-06-07 22:13:44,0
2uf54mjq,bt6wh0,"Doctors of Reddit, is this something I should worry about?",7,AskDocs,1558870392.0,2019-05-26 19:33:12,-1
2uf54mjq,bsh3dq,Nmom had me assaulted.,34,raisedbynarcissists,1558705403.0,2019-05-24 21:43:23,-1
49sheo3j,cuiinz,"I’m absolutely annoyed whenever I comment something suicidal and random people just tell me “call the national suicide prevention hotline” , I actually want people that I can relate my problems with, I don’t want a fucking hotline that doesn’t do shit.",90,SuicideWatch,1566587939.0,2019-08-24 03:18:59,-1
1ritlfux,cx2hsr,Staying connected/support,3,SuicideWatch,1567092783.0,2019-08-29 23:33:03,0
1ritlfux,ce0xmf,I completely shut off everyone I know for 2 years because of ANXIETY,3,Anxietyhelp,1563301552.0,2019-07-17 02:25:52,-1
1ritlfux,c684pq,"Everytime im watching tv with my mum, suicide scenes/topics would always Come up. I get extremely uncomfortable because she knows I’m suicidal. I hate watching tv NOW.",5,SuicideWatch,1561655363.0,2019-06-28 01:09:23,-1
1ritlfux,bjfu2r,The idea of an existing god yet the extreme suffering that people experience in hospitals and mental clinics and suicide rates terrifies me.,44,atheism,1556708920.0,2019-05-01 19:08:40,-1
1ritlfux,bfoyug,I get so angry when I hear about people who die in their sleep because it’s not fair and it should be me.,44,SuicideWatch,1555854459.0,2019-04-21 21:47:39,-1
1ritlfux,bevo2j,I received an acceptance letter from a good university and I started crying because I still wanted to Die,15,SuicideWatch,1555652417.0,2019-04-19 13:40:17,-1
1ritlfux,bbln9q,"“There are two kinds of pain. The sort of pain that makes you strong, or useless pain. The sort of pain that's only suffering.” Frank Underwood",3,SuicideWatch,1554900723.0,2019-04-10 20:52:03,-1
1ritlfux,b91u17,OTC anxiety meds?,2,Anxiety,1554316714.0,2019-04-04 02:38:34,0
1ritlfux,b7ezsz,"Today I couldn’t breathe at all, I’m already dead",1,SuicideWatch,1553974120.0,2019-03-31 03:28:40,-1
1ritlfux,b7d5rl,"I hate myself for thinking this way, but I wish I had an incurable disease that would give me only 6 more months to live",3,SuicideWatch,1553963757.0,2019-03-31 00:35:57,1
1ritlfux,b7cbso,I don’t think I’ll live long,12,SuicideWatch,1553958738.0,2019-03-30 23:12:18,0
1ritlfux,b5v2b9,I force myself to stay up all night so that I end up sleeping the whole day because I can’t stand living anymore,6,SuicideWatch,1553633306.0,2019-03-27 04:48:26,0
1ritlfux,b4wax6,Why is so damn hard to kill yourself when it seems so EASY in stupid movies and shows. I hate everything.,28,SuicideWatch,1553433898.0,2019-03-24 21:24:58,-1
1ritlfux,b4hq5d,I weigh 85 pounds and I’m 23,3,SuicideWatch,1553337163.0,2019-03-23 18:32:43,0
1ritlfux,b3wdze,"I was about to kill myself when someone randomly sent “ don’t kill yourself, death will come to you at the right time”",10,SuicideWatch,1553204265.0,2019-03-22 05:37:45,-1
1ritlfux,b3kqxk,Anyone extra depressed because it’s spring and then summer,4,depression,1553133522.0,2019-03-21 09:58:42,-1
1ritlfux,b1f436,I force myself to sleep for so long,8,depression,1552657356.0,2019-03-15 21:42:36,0
1ritlfux,az4uvy,My soul is dead,9,depression,1552147085.0,2019-03-09 23:58:05,-1
1ritlfux,axo0ii,My hair is so THIN,27,HaircareScience,1551808453.0,2019-03-06 01:54:13,0
1ritlfux,axn1r7,I currently hate my family,2,depression,1551803436.0,2019-03-06 00:30:36,-1
1ritlfux,as9aq4,Overdosing or cutting,5,SuicideWatch,1550574788.0,2019-02-19 19:13:08,0
1ritlfux,anqe3v,Ever love someone so much that it hurts,3,PanicAttack,1549457460.0,2019-02-06 20:51:00,1
1ritlfux,ajhn1r,Afraid,1,SuicideWatch,1548366217.0,2019-01-25 05:43:37,0
1ritlfux,ah915x,Can I please die already,2,depression,1547806118.0,2019-01-18 18:08:38,-1
1ritlfux,aej1o3,23 and might not graduate until 25,6,depression,1547126210.0,2019-01-10 21:16:50,0
1ritlfux,abr3fr,It will be okay,4,depression,1546413522.0,2019-01-02 15:18:42,1
1ritlfux,94kvhd,I live one day everyday,8,depression,1533404094.0,2018-08-05 01:34:54,0
474sq6bx,cg2rwu,What took you the fear of dying?,2,SuicideWatch,1563736343.0,2019-07-22 03:12:23,-1
474sq6bx,cfpj9u,Ive attempted suicide and my goodbye letter was shown to everyone,50,SuicideWatch,1563649616.0,2019-07-21 03:06:56,-1
3hdghkqn,b5jhfp,Just please read it would mean a lot to me. I’m so alone.,102,SuicideWatch,1553563675.0,2019-03-26 09:27:55,0
1f5lfbn9,dolyov,Would it be a bad idea to lie just to get EMDR over with?,2,EMDR,1572330411.0,2019-10-29 14:26:51,-1
1f5lfbn9,dkprqt,Should I tell a potential job that I'm interviewing at other places as well?,7,jobs,1571605162.0,2019-10-21 04:59:22,1
1f5lfbn9,dfb7yf,Will EMDR be helpful for me if I don't personally believe I've dealt with trauma before?,5,EMDR,1570591148.0,2019-10-09 11:19:08,0
1f5lfbn9,devthe,"BDD culture is thinking that if I just did my makeup like that, had those clothes, got my body down to that size, maybe i'd finally feel pretty",4,BodyDysmorphia,1570513585.0,2019-10-08 13:46:25,1
1f5lfbn9,ddcbaj,Why won't my throat stop filling up with mucus?,10,AskDocs,1570217937.0,2019-10-05 03:38:57,1
1f5lfbn9,dcyuge,If I tell my therapist about a previous suicide attempt will I be hospitalized?,2,mentalhealth,1570143987.0,2019-10-04 07:06:27,-1
1f5lfbn9,dbnfbc,Where can I get a good charcuterie board in LA?,29,AskLosAngeles,1569900741.0,2019-10-01 11:32:21,1
1f5lfbn9,d7thq6,Does anyone else purposely go to sleep early and sleep in late to avoid having to be aware of feeling this way?,91,depression,1569172906.0,2019-09-23 01:21:46,0
1f5lfbn9,d6ye52,"Women who have dealt with this, how did you overcome your infatuation with older men?",19,GenderCritical,1569001279.0,2019-09-21 01:41:19,0
1f5lfbn9,d5ammv,What will help me [21F] stop being depressed?,7,Advice,1568686796.0,2019-09-17 10:19:56,-1
1f5lfbn9,d562q8,Do you believe men are capable of love/empathy for women?,96,GenderCritical,1568665402.0,2019-09-17 04:23:22,1
1f5lfbn9,d4aijo,Does anyone else get almost manic feeling hypersexuality episodes?,15,BPD,1568492714.0,2019-09-15 04:25:14,0
1f5lfbn9,d3gcmv,What is this itchy rash i've been getting on my arms?,6,AskDocs,1568330766.0,2019-09-13 07:26:06,-1
1f5lfbn9,d0jksi,DAE ever feel like running away and starting over would solve all your problems?,9,BPD,1567790190.0,2019-09-07 01:16:30,0
1f5lfbn9,cxlgdw,Does anyone have the opposite of retroactive jealousy?,4,BPD,1567192352.0,2019-08-31 03:12:32,-1
1f5lfbn9,cvyqhz,DAE ever just wish someone would make all your decisions for you and plan out your life so you wouldn't have to?,40,BPD,1566876221.0,2019-08-27 11:23:41,1
1f5lfbn9,ctj1yy,Breaking up with someone I wasn't even dating.,0,BreakUps,1566404261.0,2019-08-22 00:17:41,0
1f5lfbn9,csb03w,Can we talk about how painful it is to watch someone get over you while you're still super attached to them?,12,BPD,1566182440.0,2019-08-19 10:40:40,1
1f5lfbn9,crbwjk,I wish I could just come to terms with feeling ugly.,15,BodyDysmorphia,1565986852.0,2019-08-17 04:20:52,0
1f5lfbn9,cqjtdx,What age did you think you would die by?,12,depression,1565835873.0,2019-08-15 10:24:33,-1
1f5lfbn9,cmymdl,"Ladies, how do you play up your charm and charisma?",15,sugarlifestyleforum,1565137517.0,2019-08-07 08:25:17,1
1f5lfbn9,ch12mg,I just want to know what it's like to be/feel pretty.,5,BodyDysmorphia,1563929071.0,2019-07-24 08:44:31,1
1f5lfbn9,cfbp9i,ABANDONMENT IS SO PAINFUL.,6,BPD,1563563134.0,2019-07-20 03:05:34,-1
1f5lfbn9,ccth3a,How have your opinions of the characters changed with rewatching?,6,PrettyLittleLiars,1563046746.0,2019-07-14 03:39:06,0
1f5lfbn9,ca19e0,I want to look unattainable.,13,BodyDysmorphia,1562462334.0,2019-07-07 09:18:54,0
1f5lfbn9,c02n9j,How painful was/is invisalign for you?,24,Invisalign,1560409766.0,2019-06-13 15:09:26,-1
1f5lfbn9,bz7ii2,Is there any situation in which EMTs or doctors or police officers would just put someone out of their misery?,8,morbidquestions,1560224345.0,2019-06-11 11:39:05,-1
1f5lfbn9,al5ll8,What was the secret to losing weight for you guys?,13,TheGirlSurvivalGuide,1548800750.0,2019-01-30 06:25:50,-1
1f5lfbn9,akhbbi,What are some songs that you can think of that were obviously written with live performances or streaming in mind?,39,popheads,1548632252.0,2019-01-28 07:37:32,0
1f5lfbn9,aftccd,Gaga's horse Arabella is reportedly dying ❤️😢,8,LadyGaga,1547450185.0,2019-01-14 15:16:25,0
1f5lfbn9,a5bfxe,Can I get a restraining order against someone scary without notifying my family?,3,Advice,1544565119.0,2018-12-12 05:51:59,-1
1f5lfbn9,9ol124,What do you think is Taylor's most underrated song from each album?,17,TaylorSwift,1539671460.0,2018-10-16 14:31:00,0
1f5lfbn9,9m1q5q,I don't mean to hate on shane so maybe he isn't a vlogger...but I don't think he's a documentarian either.,0,ShaneDawson,1538878516.0,2018-10-07 10:15:16,1
1f5lfbn9,8ykwtq,It’s beyond me that there are people who don’t think about committing suicide.,82,SuicideWatch,1531495758.0,2018-07-13 23:29:18,-1
1f5lfbn9,8x8r4z,What are some of your holy grail products for dry skin?,5,MakeupAddiction,1531115808.0,2018-07-09 13:56:48,0
1f5lfbn9,8t91i8,You know you have BPD & depression when...,26,BPD,1529748964.0,2018-06-23 18:16:04,-1
41u78p67,dc7rcn,What we can learn from Chris Chan,0,ChrisChanSonichu,1570008008.0,2019-10-02 17:20:08,0
41u78p67,dc7cd3,What you are about the watch is a nightmare ...,35,ChrisChanSonichu,1570004695.0,2019-10-02 16:24:55,0
41u78p67,db1tfo,Be yourself ...,0,SuicideWatch,1569793831.0,2019-09-30 05:50:31,0
41u78p67,d9qnje,Last Post,1,SuicideWatch,1569535015.0,2019-09-27 05:56:55,0
41u78p67,d9qmd0,Last Post,2,asktransgender,1569534878.0,2019-09-27 05:54:38,0
41u78p67,d9451l,Your experiences and expections about transition ?,8,asktransgender,1569422088.0,2019-09-25 22:34:48,0
41u78p67,d2gd21,Hi i need a vent it is all getting worse ...,16,detrans,1568156903.0,2019-09-11 07:08:23,-1
41u78p67,cvuj5t,Sometimes do you envy video game character's body ?,5,asktransgender,1566855344.0,2019-08-27 05:35:44,-1
41u78p67,cvldox,Iam a useless NPC in life,6,SkyrimMemes,1566809221.0,2019-08-26 16:47:01,-1
41u78p67,cvlaht,Do you feel like a useless NPC ?,92,SuicideWatch,1566808555.0,2019-08-26 16:35:55,0
41u78p67,cvfduy,You are not alone ...,0,depression,1566772669.0,2019-08-26 06:37:49,0
41u78p67,cuk5ko,I need a long life time break from the life ...,2,SuicideWatch,1566595397.0,2019-08-24 05:23:17,0
41u78p67,cuiy1r,"""We fight together or we die alone. "" Kuai Liang",16,MortalKombat,1566589882.0,2019-08-24 03:51:22,-1
41u78p67,cu4spx,I got some questions,5,asktransgender,1566513020.0,2019-08-23 06:30:20,0
41u78p67,cu24me,My thoughts about videogames,12,StopGaming,1566501268.0,2019-08-23 03:14:28,0
41u78p67,ctxnvj,İam an alien,0,depression,1566481541.0,2019-08-22 21:45:41,0
41u78p67,cih5ue,MTF vs Replica Forces who would win?,2,SCP,1564232065.0,2019-07-27 20:54:25,1
41u78p67,c7icjh,To all fellow fathers and mothers in here ...,1,raisedbynarcissists,1561922315.0,2019-07-01 03:18:35,0
41u78p67,c7i1qh,It hurts so much ...,3,depression,1561920737.0,2019-07-01 02:52:17,-1
41u78p67,c7hxko,I cannot take it anymore it hurts so much ...,4,SuicideWatch,1561920123.0,2019-07-01 02:42:03,-1
eb3fncz,bjzs6w,"Just graduated from college today, planning on taking my life tonight.",145,SuicideWatch,1556829288.0,2019-05-03 04:34:48,0
2ivawh17,d501qi,Anybody else wishing that they could run away instead of killing themselves?,88,SuicideWatch,1568637339.0,2019-09-16 20:35:39,-1
2ivawh17,btcxk2,*sad pre teen noises*,3,im14andthisisdeep,1558903194.0,2019-05-27 04:39:54,0
jdh0u,dnshr2,Doing the L-sit progression on bed ?,14,bodyweightfitness,1572178778.0,2019-10-27 20:19:38,0
jdh0u,dcwjkc,"So empty, So meaningless.",2,SuicideWatch,1570134018.0,2019-10-04 04:20:18,-1
jdh0u,dcoxv6,noob looking for friends. 8876 7029 9235,0,PokemonGoFriends,1570098207.0,2019-10-03 18:23:27,1
jdh0u,db0lct,I've failed in everything.,10,SuicideWatch,1569788335.0,2019-09-30 04:18:55,-1
jdh0u,d0ldpr,"Too tired to win, too weak to fight.",3,SuicideWatch,1567798336.0,2019-09-07 03:32:16,-1
jdh0u,cworx1,"I'm tired,I'm so tired.",4,SuicideWatch,1567017000.0,2019-08-29 02:30:00,-1
jdh0u,blciyc,What's the point ?,2,SuicideWatch,1557151180.0,2019-05-06 21:59:40,0
jdh0u,beozni,[MF] The phone,0,shortstories,1555612190.0,2019-04-19 02:29:50,0
jdh0u,bayxv8,"Sleeping is so peaceful, I hate waking up.",65,SuicideWatch,1554756485.0,2019-04-09 04:48:05,0
jdh0u,b9wn32,It just never changes.Just a downward spiral.,2,SuicideWatch,1554498259.0,2019-04-06 05:04:19,0
jdh0u,b7nmlh,Last attempt,0,shortstory,1554038089.0,2019-03-31 21:14:49,0
jdh0u,b4wj0n,Just so tired of everything.,2,SuicideWatch,1553435401.0,2019-03-24 21:50:01,-1
jdh0u,b2w9q1,"TIL Bayer sold HIV and Hepatitis C contaminated blood products that caused up to 10,000 people in the US alone infected to HIV. After they found out the drug was contaminated, they pulled it off the US market and sold it to countries in Asia and Latin America so that they could still make money.",8,LateStageCapitalism,1552995026.0,2019-03-19 19:30:26,-1
jdh0u,b0ymds,I'm so tired,3,SuicideWatch,1552558787.0,2019-03-14 18:19:47,-1
jdh0u,9qgyt4,21/m awkward dude who loves literature,0,MakeNewFriendsHere,1540235556.0,2018-10-23 03:12:36,1
jdh0u,9qgym4,21/m awkward dude who loves literature,0,Needafriend,1540235524.0,2018-10-23 03:12:04,1
jdh0u,9kfd0z,21/m Awkward dude who loves novels and art.,7,MakeNewFriendsHere,1538391884.0,2018-10-01 19:04:44,1
jdh0u,9jqvdh,21/m Awkward not so hot god looking to meet new people.,37,Needafriend,1538169080.0,2018-09-29 05:11:20,-1
jdh0u,9jqusv,21/m Awkward not so hot god looking to meet new people.,0,MakeNewFriendsHere,1538168966.0,2018-09-29 05:09:26,-1
jdh0u,8l9cao,21/m socially awkward lonely legend here,2,togetheralone,1526989477.0,2018-05-22 19:44:37,-1
jdh0u,8jy2mf,Fruits,5,OCPoetry,1526501314.0,2018-05-17 04:08:34,0
3jrcxi9w,dfr5ku,"My emotions are: sad, depressed, horny, embarrassment, fear, hate, disgust, humiliation, anger, jealousy, envy, bored, empty, uncomfortable, regret, and feeling lonely.",7,depression,1570672523.0,2019-10-10 09:55:23,-1
3jrcxi9w,dbn3yn,Anybody else know of anymore psychedelic Jesus music such as...,12,ifyoulikeblank,1569899239.0,2019-10-01 11:07:19,0
3jrcxi9w,d2jndv,"This is so sad. Alexa, play “Godbless the USA - Lee Greenwood”",57,lossofalovedone,1568171315.0,2019-09-11 11:08:35,-1
3jrcxi9w,clpk56,Do y’all’s ever want to kill yourself over a minor inconvenience and that makes you want to kill yourself even more cause other people have it way worse?,36,SuicideWatch,1564875776.0,2019-08-04 07:42:56,-1
4nh7za5y,dj4nrp,"Suicidal people don’t want to die, they just want the pain to stop.",67,SuicideWatch,1571309434.0,2019-10-17 18:50:34,-1
121aza,dnp4ha,Thinking of moving to Libby,3,LibbyandTroyMT,1572153142.0,2019-10-27 13:12:22,0
121aza,ccs5ch,I asked SEVEN different people to be my plus one at a wedding. All of them bailed/made other plans.,1,lonely,1563040100.0,2019-07-14 01:48:20,0
121aza,btmn4i,How did your abortion affect your relationship?,10,abortion,1558967516.0,2019-05-27 22:31:56,0
121aza,b228m1,I feel like my anxiety is keeping me from who I really am,2,Anxiety,1552802905.0,2019-03-17 14:08:25,1
121aza,ag3xis,RANT Sent my textbooks to my old address. Didn't even notice until I looked today,1,ADHD,1547521393.0,2019-01-15 11:03:13,-1
121aza,a6vzec,"College student, first day home from winter break and I already want to leave.",2,rant,1545016826.0,2018-12-17 11:20:26,0
121aza,a3vrfu,The concept that suicide will always be an option keeps me alive.,13,SuicideWatch,1544152594.0,2018-12-07 11:16:34,-1
121aza,a2m9el,I’m the laughing stock of my friend group when I drink. 22 years old.,5,alcoholism,1543820624.0,2018-12-03 15:03:44,1
121aza,a13smn,"My abusive, schizophrenic ex-boyfriend just tried to contact me out of the blue. The no-contact order has expired. How do I proceed? Washington State",5,TwoXChromosomes,1543387843.0,2018-11-28 14:50:43,-1
121aza,a13gpx,"My abusive, schizophrenic ex-boyfriend just tried to contact me out of the blue. The no-contact order has expired. How do I proceed? Washington State",2,domesticviolence,1543384838.0,2018-11-28 14:00:38,-1
121aza,a13cx6,"My abusive, schizophrenic ex-boyfriend just tried to contact me out of the blue. The no-contact order has expired. How do I proceed? Washington State",1,legal,1543383893.0,2018-11-28 13:44:53,-1
121aza,8gezu5,How do I (21F) tell my parents (60'sM/F) they abusing me by parentification without disrespecting them...?,2,relationships,1525238505.0,2018-05-02 13:21:45,-1
121aza,8gerxb,"Misdemeanor charge (possession of a controlled substance, less than 3 oz - marijuana)... can he still join?",2,Militaryfaq,1525235884.0,2018-05-02 12:38:04,1
121aza,8doxzq,My [21F] Dad [62M] doesn’t want to attend my half-sister’s [35F] graduation because of drama that happened 15-30 years ago.,11,relationships,1524241935.0,2018-04-21 00:32:15,0
121aza,7wk8nz,Haven't been able to take my birth control for a week because my doctor still hasn't refilled my prescription,3,TwoXChromosomes,1518250073.0,2018-02-10 16:07:53,0
121aza,75kgaz,How Tom Petty has Changed my Life,13,tompetty,1507672221.0,2017-10-11 05:50:21,-1
121aza,6zkb26,Okay to take the GRE in November?,3,GRE,1505184934.0,2017-09-12 10:55:34,1
121aza,6e5wfi,Will I EVER commit suicide? Probably not. Do I think about doing it? Every. Single. Day.,36,SuicideWatch,1496129658.0,2017-05-30 15:34:18,-1
z47fg8q,81zuxe,Attempt failed. Currently in the hospital.,88,SuicideWatch,1520191498.0,2018-03-05 03:24:58,-1
z47fg8q,81snc5,Overdose or reckless driving,0,SuicideWatch,1520108020.0,2018-03-04 04:13:40,-1
30vcoqjk,c3zmsh,Scared of mirrors while on DPH?,9,DPH,1561267370.0,2019-06-23 13:22:50,-1
30vcoqjk,bmvkty,GUILT TRIPPING IS NOT OK,92,SuicideWatch,1557475373.0,2019-05-10 16:02:53,-1
30vcoqjk,bey51j,I Want to Die so DXM Tripping it is,6,SuicideWatch,1555674061.0,2019-04-19 19:41:01,-1
30vcoqjk,b4i3q6,I'm seriously done. Ending my life asap,2,SuicideWatch,1553340139.0,2019-03-23 19:22:19,0
30vcoqjk,b2ttw5,So pissed at life because it's complete shit,4,SuicideWatch,1552976357.0,2019-03-19 14:19:17,-1
30vcoqjk,asno2p,I'm so done,1,SuicideWatch,1550665024.0,2019-02-20 20:17:04,0
30vcoqjk,aruzsn,Litterally no motivation,9,SuicideWatch,1550477584.0,2019-02-18 16:13:04,0
30vcoqjk,aruwg6,How much more can I take before i break again?,10,SuicideWatch,1550476758.0,2019-02-18 15:59:18,0
30vcoqjk,aoepp5,"Being unable to kill myself has me obsessed with alcohol, cutting, drugs, ect.",8,SuicideWatch,1549616353.0,2019-02-08 16:59:13,-1
30vcoqjk,am09o1,Crisis line useless,4,SuicideWatch,1549012403.0,2019-02-01 17:13:23,-1
30vcoqjk,akj9zn,How much longer can i take it?,2,SuicideWatch,1548645510.0,2019-01-28 11:18:30,0
wvrqr,dkrmv8,I hate how your brain teases you with random moments of motivation/hope/joy/etc. then plunges you back into feeling like subhuman trash for days or weeks on end,27,SuicideWatch,1571613587.0,2019-10-21 07:19:47,-1
wvrqr,dabg4d,"Went to homecoming, was fricking EPIC",3,teenagers,1569644918.0,2019-09-28 12:28:38,0
wvrqr,cnqtdf,Actually feeling better today.,5,feemagers,1565293171.0,2019-08-09 03:39:31,1
wvrqr,chvdtv,Confield (First listen),18,autechre,1564098271.0,2019-07-26 07:44:31,0
wvrqr,ccxqhq,"Fortnite good, Minecraft bad",9,teenagers,1563070824.0,2019-07-14 10:20:24,0
wvrqr,ccxj8z,"Humans: *sends long list of our history, accomplishments, and reasons for aliens not to kill us or take our resources*",5,teenagers,1563069599.0,2019-07-14 09:59:59,1
wvrqr,cckiwa,My thoughts on LP5.,5,autechre,1562987672.0,2019-07-13 11:14:32,0
wvrqr,cadztj,"If there is one thing that sucks for Generation Z, it's the political tension and other world problems we grow up in.",7,teenagers,1562544833.0,2019-07-08 08:13:53,-1
wvrqr,c15lgk,"My opinion regarding the ""beings""",1,TheBackrooms,1560655229.0,2019-06-16 11:20:29,0
