author_id,sub_id,submission,comments,subreddit,created,timestamp,risk
2xxntvzu,d4rl5g,I get depressed and push people away because I feel like “we’re not right for each other” and they deserve better,0,depression,1568586057.0,2019-09-16 06:20:57,1
2xxntvzu,d4j7m5,"I’m so selfish, how can I feel so sad when there are so many people who have it so much worse",2,depression,1568546517.0,2019-09-15 19:21:57,-1
2xxntvzu,d4bdmt,It’s now 5am. Spent the entire night thinking about how much I hate myself and forgot to sleep ahaha great.,5,Anxiety,1568496819.0,2019-09-15 05:33:39,0
2xxntvzu,d4awnu,Everyday is such an unnecessarily huge battle that I don’t want to fight,0,depression,1568494565.0,2019-09-15 04:56:05,-1
2xxntvzu,d4a1wy,"I hate myself so much, I feel physically nauseous",0,BodyDysmorphia,1568490562.0,2019-09-15 03:49:22,-1
2xxntvzu,d46355,“wHy dO yoU alWays delEte youR meSsageS”,4,Anxiety,1568472409.0,2019-09-14 22:46:49,0
2xxntvzu,d404r1,Am I tired of being alive or have I just not eaten or drunk anything in a while,1,bulimia,1568432231.0,2019-09-14 11:37:11,0
2xxntvzu,d3pa9u,When I say I hate myself I mean I HATE myself,0,depression,1568381397.0,2019-09-13 21:29:57,-1
2xxntvzu,d3m8lk,Wanting to disappear,0,depression,1568363386.0,2019-09-13 16:29:46,-1
2xxntvzu,d38cpt,Yh I know that I’ll still be depressed if I reached my goal weight but atleast I’d be depressed and socially accepted by society,0,BodyDysmorphia,1568296973.0,2019-09-12 22:02:53,-1
2xxntvzu,d1qdah,Is everyone suicidal at least once in their life?,3,depression,1568032854.0,2019-09-09 20:40:54,-1
2xxntvzu,d0gbrm,The constant fear that all my friends hate me and think I’m annoying and want me to stop talking but are too nice to say anything is crushing,68,Anxiety,1567774726.0,2019-09-06 20:58:46,-1
2xxntvzu,d0g9hx,It makes me upset that my friends only reply to me when they see I’ve deleted my text,1,Anxiety,1567774384.0,2019-09-06 20:53:04,0
2xxntvzu,d0g8w1,I wish I believed when people told me I am “pretty”,19,BodyDysmorphia,1567774297.0,2019-09-06 20:51:37,1
2xxntvzu,d0g8c6,It’s so hard accepting compliments when I hate myself and I got constantly bullied for being “ugly” when I was younger,1,BodyDysmorphia,1567774219.0,2019-09-06 20:50:19,-1
2xxntvzu,cx61c3,4am just woke up I’m gonna cry for no reason,0,depression,1567108852.0,2019-08-30 04:00:52,-1
2xxntvzu,cx2pb3,People always say they “get it” and they “get stressed sometimes too”,1,depression,1567093736.0,2019-08-29 23:48:56,-1
2xxntvzu,cwfvus,My sister used to say that living is survival of the fittest and I guess she was right because I’m too weak to find the power to keep myself alive,1,SuicideWatch,1566966637.0,2019-08-28 12:30:37,0
2xxntvzu,cvgxc3,Why do I do this to myself,0,depression,1566780623.0,2019-08-26 08:50:23,0
2xxntvzu,cubxv2,No one cares about your life until you say you want to end it,112,SuicideWatch,1566555661.0,2019-08-23 18:21:01,1
2xxntvzu,cubxhe,Why me? I just want to live a normal life without being burdened by this constant dark cloud above my head,0,depression,1566555598.0,2019-08-23 18:19:58,1
2xxntvzu,cub8gg,Struggle to find reasons to live,2,SuicideWatch,1566550778.0,2019-08-23 16:59:38,-1
2xxntvzu,ctozx2,My life is forcing me into a hole of sadness because I feel like I don’t deserve to leave,0,depression,1566430271.0,2019-08-22 07:31:11,0
2xxntvzu,cry61w,One of my friends has anxiety but throws around the word like it’s nothing,2,Anxiety,1566112263.0,2019-08-18 15:11:03,1
2xxntvzu,crfrqv,Not having the energy to go out with friends when invited but getting upset when I’m not invited :)),0,depression,1566006028.0,2019-08-17 09:40:28,-1
2xxntvzu,cql3ct,I just need one single reason to get out of bed everyday and currently it’s nothing.,0,depression,1565843014.0,2019-08-15 12:23:34,0
2xxntvzu,cqk7fq,"Is it normal to get really bad stomach aches everytime I go to school, does this have anything to do with anxiety?",3,Anxiety,1565837948.0,2019-08-15 10:59:08,-1
2xxntvzu,cq9xzo,I just wish I could drop all of my responsibilities and stay in bed forever,0,depression,1565790655.0,2019-08-14 21:50:55,0
2xxntvzu,cq9w8p,My google searches be like: how to stop existing,0,depression,1565790412.0,2019-08-14 21:46:52,0
2xxntvzu,cq57b6,Changing my hair and makeup drastically everyday to make me feel like everyday isn’t the same day repeating over and over for the rest of my life,0,depression,1565759992.0,2019-08-14 13:19:52,1
2xxntvzu,cptsmw,My friend said that she would always be here to listen if I needed to talk but I always feel so constantly sad,1,depression,1565706030.0,2019-08-13 22:20:30,-1
2xxntvzu,cpti4t,I just want to never go outside and stay inside forever so I don’t have to burden anyone with my existence,3,Anxiety,1565704662.0,2019-08-13 21:57:42,-1
2xxntvzu,cpti3k,I want a nose piercing really badly but I’m scared that the hole will be really obvious if I decided I didn’t want it anymore took it out when I’m older,12,piercing,1565704659.0,2019-08-13 21:57:39,-1
2xxntvzu,cpssc9,Feeling alone,1,depression,1565701065.0,2019-08-13 20:57:45,0
2xxntvzu,cpsfqi,It’s so stressful knowing I’m alive and breathing,0,depression,1565699238.0,2019-08-13 20:27:18,-1
2xxntvzu,cps1d3,"Aaannnddd I’ve done it again, I’ve forced myself into a hole of sadness that I feel like I don’t deserve to leave",1,sad,1565697084.0,2019-08-13 19:51:24,-1
2xxntvzu,cp3mv9,I feel like I need attention and even then I still feel like everyone hates me,0,depression,1565563571.0,2019-08-12 06:46:11,1
2xxntvzu,cp3mkh,How do I stop feeling like everyone hates me and I’m a burden,7,depression,1565563523.0,2019-08-12 06:45:23,-1
2xxntvzu,covz8e,Why are guys so judgemental about girls who wear a lot of makeup?,20,teenagers,1565525261.0,2019-08-11 20:07:41,0
2xxntvzu,cotdel,I can’t help but feel like such a burden to everyone around me especially my friends,0,depression,1565504167.0,2019-08-11 14:16:07,1
3bt40uew,dmg28p,College is stupid and it makes me want to die even more,44,SuicideWatch,1571922033.0,2019-10-24 21:00:33,-1
3bt40uew,dje8ls,Why do I feel so stupid and guilty,0,depression,1571353018.0,2019-10-18 06:56:58,-1
3bt40uew,dj0riv,Why does looking for a part time job feel so scary?,4,depression,1571283654.0,2019-10-17 11:40:54,-1
3bt40uew,dfuby6,I can’t do the one thing I want to do for a living cause I can’t fucking talk to people,2,SuicideWatch,1570691340.0,2019-10-10 15:09:00,0
3bt40uew,df2c5z,Naw seriously fuck this life shit,2,SuicideWatch,1570551907.0,2019-10-09 00:25:07,-1
3bt40uew,degb5a,I have a midterm assignment due at 11:59. My grade right now is an 8% out of 100. What’s the quickest way to fucking kill myself?,7,depression,1570434562.0,2019-10-07 15:49:22,-1
3bt40uew,d56r46,Fuck people who report suicidal people to the police. They have better shit to do.,39,SuicideWatch,1568668340.0,2019-09-17 05:12:20,-1
3bt40uew,d56pr5,I feel like I’m too thick skinned to the point where I’m hurting everybody else,1,SuicideWatch,1568668176.0,2019-09-17 05:09:36,0
3bt40uew,d56mls,Idk if I want to die but I don’t want to do this life shit anymore,4,SuicideWatch,1568667807.0,2019-09-17 05:03:27,-1
3bt40uew,d244v2,Fuck suicide prevention day,1,SuicideWatch,1568099856.0,2019-09-10 15:17:36,-1
3bt40uew,d18hjk,"“Hey if it all goes wrong, there’s always suicide”",1,SuicideWatch,1567931995.0,2019-09-08 16:39:55,-1
3bt40uew,d17r3e,I should kill myself because my parents only put me here to make themselves look good,2,SuicideWatch,1567926055.0,2019-09-08 15:00:55,-1
3bt40uew,d17jws,I’m sitting in front of my computer staring at my college tuition fee,0,depression,1567924499.0,2019-09-08 14:34:59,0
3bt40uew,d0smjm,People liked me better when all I did was shut up,2,SuicideWatch,1567837922.0,2019-09-07 14:32:02,1
3bt40uew,czwgjj,If you try to make me feel better or show me that you care my mind will literally hate you,9,SuicideWatch,1567660673.0,2019-09-05 13:17:53,1
3bt40uew,cztaq5,You ever just leave an awkward conversation and think “Wow. I should really just kill myself.”?,53,SuicideWatch,1567642964.0,2019-09-05 08:22:44,-1
3bt40uew,cw1ib7,It’s 4am. I have my first class of the semester in 5 hours and I can’t sleep,36,SuicideWatch,1566894570.0,2019-08-27 16:29:30,0
3bt40uew,ctv37p,“Think about your friends and family”,5,SuicideWatch,1566466971.0,2019-08-22 17:42:51,1
3bt40uew,ctlrdx,I’m just not made for this world,3,SuicideWatch,1566415887.0,2019-08-22 03:31:27,0
3bt40uew,csdrrq,I can’t wait for classes to start so I can really plan on ending it,3,SuicideWatch,1566199943.0,2019-08-19 15:32:23,0
3bt40uew,csdfhr,Literally no one’s going to miss me,5,SuicideWatch,1566197523.0,2019-08-19 14:52:03,-1
3bt40uew,cq5z6l,Found a razor in a used car I bought on Facebook marketplace,1,SuicideWatch,1565765223.0,2019-08-14 14:47:03,0
3bt40uew,cpqxri,I just complain about the same selfish shit on here,0,SuicideWatch,1565690050.0,2019-08-13 17:54:10,-1
3bt40uew,cpqsbr,I’m so fucking useless,1,SuicideWatch,1565688960.0,2019-08-13 17:36:00,-1
3bt40uew,cotv55,If everyone is “loved”,4,SuicideWatch,1565507975.0,2019-08-11 15:19:35,0
3bt40uew,cosgwo,No matter how much I try to change I’m always going to be a toxic person and this world doesn’t need people like me.,0,SuicideWatch,1565497924.0,2019-08-11 12:32:04,0
3bt40uew,cndbaa,I don’t belong here at all I can just feel it,1,SuicideWatch,1565219985.0,2019-08-08 07:19:45,0
3bt40uew,cn9282,How am I supposed to build a network and get a job when nobody wants me around?,0,depression,1565200147.0,2019-08-08 01:49:07,0
3bt40uew,cl16pr,Anyone else feel like their family won’t give a shit?,0,SuicideWatch,1564733017.0,2019-08-02 16:03:37,-1
3bt40uew,cl11om,The problem is just me.,2,SuicideWatch,1564731936.0,2019-08-02 15:45:36,-1
3bt40uew,cizsaq,Can you imagine there are people who hate it when they get asked to take selfies,0,depression,1564340303.0,2019-07-29 02:58:23,-1
3bt40uew,cizlrh,I just want a group of friends who support me,0,depression,1564339430.0,2019-07-29 02:43:50,1
3bt40uew,cizhns,Why is everyone ignoring me,1,depression,1564338899.0,2019-07-29 02:34:59,-1
3bt40uew,cbdf1r,I literally can’t make lasting friendships,1,depression,1562742268.0,2019-07-10 15:04:28,1
3bt40uew,cap76v,I should kill myself,7,depression,1562611985.0,2019-07-09 02:53:05,-1
3bt40uew,bseadg,I’m tired of trying to get along with people I don’t even like just to try and feel like I belong here. I don’t.,3,SuicideWatch,1558686001.0,2019-05-24 16:20:01,1
3bt40uew,bse2xe,What’s it like having a support group or a single person who cares if you exist?,0,depression,1558684116.0,2019-05-24 15:48:36,1
3bt40uew,bs02gq,‪No feeling quite like having your parents crush all of your dreams because they’d rather see you wealthy than actually happy‬,1,depression,1558597206.0,2019-05-23 15:40:06,1
3bt40uew,br727c,From how high does a 6’0 tall man need to fall in order to die?,8,SuicideWatch,1558420957.0,2019-05-21 14:42:37,-1
3bt40uew,br70ob,No one else understands that I’m not supposed to be on this planet,4,depression,1558420624.0,2019-05-21 14:37:04,-1
3bt40uew,br6xhy,"“You have your life ahead of you”, “you have so much to live for”, “people want you here”",9,SuicideWatch,1558419926.0,2019-05-21 14:25:26,0
3bt40uew,bqnm6r,Nobody cares if I’m here or not. I don’t have a friend circle or anything like that,0,depression,1558308203.0,2019-05-20 07:23:23,1
3bt40uew,bqencc,So I’ve realized that I’m only a likable/charismatic person online and totally boring in person,2,depression,1558255589.0,2019-05-19 16:46:29,-1
3bt40uew,bqe8le,All my life I thought that the only thing that would make me happy is a girlfriend,0,depression,1558252086.0,2019-05-19 15:48:06,1
3bt40uew,bqe4ec,I really should kill myself,3,depression,1558251069.0,2019-05-19 15:31:09,-1
3bt40uew,bpshr3,My last huge heartbreak was 5 years ago and I still can’t bring myself to be vulnerable with a girl,0,depression,1558105951.0,2019-05-17 23:12:31,-1
3bt40uew,bppk4a,Money is the reason I can’t get anywhere in life,1,depression,1558089166.0,2019-05-17 18:32:46,0
3bt40uew,bp61gd,Sometimes I wish I could die and be reborn less ugly,0,depression,1557967463.0,2019-05-16 08:44:23,-1
3bt40uew,bkd4lh,Why are people so against suicide?,1,depression,1556915521.0,2019-05-04 04:32:01,-1
3bt40uew,bkblp4,I can’t stop dissociating,4,depression,1556907247.0,2019-05-04 02:14:07,-1
3bt40uew,bikjl6,People who say “somebody cares about you” don’t know what it’s like when literally everyone in your life couldn’t give two shits if you’re breathing right now,0,depression,1556511211.0,2019-04-29 12:13:31,1
3bt40uew,bikiro,I watched Endgame and felt nothing,2,depression,1556511130.0,2019-04-29 12:12:10,0
3bt40uew,bikhpg,My pastor thinks I’m suicidal and now I feel too embarrassed to show my face at church,0,depression,1556511016.0,2019-04-29 12:10:16,-1
3bt40uew,bikfxi,I’m 19 studying computer science but I hate it and I want to drop out of college but my family’s relying on me to make money and support them,0,depression,1556510842.0,2019-04-29 12:07:22,-1
3bt40uew,bikerm,Need to hang out with friends to become an interesting person. Need to become an interesting person to make friends,0,depression,1556510736.0,2019-04-29 12:05:36,1
3bt40uew,bika15,Everyone I know is out with their friends enjoying the end of finals and here I am at the end of my second semester of college just as lonely as when I started,0,depression,1556510259.0,2019-04-29 11:57:39,1
3bt40uew,bic7dd,"My younger brother gets to have fun and enjoy high school and get offers from different colleges while I spent those four years stressing out, isolating myself, and considering suicide just to get into college with a scholarship.",3,depression,1556464281.0,2019-04-28 23:11:21,0
3bt40uew,bi2ox1,Sometimes I hate my parents for putting me here,0,depression,1556393660.0,2019-04-28 03:34:20,-1
3bt40uew,bi2e7z,Nobody’s ever going to give a fuck about me. I’m never going to be likeable or surrounded by friends like everyone else. I should just fucking end this embarrassing life now.,0,depression,1556391899.0,2019-04-28 03:04:59,0
3bt40uew,bhsagw,Every time I want to go out and do something nobody ever wants to join me,4,depression,1556317531.0,2019-04-27 06:25:31,1
3bt40uew,bhi3fg,How does dating work when nobody’s interested in you?,0,depression,1556252068.0,2019-04-26 12:14:28,1
3bt40uew,bhdlw0,I just can’t be myself around other people,0,depression,1556224879.0,2019-04-26 04:41:19,0
3bt40uew,bh5tyz,Suicide hotlines are bullshit,79,SuicideWatch,1556177608.0,2019-04-25 15:33:28,-1
3bt40uew,bh5npz,Anybody over 30 regret not killing themselves when they were younger?,0,depression,1556176154.0,2019-04-25 15:09:14,0
3bt40uew,bgr4sx,I’m 19 and my mom’s a cancer survivor but I wouldn’t mind if I died from cancer,0,depression,1556085963.0,2019-04-24 14:06:03,-1
3bt40uew,bdplpn,Nobody cares that I’m fucking here,0,depression,1555388139.0,2019-04-16 12:15:39,1
3bt40uew,bdnplw,I just walked out of a comedy show that I went to alone,11,depression,1555376019.0,2019-04-16 08:53:39,0
3bt40uew,bco7vk,I want to make friends but it’s hard because I’m very gassy,8,socialskills,1555141418.0,2019-04-13 15:43:38,0
3bt40uew,bclt1b,Should I write a suicide note or not? Not like I have close friends or anything who would read it,2,depression,1555121423.0,2019-04-13 10:10:23,0
3bt40uew,bcls79,Should I do these three huge assignments due in 2 hours or just take the F and jump off a parking garage,6,depression,1555121261.0,2019-04-13 10:07:41,1
3bt40uew,bcljbh,[L][M][19] I’m a shitty friend and I should fucking die,7,KindVoice,1555119574.0,2019-04-13 09:39:34,-1
3bt40uew,bclinv,It’s my fault. I’m the shit friend no matter who I try to make friends with. Wow. I should just die.,1,depression,1555119449.0,2019-04-13 09:37:29,1
3bt40uew,b7d1vx,In a few months it’s going to be a year since I pissed off my best friend and they stopped talking to me. I deserve to die.,5,SuicideWatch,1553963127.0,2019-03-31 00:25:27,-1
3bt40uew,b7cnjg,Stop pretending like you all fucking care,104,SuicideWatch,1553960753.0,2019-03-30 23:45:53,1
14uh33,9cosvh,Operation stay up 24 hours to fix sleep schedule is a go,15,insomnia,1536005690.0,2018-09-04 04:14:50,0
14uh33,8fpbd4,Sleep is great because it's like being dead without hurting your family.,44,SuicideWatch,1524977832.0,2018-04-29 12:57:12,1
3v1oosyy,d7jb0v,Has anyone else felt extremely sad after seeing someone particularly attractive?,49,ForeverAlone,1569112864.0,2019-09-22 08:41:04,0
3v1oosyy,d1fx4w,I wish I could donate my time on Earth to people who really deserve to live. I'm not enjoying my stay.,70,SuicideWatch,1567972266.0,2019-09-09 03:51:06,0
3v1oosyy,catolf,How do you find the will to live?,46,FA30plus,1562633759.0,2019-07-09 08:55:59,0
3v1oosyy,cac8xl,Men's posts are not receiving as much traffic as women's posts are.,139,amiugly,1562534975.0,2019-07-08 05:29:35,0
sg4qt00,82gf20,Today I want too die.,3,SuicideWatch,1520354278.0,2018-03-07 00:37:58,-1
sg4qt00,81aeou,Today I told the love of my life no because my stupid ass mind wasn’t ok with the thought off happiness.,1,Anxiety,1519951859.0,2018-03-02 08:50:59,1
sg4qt00,7yaf24,I hate how when you’re depressed you just forget everything. You forget to do stuff and you forget the stuff you did. Time passes without you realising and instead of doing nothing for ten minutes you did nothing for three hours but you didn’t even realise you were actually living.,50,SuicideWatch,1518910665.0,2018-02-18 07:37:45,-1
sg4qt00,7r43zo,How do my parents look me in the eyes everyday and not see the mental pain I suffer because when I look in the mirror I see nothing but numbness.,15,SuicideWatch,1516221755.0,2018-01-18 04:42:35,-1
ui6rl,dkv341,Let’s get lost together,6,gonewildcolor,1571631339.0,2019-10-21 12:15:39,-1
ui6rl,dkovuu,Get lost (with me),10,DreamFuck,1571601473.0,2019-10-21 03:57:53,-1
ui6rl,dc61gk,going to bed alone every night is getting old... 🥺,20,DreamFuck,1569994959.0,2019-10-02 13:42:39,-1
ui6rl,dbsfg7,"Guys, I'm live on Chaturbate now!",2,DreamFuck,1569931749.0,2019-10-01 20:09:09,0
ui6rl,d9s8c8,Today I'm going to film some video clips for purchase on my ManyVids. Does anyone have any requests?,10,DreamFuck,1569542020.0,2019-09-27 07:53:40,0
ui6rl,d8xl6x,He said I have bad hair and I look very haggardly,21,DreamFuck,1569381317.0,2019-09-25 11:15:17,-1
ui6rl,d8jf0x,"I love dancing to this song and video. When the beat drops, I absolutely have to drop what I'm doing and start twerking and doing body rolls. I want to party with them, I wish they were my friends irl...",0,DreamFuck,1569307415.0,2019-09-24 14:43:35,1
ui6rl,d8jdwr,Why do people drag her so much? She makes songs that are cute bops. I'm totally here for it.,4,DreamFuck,1569307208.0,2019-09-24 14:40:08,1
ui6rl,d2247f,The abuser is following me on ManyVids,11,DreamFuck,1568086583.0,2019-09-10 11:36:23,-1
ui6rl,cuqjxy,"""hot Summer nights"" LIVE on ChaturH8!",4,DreamFuck,1566632693.0,2019-08-24 15:44:53,0
ui6rl,csswfa,"I will be webcamming tonight for a few hours, really chill and casual, if you want to stop by",0,DreamFuck,1566277326.0,2019-08-20 13:02:06,0
ui6rl,cppaie,On Camgirls. NSFW posters. Reddit thots. (Etc.) Reality check: We can’t respond to all of our fan messages.,2,rant,1565678419.0,2019-08-13 14:40:19,1
45ys4cs4,dkpkqj,Candidate held for using surgically implanted device in exam,0,DarkFuturology,1571604346.0,2019-10-21 04:45:46,0
45ys4cs4,dekwto,[Serious] How many of you plan to not have children because of your worries about the future?,15,AskReddit,1570461714.0,2019-10-07 23:21:54,-1
45ys4cs4,ddkg4a,I slipped after a week and immediately remembered why I want to stop. Back on Day 3.,3,leaves,1570263451.0,2019-10-05 16:17:31,-1
45ys4cs4,dd45gf,"Naga Munchetty on Banksy's 'Devolved Parliament': ""It's a brilliant, brilliant picture""",47,unitedkingdom,1570174740.0,2019-10-04 15:39:00,1
45ys4cs4,daesgr,After over 250 years of this its time for change,6,GreenAndPleasant,1569669971.0,2019-09-28 19:26:11,0
45ys4cs4,d8svcw,"TIL that Queen Elizabeth II cannot be prosecuted, as civil and criminal proceedings cannot be taken against the Sovereign as a person under UK law",13,todayilearned,1569356661.0,2019-09-25 04:24:21,-1
45ys4cs4,d63cz7,"Look above you. Imagine you are standing in a grassy meadow. Feel the cool, summer breeze caressing your face. Now get back to work you lazy shit.",1,ABoringDystopia,1568837138.0,2019-09-19 04:05:38,-1
45ys4cs4,d5f6zz,Whatever stage of capitalism this is,8,LateStageCapitalism,1568717219.0,2019-09-17 18:46:59,0
45ys4cs4,d57rp7,Hong Kong police group warns live ammo may be used against protesters who throw petrol bombs at officers,2,Anarchism,1568672842.0,2019-09-17 06:27:22,-1
45ys4cs4,d4zohx,Having trouble breathing outside? For a large amount of dollars you can buy one of our stylish and form-fitting face masks so you can breathe outside like its 2005!,25,ABoringDystopia,1568635332.0,2019-09-16 20:02:12,0
45ys4cs4,d4qhip,Fascists are planning a modern Night of the Long Knives,4,DescentIntoTyranny,1568581310.0,2019-09-16 05:01:50,-1
45ys4cs4,d44bso,Nooo don't kill yourself you're too valuable to The Economy aha,331,ABoringDystopia,1568462742.0,2019-09-14 20:05:42,1
45ys4cs4,d36a43,"An article from 2005 about panic buying at petrol stations after a rise to £1 a litre, news of planned protests and rumours of a closed station, quite an interesting public reaction",0,unitedkingdom,1568286438.0,2019-09-12 19:07:18,-1
45ys4cs4,d24h4v,"Discussing the necessity for ""Grab Bags"" on BBC Breakfast",134,unitedkingdom,1568102494.0,2019-09-10 16:01:34,0
45ys4cs4,d11hq1,"""His parents made him available as a stock photograph, the license to which we obtained. Let us all gaze at him. It is our right."" (Satire)",2,LateStageCapitalism,1567889563.0,2019-09-08 04:52:43,0
45ys4cs4,d0mctx,"Assuming that Britain leaves the EU on October 31st without a deal, assuming that drivers and businesses have difficulty getting goods into the country, you're going to have the collapse of a 1st world nation live-streamed to your phone",36,collapse,1567802849.0,2019-09-07 04:47:29,-1
3j82c5fo,bs4wb7,My sister committed suicide last night.,61,SuicideWatch,1558628155.0,2019-05-24 00:15:55,-1
3j82c5fo,bq0vzb,Tried to kill myself and it didn’t work again F14.,2,SuicideWatch,1558160479.0,2019-05-18 14:21:19,-1
3j82c5fo,bnl9wu,I don’t care about anything anymore,5,depression,1557635914.0,2019-05-12 12:38:34,1
3j82c5fo,bhhlkj,I nearly killed myself today F14,16,SuicideWatch,1556248658.0,2019-04-26 11:17:38,-1
3j82c5fo,be6iky,I’m all alone.,7,SuicideWatch,1555499554.0,2019-04-17 19:12:34,-1
3j82c5fo,be673v,Whenever I tell my friend my problems she calls me dumb.,1,SuicideWatch,1555497121.0,2019-04-17 18:32:01,-1
3j82c5fo,be5wml,Bullies are getting to me F14,5,SuicideWatch,1555494691.0,2019-04-17 17:51:31,0
3j82c5fo,bdmw2e,I’m shaking and can’t breathe,34,SuicideWatch,1555371127.0,2019-04-16 07:32:07,0
3j82c5fo,bcg7r1,The pain won’t go away,2,SuicideWatch,1555089789.0,2019-04-13 01:23:09,-1
3j82c5fo,bbmw72,I started cutting my other arm F14,5,SuicideWatch,1554907734.0,2019-04-10 22:48:54,0
3j82c5fo,bb7p09,I overthink too much. F14,11,SuicideWatch,1554815058.0,2019-04-09 21:04:18,0
3j82c5fo,baur4q,I am alive. sadly,3,SuicideWatch,1554735220.0,2019-04-08 22:53:40,0
3j82c5fo,b9cvzl,"I tried to hang myself yesterday + the story of my life. If I ever kill myself, here’s why.",14,SuicideWatch,1554385493.0,2019-04-04 21:44:53,-1
3j82c5fo,b93gjv,"This is my beautiful bestfriend I lost to suicide on the 15th of August😭 I wish I could tell you how much I miss you, I wish I could hug you and never let you go. I wish I could tell you how much I care about you. I love you, i’m sorry",3,GriefSupport,1554324284.0,2019-04-04 04:44:44,1
3j82c5fo,b90gq8,Attempting suicide today because I can’t take it anymore. Happy birthday me,12,SuicideWatch,1554310270.0,2019-04-04 00:51:10,-1
3j82c5fo,b8yoze,I want to die,6,SuicideWatch,1554301876.0,2019-04-03 22:31:16,-1
20huv6cv,cb75pu,"I got a delivery, I think he's happier about it than I am",0,cats,1562707685.0,2019-07-10 05:28:05,1
20huv6cv,cb655d,This quote about suicide is feeling far too accurate,49,SuicideWatch,1562703072.0,2019-07-10 04:11:12,-1
20huv6cv,bnilgj,How to help a friend,7,OCD,1557618020.0,2019-05-12 07:40:20,1
20huv6cv,ab03s6,Does anyone else feel like self-harming resets an urge inside of themselves?,19,selfharm,1546205814.0,2018-12-31 05:36:54,1
15le6i,db3qx6,"Can write bass lines on paper, but no in execution",6,Bass,1569803479.0,2019-09-30 08:31:19,-1
15le6i,bjnzf8,My friends all told me I'm too tense (physically) and I dont know what they mean?,5,CasualConversation,1556752901.0,2019-05-02 07:21:41,0
15le6i,bdxsuy,Tone question on a peppers song,6,Bass,1555441494.0,2019-04-17 03:04:54,0
15le6i,baujbg,"LPT: If you find yourself not getting anything from your hobbies, try doing an activity that involves creating something",59,LifeProTips,1554734066.0,2019-04-08 22:34:26,1
15le6i,b6hni0,Do you ever have a really good dream but then wake up back to reality and tasting that fleeting moment of happiness makes you just want to fucking die so much?,69,SuicideWatch,1553772716.0,2019-03-28 19:31:56,1
15le6i,asjvwk,My audition is Saturday please send help,3,Berklee,1550636761.0,2019-02-20 12:26:01,1
15le6i,ab26c1,Hey tb to when I was like 8 and wasnt an empty husk that didnt want to kill myself on the daily,4,SuicideWatch,1546219495.0,2018-12-31 09:24:55,1
15le6i,9yngwk,MAJOR BUG: do NOT store any cores or armor on a power armor chassis if it going in your inventory,3,fo76,1542678863.0,2018-11-20 09:54:23,0
