author_id,sub_id,submission,comments,subreddit,created,timestamp,risk
wvrqr,bu9ugg,The Mountain Goats - Going to Georgia [Indie Folk],1,Music,1559101523.0,2019-05-29 11:45:23,0
wvrqr,bnku85,When people tell you to not give a fuck about anything to be happier and you already have but you are depressed is pretty fucking terrible,0,depression,1557632618.0,2019-05-12 11:43:38,-1
wvrqr,bmat3y,Fuck you and your loud car,1,rant,1557349540.0,2019-05-09 05:05:40,-1
wvrqr,bl46de,Oh god oh fuck,11,teenagers,1557096492.0,2019-05-06 06:48:12,-1
wvrqr,bi571e,I hope you die,7,teenagers,1556408916.0,2019-04-28 07:48:36,-1
wvrqr,bfk7mj,elyc6 0nset,7,autechre,1555814018.0,2019-04-21 10:33:38,0
wvrqr,b8rf8c,"I hate whenever I am around players of the opposite sex I get the ""nervous"" debuff.",0,outside,1554252696.0,2019-04-03 08:51:36,-1
wvrqr,b765ap,Made a playlist for all users who see this to add songs you want.,5,teenagers,1553913600.0,2019-03-30 10:40:00,0
wvrqr,b4rkyy,if you could describe your social life at school/college/whatever with songs what would it be?,6,teenagers,1553395750.0,2019-03-24 10:49:10,0
wvrqr,ax0con,Anyone else's grades going down the drain because of your mental state?,1,depression,1551657455.0,2019-03-04 07:57:35,0
wvrqr,awyaci,Underrated song by Radiohead that kind of sums up depression (at least for a lot of people with depression).,5,depression,1551645573.0,2019-03-04 04:39:33,-1
wvrqr,au4g5n,aaa,1,progmemes,1550983373.0,2019-02-24 12:42:53,0
wvrqr,ar4bhj,"If you could only keep half of the songs from each album to listen to, what would they be?",7,radiohead,1550284337.0,2019-02-16 10:32:17,0
wvrqr,92eobe,"List of ""starter"" progressive rock/metal albums",11,Music,1532713572.0,2018-07-28 01:46:12,0
wvrqr,8qoaui,Listening to Pink Floyd's discography,8,pinkfloyd,1528851528.0,2018-06-13 08:58:48,0
wvrqr,8pye3k,My favorite riffs & solos,8,Opeth,1528603194.0,2018-06-10 11:59:54,1
wvrqr,8p5fzx,dream pink floyd setlist pt. 2,1,PinkFloydCircleJerk,1528327720.0,2018-06-07 07:28:40,1
wvrqr,8o3k41,Dream pink floyd setlist,2,PinkFloydCircleJerk,1527973171.0,2018-06-03 04:59:31,1
wvrqr,7ybjm6,oh my god,13,progrockmusic,1518922105.0,2018-02-18 10:48:25,1
wvrqr,7oemxs,What are places you'd like to go but nobody else would want to go?,9,AskReddit,1515189195.0,2018-01-06 05:53:15,1
wvrqr,7isy3y,What is your favorite soft moment from a heavy song?,40,Opeth,1512895639.0,2017-12-10 16:47:19,1
wvrqr,7fqp6p,Kind of describes PMO...,0,NoFap,1511738504.0,2017-11-27 07:21:44,0
wvrqr,7f4xg9,More attention from girls,1,NoFap,1511497046.0,2017-11-24 12:17:26,0
wvrqr,73ougp,Basically PMO in a song,2,NoFap,1506897284.0,2017-10-02 06:34:44,0
wvrqr,6xv7kl,Almost relapsed.,2,NoFap,1504466921.0,2017-09-04 03:28:41,0
wvrqr,6w90up,"Relapsing constantly, but I do not want to. help me please.",1,NoFap,1503791447.0,2017-08-27 07:50:47,0
wvrqr,6uynrr,I never felt like shit so bad in a while...,1,NoFap,1503266747.0,2017-08-21 06:05:47,-1
wvrqr,6ur199,Looking back through my search history... disgusted.,2,NoFap,1503170816.0,2017-08-20 03:26:56,-1
wvrqr,6rt9r8,CLEAN YOUR ROOM,1,NoFap,1501956569.0,2017-08-06 02:09:29,1
wvrqr,6o30m2,Porn is more like junk food than drugs.,0,NoFap,1500405313.0,2017-07-19 03:15:13,1
3wi9k8ow,c9o27b,"UPDATE THANK YOU, EVERYONE,​ WHO PUSHED ME TO LIVE!!!!!!!",94,SuicideWatch,1562377604.0,2019-07-06 09:46:44,1
3wi9k8ow,bxpfp1,on the verge of suicide!!!!! please help!!,48,SuicideWatch,1559875303.0,2019-06-07 10:41:43,1
4eji107y,dgrf45,Moving from East Hollywood (off East Melrose) is this area safer???,0,LAApartments,1570861426.0,2019-10-12 14:23:46,1
4eji107y,cwio6u,"My name is Tyler, that’s my real name this is my only account, I’m highly suicidal, have been since I was about 6-7 years old, I’m 26 now and it’s different now. I’m going to tell you my story in a new attempt to gain enough relief to fall asleep tonight. Thanks for reading if you do <3",46,SuicideWatch,1566986546.0,2019-08-28 18:02:26,1
3omvhqgz,dkvqx4,two recent suicide attempts and hospitalizations later and i still want to die,6,SuicideWatch,1571635317.0,2019-10-21 13:21:57,-1
3omvhqgz,defn8n,hey guys i’m barbecuing tonight 😋,7,EDanonymemes,1570429665.0,2019-10-07 14:27:45,0
3omvhqgz,ddacqo,my scrumptious dinner from last night 👌🏼👏🏻😍 #mealspo,6,EDanonymemes,1570209399.0,2019-10-05 01:16:39,1
3omvhqgz,d8jmpf,i just took all the remaining pills of my 5 prescriptions. goodbye.,171,SuicideWatch,1569308949.0,2019-09-24 15:09:09,0
3omvhqgz,d0twjt,Does anyone else experience intense short lived bouts of suicidal feelings/ideation when not otherwise suicidal?,8,bipolar,1567848200.0,2019-09-07 17:23:20,-1
3omvhqgz,cxvy3h,When I’m fresh outta inpatient and my eyes aren’t used to the fucking sun anymore,13,TrollCoping,1567260440.0,2019-08-31 22:07:20,1
3omvhqgz,cri4rr,Saw some other users here trying to draw maps from memory so I thought I’d add my contribution. I fucked up the scale insanely badly zooming in and out and my attempts to fix it just made it worse but it adds to the shitty map magic ;) can you tell I’m from the west coast?,6,ShittyMapPorn,1566019900.0,2019-08-17 13:31:40,-1
3omvhqgz,bxtxil,I feel hopeless and directionless after my first LTR break up?,3,Advice,1559909855.0,2019-06-07 20:17:35,-1
3omvhqgz,bjsicb,Has anybody lived on campus at CSUB before?,11,Bakersfield,1556785662.0,2019-05-02 16:27:42,0
q5whm,dkfkaq,Do you ever feel like suicide is your destiny?,121,SuicideWatch,1571549703.0,2019-10-20 13:35:03,-1
q5whm,b7twb2,It is perfectly OK to steal from businesses like Tesco or Walmart,26,unpopularopinion,1554072600.0,2019-04-01 06:50:00,1
kwtj9,dhsn9h,"Why does the top leg go forward in a sidestroke scissor kick, and not the other way around?",6,Swimming,1571068988.0,2019-10-15 00:03:08,1
kwtj9,dhpm2z,First time questions,3,DMT,1571054743.0,2019-10-14 20:05:43,0
kwtj9,cpt5pp,[MARCA] Real Betis is close to signing Borja Iglesias from Espanyol,11,soccer,1565702952.0,2019-08-13 21:29:12,0
kwtj9,bzi3ly,I tried killing myself today.,45,SuicideWatch,1560286794.0,2019-06-12 04:59:54,-1
kwtj9,b1wps4,Does anyone know what the colored crystals in these pills might be?,14,MDMA,1552766991.0,2019-03-17 04:09:51,0
kwtj9,axxdg2,Something I really like doing with my phone's flashlight while tripping...,11,LSD,1551868078.0,2019-03-06 18:27:58,1
kwtj9,auyqs4,Tripping balls; trilogy is hilarious. help?,6,TheWeeknd,1551182991.0,2019-02-26 20:09:51,1
kwtj9,alfops,Match Thread: Real Betis vs RCD Espanyol (Copa del Rey),61,soccer,1548872721.0,2019-01-31 02:25:21,0
kwtj9,aie13t,Match Thread: SD Eibar vs RCD Espanyol,3,soccer,1548100681.0,2019-01-22 03:58:01,0
kwtj9,ah0n96,Match Thread: Real Sociedad vs Real Betis (Copa del Rey),77,soccer,1547748867.0,2019-01-18 02:14:27,0
kwtj9,abehiy,"Happy new year to all, whatever your drug of choice (long read).",2,Drugs,1546313160.0,2019-01-01 11:26:00,1
kwtj9,abe67w,i'm hella drunk rn and i wanna say happy new year to all ya lonely bastards out there,9,2meirl4meirl,1546310476.0,2019-01-01 10:41:16,-1
kwtj9,a6mgxt,Thank you,2,2meirl4meirl,1544936884.0,2018-12-16 13:08:04,1
kwtj9,a1q338,TIP: Saturate your track to increase loudness,88,WeAreTheMusicMakers,1543560459.0,2018-11-30 14:47:39,1
kwtj9,a0zitt,Channel EQ spectrum analyzer,0,Logic_Studio,1543355909.0,2018-11-28 05:58:29,0
kwtj9,a0bcq5,Match Thread: Villarreal CF vs Real Betis,16,soccer,1543173372.0,2018-11-26 03:16:12,0
kwtj9,9u6fl6,Match Thread: Real Betis vs RC Celta,43,soccer,1541360858.0,2018-11-05 03:47:38,0
kwtj9,9tvd1s,Tip: Keep your reverb tail under control,8,WeAreTheMusicMakers,1541261869.0,2018-11-04 00:17:49,0
kwtj9,9t54k4,"Why should a foreign fan watch the Eredivisie instead of another league, like Premier League or La Liga",9,Eredivisie,1541035751.0,2018-11-01 09:29:11,1
kwtj9,9qs4om,What do you think will happen on Thursday?,33,ACMilan,1540322133.0,2018-10-24 03:15:33,0
kwtj9,9q5k5z,Match Thread: Real Betis vs R. Valladolid CF,7,soccer,1540144406.0,2018-10-22 01:53:26,0
kwtj9,8f4iww,"I'm thinking of building my first PC for ~$1100, and I'd really appreciate some help.",7,buildapc,1524764088.0,2018-04-27 01:34:48,1
kwtj9,88vj44,"After match round 30, Atlético de Madrid have conceded less than 0.5 goals per game (14 in 30), and the fewest in the league. Barcelona are close behind at exactly 1.5 goals per game (15 in 30).",27,soccer,1522630381.0,2018-04-02 08:53:01,0
kwtj9,875dkb,"With rumours of Hysaj leaving in the summer, who would you look to replace him?",6,sscnapoli,1522027361.0,2018-03-26 09:22:41,0
kwtj9,83db4z,"Lazio has cancelled ticket sales for the club's fans for the Europa League match with Dynamo Kiev (in Kiev), for logistical and security reasons.",5,soccer,1520660569.0,2018-03-10 13:42:49,0
tzk5p63,dimccf,I overdosed. Ended up calling 911 before it was late. I ended up pretty bad. I couldn’t move and wasn’t coherent for a day and half. Spent 6 days in the hospital. Getting outpatient help I guess we go from here. I have better hope now I think,36,SuicideWatch,1571214690.0,2019-10-16 16:31:30,1
tzk5p63,dfsjvo,Should I just drink instead or dying just drink all time? Which can be better I choose the latter,1,SuicideWatch,1570680085.0,2019-10-10 12:01:25,1
tzk5p63,dfs4lv,I’m going to sleep tonight,1,SuicideWatch,1570677732.0,2019-10-10 11:22:12,0
ajeutqm,dmmlev,Boundaries are key,4,NarcissisticAbuse,1571950342.0,2019-10-25 04:52:22,0
ajeutqm,dhyol2,Why did she ignore my cry for help?,9,MomForAMinute,1571093927.0,2019-10-15 06:58:47,-1
ajeutqm,d60rvg,Some guy took a picture of me,16,TwoXChromosomes,1568826270.0,2019-09-19 01:04:30,0
ajeutqm,d0z0hy,Good people do exist,7,LifeAfterNarcissism,1567877869.0,2019-09-08 01:37:49,1
ajeutqm,cxrjbm,"Going on a date soon, anxiety over the possibility of another narc",4,NarcissisticAbuse,1567224699.0,2019-08-31 12:11:39,0
ajeutqm,cw167n,Anyone else cut off their narc before they could discard?,28,NarcissisticAbuse,1566891997.0,2019-08-27 15:46:37,-1
ajeutqm,cw0rwn,First day of taking the train to school...,5,TwoXChromosomes,1566889130.0,2019-08-27 14:58:50,0
ajeutqm,cuqrly,I think I am crazy,2,NarcissisticAbuse,1566634342.0,2019-08-24 16:12:22,-1
ajeutqm,cuqjzo,I feel like I should just stay away from people,2,depression,1566632705.0,2019-08-24 15:45:05,1
ajeutqm,ctnmpp,I realized I have no one to talk to about this,13,depression,1566423986.0,2019-08-22 05:46:26,-1
ajeutqm,cqjwkr,The First Date,1,NarcissisticAbuse,1565836350.0,2019-08-15 10:32:30,0
ajeutqm,cnh7zk,People are scary now,4,NarcissisticAbuse,1565242227.0,2019-08-08 13:30:27,-1
ajeutqm,cmn7ql,Trusting again is scarier than I imagined,1,NarcissisticAbuse,1565074395.0,2019-08-06 14:53:15,1
ajeutqm,cmln92,Vision problems accompanied by neck pain,3,AskDocs,1565063909.0,2019-08-06 11:58:29,-1
ajeutqm,cl92x1,I have a hard time feeling anything over it,1,GriefSupport,1564775897.0,2019-08-03 03:58:17,0
ajeutqm,ciki77,They know how to isolate you in every way,1,NarcissisticAbuse,1564249535.0,2019-07-28 01:45:35,-1
ajeutqm,chzd9f,"I get a strange, deep feeling of sadness when I see old people",1,offmychest,1564122975.0,2019-07-26 14:36:15,-1
ajeutqm,chkoae,Yet another memory,3,NarcissisticAbuse,1564040977.0,2019-07-25 15:49:37,0
ajeutqm,cf0l32,"Expecting every new person to be a narc now, unsure about how to proceed with new ""relationship""",6,NarcissisticAbuse,1563496035.0,2019-07-19 08:27:15,-1
ajeutqm,cdbf8j,How to politely tell someone to F off?,5,socialskills,1563155850.0,2019-07-15 09:57:30,0
ajeutqm,ca583y,"Half the time I want to die, the other half I'm terrified to die",17,mentalhealth,1562493380.0,2019-07-07 17:56:20,-1
ajeutqm,c8tk79,"Toothache, dentists don't know what's wrong",3,AskDocs,1562187551.0,2019-07-04 04:59:11,1
ajeutqm,c7pd98,Being alive is terrifying,0,mentalhealth,1561964350.0,2019-07-01 14:59:10,-1
ajeutqm,c7p6a7,He invalidated my rape,2,NarcissisticAbuse,1561962913.0,2019-07-01 14:35:13,-1
ajeutqm,c6ah0j,Anxiety,1,mentalhealth,1561666815.0,2019-06-28 04:20:15,0
ajeutqm,c63ish,I lost a year of my life,5,NarcissisticAbuse,1561628556.0,2019-06-27 17:42:36,-1
ajeutqm,c4a0sm,I had a dream about my narc,6,NarcissisticAbuse,1561317568.0,2019-06-24 03:19:28,1
ajeutqm,c03c84,I think another depressive episode is coming on,1,mentalhealth,1560415541.0,2019-06-13 16:45:41,-1
ajeutqm,bybvhw,I lied to my mom,1,offmychest,1560023798.0,2019-06-09 03:56:38,-1
ajeutqm,bx0rk0,Angry at my parents for not acting like they care,0,mentalhealth,1559728221.0,2019-06-05 17:50:21,-1
ajeutqm,bw1rz1,Help interpreting ultrasound results,2,obgyn,1559506837.0,2019-06-03 04:20:37,1
ajeutqm,buxhq2,Three days in a row complete strangers have told me to smile,17,TwoXChromosomes,1559245014.0,2019-05-31 03:36:54,1
ajeutqm,bs7yga,Struggling with guilt after having sex,9,sex,1558643764.0,2019-05-24 04:36:04,-1
ajeutqm,bq2hpa,It's 3am and my loneliness is giving me so much anxiety,5,mentalhealth,1558174477.0,2019-05-18 18:14:37,-1
ajeutqm,bl7f5l,Honestly don't know if I'm stupid or just have zero attention span,2,mentalhealth,1557116300.0,2019-05-06 12:18:20,0
ajeutqm,bkj7k8,DAE feel like they've died before?,1,DAE,1556959930.0,2019-05-04 16:52:10,-1
ajeutqm,bjsc7w,i swear my cat knows when i'm sad,0,offmychest,1556784051.0,2019-05-02 16:00:51,-1
ajeutqm,bjeky0,Realized something today,9,NarcissisticAbuse,1556697648.0,2019-05-01 16:00:48,0
ajeutqm,bhsomt,Need advice on what to do next,2,obgyn,1556319846.0,2019-04-27 07:04:06,0
ajeutqm,bhsk26,Are these red flags or is this normal?,4,abusiverelationships,1556319095.0,2019-04-27 06:51:35,0
ajeutqm,bhkq41,I feel absolutely nothing,0,offmychest,1556274107.0,2019-04-26 18:21:47,0
ajeutqm,bfhdvp,I always sleep with a pillow next to me so I can pretend I'm not sleeping alone,2,confession,1555796079.0,2019-04-21 05:34:39,0
ajeutqm,bfgf3i,"Severe cramps, no period, not pregnant",1,AskDocs,1555790545.0,2019-04-21 04:02:25,-1
ajeutqm,bbqrv0,How is gender different from personality?,19,TooAfraidToAsk,1554927240.0,2019-04-11 04:14:00,0
ajeutqm,ba8dms,I just don't feel right,1,mentalhealth,1554581358.0,2019-04-07 04:09:18,0
ajeutqm,b89zn3,"I (20f) don't know if I was in the wrong on a ""date"" with my platonic friend (20m)",16,relationship_advice,1554156426.0,2019-04-02 06:07:06,0
ajeutqm,b7l13i,"DAE like to reach out to ""trolls"" through PM to see what's really up with them?",1,DAE,1554016125.0,2019-03-31 15:08:45,1
ajeutqm,b7kabc,"""Love"" is blinding, seriously",3,NarcissisticAbuse,1554009556.0,2019-03-31 13:19:16,0
ajeutqm,b7jyx9,"Complete loss of appetite, several symptoms in various body locations, please help me get some sense of what's happening",4,AskDocs,1554006966.0,2019-03-31 12:36:06,1
ajeutqm,b7hkbu,Random flashback,4,NarcissisticAbuse,1553989658.0,2019-03-31 07:47:38,0
ajeutqm,b6a87o,Deep fear that I fart while high in public and don't know it,11,Drugs,1553722966.0,2019-03-28 05:42:46,-1
ajeutqm,b2fakm,I think I had a panic attack,2,mentalhealth,1552890703.0,2019-03-18 14:31:43,-1
ajeutqm,b2f2ug,When is it time to break off a friendship?,0,socialskills,1552889022.0,2019-03-18 14:03:42,1
ajeutqm,b2ch4k,"Tried to help my family get closer, only made things worse",0,offmychest,1552871067.0,2019-03-18 09:04:27,0
ajeutqm,b1iesw,I'm finally getting therapy!,5,DecidingToBeBetter,1552674677.0,2019-03-16 02:31:17,0
ajeutqm,b19kaj,It feels like god is giving me narcissist training,3,NarcissisticAbuse,1552618486.0,2019-03-15 10:54:46,1
ajeutqm,b0xmtq,Cramping after period?,3,AskDocs,1552550506.0,2019-03-14 16:01:46,0
ajeutqm,azp1or,Rant,4,NarcissisticAbuse,1552279105.0,2019-03-11 12:38:25,-1
ajeutqm,azjro9,It's been 3 years,2,rape,1552248442.0,2019-03-11 04:07:22,0
ajeutqm,ayjydr,I got accepted into college and I couldn't be more disappointed,2,offmychest,1552005264.0,2019-03-08 08:34:24,1
ajeutqm,ay7opy,I absolutely hate the healthcare system,2,offmychest,1551927385.0,2019-03-07 10:56:25,-1
ajeutqm,axwjpw,Yesterday I had an awesome time with a friend I thought I was drifting away from,1,socialskills,1551860759.0,2019-03-06 16:25:59,1
ajeutqm,awfmm3,My (20f) little brother (14m) got high at school and I'm debating whether telling my parents will do more harm than good,1,relationships,1551514759.0,2019-03-02 16:19:19,0
ajeutqm,aw28s6,I want revenge so badly,30,NarcissisticAbuse,1551426617.0,2019-03-01 15:50:17,-1
ajeutqm,avp253,I feel like I just got off a rollercoaster ride,3,mentalhealth,1551345046.0,2019-02-28 17:10:46,1
ajeutqm,atbsdm,My professor is an asshole,0,offmychest,1550801891.0,2019-02-22 10:18:11,0
ajeutqm,asflft,Very scared,2,AskDocs,1550611349.0,2019-02-20 05:22:29,-1
ajeutqm,as2xve,It feels like I'm alive again,1,NarcissisticAbuse,1550528772.0,2019-02-19 06:26:12,1
ajeutqm,ap2afj,I think I should quit for awhile,12,Drugs,1549788578.0,2019-02-10 16:49:38,0
ajeutqm,acdwc9,"i ""stone out"" for a reason, mom. (long rant)",1,offmychest,1546572300.0,2019-01-04 11:25:00,0
ajeutqm,ac409l,is this okay to say to someone?,3,socialskills,1546506524.0,2019-01-03 17:08:44,1
ajeutqm,a2mvq3,i'm terrified i won't be able to give you grandchildren,12,MomForAMinute,1543826742.0,2018-12-03 16:45:42,-1
ajeutqm,a1pgu6,I am one of the most terrible people I know,3,offmychest,1543554973.0,2018-11-30 13:16:13,-1
ajeutqm,9nxocv,I think being high helps me see my ex for who he really is,1,offmychest,1539468118.0,2018-10-14 06:01:58,1
ajeutqm,9jfg5y,I got drunk with people I barely knew at all and I think it saved my life (long vent),2,offmychest,1538073351.0,2018-09-28 02:35:51,0
ajeutqm,9imvgk,I realized my daydreams have changed over the years,1,MaladaptiveDreaming,1537830768.0,2018-09-25 07:12:48,0
ajeutqm,9ik8d8,i become severely suicidal every month as a part of my pms,4,mentalhealth,1537812025.0,2018-09-25 02:00:25,-1
ajeutqm,9igy4o,my grandma is dying.,0,offmychest,1537786753.0,2018-09-24 18:59:13,0
ajeutqm,9ffo1i,I am basically the antichrist because I didn't want to give a homeless guy head,6,JustNoSO,1536820601.0,2018-09-13 14:36:41,0
ajeutqm,9dqb9c,i feel physically incapable of going on much longer,1,SuicideWatch,1536290250.0,2018-09-07 11:17:30,-1
ajeutqm,9bhv9f,My ex may or may not finally be out of my life,16,JustNoSO,1535618251.0,2018-08-30 16:37:31,0
ajeutqm,9b5mun,Headache after being choked,11,AskDocs,1535512409.0,2018-08-29 11:13:29,-1
ajeutqm,9869uz,Shutting down. I feel like I'm truly alone,3,offmychest,1534541936.0,2018-08-18 05:38:56,1
ajeutqm,972y44,I need a lot of reassurance in relationships but feel uncomfortable asking for it,2,offmychest,1534200114.0,2018-08-14 06:41:54,-1
ajeutqm,96msem,annnnnd i'm a loser,12,socialskills,1534048899.0,2018-08-12 12:41:39,-1
ajeutqm,95zr8r,I don't know how to explain my parents behavior to people,16,relationships,1533844014.0,2018-08-10 03:46:54,0
ajeutqm,95icab,nobody cares if youre suicidal until you actually commit suicide,52,SuicideWatch,1533697432.0,2018-08-08 11:03:52,-1
ajeutqm,955sff,i miss the life i thought i was going to have with him,1,offmychest,1533593726.0,2018-08-07 06:15:26,0
ajeutqm,944yvx,"i (19f) am finally done with my abusive, homeless boyfriend (20m) of almost a year.. having a happy broken heart seemed like an oxymoron until now",5,JustNoSO,1533257045.0,2018-08-03 08:44:05,-1
ajeutqm,91z2sq,i've never talked about this to anyone,7,offmychest,1532578616.0,2018-07-26 12:16:56,0
lq18c,doh6xx,Robert Eggers (of THE LIGHTHOUSE fame) did an AMA and talked a bit about Lovecraft + other things,1,Lovecraft,1572304421.0,2019-10-29 07:13:41,0
lq18c,doh5bf,"Robert Eggers did an AMA on /r/movies. Lots of interesting insight, including his favorite horror movies.",6,flicks,1572304219.0,2019-10-29 07:10:19,1
lq18c,cfjgkg,[TOMT][SCIFI BOOK][probably a classic] Sci-fi book where people engineered a religion to be about science so that after a post-apocalyptic event science isn't lost,15,tipofmytongue,1563610395.0,2019-07-20 16:13:15,1
lq18c,c6lyxb,"Any books like ""Empires of Eve""?",0,suggestmeabook,1561737803.0,2019-06-29 00:03:23,1
lq18c,ae3ki8,What's that fetish called where you want something really big to enter your anus and die by rupturing your internal organs?,8,NoStupidQuestions,1547010927.0,2019-01-09 13:15:27,-1
lq18c,a9gkf5,Mobile Vikings has some of the worst customer support I've ever seen,107,belgium,1545758918.0,2018-12-26 01:28:38,-1
lq18c,a5aj16,My year in speculative fiction & quick thoughts,12,printSF,1544559427.0,2018-12-12 04:17:07,0
lq18c,a5aiqx,My year in fantasy books & quick thoughts,14,Fantasy,1544559385.0,2018-12-12 04:16:25,0
lq18c,9dakso,Has anyone here read The Expert's System Brother yet?,9,printSF,1536179130.0,2018-09-06 04:25:30,0
lq18c,81qo4j,Elliott Smith in Simon vs the Homo Sapiens Agenda,26,elliottsmith,1520089908.0,2018-03-03 23:11:48,0
lq18c,80zzs8,"Books with something old/ancient being ""released"" or suddenly appearing?",6,suggestmeabook,1519854908.0,2018-03-01 05:55:08,0
lq18c,7he3h4,"the only existence sadder than being suicidal is being suicidal but with the option of suicide taken away from you because if you were to kill yourself, you would kill someone else too",63,SuicideWatch,1512351909.0,2017-12-04 09:45:09,-1
lq18c,7dl3kd,"On this day, one year ago, we lost What.CD.",169,trackers,1510927169.0,2017-11-17 21:59:29,-1
lq18c,7bwiqe,"Madonna on Twitter: ""Between the Bars............🎼🖤strumming my favorite song when everyone else is asleep. ♥️ Eliot Smith""",10,elliottsmith,1510263249.0,2017-11-10 05:34:09,1
lq18c,6qm41y,What do you guys want from this subreddit?,20,elliottsmith,1501474655.0,2017-07-31 12:17:35,0
lq18c,6ql0i0,Tracker Spreadsheet Update,48,trackers,1501460938.0,2017-07-31 08:28:58,0
lq18c,6gr8uz,"6 months on - Seems like Redacted has won the ""What.CD Replacement"" fight",302,trackers,1497261123.0,2017-06-12 17:52:03,1
3fhlni5d,cei14y,Failed suicide attempt,97,SuicideWatch,1563393931.0,2019-07-18 04:05:31,-1
3x3o7amd,cjt75v,Thanks reddit,31,SuicideWatch,1564499903.0,2019-07-30 23:18:23,1
3x3o7amd,cjidca,Bye guys,19,SuicideWatch,1564438581.0,2019-07-30 06:16:21,0
3x3o7amd,c27cqs,How to stop?,1,selfharm,1560889470.0,2019-06-19 04:24:30,-1
3larjw5y,bcn6n9,Its 1 am and I dont want to sleep because I'm not ready to wake up and deal with another fucking day.,61,SuicideWatch,1555131898.0,2019-04-13 13:04:58,-1
3sbcbcul,cddlro,I scratch myself as self harm,3,SuicideWatch,1563169703.0,2019-07-15 13:48:23,-1
3sbcbcul,c6cqu9,I’m worthless,1,SuicideWatch,1561678533.0,2019-06-28 07:35:33,-1
3sbcbcul,c64whf,In my bathroom self harming again,5,SuicideWatch,1561638405.0,2019-06-27 20:26:45,-1
3sbcbcul,c64s1y,I’m so lonely,0,u_wanna-be-unbirthed,1561637616.0,2019-06-27 20:13:36,-1
3sbcbcul,c5w11l,Does anyone else have persistent depressive disorder?,2,SuicideWatch,1561583611.0,2019-06-27 05:13:31,-1
3sbcbcul,btwdb1,I tried three days ago,3,SuicideWatch,1559022926.0,2019-05-28 13:55:26,0
3sbcbcul,bt61pi,The loneliness is killing me,9,SuicideWatch,1558863282.0,2019-05-26 17:34:42,-1
3sbcbcul,bqim6u,Can we not gatekeep suicidal depression?,55,SuicideWatch,1558282015.0,2019-05-20 00:06:55,1
3sbcbcul,bqb7s6,I lost the only person to show interest in me and now I don’t want to live anymore,7,SuicideWatch,1558227969.0,2019-05-19 09:06:09,1
3sbcbcul,bq936j,Paranoid,1,SuicideWatch,1558214897.0,2019-05-19 05:28:17,-1
3sbcbcul,bq8xzs,Noises,2,Paranoia,1558214290.0,2019-05-19 05:18:10,0
3sbcbcul,bq2ay6,I’m a bad person,8,SuicideWatch,1558173631.0,2019-05-18 18:00:31,-1
3sbcbcul,bq26ah,I’m a bad person,0,u_wanna-be-unbirthed,1558172978.0,2019-05-18 17:49:38,-1
3sbcbcul,bpme38,I’m lonely,16,gay,1558064980.0,2019-05-17 11:49:40,-1
i0hgj,c9689w,I feel like an NPC in a world filled with players. i’m just created to commit suicide and i can’t change the settings to stop that.,49,SuicideWatch,1562266359.0,2019-07-05 02:52:39,-1
i0hgj,4wf2es,When you live in a rural area,0,pokemongo,1470471609.0,2016-08-06 16:20:09,0
i0hgj,2ztps8,flame wizard glitch,8,Maplestory,1426960978.0,2015-03-22 02:02:58,0
i0hgj,2yl4n6,Gif request of giroud right when he was subbed in,2,Gunners,1426013044.0,2015-03-11 02:44:04,0
is16n,cw8rx4,Being born ugly sets you up to fail,121,SuicideWatch,1566931990.0,2019-08-28 02:53:10,-1
is16n,cm9omt,"Planning on jumping off a bridge in couple days. I don’t want support, I want this to happen more than anything.",31,SuicideWatch,1565003871.0,2019-08-05 19:17:51,1
is16n,clkb5i,I have a plan,4,SuicideWatch,1564847897.0,2019-08-03 23:58:17,0
is16n,cg36yt,It’s hard to want to keep going knowing that I’ve already passed the peak of my very unsatisfying life,1,SuicideWatch,1563738502.0,2019-07-22 03:48:22,0
is16n,c6afma,I have fully accepted that I’ll eventually kill myself,9,SuicideWatch,1561666610.0,2019-06-28 04:16:50,-1
is16n,bzf468,I'm so glad that DLC character reveal trailers are CG,185,smashbros,1560272686.0,2019-06-12 01:04:46,1
is16n,bvy3s2,The only person I have for support is my least favourite person I know,4,SuicideWatch,1559486946.0,2019-06-02 22:49:06,1
is16n,bqh4wt,I am an inherently unlikeable person,1,SuicideWatch,1558273708.0,2019-05-19 21:48:28,0
is16n,bnscm7,I am confused about everything in life except for my desire to stop living,2,SuicideWatch,1557686186.0,2019-05-13 02:36:26,-1
is16n,biemu2,I’ve been feeling good recently (long and rambly),2,SuicideWatch,1556477939.0,2019-04-29 02:58:59,1
is16n,b80coh,"For the amount of times I’ve been told to ’get over it’, you think I’d be healthy by now",6,SuicideWatch,1554113677.0,2019-04-01 18:14:37,1
is16n,b1ceiu,[REQUEST] Noname - With You,0,Tabs,1552639163.0,2019-03-15 16:39:23,0
is16n,aziyuv,I have absolutely no value as a person,29,SuicideWatch,1552244254.0,2019-03-11 02:57:34,0
is16n,awvnh1,I’ve been suicidal for so long that even if I conquer it I won’t know how to function,12,SuicideWatch,1551631139.0,2019-03-04 00:38:59,-1
