author_id,sub_id,submission,comments,subreddit,created,timestamp,risk
3zahvor3,c34ko8,My girlfriend killed herself a week after we broke up,193,SuicideWatch,1561082051.0,2019-06-21 09:54:11,-1
2zpif9u2,czvbqy,There is really no point in continuing my life just gets shittier and shittier,5,SuicideWatch,1567653675.0,2019-09-05 11:21:15,-1
2zpif9u2,bmv6ll,Not thinking anymore just sounds so peaceful,2,SuicideWatch,1557472077.0,2019-05-10 15:07:57,1
2zpif9u2,bczd1f,Why do I feel this bad all the time?,4,SuicideWatch,1555217325.0,2019-04-14 12:48:45,-1
2zpif9u2,b6tuz3,I don’t understand what’s wrong with me anymore,3,SuicideWatch,1553840990.0,2019-03-29 14:29:50,-1
2zpif9u2,b4gsy8,I’m starting to feel like I’m meant to commit suicide the same way as someone else is meant to become a doctor or to get married. It’s just the path I was meant to take,179,SuicideWatch,1553329505.0,2019-03-23 16:25:05,-1
2zpif9u2,b39e3k,I was supposed to kill myself tonight,6,SuicideWatch,1553069790.0,2019-03-20 16:16:30,-1
2zpif9u2,b2frui,I hate being too afraid to kill myself,11,SuicideWatch,1552894862.0,2019-03-18 15:41:02,-1
2zpif9u2,b1ccgv,I wish dying was easier,5,SuicideWatch,1552638688.0,2019-03-15 16:31:28,1
2zpif9u2,b1audi,I think I’m finally going to kill myself by this time next week. Thank you for the people on here who have tried to talk to me before.,6,SuicideWatch,1552627035.0,2019-03-15 13:17:15,-1
2zpif9u2,auf1y0,Broken,1,SuicideWatch,1551056975.0,2019-02-25 09:09:35,-1
2zpif9u2,aqv54z,4am and can’t sleep,7,SuicideWatch,1550225194.0,2019-02-15 18:06:34,0
2zpif9u2,apb30d,Weekends are the worst,6,SuicideWatch,1549849224.0,2019-02-11 09:40:24,-1
2zpif9u2,aovypo,I’m deciding to just forget about transitioning.,20,MtF,1549742126.0,2019-02-10 03:55:26,-1
2zpif9u2,ao0yis,What’s wrong with me,7,SuicideWatch,1549521473.0,2019-02-07 14:37:53,-1
2zpif9u2,anc2y3,Im done,8,SuicideWatch,1549354377.0,2019-02-05 16:12:57,0
2zpif9u2,ams3la,The thoughts won’t stop,1,SuicideWatch,1549217275.0,2019-02-04 02:07:55,-1
2zpif9u2,amkci4,Hope I am gone soon,1,SuicideWatch,1549153861.0,2019-02-03 08:31:01,1
2zpif9u2,al8sv7,I just want to die. I’m so mad at myself everyday I want it to stop,5,SuicideWatch,1548821144.0,2019-01-30 12:05:44,-1
2zpif9u2,ak4nnq,"I thought I was having a good week, but no I don’t deserve those.",2,SuicideWatch,1548534270.0,2019-01-27 04:24:30,-1
2zpif9u2,aier4v,My mom asked me if I’m depressed and I said nothing,17,SuicideWatch,1548104029.0,2019-01-22 04:53:49,-1
2zpif9u2,ahha8i,I couldn’t get myself to cut,2,SuicideWatch,1547860361.0,2019-01-19 09:12:41,-1
2zpif9u2,aggddx,I’m sorry I need to vent and I don’t know where else I could go,8,MtF,1547605185.0,2019-01-16 10:19:45,0
2zpif9u2,afu8xt,I just want everything to stop,1,SuicideWatch,1547458906.0,2019-01-14 17:41:46,-1
2zpif9u2,afr6ju,Ever since I realized I am trans I’ve had no faith in my life,18,MtF,1547433860.0,2019-01-14 10:44:20,0
15fss0,dmij6t,Anyone else feel sad that they can’t relate to break up songs?,6,ForeverAlone,1571933117.0,2019-10-25 00:05:17,-1
15fss0,dku5rd,"First time I see my A. Chalcodes groom herself. And to think not even six months ago I was very afraid of spiders, including tarantulas",0,tarantulas,1571626347.0,2019-10-21 10:52:27,0
15fss0,d1u229,I feel so alone and vulnerable,4,ForeverAlone,1568050269.0,2019-09-10 01:31:09,-1
15fss0,co6nc0,"If I’m not happy with myself I will not find someone, and if I do it won’t be a healthy, lasting relationship, right?",12,ForeverAlone,1565376325.0,2019-08-10 02:45:25,0
15fss0,cmtrhx,I don’t feel like a man and don’t think I ever will,3,SuicideWatch,1565113375.0,2019-08-07 01:42:55,1
15fss0,ckrq11,Second time in my life I had the courage to ask out my crush,9,ForeverAlone,1564681743.0,2019-08-02 01:49:03,1
15fss0,ccvnek,DAE feel stressed out about enjoying your day off to the fullest,4,DAE,1563058281.0,2019-07-14 06:51:21,1
15fss0,cbk8i7,I feel embarrassed but....does anyone else get extremely depressed and suicidal when you see a cute person and remember that you’ll always be single and never have a family of your own,256,SuicideWatch,1562782392.0,2019-07-11 02:13:12,-1
15fss0,bntdel,I want to live a solitary life,4,offmychest,1557691002.0,2019-05-13 03:56:42,0
15fss0,bmfixh,Anyone else get extremely depressed with just the thought of working your life away?,20,SuicideWatch,1557376398.0,2019-05-09 12:33:18,-1
15fss0,blf5h0,"I’m confident that suicide is bound to happen, no matter how good I’m doing",5,SuicideWatch,1557164253.0,2019-05-07 01:37:33,0
15fss0,blf2ng,Does depression ever go away or is it with you for life and you just have to learn to live with it and keep under control?,14,NoStupidQuestions,1557163875.0,2019-05-07 01:31:15,-1
15fss0,bhbxpk,I’m finally making big improvements in my life....but what’s the point,5,SuicideWatch,1556216199.0,2019-04-26 02:16:39,1
15fss0,b94xed,Is anyone else waiting for an accident or illness to kill you because you’re too scared to end it yourself?,24,SuicideWatch,1554332008.0,2019-04-04 06:53:28,-1
15fss0,b7vc47,"When you never asked to be born and hate your existence, but others are quick to point out how selfish it would be to kill yourself and how it would affect them...",8,SuicideWatch,1554080763.0,2019-04-01 09:06:03,-1
15fss0,b4f0if,"This may sound stupid, but does anyone else become more depressed and suicidal when they have a crush?",5,SuicideWatch,1553315945.0,2019-03-23 12:39:05,-1
15fss0,b1zkoz,Is it possible to never have a crush again?,9,ForeverAlone,1552783851.0,2019-03-17 08:50:51,0
15fss0,awtx9q,Just one of those Saturdays where every single person ignored me,4,ForeverAlone,1551619100.0,2019-03-03 21:18:20,-1
15fss0,avuur4,In your opinion are depression/suicidal thoughts/suicide attempts something to be ashamed of?,1,SuicideWatch,1551380838.0,2019-03-01 03:07:18,-1
15fss0,arsxh1,I think my best friends have to force themselves to hang out with me,2,ForeverAlone,1550462094.0,2019-02-18 11:54:54,1
15fss0,ap0cr3,DAE have a hard time enjoying the good things/being happy and immediately become suspicious?,2,DAE,1549770411.0,2019-02-10 11:46:51,1
15fss0,ah6f25,I haven’t seen my very loving and supportive family in years....and truth is I don’t want to see them again. I don’t even want to talk to them,0,offmychest,1547783435.0,2019-01-18 11:50:35,1
15fss0,ag7pd9,"Feeling guilty about wanting die, but then I remembered I didn’t ask to be born",11,SuicideWatch,1547552992.0,2019-01-15 19:49:52,-1
15fss0,ad2jm9,Why can’t someone walk into a hospital and donate their organs?,9,NoStupidQuestions,1546750873.0,2019-01-06 13:01:13,0
15fss0,ad28zk,Why can’t I just walk into a hospital and donate my organs,5,SuicideWatch,1546748609.0,2019-01-06 12:23:29,0
15fss0,a1b6be,It really sucks staying alive for others,8,SuicideWatch,1543444372.0,2018-11-29 06:32:52,0
15fss0,9e8nli,Is it just me or does it feel like depression will always be in your life?,6,depression,1536450244.0,2018-09-09 07:44:04,-1
15fss0,9dyz92,"I feel the need to cut contact with everyone, specially family, and I’m not sure why",79,Advice,1536357519.0,2018-09-08 05:58:39,-1
15fss0,9as5qf,Does everyone eventually stop talking to you?,17,ForeverAlone,1535399373.0,2018-08-28 03:49:33,-1
15fss0,9a9v00,Is 24 too old to get your life together?,7,depression,1535228727.0,2018-08-26 04:25:27,0
15fss0,8fp2t2,What if there was a delete button on life,7,SuicideWatch,1524974752.0,2018-04-29 12:05:52,0
15fss0,7ghhav,When you were younger did you believe you would eventually meet someone?,72,ForeverAlone,1511995894.0,2017-11-30 06:51:34,0
rdono8g,creht1,The tortured giant woman,1,Nightmares,1565999178.0,2019-08-17 07:46:18,-1
rdono8g,cly7r7,"My dad made me list of every ""n-word"" in my class and it made me feel like shit",13,Vent,1564935959.0,2019-08-05 00:25:59,-1
rdono8g,ckuqxj,i swear to god if there's an afterlife i'm gonna be so pissed,183,SuicideWatch,1564695542.0,2019-08-02 05:39:02,-1
rdono8g,cimfoz,"1kg heavier after going to the gym? is this normal, if so why does it happen?",6,WeightLossAdvice,1564258885.0,2019-07-28 04:21:25,0
rdono8g,cc421j,How do i make my friends hate me?,1,SuicideWatch,1562893331.0,2019-07-12 09:02:11,0
rdono8g,bxfb7p,Today I raised my voice at my father for the first time and had a breakdown after he didn't let me go to school,9,mentalhealth,1559818200.0,2019-06-06 18:50:00,0
rdono8g,bu5gfv,pre T and insecure about your voice? chainsmoke a pack a day,2,transgendercirclejerk,1559077116.0,2019-05-29 04:58:36,-1
rdono8g,br0rkd,i'm just gonna go i guess,3,SuicideWatch,1558383656.0,2019-05-21 04:20:56,0
rdono8g,bh1fgc,I haaate telling my SO i won't kill myself because it's a lie {i don't want advice or anything i'm just writing this down because i can't tell anyone},4,SuicideWatch,1556147695.0,2019-04-25 07:14:55,1
rdono8g,bcjimj,[TW sexual assault] My therapist made me realise that my cousing assaulted me and i don't know how to feel.,13,ptsd,1555106945.0,2019-04-13 06:09:05,-1
rdono8g,axj51k,I think i'm gonna go soon,1,SuicideWatch,1551776979.0,2019-03-05 17:09:39,0
rdono8g,axiu2h,I'm just 15 but my mom wants me to give birth and have bilogical children at all costs.... i'm transgender,106,childfree,1551774236.0,2019-03-05 16:23:56,0
rdono8g,axah77,WELCOME TO SCHOOL! To be allowed to exist you must shove the following rules up your slimy tranny cunt until you orgasm,1,transgendercirclejerk,1551724160.0,2019-03-05 02:29:20,1
rdono8g,avv6az,after a fight with my dad,1,MadeOfStyrofoam,1551382560.0,2019-03-01 03:36:00,-1
rdono8g,auqfqd,I'm such a fucking dissapointment and now i can sense my parents starting to hate me,7,TransyTalk,1551129140.0,2019-02-26 05:12:20,-1
rdono8g,anwpfs,I think i'm demisexual! i feel so weird now and i want to write it down,2,demisexuality,1549493349.0,2019-02-07 06:49:09,-1
rdono8g,abdaq0,I can't identify objects,1,dpdr,1546303779.0,2019-01-01 08:49:39,0
rdono8g,a5sws5,"You don't even know my name, but you were the first person to show me kindness",2,UnsentLetters,1544702630.0,2018-12-13 20:03:50,1
rdono8g,a21ihd,Today's my birthday and tbh i thought i'd be alone and no one gave a fuck but i got 4 messages on my facebook wall!!! (one was from my geography teacher what lol),19,teenagers,1543654227.0,2018-12-01 16:50:27,-1
rdono8g,9ibrmo,[Relationships] i'm so dysphoric ugh,3,LGBTeens,1537735489.0,2018-09-24 04:44:49,-1
rdono8g,9g8g21,My best friend confessed her feelings for me through text and NOW I'LL SEE HER IN REAL PERSON AND I'M SO HAPPY,8,teenagers,1537078021.0,2018-09-16 14:07:01,1
rdono8g,9c66sb,My friend said i look cute here 😄 is it true? (ftm),12,transadorable,1535832955.0,2018-09-02 04:15:55,1
rdono8g,9bur07,When you find r/teenagers hoping to relate and feel understood but you don't relate to anything because you're a weirdo who lives in the middle of nowhere and doomed to die alone,12,teenagers,1535730583.0,2018-08-31 23:49:43,-1
rdono8g,98f22t,Not able to change my name as a Romanian citizen. Would it be a problem if i move to Canada?,3,asktransgender,1534627266.0,2018-08-19 05:21:06,-1
rdono8g,9738n7,I'm at a point where i'm not even there anymore.,7,MaladaptiveDreaming,1534202412.0,2018-08-14 07:20:12,0
rdono8g,972bqs,Are there trans subs specifically for venting?,4,asktransgender,1534195450.0,2018-08-14 05:24:10,0
rdono8g,8u8z69,MY COMING OUT LETTER! i left it on the nightstand and my mom is opening it rn (i'm in the park having a panic attack),25,transpositive,1530100402.0,2018-06-27 19:53:22,-1
rdono8g,8sgcf0,Not a meme but tomorrow i'm coming out to my parents AAAAAAAAAAAAaaaaAaa i dont wanna die ;-;,8,traaaaaaannnnnnnnnns,1529479097.0,2018-06-20 15:18:17,1
1t70,cz6nfd,"New wiki on how to avoid accidentally encouraging suicide, and how to spot covert incitement",130,SuicideWatch,1567525791.0,2019-09-03 23:49:51,-1
1t70,anh7tv,Regular Check-In Post,7572,depression,1549392217.0,2019-02-06 02:43:37,0
1t70,95ezhs,Regular Check-In Post,7653,depression,1533671650.0,2018-08-08 03:54:10,0
1t70,87b92r,"Bug: RiF displays the flair css CLASS as the flair TEXT when flair text is blank, causing major issues for subs that use invisible flair",2,redditisfun,1522087638.0,2018-03-27 02:07:18,0
1t70,829s50,"Sorry folks, we've got a troll: Please message the moderators if you get harassed via PM after posting here.",312,SuicideWatch,1520287315.0,2018-03-06 06:01:55,-1
1t70,80et1l,Warning: We're being targeted by a PM-spammer promoting a blog at mentorself.com,158,depression,1519666571.0,2018-02-27 01:36:11,0
1t70,7vsbmm,"Check-In Post, with some info about contacting the moderators",3314,depression,1517965509.0,2018-02-07 09:05:09,0
1t70,6swsuk,"Regular Check-In, and some info about high-risk posts.",5058,depression,1502403149.0,2017-08-11 06:12:29,0
1t70,6rge0j,What's the deal with votes being disabled in the modqueue?,2,ModSupport,1501802250.0,2017-08-04 07:17:30,0
1t70,6lfjbt,"Regular Check-In, plus FYI about why we don't allow ""I'm here to help"" posts.",1182,depression,1499275912.0,2017-07-06 01:31:52,1
1t70,6ju4xs,"Let's Check In: Tell us how you're doing, share an accomplishment, ask a question about the community...",359,depression,1498583498.0,2017-06-28 01:11:38,1
1t70,6j25gc,"Now that AM is intrinsic to reddit, can someone PLEASE change the hardcoded ""I am a bot"" text at the bottom of AM's PMs and comments to something like ""This is an automated message/comment""?",9,AutoModerator,1498234091.0,2017-06-24 00:08:11,1
1t70,6gu3p4,"Evan Stark: 4.5 minute video tl;dr of his 450-page book, Coercive Control. How the way people and institutions often conceptualize abuse completely misses the point.",2,AbuseInterrupted,1497291985.0,2017-06-13 02:26:25,-1
1t70,6fx6lt,"Hi /r/depression, let's check in.",933,depression,1496877664.0,2017-06-08 07:21:04,0
1t70,6a7gb9,"/r/depression, let's Check In",1835,depression,1494356000.0,2017-05-10 02:53:20,0
1t70,69hlxg,"On the list of things I wouldn't have expected to exist, this rates pretty high: Giulietta Simionato and Ettore Bastianini in a charming, bilingual performance of ""Anything You Can Do"" from Annie Get Your Gun",6,opera,1494021187.0,2017-05-06 05:53:07,1
1t70,60k4i5,The /r/opera mod team has implemented some anti-spam measures. There's a slight chance this may mean your posts are delayed showing up.,1,opera,1490052875.0,2017-03-21 07:34:35,0
1t70,5t38z2,"[S0413] Spoilers: WNYC public radio episode of health podcast ""Only Human"", about GA's participation in a social experiment on altering perceptions of HIV",0,greysanatomy,1486678457.0,2017-02-10 06:14:17,0
1t70,5cfoq7,From the SW Mod team: Please be cautious if your post references political events,19,SuicideWatch,1478885332.0,2016-11-12 01:28:52,1
1t70,5bzobe,"Due to extreme brigading and abuse, we have extra filters in place. If your post or response is delayed, please see the sidebar (community info on mobile) for other resources.",3,SuicideWatch,1478678526.0,2016-11-09 16:02:06,-1
1t70,5bz2yg,"If you're upset about the election, the place to seek help is NOT by inviting discussion about it on the internet. Including here.",92,SuicideWatch,1478672725.0,2016-11-09 14:25:25,-1
1t70,59ak4h,"The Meat-Machine model, and how narcissism turns out own empathy against us",44,raisedbynarcissists,1477395781.0,2016-10-25 19:43:01,0
1t70,4ttne8,"PSA from the mod team: Please don't report posts just because they seem high-risk to you, thanks.",2,SuicideWatch,1469052258.0,2016-07-21 06:04:18,1
1t70,4pzt84,"Requesting /r/suicides, no visible activity from only mod for over a year. Will redirect to /r/SuicideWatch for support and discourage the voyeurism which appears to have been the original purpose.",6,redditrequest,1466976464.0,2016-06-27 05:27:44,0
1t70,4n7oda,"[FO] My office is making 100 hats for a charity project. We had some pink wool. I don't normally do ""girly"", but I thought this one turned out cute.",11,knitting,1465423842.0,2016-06-09 06:10:42,1
1t70,4n69bz,"Halp! A rule for people commenting on someone else's post fired yesterday for someone who's never been to our sub, on a post that's been archived for months, so couldn't possibly have been commented on yesterday.",4,AutoModerator,1465407372.0,2016-06-09 01:36:12,-1
1t70,4hx3s8,"Not narcissist-specific, but relevant: ""...when you are dealing with a disagreeable person, forgiveness may backfire, because disagreeable people are more motivated by whether you will be angry with them in the future than by an obligation to repay your forgiveness.""",6,raisedbynarcissists,1462402195.0,2016-05-05 06:49:55,-1
1t70,4drudw,"PSA from the mod team: If you got one or more PMs directing you to /r/CatharticSite and/or cathartic.co, please be warned that the person behind this is an aggressive and devious spammer.",40,depression,1460046672.0,2016-04-08 00:31:12,-1
1t70,41lt9s,"Requesting /r/suicidesurvivors, creator is [deleted], no moderators. To be consolidated with /r/SuicideBereavement.",0,redditrequest,1453161272.0,2016-01-19 07:54:32,-1
1t70,3fy1nb,"""The Healing Power of Awe"" from a blog about relationships with psychopaths, but relevant for ACoNs too, I think.",0,raisedbynarcissists,1438821751.0,2015-08-06 08:42:31,0
1t70,3aga5h,"""...a world so topsy-turvy that seeking medical help for depression or anxiety is apparently stronger evidence of violent tendencies than going out and purchasing a weapon... "" The ""mental health"" fallacy in mass murder.",3,mentalhealth,1434752299.0,2015-06-20 06:18:19,-1
1t70,35tzte,"[Feedback] I don't feel strongly about the ""read next"" box in terms of the general UX, but I think it MUST be configurable by subreddit. Just try browing /r/SuicideWatch with it turned on... :-o",0,beta,1431527189.0,2015-05-13 22:26:29,0
1t70,32miq4,Warning: Watch out for PMs pushing religion.,317,depression,1429055755.0,2015-04-15 07:55:55,-1
1t70,32dz8d,The psychological effects of narcissistic parenting (from Psychology Today),41,raisedbynarcissists,1428884879.0,2015-04-13 08:27:59,0
1t70,2wm8z2,"Update on PM trolls, self-appointed enforcers, and SW Moderation Practices. If you got a PM that was abusive or critical, please read, thx!",39,SuicideWatch,1424486344.0,2015-02-21 10:39:04,-1
1t70,2uxido,"Caution: There's a PM troll active in SW. If you get a nasty message after posting here, be aware that this person is doing this randomly, and IT'S NOT ABOUT YOU.",77,SuicideWatch,1423181986.0,2015-02-06 08:19:46,-1
1t70,2o871w,Guardian Op-Ed on Kyung-Wha Chung's comment to the parents a coughing child in her audience. (There are comments from people who were in attendance with completely different takes on the incident.),4,classicalmusic,1417665506.0,2014-12-04 11:58:26,0
1t70,2fek7j,"Got any outrageous, sickening, examples of ""Christian kitsch""?",18,exchristian,1409786883.0,2014-09-04 07:28:03,-1
1t70,2f0txc,September 10 is World Suicide Prevention Day. The SW mod team would like the community's thoughts about how we should recognise it.,53,SuicideWatch,1409423185.0,2014-08-31 02:26:25,-1
1t70,2daifp,REMINDER of Rule 1 in the sidebar: Nothing that's controversial or triggering belongs here.,88,depression,1407805549.0,2014-08-12 09:05:49,0
1t70,2co18u,Opera Now Podcast #219: Live show with Marilyn Horne and Oliver talking about Carmen :-),0,opera,1407221710.0,2014-08-05 14:55:10,1
1t70,2atvvg,How can I be a better pain-pal to my friend with ME/CFS?,6,PainPals,1405483596.0,2014-07-16 12:06:36,1
1t70,29zv2t,"Okay, /r/opera, want to try a contest? Which Juliette shines the brightest?",37,opera,1404682315.0,2014-07-07 05:31:55,1
1t70,28z97u,Safety warning from the SW mod team: We encourage you not to trust anyone who violates any of the subreddit rules. DO NOT respond to anyone who takes conversations to PM right away!,45,SuicideWatch,1403629076.0,2014-06-25 00:57:56,-1
1t70,264rpf,"If you get a snarky pro-suicide PM after posting here, IT'S NOT ABOUT YOU! Somebody's doing this randomly and indiscriminately.",55,SuicideWatch,1400691085.0,2014-05-22 00:51:25,0
1t70,25igd7,"What's wrong with ""It Gets Better""? What if it doesn't?",41,SuicideWatch,1400041276.0,2014-05-14 12:21:16,-1
1t70,217jxj,"PSA from the SuicideWatch Mod Team: We're getting a lot of complaints about generic ""uplifting"" or ""I love you"" type posts and comments. Please read and follow guideline 4c in the sidebar.",119,SuicideWatch,1395639059.0,2014-03-24 13:30:59,1
1t70,1zumzz,"""This important study could save lives, and Joiner’s suggestion for mental health professionals to engage patients on the topic of virtue is well-founded."" Publisher's Weekly review of ""The Perversion of Virtue"", Thomas Joiner's new book on murder-suicides.",2,suicidology,1394235853.0,2014-03-08 07:44:13,1
1t70,1zl6zp,"""Introverts are drained by proximity without rapport, and energised by rapport with or without proximity. Extraverts are energized by proximity with or without rapport, and are drained by rapport without proximity."" -- Me, trying to frame the distinction more precisely.",29,introvert,1393985548.0,2014-03-05 10:12:28,-1
1t70,1ywyvt,"If you get a PM from someone claiming that religion with cure your depression, please click ""report"" and then ignore it!",176,depression,1393355640.0,2014-02-26 03:14:00,-1
1t70,1updr1,"My psycho-mom called her favourite perfume ""child repellant""...",43,raisedbynarcissists,1389181530.0,2014-01-08 19:45:30,0
1t70,1tets4,Biochemical prediction of suicidality (xpost from /r/psychology),1,suicidology,1387654150.0,2013-12-22 03:29:10,0
1t70,1qm9vd,"From the /r/depression moderators: We're test-driving some CSS tweaks, please let us know what you think!",45,depression,1384443056.0,2013-11-14 23:30:56,1
1t70,1q2ls5,"Listening to Sondra Radvanovsky: ""Nobody's got a more jaw-droppingly beautiful voice, but DAMN I wish she could carry a tune in a straight line."" What is one thing you'd change about a singer you (otherwise) love?",32,opera,1383790971.0,2013-11-07 10:22:51,1
1t70,1j3ks4,"We are back to normal, thanks to everyone for their understanding.",4,StopSelfHarm,1374849967.0,2013-07-26 22:46:07,1
1t70,1j2og8,PSA: /r/stopselfharm is temporarily in restricted mode!,7,StopSelfHarm,1374808283.0,2013-07-26 11:11:23,-1
1t70,1fxrm0,"Review of Opera Now Podcast #189: Arab Spring at the opera house, heavy weather in NYC, a bad (as in ""spank me"" ಠ_ಠ) voice teacher and a buttload of scoopy, slidey Handelian ecstasy (xpost /r/opera)",0,classicalmusic,1370716161.0,2013-06-09 02:29:21,0
1t70,1fxriz,"Review of Opera Now Podcast #189: Arab Spring at the opera house, heavy weather in NYC, a bad (as in ""spank me"" ಠ_ಠ) voice teacher and a buttload of scoopy, slidey Handelian ecstasy",1,opera,1370716067.0,2013-06-09 02:27:47,0
3nra8exd,dom80w,I feel VERY bad today. My suicidal thoughts are about as bad as they've ever been. I made some tiny progress lately but it's all come crashing back down and I feel like I could just call it quits right here and now,0,SuicideWatch,1572332405.0,2019-10-29 15:00:05,-1
3nra8exd,dolt5w,My debit transactions are pending for a week+ and I don't know why. I didn't know it was happening and I overdrew the hell out of my account,4,personalfinance,1572329271.0,2019-10-29 14:07:51,-1
3nra8exd,do5sug,Hey guys. I'm gonna TRY to be totally sober for right now. Looking for suggestions or insight,0,depression,1572249730.0,2019-10-28 16:02:10,0
3nra8exd,dlud22,I'm seeing my psychiatrist tomorrow because I've been having all these thoughts again,2,SuicideWatch,1571806493.0,2019-10-23 12:54:53,0
3nra8exd,dkuagz,I have no control over myself,3,StopSelfHarm,1571627012.0,2019-10-21 11:03:32,-1
3nra8exd,dkp7t3,"I hate hate hate the tough love ""stop making excuses get up and kick depressions ass and just do it"" attitude to help",46,depression,1571602855.0,2019-10-21 04:20:55,-1
3nra8exd,dkg127,I'm extremely stressed out because of money right now. I haven't had a panic attack in years but this feels like the start of one,4,Anxiety,1571553155.0,2019-10-20 14:32:35,1
3nra8exd,dkfl4a,"/r/Nostupidquestions time, can I show my therapist a sort of journal entry I wrote?",7,depression,1571549881.0,2019-10-20 13:38:01,0
3nra8exd,dj40r8,Burned myself today because of how much I ate,7,StopSelfHarm,1571305289.0,2019-10-17 17:41:29,0
3nra8exd,diy0ln,"I impulsively ate a slice of chocolate cake, a sundae, and 4 donuts :(",164,loseit,1571269692.0,2019-10-17 07:48:12,-1
3nra8exd,dhzb50,Having a really bad night,13,depression,1571096761.0,2019-10-15 07:46:01,-1
3nra8exd,dhnaao,My life would have to make a TOTAL 180 for me to be ok,7,depression,1571038793.0,2019-10-14 15:39:53,1
3nra8exd,dh7utu,I've felt really bad the last week or so at nights,0,depression,1570954876.0,2019-10-13 16:21:16,-1
3nra8exd,dh7ryz,I'm extremely angry because I'm stuck with this forever,7,depression,1570954293.0,2019-10-13 16:11:33,-1
3nra8exd,dfst3g,Is it just me or is life just God awful fucking boring,12,self,1570681596.0,2019-10-10 12:26:36,-1
3nra8exd,devzhi,What do you do if it feels actually real-life impossible to eat right,37,loseit,1570514760.0,2019-10-08 14:06:00,0
3nra8exd,ddgqal,"There are things that are good, yes. I see that. The problem is deciding if it outweighs everything that isn't",4,depression,1570238779.0,2019-10-05 09:26:19,1
3nra8exd,dd3dib,"Everyone's first response is just ""have you seen/can you see a therapist?"" like that's the problem. Yes I've seen so many that isn't it",4,depression,1570169246.0,2019-10-04 14:07:26,1
3nra8exd,dclt9i,Sounds cliché and stupid but I really don't feel like I'll find anybody else,2,BreakUp,1570075977.0,2019-10-03 12:12:57,-1
3nra8exd,dac2gw,People always say just live moment to moment and distract yourself from reality but that's a terrible way to live,0,depression,1569649229.0,2019-09-28 13:40:29,-1
3nra8exd,d9xaga,Alright yeah we're depressed but life and the world also just suck,16,depression,1569571964.0,2019-09-27 16:12:44,-1
