author_id,sub_id,submission,comments,subreddit,created,timestamp,risk
32219w1n,avy4jk,I got a 98% on my exam for nursing school and have nobody to tell who actually cares.,599,offmychest,1551399431.0,2019-03-01 08:17:11,1
bnq6d58,b8yn88,Audrey I know you sneak into my room at night.,212,offmychest,1554301630.0,2019-04-03 22:27:10,0
bnq6d58,aurih6,Thank you to the kind stranger who gifted this to me today. Often my boyfriend and I tend to do as much as we can for others to keep the magic alive. We give pins and stuffed animals to those who like they need them. This is the first time someone has shared the magic with me.,6,Disneyland,1551134744.0,2019-02-26 06:45:44,1
bnq6d58,amviih,Pumpkin Pie and her cute little beans,0,jellybeantoes,1549236820.0,2019-02-04 07:33:40,1
o8hdl,diuxob,"Is Bojack ""more a horse than a man"" or ""more a man than a horse""? Season 6 Predictions/Discussion",6,BoJackHorseman,1571256420.0,2019-10-17 04:07:00,0
o8hdl,d5z6kq,What was your most recent teachable moment / epiphany about life outside your standpoint?,10,MensLib,1568819517.0,2019-09-18 23:11:57,0
o8hdl,d59rix,What would Bojack have been like if Beatrice married Corbin Creamerman?,9,BoJackHorseman,1568682440.0,2019-09-17 09:07:20,1
o8hdl,cvaeha,I can't forget the cuteness of this scene,7,BoJackHorseman,1566749483.0,2019-08-26 00:11:23,-1
o8hdl,cpkprt,TIFU by accidentally taking my boyfriend on his nightmare date.,1659,tifu,1565653573.0,2019-08-13 07:46:13,-1
o8hdl,cmhvzx,"Why was the final product of the Secretariat film ""genuinely good""?",12,BoJackHorseman,1565043357.0,2019-08-06 06:15:57,0
o8hdl,cdnrib,"I rescinded my ""good luck on finals"" text.",4,cringe,1563226163.0,2019-07-16 05:29:23,1
o8hdl,bz2r97,In Defense of Boring Office Clothes: Olga Khazan,40,femalefashionadvice,1560197942.0,2019-06-11 04:19:02,-1
o8hdl,bvbr04,"When did you do ""damage control"" after making a bad impression? How did you do it and were you successful? [Serious]",2,AskReddit,1559330596.0,2019-06-01 03:23:16,-1
o8hdl,btono8,Why are Filipinos often great at singing?,6,TooAfraidToAsk,1558977689.0,2019-05-28 01:21:29,1
o8hdl,bpvhwe,"""HAPPINESS: You don't have to earn it."" found in a secondhand notebook.",10,FoundPaper,1558120877.0,2019-05-18 03:21:17,0
o8hdl,bnd1c1,I overheard a cute conversation on campus this week,130,offmychest,1557587225.0,2019-05-11 23:07:05,1
o8hdl,blv9au,I accidentally missed my bus stop because I was talking to the toddler in the seat behind me.,2,BenignExistence,1557258544.0,2019-05-08 03:49:04,-1
o8hdl,b2m96l,What's your favorite thought-provoking quotation that isn't cheesy or cliche?,119,AskWomen,1552933946.0,2019-03-19 02:32:26,1
o8hdl,b2kchn,Saw an advance release of Emilio Estevez's new film The Public.,20,movies,1552924442.0,2019-03-18 23:54:02,0
o8hdl,b1iwug,I read the newspaper and listened to a professional flutist practicing live over my lunch break.,3,BenignExistence,1552677191.0,2019-03-16 03:13:11,0
o8hdl,b1ge08,Minneapolis students helping lead US branch of the International Youth Climate Strike today.,9,Minneapolis,1552664323.0,2019-03-15 23:38:43,0
o8hdl,aw6p4u,Religious notes found on campus this morning.,5,FoundPaper,1551457132.0,2019-03-02 00:18:52,0
o8hdl,apx0jw,I just overheard something cute I wanted to share,6,offmychest,1549998943.0,2019-02-13 03:15:43,1
o8hdl,al1g4k,I swear Camila is a dead ringer for this 80s shoujo manga villain,11,riverdale,1548777839.0,2019-01-30 00:03:59,-1
o8hdl,a96k57,What are the Christmas movies/specials with prominent female characters?,17,movies,1545670377.0,2018-12-25 00:52:57,1
o8hdl,9ylh99,The first (and only written) page of a thrifted notebook.,4,FoundPaper,1542664818.0,2018-11-20 06:00:18,0
o8hdl,9xoawc,"Vintage Shoujo Anime Style Inspo (Part 2): ""Aim for the Ace! / Ace wo Nerae!""",12,femalefashionadvice,1542389827.0,2018-11-17 01:37:07,0
o8hdl,9xfuz0,"New study of adolescents reveals: ""Many Ways to Be a Girl, but One Way to Be a Boy: The New Gender Rules""",67,MensLib,1542319791.0,2018-11-16 06:09:51,0
o8hdl,9v6b2w,A sad and mysterious note found on campus,23,FoundPaper,1541646059.0,2018-11-08 11:00:59,-1
o8hdl,9na6kw,"Vintage Shoujo Anime Style Inspo: ""Oniisama E... / Brother Dear Brother""",60,femalefashionadvice,1539266211.0,2018-10-11 21:56:51,1
h9jzr,ci57pc,Thinking of a sonos setup but wondering if I can do this,3,sonos,1564159289.0,2019-07-27 00:41:29,0
h9jzr,bg5cpi,Used to old school brakes levers and requesting advice please,4,bicycling,1555956785.0,2019-04-23 02:13:05,1
h9jzr,bdv7r6,Woodworkers. Is there somewhere in Austin that will plane and joint cheap lumber for you?,9,Austin,1555428312.0,2019-04-16 23:25:12,0
h9jzr,au9van,"My 95 Year old Mom died this past week. She's from Europe, lived during WWII time and loved to tell her story. I'm her only living child left and hardly anyone left for her. No big funeral. So I'm telling her story for her now. I think she would have loved that.",690,offmychest,1551027727.0,2019-02-25 01:02:07,0
h9jzr,atjtab,My 95 year old European mom just died and there's no one left for a funeral to tell her story. I just need to tell someone.,12,europe,1550854133.0,2019-02-23 00:48:53,-1
h9jzr,8o39qp,Any way to Watch Brewers baseball Live Streaming in Austin?,12,Austin,1527970520.0,2018-06-03 04:15:20,0
h9jzr,8jwso3,Newish to Austin. This may be a stupid question about public transportation.,38,Austin,1526491745.0,2018-05-17 01:29:05,-1
h9jzr,84gzf1,In search of a place that cuts men's hair to a good undercut.,20,Austin,1521061744.0,2018-03-15 05:09:04,0
h9jzr,4k2z61,Saw posted one day passes on line. Do you pick them up there?,4,animecentral,1463671480.0,2016-05-19 23:24:40,0
h9jzr,4duug0,I was made co-owner of Mom's house along with siblings and she was also still named owner. Sold house after Mom had to go into nursing home and the nursing home got her portion. Wondering how it all will affect my taxes. More details.,9,tax,1460088753.0,2016-04-08 12:12:33,0
h9jzr,362owq,Which Talalay Latex Topper Mattress Pad softness?,10,BuyItForLife,1431706847.0,2015-05-16 00:20:47,0
h9jzr,32un6n,Going to buy a NEW car for the first time in years tomorrow. What should I know?,8,cars,1429218838.0,2015-04-17 05:13:58,0
5rivm,df7zep,"Diagnostic Help Request- Attempted to Upgrade Laptop memory and HD, Won't Turn On",2,techsupport,1570575780.0,2019-10-09 07:03:00,1
5rivm,d2sbia,"A letter to my son, part three",4,offmychest,1568217318.0,2019-09-11 23:55:18,0
5rivm,buosz7,Update: Another letter to my son,2,offmychest,1559190026.0,2019-05-30 12:20:26,0
5rivm,as0ug6,A letter to my son,491,offmychest,1550517461.0,2019-02-19 03:17:41,0
5rivm,9bb5z9,"[4600] Reddit Mutiny, 3067 War trophies #2C2CQ2",2,RoyaleRecruit,1535562457.0,2018-08-30 01:07:37,-1
5rivm,92oo3m,"[4300] Reddit Mutiny, 2531 War trophies #2C2CQ2",7,RoyaleRecruit,1532805572.0,2018-07-29 03:19:32,-1
5rivm,8yuxty,"[4300] Reddit Mutiny, 2363 War trophies #2C2CQ2",4,RoyaleRecruit,1531589663.0,2018-07-15 01:34:23,-1
5rivm,8vxocx,"[4300] Reddit Mutiny, 2202 War trophies #2C2CQ2",0,RoyaleRecruit,1530667663.0,2018-07-04 09:27:43,-1
5rivm,8te53z,"[4000] Reddit Mutiny, 1791 War trophies #2C2CQ2",6,RoyaleRecruit,1529799839.0,2018-06-24 08:23:59,-1
5rivm,8rkbpc,"[4000] Reddit Mutiny, 1551 War trophies #2C2CQ2",12,RoyaleRecruit,1529165281.0,2018-06-17 00:08:01,-1
5rivm,8ploep,[4000] Reddit Mutiny #2C2CQ2 War Trophies: 1611,13,RoyaleRecruit,1528477893.0,2018-06-09 01:11:33,-1
5rivm,8nubzw,[4000] Reddit Mutiny #2C2CQ2 War Trophies: 1299,3,RoyaleRecruit,1527878328.0,2018-06-02 02:38:48,-1
5rivm,8m412p,[4000] Reddit Mutiny #2C2CQ2,0,RoyaleRecruit,1527273137.0,2018-05-26 02:32:17,0
5rivm,6j8pfq,RWT Roster Weekend of July 1,0,ClanZen,1498317946.0,2017-06-24 23:25:46,0
5rivm,5kmq9i,Zombie Chow's Guide to TH9 Warring,4,ClanZen,1482879806.0,2016-12-28 07:03:26,-1
5rivm,5c6mcp,Scrim Rosters,0,ClanZen,1478762463.0,2016-11-10 15:21:03,0
5rivm,4ky4u8,Zombie Chow's Suggested Upgrade Path for TH9,5,ClanZen,1464153861.0,2016-05-25 13:24:21,0
5rivm,4foe8e,Zombie Chow's Guide to TH8 Hogs,5,ClanZen,1461172406.0,2016-04-21 01:13:26,0
5rivm,48ekro,Basic Warring Tips- Add your own,1,ClanZen,1456807522.0,2016-03-01 12:45:22,-1
5rivm,46dfhe,Townhall .5s No Longer Best?,0,ClanZen,1455776665.0,2016-02-18 14:24:25,1
5rivm,44dp0c,New War Planning Clan-wide GroupMe,0,ClanZen,1454717350.0,2016-02-06 08:09:10,-1
5rivm,3vuxvm,Cerebrum's Guide to TH6 Warring,8,ClanZen,1449532541.0,2015-12-08 07:55:41,-1
5rivm,2gt20d,Referral and self-referral question,4,republicwireless,1411080369.0,2014-09-19 06:46:09,0
5rivm,1sux0s,Can I use dehydrator on meringues?,8,Cooking,1387013503.0,2013-12-14 17:31:43,0
40n9yd2g,de246j,SLPT: How to become immortal,3,ShittyLifeProTips,1570361813.0,2019-10-06 19:36:53,1
40n9yd2g,cxe8ak,"When a basement is being dug out under a house, how do they stop the house ending up in the basement void?",0,explainlikeimfive,1567155021.0,2019-08-30 16:50:21,-1
40n9yd2g,cnu6li,"Its 1am, my room-mates and I are going to bed. Good night.",0,lookatmydog,1565308340.0,2019-08-09 07:52:20,1
40n9yd2g,cmu4c1,I've dropped a bollocks....,2,phones,1565115017.0,2019-08-07 02:10:17,0
40n9yd2g,cmj5px,How do I make new friends in my 30's?,7,CasualConversation,1565049904.0,2019-08-06 08:05:04,1
40n9yd2g,cm07ir,Yesterday I had my physically abusive wife arrested,317,offmychest,1564945703.0,2019-08-05 03:08:23,-1
3l1kfqwu,d50fap,I just found my boyfriend’s suicide note,232,offmychest,1568639281.0,2019-09-16 21:08:01,-1
3l1kfqwu,bd7qyw,Creepy Walmart stalker,6,LetsNotMeet,1555276765.0,2019-04-15 05:19:25,0
3l1kfqwu,bctoyv,Don’t let a bad day make you feel like you have a bad life,4,self,1555180912.0,2019-04-14 02:41:52,-1
1jlnd1be,b5uz46,My abused adopted dog let me to pet him after 2 years of being scared of me.,153,offmychest,1553632884.0,2019-03-27 04:41:24,-1
1jlnd1be,b4idjf,"How can I help now? I feel lost, I have no power.",2,SBSK,1553342300.0,2019-03-23 19:58:20,-1
1jlnd1be,awl01b,"When i feel depressed, i make gifts for close friends and i put there a personalized letter why they should be proud of themselves.",22,confession,1551553178.0,2019-03-03 02:59:38,1
1jlnd1be,a9y0lt,SLPT: Just beat up a homeless woman so she can go to hospital and have a bed to sleep on. Be a nice person this year.,1,ShittyLifeProTips,1545905242.0,2018-12-27 18:07:22,1
3g5oc5kt,cy1n5n,Petition to remove crossroads from the game.,9,Mordhau,1567289095.0,2019-09-01 06:04:55,0
3g5oc5kt,coh1at,I pretend to be asleep so I can hear my girlfriend sing.,195,offmychest,1565437507.0,2019-08-10 19:45:07,0
3g5oc5kt,cocvfz,I pretend to be asleep so I can hear my girlfriend sing.,0,confession,1565407637.0,2019-08-10 11:27:17,0
3g5oc5kt,cn9foo,AITA for telling my girlfriend I don't want a puppy?,31,AmItheAsshole,1565201798.0,2019-08-08 02:16:38,0
3g5oc5kt,cmhiwk,WIBTA if I took my girlfriend on a vacation even when her parents told me not to?,55,AmItheAsshole,1565041642.0,2019-08-06 05:47:22,0
3g5oc5kt,cm13u5,AITA for going after a girl I knew my friend liked?,12,AmItheAsshole,1564950194.0,2019-08-05 04:23:14,1
3g5oc5kt,cl361i,AITA for having sex with a girl that has a boyfriend even though we were drunk?,53,AmItheAsshole,1564747229.0,2019-08-02 20:00:29,-1
3g5oc5kt,cki81w,What is the most useless thing you can do on reddit?,10,AskReddit,1564626278.0,2019-08-01 10:24:38,-1
3g5oc5kt,ck5mon,Is this wrong?,8,sex,1564561819.0,2019-07-31 16:30:19,-1
3g5oc5kt,cj0mut,Should I be worried about diseases?,3,sex,1564344252.0,2019-07-29 04:04:12,-1
3g5oc5kt,cac6wg,Just got these two delivered.,4,dvdcollection,1562534669.0,2019-07-08 05:24:29,0
3g5oc5kt,c93qy9,Petition to remove horses from the game.,13,Mordhau,1562253418.0,2019-07-04 23:16:58,0
3g5oc5kt,c5eryg,Petition to remove pole axes from the game.,33,Mordhau,1561494817.0,2019-06-26 04:33:37,0
3g5oc5kt,c3bqhd,"So, come here often?",7,CasualConversation,1561129651.0,2019-06-21 23:07:31,0
3g5oc5kt,c0peck,The original soundtrack for red dead redemption 2 is coming out july 12.,1,reddeadredemption,1560546932.0,2019-06-15 05:15:32,-1
3g5oc5kt,btzxd5,Anyone know any good books about serial killers?,7,TrueCrime,1559049509.0,2019-05-28 21:18:29,-1
3g5oc5kt,bsyxbt,Does anyone know of any unsolved serial killer cases from the 70s and 80s?,7,TrueCrime,1558814744.0,2019-05-26 04:05:44,-1
3g5oc5kt,bshuju,Who is your favorite serial killer?,26,TrueCrime,1558709484.0,2019-05-24 22:51:24,-1
3g5oc5kt,brq61y,Any information on the son of Sam serial killer? I'm writing a paper about him.,11,serialkillers,1558538970.0,2019-05-22 23:29:30,-1
1va5vevs,d9skb2,Working 60 hours a week isn't a badge of honor. Working nonstop isn't noble. Society needs to stop this crap.,477,offmychest,1569543630.0,2019-09-27 08:20:30,-1
12vjmy4b,a5ux6f,Thank you u/wafflediva & u/FTThrowAway123,1,SantasLittleHelpers,1544717896.0,2018-12-14 00:18:16,1
12vjmy4b,8e343k,Nobody came to my son's party last night WTF,1665,offmychest,1524402316.0,2018-04-22 21:05:16,-1
3hhwfd81,cg7dcn,I'm so introverted I'm afraid to post stuff anonymously online,388,offmychest,1563762006.0,2019-07-22 10:20:06,0
28tab16w,dkp7zv,How long does carbon take to remove medication?,5,Aquariums,1571602879.0,2019-10-21 04:21:19,0
28tab16w,djdx39,125 Gallon Stocking Ideas?,10,Aquariums,1571351567.0,2019-10-18 06:32:47,0
28tab16w,dj736v,"What's this slime around my zucchini? It's been in there for two days, so I was going to take it out and noticed it. No fish have died, but should I be worried?",12,Aquariums,1571322192.0,2019-10-17 22:23:12,-1
28tab16w,dhtbz1,Good bg1 quests?,2,baldursgate,1571071841.0,2019-10-15 00:50:41,1
28tab16w,dhqyw8,"I started having fish die left and right earlier this week, and today I found my cherry barb looking like this. What is happening and how do I fix it???",4,Aquariums,1571061700.0,2019-10-14 22:01:40,-1
28tab16w,dggf1p,An oldie but a goodie.,21,memes,1570806120.0,2019-10-11 23:02:00,0
28tab16w,dg660g,Suggestions For Best First Whole Playthrough?,6,Morrowind,1570748839.0,2019-10-11 07:07:19,1
28tab16w,df6inr,All respect for blizzard is lost,22,Blizzard,1570569731.0,2019-10-09 05:22:11,1
28tab16w,cvc180,Decreasing sound and water flow from filter?,4,Aquariums,1566757010.0,2019-08-26 02:16:50,0
28tab16w,cuf8a4,Stahp advertising dead content pls,36,runescape,1566573240.0,2019-08-23 23:14:00,-1
28tab16w,ct8atb,How does increasing GPH improve water quality?,6,Aquariums,1566344091.0,2019-08-21 07:34:51,1
28tab16w,csnfj4,Likelihood Of Fish Being Cut By Slate?,4,Aquariums,1566248921.0,2019-08-20 05:08:41,-1
28tab16w,cpv2zq,What are water changes for?,7,Aquariums,1565711800.0,2019-08-13 23:56:40,0
28tab16w,clmll1,How much does an arowana go for?,7,Aquariums,1564859770.0,2019-08-04 03:16:10,0
28tab16w,clf5xc,This little pleco was the only fish left alive in the dirtiest tank I've ever seen. What kind of a pleco is he?,5,Aquariums,1564810134.0,2019-08-03 13:28:54,-1
28tab16w,clbbq7,See that little cup in the top left? Right now my betta is using it as a bed. What hardy plant can I put in such a tiny cup?,8,Aquariums,1564786980.0,2019-08-03 07:03:00,1
28tab16w,cddeko,Need cichlid help,5,Aquariums,1563168306.0,2019-07-15 13:25:06,1
28tab16w,c8xtvy,Custom Tank - Need Advice,1,Aquariums,1562212420.0,2019-07-04 11:53:40,0
28tab16w,c8g93t,What's slowing down my computer,7,techsupport,1562107703.0,2019-07-03 06:48:23,0
28tab16w,c4zc4u,Rip Barry. Black lives matter.,2,memes,1561423638.0,2019-06-25 08:47:18,0
28tab16w,c0eqmy,Can Bettas Really Live In A Tropical Community Tank?,15,Aquariums,1560479426.0,2019-06-14 10:30:26,0
28tab16w,by47xp,Change of stocking plans,4,Aquariums,1559969356.0,2019-06-08 12:49:16,0
28tab16w,bxj92q,"What's wrong with my gourami? Normally she's moving all over the place and is super active, but all of today she's just been hanging out here.",12,Aquariums,1559841132.0,2019-06-07 01:12:12,1
28tab16w,bv9oir,"Cardinal stuck swimming like this. What's wrong? He's the only one doing it, the rest are fine",18,Aquariums,1559320084.0,2019-06-01 00:28:04,-1
28tab16w,bt3yts,Fish fading color?,2,Aquariums,1558845550.0,2019-05-26 12:39:10,0
12t88acw,dibptd,"Need help fast, anything helps.",3,Assistance,1571162504.0,2019-10-16 02:01:44,1
12t88acw,dfuphr,"In the end, it boils down to the same problem.",4,UnsentLetters,1570694019.0,2019-10-10 15:53:39,-1
12t88acw,cyr1q8,My first time on normal.,7,NoMansSkyTheGame,1567440896.0,2019-09-03 00:14:56,0
12t88acw,cx1yom,How do you find a forever home?,8,NoMansSkyTheGame,1567090320.0,2019-08-29 22:52:00,0
12t88acw,caq2jq,My coworker died this morning and I’m actually pretty glad about it.,133,offmychest,1562615928.0,2019-07-09 03:58:48,1
12t88acw,c3gacs,Target dressing rooms are evil.,0,Vent,1561150405.0,2019-06-22 04:53:25,-1
12t88acw,c2i2gx,Thanks u/readyfreedy for giving me the idea last night!,3,MadeOfStyrofoam,1560956106.0,2019-06-19 22:55:06,1
12t88acw,c0826t,This game has saved me from a lot of suffering.,23,NoMansSkyTheGame,1560443807.0,2019-06-14 00:36:47,0
12t88acw,c054wa,16 Days Clean,10,AdultSelfHarm,1560428480.0,2019-06-13 20:21:20,1
12t88acw,bzr6cp,Awkward interaction with next door neighbor.,4,AdultSelfHarm,1560345786.0,2019-06-12 21:23:06,0
12t88acw,bxuilq,I feel like everyone in my life expects me to stop grieving now.,3,Miscarriage,1559913494.0,2019-06-07 21:18:14,-1
12t88acw,bx6e5k,Whatever works right?,6,MadeOfStyrofoam,1559761153.0,2019-06-06 02:59:13,0
12t88acw,bvaksv,I just want to be that girl.,9,Vent,1559324578.0,2019-06-01 01:42:58,0
12t88acw,btzw8z,Goodbye MOS,12,MadeOfStyrofoam,1559049327.0,2019-05-28 21:15:27,0
12t88acw,btzgq9,The curse you placed on me worked somehow.,1,UnsentLetters,1559046666.0,2019-05-28 20:31:06,-1
12t88acw,bttucp,I am doing really poorly and I need help.,4,AdultSelfHarm,1559005829.0,2019-05-28 09:10:29,1
12t88acw,brtkhu,I'm so glad this sub exists.,7,AdultSelfHarm,1558555852.0,2019-05-23 04:10:52,1
12t88acw,brovpq,Whew bois I really did it last night,5,MadeOfStyrofoam,1558532180.0,2019-05-22 21:36:20,0
12t88acw,brosr4,Boy I really am bad at this.,1,socialskills,1558531710.0,2019-05-22 21:28:30,-1
12t88acw,braix7,"First post, be kind?",0,sad,1558445882.0,2019-05-21 21:38:02,1
12t88acw,boknnc,I hate being on medication.,2,PCOS,1557849045.0,2019-05-14 23:50:45,-1
12t88acw,bnuy9x,Awkward interaction with hairstylist,6,socialskills,1557699386.0,2019-05-13 06:16:26,0
12t88acw,bm8bvp,How many of us self-harm?,4,BPD,1557337556.0,2019-05-09 01:45:56,0
12t88acw,bj3bj5,DAE feel like they never fit anywhere?,13,BPD,1556630963.0,2019-04-30 21:29:23,0
12t88acw,bhb5qt,Dear Theodore John,1,UnsentLetters,1556212212.0,2019-04-26 01:10:12,1
12t88acw,bh1fya,Really hate this feeling.,1,Anxiety,1556147779.0,2019-04-25 07:16:19,-1
12t88acw,bg4cbb,"I guess I'm turning over a new leaf. Thanks, SH community.",1,selfharm,1555951702.0,2019-04-23 00:48:22,1
12t88acw,belyy6,Coping mechanisms that work for you?,7,askwomenadvice,1555596458.0,2019-04-18 22:07:38,0
12t88acw,bc0f4w,"I need help, steps.",21,stepparents,1554992304.0,2019-04-11 22:18:24,1
12t88acw,b9wdyk,I hate that we lost touch.,1,UnsentLetters,1554496900.0,2019-04-06 04:41:40,-1
12t88acw,b9rav4,Medina's The Limehouse Golem (2016),0,horror,1554471383.0,2019-04-05 21:36:23,0
12t88acw,b8m7aq,Emotions all over the place.,1,ttcafterloss,1554226003.0,2019-04-03 01:26:43,0
12t88acw,b6lr3d,Why is it so important to fight?,2,selfharm,1553794464.0,2019-03-29 01:34:24,0
12t88acw,b5qf73,To Nana,1,UnsentLetters,1553610781.0,2019-03-26 22:33:01,0
3d9ihuut,cr51h3,Today my depressed mom finally took a shower and I spent 3 hours brushing the matt out of her hair.,253,offmychest,1565954813.0,2019-08-16 19:26:53,-1
3d9ihuut,cjfl6i,I’ve lost over 7 stone in weight and I think I hate my body more than I did before.,1,offmychest,1564426389.0,2019-07-30 02:53:09,-1
3d9ihuut,b95w1d,I need to brag/reflect/think? Idk,9,offmychest,1554337424.0,2019-04-04 08:23:44,0
1cwj19pc,d9n52o,Someone hacked my grandmother on Facebook. I have their phone number. Please help me flood them.,31,myevilplan,1569520129.0,2019-09-27 01:48:49,1
1cwj19pc,byz1wt,Parking downtown help,16,stcatharinesON,1560179722.0,2019-06-10 23:15:22,1
1cwj19pc,btgqfh,My manager is physically and emotionally abusive so I get her undercover boss’d and fired,27,RegularRevenge,1558925274.0,2019-05-27 10:47:54,-1
1cwj19pc,aku8xo,A metaphor that I have found comfort in,2,mourning,1548722088.0,2019-01-29 08:34:48,1
1cwj19pc,ah7aip,"My visit to Miami. The good, the bad, and the ugly.",8,VisitingMiami,1547789948.0,2019-01-18 13:39:08,-1
1cwj19pc,abu36l,You can get a ticket for eating “depending on the food”,139,ontario,1546441060.0,2019-01-02 22:57:40,0
1cwj19pc,a9exg6,Today I am 365 days self harm free. Merry Christmas everyone.,215,offmychest,1545745164.0,2018-12-25 21:39:24,1
1cwj19pc,a2t4yc,I couldn’t crush his spirits by admitting this is an oldie,4,harrypotter,1543871908.0,2018-12-04 05:18:28,0
1cwj19pc,9tkh0w,"Take that, haters",37,wholesomememes,1541168191.0,2018-11-02 22:16:31,-1
1cwj19pc,9t9hbx,Does narcissism run on a spectrum?,17,raisedbynarcissists,1541079481.0,2018-11-01 21:38:01,0
1cwj19pc,8tjdca,"“Harry, you are so loved”",6,harrypotter,1529861506.0,2018-06-25 01:31:46,0
4m8kd01u,d92ibr,"I’ve made bad choices my entire life and now that I have everything together, I’m need to get this off my chest.",214,offmychest,1569414147.0,2019-09-25 20:22:27,-1
20np54hy,cssg27,Saddest thing ever!,0,RodStewart,1566273187.0,2019-08-20 11:53:07,-1
20np54hy,c1ialh,My husband died on Friday afternoon,354,offmychest,1560739191.0,2019-06-17 10:39:51,-1
20np54hy,bb3lly,What would happen to a human body lost in space?,8,TooAfraidToAsk,1554783910.0,2019-04-09 12:25:10,-1
20np54hy,b71pyc,Could this be medical rather than psychological?,2,PanicAttack,1553888524.0,2019-03-30 03:42:04,0
3osdl28x,dj8nr4,Anybody else's parents want you to change your major?,22,college,1571329083.0,2019-10-18 00:18:03,0
3osdl28x,bxy0h0,"Could this be age regression, or just a random clingy phase?",3,Parenting,1559931951.0,2019-06-08 02:25:51,0
3osdl28x,biykld,I'm finally okay with what I lost.,320,offmychest,1556594483.0,2019-04-30 11:21:23,0
2bki2omh,cireo1,[REQUEST] Finally getting back on my feet but got hit with several bills,9,Random_Acts_Of_Pizza,1564286924.0,2019-07-28 12:08:44,0
2bki2omh,cajl0u,Moving to a nicer neighborhood turned into a nightmare.,71,LetsNotMeet,1562583452.0,2019-07-08 18:57:32,1
2bki2omh,aktnf9,My fiance committed suicide and I can't bring myself to tell our loved ones how everything went down so I'm posting it here.,272,offmychest,1548718389.0,2019-01-29 07:33:09,0
2bki2omh,akm6nx,"Every night as I'm falling asleep, but I'm still awake and aware, everything will either go completely silent or I'll hear a random noise, am I crazy or is this normal?",4,NoStupidQuestions,1548670986.0,2019-01-28 18:23:06,-1
3mgew0br,ber9ee,My 4 year old son is autistic and I hate him. I hate being a parent. I hate everything about this.,143,offmychest,1555624452.0,2019-04-19 05:54:12,-1
15j4ag5,aukh2s,I saw my dead husband in a dream and I’m so happy right now,249,offmychest,1551095928.0,2019-02-25 19:58:48,1
4it3sqe9,dmba7h,"[Update] I am dying, and am unsure how to tell my wife and family. I dont want to leave my children.",1,offmychest,1571891210.0,2019-10-24 12:26:50,-1
4it3sqe9,czuo53,"I am dying, and am unsure how to tell my wife and family. I dont want to leave my children.",378,offmychest,1567650084.0,2019-09-05 10:21:24,-1
me43z,dcapdu,I have low oxygen levels. They referred me to a pulmonologist. Is this the usual way it goes?,17,SleepApnea,1570025348.0,2019-10-02 22:09:08,-1
me43z,d8oydy,We've all thought about eating/drinking our reagents,246,labrats,1569339745.0,2019-09-24 23:42:25,0
me43z,d8mgrm,Dessicated agarose gel left to bake on the imager - has been hung up as a reminder of our shame for years,7,labrats,1569328118.0,2019-09-24 20:28:38,-1
me43z,d6uqys,Renal lab next door that doesn't work with anything harmful: *touches common doorknobs wearing gloves.* Our lab in the infectious disease department:,9,labrats,1568985288.0,2019-09-20 21:14:48,0
me43z,d6ga3f,They're coming.....and they're hungry,0,labrats,1568909599.0,2019-09-20 00:13:19,0
me43z,d4t8fr,Research Lab Gothic,23,labrats,1568594350.0,2019-09-16 08:39:10,0
me43z,d3qkeb,Gave our poor postdoc a heart attack with a simple prank,13,labrats,1568387151.0,2019-09-13 23:05:51,-1
me43z,cpi6ew,"Getting tested in one month, please help me survive until then.",3,SleepApnea,1565642090.0,2019-08-13 04:34:50,1
me43z,cnf7om,Any ideas on what killed my bumblebee Millipede?,1,InvertPets,1565230341.0,2019-08-08 10:12:21,-1
me43z,cmdu85,Why do people have to do things like marathons to raise money for charity?,6,NoStupidQuestions,1565025332.0,2019-08-06 01:15:32,1
me43z,ckwamz,Spider in my terrarium?,2,InvertPets,1564703145.0,2019-08-02 07:45:45,0
me43z,ckn33o,Nobody cares about your body as much as you do,121,howtonotgiveafuck,1564658668.0,2019-08-01 19:24:28,1
me43z,cgfyt5,Does this happen to anyone else when seeing/listening to other people talk about short hair:,28,butchlesbians,1563815498.0,2019-07-23 01:11:38,0
me43z,cbyod0,I constantly feel like I'm forgetting to do something important but can't remember what it is,1,Anxiety,1562866939.0,2019-07-12 01:42:19,1
me43z,c9w75u,What is your experience with breast reduction or removal?,16,butchlesbians,1562434277.0,2019-07-07 01:31:17,0
me43z,c2lu8x,"ID for this pede please (right)? Approx. 1 inch long, very active, flat body. Northeastern United States. Found under leaf litter, I believe I saw it eating a dead leaf.",1,whatsthisbug,1560974275.0,2019-06-20 03:57:55,1
me43z,c2hnua,Is it normal to be completely exhausted by working a regular 40 -hour work week?,62,NoStupidQuestions,1560953986.0,2019-06-19 22:19:46,-1
me43z,bzpnt8,I would love to see a main series game with battle mechanics like Pokken,9,pokemon,1560336344.0,2019-06-12 18:45:44,1
