author_id,sub_id,submission,comments,subreddit,created,timestamp,risk
me43z,bzko0u,Good Omens is not just a TV show!,16,goodomens,1560301016.0,2019-06-12 08:56:56,1
me43z,bz1tqi,"In your opinion, what's a sign that you're living a frugal life? (Yourself or others)",189,Frugal,1560193358.0,2019-06-11 03:02:38,0
me43z,bxh43q,I'm always tired but my gf wants to do stuff,7,relationship_advice,1559829981.0,2019-06-06 22:06:21,-1
me43z,brixfe,Has anyone had a breast reduction or removal?,25,TwoXChromosomes,1558490064.0,2019-05-22 09:54:24,0
me43z,bqvfiy,A lot of people on Reddit are really bad story tellers,202,offmychest,1558358300.0,2019-05-20 21:18:20,-1
me43z,bppw83,Does breeding change a female rat's temperament?,1,RATS,1558091535.0,2019-05-17 19:12:15,0
me43z,bp3h1l,"What can you actually put in those tiny 1/2 or 1 gallon ""Betta"" bowls?",17,Aquariums,1557953930.0,2019-05-16 04:58:50,0
me43z,bnh15e,Livestream viewing party the day the tv show comes out,7,goodomens,1557608795.0,2019-05-12 05:06:35,1
me43z,blarn4,How are you SUPPOSED to clean out your ears??,4,NoStupidQuestions,1557140940.0,2019-05-06 19:09:00,1
me43z,bi27fz,How do you safely find a roommate?,1,internetparents,1556390782.0,2019-04-28 02:46:22,1
me43z,bb92ym,"Internet Parents, i need help with my real parent and don't know what to do",6,internetparents,1554822687.0,2019-04-09 23:11:27,1
me43z,b9quwj,Casual DnD,2,DnD,1554468923.0,2019-04-05 20:55:23,1
me43z,b9jtdg,What does being butch mean to you?',17,butchlesbians,1554419786.0,2019-04-05 07:16:26,0
me43z,b9ixip,"What does being ""butch"" mean to you?",7,butchwomen,1554414825.0,2019-04-05 05:53:45,0
me43z,b9cp21,Part of me wants to look professional and the other part wants to look punk,6,butchwomen,1554384448.0,2019-04-04 21:27:28,0
me43z,b9b0da,I love butch women so much,13,butchlesbians,1554373559.0,2019-04-04 18:25:59,1
me43z,b59zfs,"Total newbie here, how do you get over the fear of going fast?",25,rollerblading,1553516352.0,2019-03-25 20:19:12,-1
me43z,b2w9qd,Sometimes i wake up and my chest feels tight and i can't stomach the thought of having to function all day feeling like this,10,Anxiety,1552995028.0,2019-03-19 19:30:28,1
me43z,b2mjzx,"I think my co-worker has depression, should I do something?",13,MensLib,1552935454.0,2019-03-19 02:57:34,-1
me43z,axenfh,Any ideas/suggestions on how to incorporate a Bop-It into a one-shot?,7,DnD,1551745807.0,2019-03-05 08:30:07,0
me43z,aunsza,TIL that sometimes male victims of statuatory rape can be held liable for child support if their abusers get pregnant,101,MensLib,1551115907.0,2019-02-26 01:31:47,-1
me43z,au9owh,Fashion advice from a tomcat who's tried cutting their own hair:,6,butchlesbians,1551026697.0,2019-02-25 00:44:57,0
16hs9h,9puf2r,"Does anyone ever get so depressed that they want to die but, because of their depression, don’t have the energy to try?",5,depression,1540044487.0,2018-10-20 22:08:07,-1
16hs9h,9pgydn,My baby Frank (named after Frank N Furter). He’s a Maine Coon but he lost his leg at a young age and it stunted his growth. I moved and he stayed with my mom but he comes speed hopping to me every time I visit.,5,cats,1539927550.0,2018-10-19 13:39:10,0
16hs9h,9n17su,My boyfriend (25) thought I was asleep...,168,offmychest,1539190380.0,2018-10-11 00:53:00,0
48a74ebg,do0h7w,"20 M, Current 250 LB's, 5'11. Goal Weight: 175. Start: October 27, 2019",1,weightlossdiarys,1572216798.0,2019-10-28 06:53:18,0
48a74ebg,dmnltx,I got an offer! Should I take it?,10,ITCareerQuestions,1571954494.0,2019-10-25 06:01:34,0
48a74ebg,dlk0vz,Trying to find a reputable news source for my class on pro guns.,18,progun,1571760299.0,2019-10-23 00:04:59,0
48a74ebg,dhb3k9,I'm suspending my business because of what's happening in China,295,offmychest,1570976099.0,2019-10-13 22:14:59,0
48a74ebg,dg20us,"I started IF, and losing weight is actually my last priority now.",2,intermittentfasting,1570731241.0,2019-10-11 02:14:01,-1
48a74ebg,dcqv2e,Please don't take that under paying job.,210,ITCareerQuestions,1570109091.0,2019-10-03 21:24:51,1
48a74ebg,d1ep4a,I want to take on smoking to offset my excessive eating.,14,Advice,1567967030.0,2019-09-09 02:23:50,0
48a74ebg,cp2yd7,"Starting a website design side income, how do I start?",11,smallbusiness,1565560251.0,2019-08-12 05:50:51,0
48a74ebg,clezfh,"I'm a product supplier that purchases from China, I have no problem that my products may have been produced by children",1,offmychest,1564808848.0,2019-08-03 13:07:28,-1
