keyword,author_id,sub_id,submission,comments,subreddit,created,timestamp,risk
stuck,3e44hk7x,cwebdp,Auntie forces MRT door open and gets herself stuck at Little India. Insane strength/10,458,singapore,1566957815.0,2019-08-28 10:03:35,-1
living,3e44hk7x,cqnh02,I _ _ _ _ _ For a living,9,AskOuija,1565860775.0,2019-08-15 17:19:35,0
insecure,3e44hk7x,chljg3,"Attached people of Reddit, what was something your Significant Other said or did which made you feel insecure about yourself/the relationship?",6,AskReddit,1564047773.0,2019-07-25 17:42:53,-1
dead,3e44hk7x,c2c6l0,You get to bring back one person from the dead. Who is it and why?,16,AskReddit,1560916375.0,2019-06-19 11:52:55,-1
hang,3e44hk7x,bjpv65,Before and after of Old Chang Kee giving out free curry puffs. All happened within 3 mins.,4,SingaporeRaw,1556764568.0,2019-05-02 10:36:08,1
hang,14f7f0,dffech,"Man caught at Changi Airport trying to smuggle 177 cocaine pellets to Thailand gets jail, caning",20,singapore,1570618831.0,2019-10-09 19:00:31,-1
die,14f7f0,aj0wmw,Actor Aloysius Pang dies after sustaining serious injuries in SAF training accident,686,singapore,1548257972.0,2019-01-23 23:39:32,-1
killing,14f7f0,9yh2ol,Kallang slashings: Jail for man who fled Singapore after construction worker killing,4,singapore,1542636630.0,2018-11-19 22:10:30,-1
kill,14f7f0,9yh2ol,Kallang slashings: Jail for man who fled Singapore after construction worker killing,4,singapore,1542636630.0,2018-11-19 22:10:30,-1
dead,14f7f0,9jkpyr,Full-time National Serviceman found dead at Sembawang Air Base,101,singapore,1538117510.0,2018-09-28 14:51:50,-1
die,14f7f0,8lq9fk,6-year-old boy pinned under SMRT bus in Choa Chu Kang accident dies in hospital,14,singapore,1527139887.0,2018-05-24 13:31:27,-1
die,14f7f0,8g8cnb,NSF who died after signs of heat injury to be accorded military funeral: SAF,84,singapore,1525180409.0,2018-05-01 21:13:29,-1
died,14f7f0,8g8cnb,NSF who died after signs of heat injury to be accorded military funeral: SAF,84,singapore,1525180409.0,2018-05-01 21:13:29,-1
injury,14f7f0,8g8cnb,NSF who died after signs of heat injury to be accorded military funeral: SAF,84,singapore,1525180409.0,2018-05-01 21:13:29,-1
die,14f7f0,8fyrp2,19-year-old NSF dies after displaying signs of heat injury: MINDEF,308,singapore,1525087962.0,2018-04-30 19:32:42,-1
injury,14f7f0,8fyrp2,19-year-old NSF dies after displaying signs of heat injury: MINDEF,308,singapore,1525087962.0,2018-04-30 19:32:42,-1
fake,14f7f0,6tem9g,This fake Sableye card (x-post r/pokemon),14,gaming,1502623592.0,2017-08-13 19:26:32,-1
commit,j5whp,d9tdmj,I would commit crimes but I have no potential :(,118,singapore,1569547834.0,2019-09-27 09:30:34,-1
die,hz30ei8,ddzl1w,"This pot came smashing down 3 steps behind me, pls don't put small pots on the balcony for fk sake, someone could've died",151,singapore,1570343446.0,2019-10-06 14:30:46,-1
died,hz30ei8,ddzl1w,"This pot came smashing down 3 steps behind me, pls don't put small pots on the balcony for fk sake, someone could've died",151,singapore,1570343446.0,2019-10-06 14:30:46,-1
hang,hz30ei8,cv3b1t,Felix needs to change his Twitter tag on YouTube to 100m,1,PewdiepieSubmissions,1566702454.0,2019-08-25 11:07:34,0
hang,hz30ei8,brigbp,"Just saw the Cyclone change, thanks for listening GGG",3,pathofexile,1558487192.0,2019-05-22 09:06:32,1
lost,hz30ei8,bii7ui,I thought I've lost you,3,dankmemes,1556498527.0,2019-04-29 08:42:07,-1
fake,hz30ei8,b8qe0r,How to know if alcohol is fake or diluted,2,assholedesign,1554246758.0,2019-04-03 07:12:38,-1
kill,hz30ei8,am2bn5,I really really really really really want CYCLONE to be a Channeling skill.,159,pathofexile,1549029979.0,2019-02-01 22:06:19,1
die,hz30ei8,9zum34,"As a 90s kid, I'm most likely going to die between 2060-2070. This life feels so short.",1,Showerthoughts,1543026630.0,2018-11-24 10:30:30,-1
kill,hz30ei8,89c3bo,"Epic missed an epic opportunity to use meteor to create another mode without storm, but a meteor to kill everyone after a certain time if there is no winner after the timer ends.",3,FortNiteBR,1522749515.0,2018-04-03 17:58:35,0
hang,hz30ei8,87872n,"Rip Uber, rather use Comfort than Grab because of its terrible UX that left me hanging time after time after time...",183,singapore,1522061564.0,2018-03-26 18:52:44,0
stupid,hz30ei8,83jsm5,This game doesn't make sense??? Sometimes I'm baffled by their stupid logic,49,blackdesertonline,1520733444.0,2018-03-11 09:57:24,-1
night,hz30ei8,8350a5,Dashcam Captures 'GHOST' along Upper Bukit Timah Rd at night,16,singapore,1520581468.0,2018-03-09 15:44:28,0
hang,hz30ei8,82tqp8,Browser default search engine changed to Bing after I restarted my comp... Seriously is Win10 some kind of malware?,50,assholedesign,1520472761.0,2018-03-08 09:32:41,0
kill,hz30ei8,81vd6k,"Ranger JIN(Absolute) skill guide, anyone can help?",8,blackdesertonline,1520135321.0,2018-03-04 11:48:41,1
kills,hz30ei8,814tum,Does Skill Add-ons work for spammable skills during their cooldown?,3,blackdesertonline,1519906528.0,2018-03-01 20:15:28,0
kill,hz30ei8,814tum,Does Skill Add-ons work for spammable skills during their cooldown?,3,blackdesertonline,1519906528.0,2018-03-01 20:15:28,0
dead,j74s7,by2j88,i woke up dead early to make this for internet points,147,singapore,1559957691.0,2019-06-08 09:34:51,-1
night,j74s7,bj5t1h,An end to the night walk,0,nightwalk,1556644067.0,2019-05-01 01:07:47,0
hide,j74s7,7s2yjp,The cologne may smell great but it doesn't hide the scent of bullshit,1,ForeverAlone,1516591483.0,2018-01-22 11:24:43,-1
hopeless,1yo9l3vo,c3ytpe,"Young, jobless and feeling hopeless in Singapore - The Straits Times",134,singapore,1561261930.0,2019-06-23 11:52:10,-1
dying,1yo9l3vo,bgc96z,Studying: A life or death matter in Singapore,310,singapore,1555995072.0,2019-04-23 12:51:12,-1
harm,1yo9l3vo,9x6r45,Most Singaporeans would choose Tharman for PM - Survey,0,singapore,1542247790.0,2018-11-15 10:09:50,0
jump,1yo9l3vo,9kxjdd,"People who jumped from IT to other sectors, please share your stories.",61,singapore,1538536926.0,2018-10-03 11:22:06,1
night,5i0uj,cy5vos,Milky Way over ECP last night,95,singapore,1567313672.0,2019-09-01 12:54:32,0
die,5i0uj,9ayksj,Some awesome UK goodies from /u/Greatgrowler,4,snackexchange,1535460172.0,2018-08-28 20:42:52,1
cut,5i0uj,3o3l25,Deceivingly cute.,0,aww,1444397667.0,2015-10-09 21:34:27,1
lost,9kmca,dl1bii,"I lost a cap on 969 from Tampines to Yishun at around 10:25PM. I hopped on the bus at 10:14PM according to the SimplyGo app. It’s labeled with the manufacturer, Yupoong and really means a lot to me. Can anyone that works at Wld Inter help me check with the lost and found. I made a L&F Report!",2,singapore,1571667987.0,2019-10-21 22:26:27,-1
stupid,9kmca,dkmsut,Clearly wearing helmet does not make you stupid — Singapore top 2 for highest average IQ.,26,singapore,1571592930.0,2019-10-21 01:35:30,1
hung,9kmca,daqwuc,"Hello Malaysians, which one of you took my FoodPanda food delivery? Pls return, I’m hungry.",1,malaysia,1569733350.0,2019-09-29 13:02:30,0
plan,9kmca,cp86ih,"Frequent flyers, do y’all think the SQ A330 planes in general is good value?",0,singapore,1565588878.0,2019-08-12 13:47:58,1
pills,9kmca,cnhbz6,"This ad is SHITTY ADVICE. Headache is a sign of dehydration. DO NOT under any circumstances, pop over-the-counter pills to get rid of headaches during any kind of military ops or PT. Go report to medic.",196,singapore,1565242962.0,2019-08-08 13:42:42,-1
die,9kmca,cbhuvj,To all the new and future soldiers. DON’T DO THIS. The 20 push-ups is not worth a precious life.,39,singapore,1562771226.0,2019-07-10 23:07:06,-1
plan,9kmca,bpf2lp,"Can I PDPA my classmates? Two of them separately told some Finaxis leaches my contact number, future plans and “finance situation”",2,singapore,1558026043.0,2019-05-17 01:00:43,0
bad,9kmca,azvm01,Mildly racist signage spotted at Sunshine Plaza...is software written by Indian and Chinese people bad?,3,singapore,1552322651.0,2019-03-12 00:44:11,-1
hang,9kmca,az0agw,Spotted at Yishun interchange — worth warning your elderly about this health scam in broad daylight. PS. My cell energy is MAGA high,37,singapore,1552110599.0,2019-03-09 13:49:59,-1
bad,9kmca,al8833,What do you think of gay people kissing and holding hands in public? Any bad incidents you seen?,1,singapore,1548817231.0,2019-01-30 11:00:31,0
hang,1mrlfcp0,cnvvn2,Changi Jewel inspired minecraft build.,119,singapore,1565317124.0,2019-08-09 10:18:44,1
hang,1mrlfcp0,cnkw2m,Singapore's Changi Jewel,1,Minecraft,1565266359.0,2019-08-08 20:12:39,1
bad,1mrlfcp0,975cjy,Grab shuttle bus on trial for Sungei Gedong. Good or bad idea?,82,singapore,1534220642.0,2018-08-14 12:24:02,0
